score,sentiment_category,sentiment_score,comment
3.0,neg,0.9960119724273682,景色一般，可玩性低，性价比低，去了就后悔，大巴倒小巴，中间有一段还需要走十多分钟陡坡才能到小巴站，如果打算在寨子里住，箱子就的拖行，路很不好有心理准备，别心疼箱子，寨子都是后盖的没几座老房子，都是各景区普遍的小吃和纪念品
5.0,pos,0.8800193071365356,西江千户苗寨，也是贵州很有特色的一个旅游景点。虽然去往景点的路上要坐很久的车程，但是到了景点一看，还是很值得一来的。而且因为十月是旅行的黄金季节，到处都是旅游团，人还是很多的。还看了表演，了解了苗寨的一些特色，很有意义。
5.0,pos,0.7072691321372986,老板是个年轻的小伙子，他说是苗寨的村民，很热情，我们下午到的时候找不到，他去路边接我们，还帮我提行李，民宿在半山腰，风景不错，可以看到差不多苗寨的全景，的确和大家评论的一样，隔音不好，不能睡懒觉，木板楼就是这样子了。总体还不错，可以介绍给朋友。
5.0,pos,0.9717885255813599,景区线路规划的不错哦，可以尝尝红心火龙果，麻婆豆腐，没吃过这么正宗的麻婆豆腐，在****找的#苗湘食府#老板人很好，菜很好吃，还有酒哦，小酒鬼可以尝一尝米酒，茅台镇原浆酒，整体价位都可以接受，自驾游可以停车在西门停车场，取票处正在新建商铺，下次去景色会更好！白天袅袅炊烟，夜晚万家灯火，烟火气息很浓厚！
3.0,neg,0.9843123555183411,国庆节过去的，感觉西江整体运营就是个混乱。取票点在百度上定位不准，票面没有行程说明，自驾停车没位停。为了多卖商业街铺面，入西江苗寨的车场在长长街铺尽头，售票处到中转停车场车场步行600多米，入停车场的地方没有疏导工作人员，导致都不排队，在排队入口处已经挤做一团，谁能挤谁就能进去到里面排队长廊。商业街做的挺漂亮，坐车地点就简陋的可以，临时调来的车运载速度跟不上，从寨子里出来的人少、进去的人多，只买票、不管理，这种运营方式早晚弄坏口碑。从到取票点停车、取票（我还提前买好的票，现买又要费时间）到坐上中转车同时近3个钟，带着孩子、拖着行李，什么性质都没了。若不是提前定了寨子里的客栈，真想放弃进去。西江苗寨景建筑依山旁地形而建，保存完好，景观是不错的。由于前面浪费了太多时间，进去到吃个晚餐、看夜场演出、逛逛夜市、休息到第二天，一早就出寨了。如果早进住一宿后晚出来，应该体验不错
4.0,pos,0.9791425466537476,虽然商业化，但是很好玩。吃饭价钱也不是很贵，不要拿行李进去，住宿一般都要爬山。中午有免费表演，一般。晚上花钱没看，电瓶车可以坐四次，往返观景点二次，进出大门二次正好。观景点真是太一般了，有电线照不出好效果。九月去的梯田不错，往里面走人少，外面人多，估计是旅行团的人。总体值得一去。
5.0,pos,0.728744626045227,实在是人多热闹，一进门就下起了大雨。订的住处是在观景台稍下方，客栈老板小哥下来接，但是下着大雨一脚深一脚浅真的痛苦。一进房间就见到窗外两道彩虹，心情立即放晴，后面逐渐停雨，游览苗寨，常规古镇模式。****排名高的都爆棚而且需要等位两个小时，去另外不用排队的店吃了，也不错
4.0,neg,0.8692759871482849,十一人多，私家车需要停在离景区八公里的临时停车，再坐免费摆渡车到景区大门。老人不能凭身份证入园，要在售票处排队换票。场景区内交通分四程，没有通程，必须一段一段倒车。苗寨商业化率95%以上，全是小旅馆、餐饮店、纪念品店，同质化严重，苗族文化氛围已经几乎看不到了。
5.0,pos,0.9609361290931702,十月一日自己开车过来，车停景区外统一停车场，北门兑票进来很方便，而且13岁半的宝贝免门票，只需要买20元电瓶车即可，这点很人性化，看来每个省免票的标准不一样。景区内人还不太多，比我去年十一去成都的人少多了，住在苗寨，挺不错的体验！
5.0,pos,0.9818860292434692,非常具有民族特色，不虚此行！晚上的山景不错，可以坐观光车前去观赏！我们是坐高铁到达凯里南，出门就有很多的旅行社安排客车直通“西江千户苗寨”车费35元一人。12:45到达北入口，7号风雨桥，携程上订好了票，取票后进入景区，儿童需要补20元的4次观光车的费用。
5.0,pos,0.8316243290901184,去苗寨的时候，已经是暑期末了，比起之前人山人海的样子，已经好很多，苗寨十分商业化，晚上去观景台看夜景的人还是很多，挤得不得了？所以没法想象旺季的时候是有多挤，不过，车辆接驳还是很到位的，田园风光的景色是蛮好的
3.0,neg,0.9917083382606506,网红打卡。寨子不大，从一号风雨桥逛到七号风雨桥，围着寨子走一圈也就三小时左右，还是边走边看，边吃边喝。夜景不错，星星点点，错落有致，甚是迷人。住宿贵，吃饭贵，商业化严重，许多外地人在这里做生意，本地居民貌似不多。不会再来第二次了。
5.0,pos,0.9392606019973755,西江的夜景美，住在半山腰的西江初见酒店，住一夜，逛逛苗寨，酒店大厅的夜景比观测台还要美，好好地带孩子体验苗族文化和风俗。
5.0,pos,0.9381426572799683,来到苗寨，满血复活！环境优美，可以感受古街的味道，也可以体验田园的风光！不多说，直接上图！感受向往的生活，欣欣向荣的美好
5.0,pos,0.6934965252876282,苗寨主街上的一家大店，很好找，二楼用餐，本来六个菜，老板娘热情给送了一个菜。服务员大姐更热情，端菜、服务、演唱、敬酒，还大方地把自己贵重的苗服借给我们穿上拍照。要说菜味道就是那样，到处都差不多，可是长桌宴这种形式很好，大家在一起有吃有说笑，认识几个陌生人，聊聊自己此行的感受，很有意思。
5.0,neg,0.6549705266952515,中午的样子到的凯里，住在了火车站，然后就在火车站拼个出租车去了苗寨，车费和大客车的价格差不多，还特别快，半个小时吧。苗寨也就商业街。田园风景那里自由拍照合适。景区下午人不是特别多。在苗寨逛吃饭玩到了晚上十点的左右吧，给出租打电话来接就行…感觉没必要住在苗寨，房价贵还住的不舒服，晚上人多还特别吵。祝大家旅途愉快！
5.0,pos,0.973076581954956,西江千户苗寨是一个保存苗族“原始生态”文化完整的地方，由10余个依山而建的自然村寨相连成片，是目前中国乃至全世界最大的苗族聚居村寨。真的太美了，而且没有大理丽江这些景点商业化严重，民风超级淳朴，去了就知道！
3.0,neg,0.9383501410484314,西江千户苗寨名气很大，身临其境感觉没有像宣传的那么好。可能还在开发中吧，但作为游客的用户体验不太舒服。建议不要在旺季和假日前往，否则会因为人流太多而影响体验和心情。从停车场到寨里面换乘两次车，没有明显标志指引。从游客中心到乘车点要穿过长长的一条商业街，试问游客拖着大小行李箱，走在颠簸不平的路上，有几人有心情买东西？坐摆渡车到了观景台，要步行400米（走过才知道，不止400米，进寨下坡，回程出寨要上坡）到另一个换乘点，就不能一辆车摆渡分两站停吗？！寨子里商业化严重，管理无序，很多基础设施还跟不上。总体感觉和门票及宣传差距较大。
3.0,neg,0.9656051397323608,贵州必打卡之处，所以旺季人太多，景区很商业化，并看不到苗族民风，重庆人民对依山而建的吊脚楼和夜景也不会感到新鲜，走在街上感觉跟所有的古镇差不多。景区里的民宿条件有限，但是好贵。自驾车不好停，不到一天收费30元。总体来说，一般般，穿了苗族服装，到此一游而已。
3.0,neg,0.9745304584503174,老实说现在的古镇古寨商业化严重我已经有心理准备，但是还是抱着一丝希望这个千户苗寨除了卖东西的和酒店宾馆之外还是有一些原生态的东西，然而，这里真心就全是卖东西的。远景还不错，进去之后全是商业。然后就是那个长桌宴非常坑，强烈不推荐预订。
4.0,neg,0.8491955995559692,西江千户苗寨因苗族特色而吸引了众多游客，商业化比较严重。 观光车往返于西门-观景台-1号风雨桥，中途不是无缝对接的，指引不够清晰。 里面的餐饮价格较高，住宿条件差。
5.0,pos,0.9401674270629883,西江苗寨是贵州行中我最喜欢的一段旅程，虽然这里住宿条件有限，吃的也好贵；虽然是千家商户，几乎没见到原住民，但苗寨的建筑风格保持的很好，田园风光也好，苗寨晨曦也好。观光车还是有必要买的，看你住在什么位置，住四号风雨桥旁边的话，又认上山路的话，只需要用两次就够了。
4.0,neg,0.814063549041748,可能我走过的古城也挺多，苗寨给我的感覺也一般般，没有那种惊艳和惊喜，本来预留两天游最后改只待一天，幸亏第一天刚去阳光普照，第二天就下大雨了，狼狈狼狈地行程，这个地方挺适合找个景色怡人的酒店坐在阳台发呆几日，至于寨内其它景点，除了需要填饱肚子之外，我觉得真没什么好逛的，就静静的在阳台对着窗外发呆，静静地听歌，这是我向往的假期
5.0,pos,0.9956396818161011,门票购买很方便，确认购买成功的速度快。门票包含大景区的门票和景区内四段观光车的车票，网络购票后到景区大门右手边游客中心换票，凭手机携程上的换票码，60岁以上和14岁以下的小朋友是免票，但也要在游客中心用身份证换取免费门票，太小的小盆友就不用多此一举换票了！总体五星评价……
3.0,pos,0.770675778388977,贵州游我选择了三个著名景点，都是5A景区，黄果树，小七孔，还有千户苗寨（下面三个景区的照片），前两个景区都特别棒！必去的！千户就太没意思了，太商业化，就为了去观景台照个所谓的苗寨（全是商铺）全景吗？不推荐！如果你要去买银器、牛角梳之类的可以去逛逛。
5.0,pos,0.9248037338256836,在携程上的双人票，比正常买优惠10元，取票非常方便，专用取票口取票，非常快，看着长长的买票队伍，真庆兴自己在网之订了票。
3.0,neg,0.9418789148330688,景色还是不错。 但游玩体验一般，首先是景区内宾馆管理不规范，价位很乱可以随意谈价钱。其次景区商业化严重而且感觉管理秩序有点混乱，全是商店。小吃街里地面比较脏，最后一些看上去还不错的饭店饭菜不太实惠，比如拍黄瓜32。 交通要吐槽一下，时间都耽误到排队上面，车站太小。单程一段要5元，出入景区还要倒车，走路换车站，很麻烦！其实做完车感觉景区根本没那么大，如果晚上再上一次观景台的话，玩一个苗寨平均一个人交通费要30块。 强烈建议：1、早上早点进，晚上玩完就出去，别住景区。2、来体验一下就行了，不会再来第二次。
3.0,neg,0.9177151322364807,和其他著名古镇古城差不多，但是规模偏小，商业气息很浓厚！观光车设计极其不合理，北门到小北门距离很近，从小北门到下个乘车点几乎穿过整个苗寨却要步行！冬天去的游客建议不要住在苗寨内，实在是太冷了，空调整晚的吹都没有用，室内室外一样的冷！除了夜景没什么可观看的，表演的人很敷衍！
4.0,pos,0.6683322191238403,去贵州旅游，西江千户苗寨非常值得一游。这里也是规模最大的苗寨。据说有上千户，所以称作为迁户苗寨。不过这里开发的有些过于旺盛了，很商业化了。失去了原有的纯朴特色。
4.0,pos,0.6748862862586975,去贵州之前查了千户，都说商业化严重，不建议去怎么怎么的，因此把郎德上寨列在行程，因为梵净山没订到票，就又临时去了千户，比期望的好很多。去的那天天气贼好，观景台看过去还是很美的，旁边是梯田，一条河流穿过，毕竟有民族特色，景区内表演，很喜欢看这种现场的民族特色演出。还是值得一去，但千户苗寨和所有古镇都一个样，商业化严重。郎德小，如果是外地游客建议去千户。
5.0,pos,0.9956508278846741,酒店在半山腰上，观光车坐到观景台再换乘后坐到一号风雨桥可以联系酒店免费接送，而且是不限次数免费接送，只要是想出去逛就可以安排接送，很人性化。服务态度很亲切热情，主动帮我们免费升级了房间、帮我们扛炒鸡重的行李等等，房间很干净，视野特别好，一边是梯田一边是苗寨，早上起床看景美呆了！总之很庆幸选对了酒店，虽然贵但物超所值，很棒！
5.0,pos,0.8570327162742615,我是中午快1点在贵阳下的飞机，按照我的计划是要趁着下午的时间一定要赶去苗寨看夜景的，我一个人带着一个10岁一个不满5岁的孩子出行，会考虑很多因素，所以我是纯自由行！临上飞机我在携程预约了首汽的车（考虑安全因素我还是选择有保障的）然后在路上定的门票，幸亏定了电子票，很方便不用排长队，自助取票机就搞定了，12岁以下孩子不要门票，所以就买了一张，但是进景区还需要一段距离需要乘观光车进去，这张门票里含4程的车票所以我和大宝正好够用小宝不要车票，（门票一定保存好，可以看歌舞剧，回来乘车也需要)
5.0,pos,0.921420156955719,夜景很不错，慢慢逛古城还是很休闲的，烤肉特别好吃，不过要看店面，有些不怎么好吃，手搓冰粉也很好吃。博物馆和表演值得看看的
3.0,neg,0.9963234663009644,怎么说呢？一个著名景区，不去后悔，去了更后悔。先说景区内的车，你们也太黑心了吧，坐一次就要五块，坐一次就要五块。一共几站不记得，反正人家是从西门到观景台算是一站，然后你就得下车了，你要跟人家司机说，我要去北门，那不好意思，您继续花五块钱买车票。真tm黑，就没见过你们这么赚钱的。然后当时不知道西江有多大，就定了两天，其实一天完全能搞定，小的不得了。也没啥可体会的。嘎歌古巷那一条街也就是卖卖特产啥的，如果你啥也不想买，那就没什么可逛的。也就夜景还行，但是人真的超级无敌多。我都怕发生踩踏事故哦，对了，还看见好几个大爷大妈抢上观光车的，为了坐个车打的不可开交。就这样吧，反正这辈子我是不会来这儿了，太黑了。
3.0,pos,0.8816239833831787,现代化商业化开发破坏了原有的风格，离开街道深入小巷，拾级而上，方能寻觅到苗民的本色，公鸡打鸣，家犬吠叫，儿童嘻戏，老人忙碌。我是顺着博物馆左侧山势上行达顶，转到山的另一侧，眼前豁然开朗，田园风光尽收眼底，这里人迹罕至，景色怡丽，实为本次最大收获。
3.0,neg,0.6158202290534973,人满为患啊。西门进，要乘坐观光接驳车，包含在门票里，小孩超过1.4米，要单独买车票，20元。接驳车分两种，第一程为大巴车，从大门半山腰下车，然后走路下坡到观光广场；第二程为电瓶车到其实如果不是自己租了车的话，真就应该坐车去北门进，起码不用受这苦。
4.0,pos,0.6505958437919617,可能刚看完织金洞被震撼到了，看到千户苗寨的时候并没有很震撼。人太多，商业气息重，景色还是不错的。晚上花了600左右才住到一间几平米的木房子，人站进去就没地方了。
4.0,pos,0.7249239683151245,刚上一年班，和男朋友的第一次出行(追求性价比)。我们属于高温城市，所以门票半价，再买了个四程观光车票(我们订的民宿是在北门)。 优点：1夜景真的不错，2建筑都是苗寨风格，3民宿很有特色。 缺点：1太太太商业化啦，景点东西都很贵(建议出民宿的时候自备一瓶水)。2观景台下面有家风景看下去很好的饭店，少于三个人就别进去吃饭了(规定最低消费200块，两个人点菜根本吃不完~)。3观景台可以拍10元一张的夜景，效果不错，可是没办法发电子图片给我们。如果想要电子版图片，建议带个U盘~ 总的来说，还是建议去看一看的~九月份水稻黄了可能会更好看！
3.0,neg,0.991786777973175,去过一次不会想再去第二次，自驾停车是个问题，30元一晚，买门票要求必须买他们景区里面的公交车，而且终点还不是景区里面，下了车还要走一大段路，里面纯属就是个商业街，里面消费又高，还不如29元门票的下司古镇，没有对比就没有伤害，。
5.0,pos,0.8920868039131165,夜景很美，本人很淳朴建议去的时候带把雨伞
5.0,pos,0.9007847905158997,验票地点和售票处在一起，拿着收到的短信验证码即可完成。出票速度很快，而且比现场买还便宜10块钱，不错非常满意，值得推荐！
5.0,pos,0.9099963903427124,西江千户苗寨作为世界文化遗产的贵州黔东南西江千户苗寨，这几年越来越红火，今天和家人下午来到了西江千户苗寨。那里夜景很美。
5.0,pos,0.9634235501289368,苗寨的夜景很棒，早晨的风景更棒。晚上的表演比较震撼，但是事先没做好攻略，买了晚上的门票，据说中午场是免费的。看图吧！哈哈
5.0,pos,0.9772546291351318,虽然路途有点远有点难走，但是玩得很开心，是一段值得回味的旅程。苗寨挺大的，景区内的消费也不贵，苗服很漂亮，烤肉串很好吃！
5.0,pos,0.8486382365226746,第一次来苗寨，环境挺不错的，没事慢慢散散，看看，住的离小吃街很近，附近有小酒吧，吃吃玩玩都是不错的选择～值得游玩的地方。
3.0,neg,0.8689953088760376,"由于处处都在建设，苗寨感觉有点乱。主要说下交通，2018年4月去的，在凯里南站下火车后，出站右侧的客运站里竟没有政府运营的车，被告知必须在旁边的两家旅行社之一买票，每人35。回程时可以同样买旅行社的车票，另一种选择，在苗寨门口的客运站可以买到政府运营的车票了，25块到凯里南站；或者16块到凯里客运站，再4块钱坐21路到凯里南站。旅行社的车是走高速的，比较块，政府运营的到凯里客运站的车是走老路,比较慢，我没有坐到凯里南的政府运营车，不知是否走高速。"
5.0,pos,0.8288852572441101,西江千户苗寨位于贵州省黔东南苗族侗族自治州雷山县东北部的雷公山麓，由十余个依山而建的自然村寨相连成片，是中国乃至全世界最大的苗族聚居村寨，是一座露天博物馆，展览着一部苗族发展史诗，成为观赏和研究苗族传统文化的大看台。
3.0,neg,0.9756622910499573,酒店离景点很近！可是房间在很高上面！爬木梯的在半山腰上面！我们很晚才到！等服务员带去房间也是很久才来！还好上去他们有帮忙拿行李，不然就累死了！说说房间情况吧！真实说一般！有灰尘还有都是木质味道不好！隔音超级差！还有飞蛾在飞来飞去！睡觉的时候老怕它们飞下来！床翻一下身体就叽叽的响！装修可能是很久了的吧！
5.0,pos,0.8482842445373535,电子票拿票很方便，有漂亮的苗族妹妹帮助很快就把票拿到了，没有排队。票是到了西大门才买的，当天买可以当天用，很方便。来苗寨的时候没有下雨，出了太阳，客栈老板说我们运气还是很不错的，人超级多啊。过年，街上有舞龙的队伍，还有苗家人的盛装**，爬到山顶看了夜景，感觉还不错。
5.0,pos,0.8597183227539062,感受带了异域风情，因为天气已经有些冷了，人比较少但是感觉也还是值得一去的，正好是苗年，还看了节目，里面的美食很赞，也不贵
5.0,pos,0.9756309986114502,虽然很商业化，但如果走到没有人的小路上还是很不错的一种体验，寨子的全景真的是很美！白天和夜晚各有不同的漂亮，美食也很多，特别喜欢吃毛豆腐！总之还是很喜欢这里的感觉，让我们从繁华的大城市来体验少数民族的乡村，真的是很美丽！携程很给力，还有发往镇远的直通车，非常方便省得去凯里换车，省去很多麻烦！
4.0,neg,0.9961942434310913,国庆期间自驾去的，又堵又贵，酒店普遍翻了一番甚至更多，在下高速的出口就开始堵车，花了一个多小时挪到停车场，3000多个停车位都不够，花了半个小时找车位。游客中心换票，然后经过一段15分钟路程的商业街到达景区入口坐摆渡车。景区内的摆渡车共两程:第一程到达观景台300米的地方，第二程从观景台送到田园观景区（也就是苗寨的最东面栈桥附近）。需要说明的是观景台并非最好的排线位置，你的镜头怎么也无法摆脱前面一大块屋顶，反而顺着摆渡车的旅途中有许多苗寨的大平台非常观景。
3.0,pos,0.7664952278137207,具有独特的苗寨特色，很多卖东西的店铺。除开民族特色外很像我们常逛的古镇。民族歌舞表演没有看到，因为只有早上才有套票包含的免费表演，晚上的表演要另外收费。我们晚上要走就不看了。如果要去一定要了解清楚。各个小吃很好吃，喜欢腊肉，糍粑，糯米饭的一定要吃！
5.0,pos,0.9408578872680664,自然风景很美，人文景观更是难得，当地的苗寨村民很热情，好客，特色的歌舞让人记忆尤深，导游和司机也很尽职，一次难忘的体验。
1.0,neg,0.9963309168815613,可以0颗星么，这是出来玩遇到的最差的景点，管理成问题，坐了观光车还要走那么久，住宿条件又差又贵，动辄三五百上千元，不就是一个超级大夜市么，还要收门票？实在不值当，完全商业化，什么民族风情，人文历史，一点点都没看到，看到闻到的只有浓浓的铜臭和被污染了的河水的腥臭味～
3.0,neg,0.9205179214477539,不可否认，民族风情，苗乡美景，确实不错，但是景区交通运行规划设计是个大问题。我们下午四点到景区大门口，开车到停车场到走出来买票要了差不多一个小时，排队坐公交进到寨内要了一个小时（而且要换乘两次），然后还是要花二十多分钟时间步行到住的地方，安顿好，八点吃饭。其实自己开车到寨子大概就是十多分钟，而且还真有车开进来，为什么？大家懂的...总的一句话，看可以看一下，就是这个运行套路太垃圾
3.0,neg,0.9800006747245789,很松散的一个五星级景区，相当浓厚的商业气息，这里有的特色在其他景区都有，除了民宿，什么酒吧、打糕、音乐、木雕、工艺品都是一样的，毫无特色，特别是铺天盖地的烧烤只能用厌恶来形容，酒店的档次丽江要甩它几条街，不会有下次了。
3.0,neg,0.8330205678939819,随团出游西江千户苗寨，纯粹的商业化模式！景色都是差不多的，里面的苗寨也是已经按照旅游景点来重新装修的，目的就是一个：博得游客的高兴，可以给当地的旅游收入添砖加瓦，苗族的同胞们更加是卖力地赚着钱…进寨去旅游的游客们一不小心就把拉进寨子里去做新郎了。当然这个大家懂的，这个新郎不好当，一不小心就是口袋掏空了……
3.0,pos,0.5241772532463074,千户苗寨不大，不过夜的话三四个小时足够完了，去到远一些的景点，有观光车可以坐。六条桥中间有风，很清凉舒服。小吃街每家人卖的东西都是那几样，看起来没食欲。到观光台拍个标志性照片，基本上就玩完了。博物馆可以去看一下
5.0,pos,0.8597183227539062,感受带了异域风情，因为天气已经有些冷了，人比较少但是感觉也还是值得一去的，正好是苗年，还看了节目，里面的美食很赞，也不贵
5.0,pos,0.9756309986114502,虽然很商业化，但如果走到没有人的小路上还是很不错的一种体验，寨子的全景真的是很美！白天和夜晚各有不同的漂亮，美食也很多，特别喜欢吃毛豆腐！总之还是很喜欢这里的感觉，让我们从繁华的大城市来体验少数民族的乡村，真的是很美丽！携程很给力，还有发往镇远的直通车，非常方便省得去凯里换车，省去很多麻烦！
