score,sentiment_category,sentiment_score,comment
5.0,pos,0.7508960366249084,"运气不错，去的当天天气很好。拍出来很漂亮。沿着一号桥开始走，一路上虽然商业气息很重，但是也不违和。有时间的话建议租套苗服拍拍照，很好看的。 交通的话，先要到凯里南站，到了之后，高铁站有很多去千户苗寨的车，基本上35-40一个人，几乎是15—20分钟就可以发车,开过去50分钟左右，然后就是景区内的观光车，有点折腾，但还行。景区里有一个博物馆，记得也要去看看。"
5.0,pos,0.927506685256958,贵州必打卡之地 富于浓厚的民族特色 人气儿旺 可以体验的项目多 尤其晚间逛 更有氛围感 各种特色吃不够 只要你有肚子 就可以一直吃下去 （个人推荐黑猪肉串 黑猪肉饼 酸汤牛肉粉 以及五色糯米饭趁热吃 香啊） 还可以穿上苗族服饰 或跟拍 或已拍 都是非常不错的选项 一路吃 一路逛 登顶最高处 俯瞰苗寨全貌
5.0,pos,0.9033657312393188,西江千户苗寨，犹如一幅绚丽画卷。木质吊脚楼依山而建，层层叠叠。白水河穿寨而过，碧波荡漾。夜晚，千户灯火如繁星闪烁，璀璨夺目。苗族歌舞悠扬，民族风情浓郁。这里是世外桃源，让人沉醉在古老而神秘的美丽之中。
5.0,pos,0.9850521087646484,这次西江苗寨待了四天，国庆假期确认人多，不想到处跑，所以决定来西江深度游一下，确实感觉很好，热闹的主街，商业繁华人头攒动，感受过节的气氛，吃喝玩乐都有，想安静就到巷子里，或者回酒店到阳台泡上一壶茶，惬意，有人说西江商业化太重，其实我觉得挺好，商业繁华才能让人体验到方便和服务，还有表演和非遗可以体验，几天玩下来刚刚好，巷子里穿梭，每天巷子里都有不一样的风景和店铺。
5.0,pos,0.8666876554489136,"隐藏在茂密丛林之中的千户苗寨,犹如一座藏在云雾中的世外桃源。沿着蜿蜒曲折的山路攀登而上,忽然眼前出现一座依山而建的古老寨子。木质的吊脚楼,错落有致地分布在青山绿林之中,构成一幅恬静而动人的画卷。"
5.0,pos,0.828279435634613,千户苗寨游览推荐 到得早的话可以先去芦笙场看演出，2点开始，然后沿着内部开始逛，逛完后往河边走，沿着一路上的n号风雨桥打卡拍照，风雨桥是苗寨里特别出片的拍照点，然后沿着路线先去猪圈咖啡打卡，最后上到观景台俯看整个千户苗寨，推荐上观景台看夜景。第二天早上想看日出的可以上观景台看，然后可以去右侧的水稻田看看。
5.0,pos,0.9184937477111816,木质吊角楼依山而建，层层叠叠，白水河穿寨而过，碧波荡漾。一定要在苗寨住一晚，看苗寨亮灯，点点星火很是惊艳。清晨，薄雾笼罩着的苗寨渐起喧哗，人间烟火的生活画卷又揭开新篇章！
5.0,pos,0.9481061697006226,西江千户苗寨值得一去，亮点众多： 壮观的建筑景观：上千户吊脚楼依山而建，层层叠叠，连绵成片，气势恢宏，是中国最大的苗族聚居地 浓郁的民族风情：寨内居民仍保留着传统苗族生活方式与习俗。苗族姑娘身着盛装，佩戴华丽银饰；可欣赏到苗族独特舞蹈，感受其对生活的热爱。还能体验拦门酒、长桌宴等传统习俗，参与芦笙舞等活动 璀璨的夜景灯光：夜幕降临，苗寨灯火辉煌，灯光与山峦交织，如梦幻般的童话世界，在观景台可俯瞰全景，令人流连忘返 丰富的文化体验：西江博物馆藏有上千件苗族文物，可深入了解苗族历史文化、生活习俗和传统工艺 特色的美食体验：能品尝酸汤鱼、烤黑猪肉串、糯米饭、苗家米酒等当地特色美食，酸汤鱼鱼肉鲜嫩，酸汤开胃，黑猪肉串肉质鲜美 。
4.0,neg,0.5050854682922363,高处看苗寨全景非常壮观，堪称人文景观一绝，推荐住在观景平台附近民宿，可以独享整个苗寨风光，观景平台人多，就别去凑热闹了，我们十一去的，整个平台全是人。住在苗寨里面的好处是早上起来可以独享宁静的街道和景观。但总体而言，苗寨商业化程度过度，整个街区基本就是餐饮，旅拍，旅社，连稻田都是捕鱼项目。餐饮就是你家也是黑猪肉烤串，我家也是，我家10元11串，你家12串，同质化竞争严重，而旅拍已经毁了旅游，特别不真实。苗寨对于当地居民而言可能既是幸运也是不幸。苗寨属于去了不后悔，但只会去一次的地方。
5.0,pos,0.9929405450820923,"美轮美奂🔥 西江千户苗寨旅游攻略 🕊️见信悦，展书容~ hi！我是欣朋~ 上班很久的人总想出去放空一下，最近国庆逃离了城市，来了贵州的西江千户苗寨旅游，建议收藏，纯干货！ ღ关于交通 ✈️飞机：全国各地到贵阳 🚅高铁：全国各地出发到贵阳 然后从贵阳北坐高铁到凯里南，只要58.5！ 出站右手边到客运中心（不是公交换乘站）买票到苗寨票价35元，全程50分钟。 🚗🚗🚗🚗🚗大巴: (1)北大门左边卖票到凯里南（末班车16:00，最好提前买好返程票。票价35,约50分钟) (2)右手边是卖到凯里或者凯里南的大巴。(到凯里票价16元,末班车,17:40；到凯里南票价25元，1小时左右,末班车16:30) Tips：往返，一定要到景区北大门 🍄景点门票: 景点门票90元(建议网上买票,免排队。网上买票的要在北大门售票大厅取票。） 🌸观光车门票 观光车20元；景区北大门到苗寨入口，往返；1号桥到山顶观景台,往返;(只有这四个点可以乘坐观光车。景点门票一定要留好，会多次用到票) 🎁线路 到了景区北大门之后，坐观光车到苗寨门口，然后走几步正式进入到到景区正式入口。 最先到7号桥，沿河边烧烤一条街向前，可以看到河对面半山腰全是客栈/酒店,木质建筑,层层叠叠,错落有致，很壮观。 观景台俯瞰苗寨美景。一片片木质结构的房子，映入眼帘,灰色的屋顶,红色的房子，互相映衬，与江南的徽式建筑大不一样，它自己独成一派。远处的山峦，云雾，梯田景色，还有山脚，山脊林立的小屋，收入眼底，美不胜收。 观景台左手边(距离10米)的楼梯上一个微型消防站门口，人很少，视野很宽阔。 从观景台坐观光车到1号桥之后,可以直走到十字路口,然后进入古街，这是条千年古街，以前是集镇买卖。在古街1/3的位置，有一个嘎歌古巷，进去可以看到苗族的生活情景演绎（15:00-15:30，16点多还有一场)。古街再往前是博物馆,主要展示苗族的一些服饰,生活，文化用品等。 然后就可以去景区大门坐车回去了~"
5.0,pos,0.661406397819519,停车场下来后会看到苗寨大牌坊，但从这里走到景区入口还有1.5公里，路比较平整，拉杆箱拖起来还是比较轻松的，走到第二块苗寨大牌坊才到真正的检票口。我们是中午到的，门口吃了花溪牛肉粉后进景区。下午在寨子上逛逛，先来到河的北面，从东头靠近梯田的一号风雨桥出发往西走，这条街上的建筑都是苗寨吊脚楼风格的，但全都是商业店铺，已经完全商业化。沿途参观了苗族博物馆，差不多参观一下半小时。然后上山看去了苗王鼓藏头的家，位置在北面山坡的最高处，鼓藏头负责守护对苗族人意义重大的鼓，算是苗族自治时期的领袖，所以也叫苗王。我们只看到一个空空的院子，还有一间放鼓的房间。鼓藏头家往下走不远就是活路头家，活路头是生产领路人，目前寨子的活路头就住在这栋房子里，对游客开放，活路头在门口贴了纸条，如果他不在家，游客可以自行进门参观，离开时记得关灯关门一切复原即可。在活路头家可以看到老百姓的生活场景，很朴素，甚至有点简陋和艰苦，和商业街上的热闹繁华，民宿的舒适华丽形成极大的反差。从活路头家出来，再回到商业街继续走到西头，回程沿河岸边走，从五号风雨桥走到四号、三号风雨桥，这一段比较漂亮，可以拍到倒影，还有很多穿着当地漂亮服饰的小姐姐站在岸边或者桥上拍照，是一道靓丽的风景线。走到三号风雨桥差不多六点了，我们就去吃晚饭了。晚饭后再跑去观景台俯瞰苗寨夜景，灯火的映衬下很美，千户人家连成片，很壮观！我们住在河南岸最东面最高处的民宿里，第二天起床推窗俯瞰北岸千户苗寨的美景，早晨的苗寨炊烟袅袅，烟雾缭绕，是另一种美。苗寨玩一圈差不多大半天，建议住一晚，感受白天和晚上两种不同的意境。景区电频车包含四程，大门口到观景台和观景台到一号风雨桥各算一程，往返就是四程，其实走走不远，但进出拉着行李还是坐车省力些。自驾车停在第一块牌坊外面的停车场，我们停过夜，不到24小时，停车费30。
5.0,pos,0.9892162084579468,西江千户苗寨，我的心愿之旅。下午3点离开镇远古镇，到达苗寨已是5点半多了，天色已渐渐暗淡下来。刚一进苗寨就被眼前随着地形的起伏变化鳞次栉比、密密麻麻的上千户吊脚楼所震撼了，虽然这么多年在云南、广西 、湖南见过了不少的苗寨和侗寨，但规模如此之大，如此壮观的还是第一次。苗寨四面环山，层峦叠嶂，梯田依山顺势直连云天，清澈见底的白水河穿寨而过，将西江苗寨一分为二，七座风情各异的风雨桥，又把两岸紧紧地连接在一起。苗寨的主体位于河流东北侧的河谷坡地上，吊脚楼依山就势层叠而上，直至山顶，羊排坡和东引坡形如一对水牛角状，正是苗族同胞最喜欢的图腾。放下行囊，迫不及待的赶往景区最佳观景台的观光车乘降点，心急火燎的排了不下20分钟终于在熙熙攘攘的人海中得愿所偿站在最佳观景台上，苍山、吊脚楼、白水河，点点闪烁的灯光，背靠青山，脚踏玉带，整个苗寨尽收眼底，微微的夜色下蔚为壮观。
5.0,pos,0.9719627499580383,晚上万家灯火给的震撼，早晨袅袅炊烟给的宁静，现在云亭轻奢全景美宿酒店阁楼上或者趴在房间阳台上，整个千户苗寨一览无余，这份在躁杂喧嚣的城市里难得的一份清净！站在吊脚楼上穿上苗族服饰，来一张美不胜收的美图，留下美好的记忆！
5.0,pos,0.9405519366264343,《到苗寨寻找属于你的诗与远方》 去贵州一定要去一次西江千户苗寨，这似乎早已是约定俗成了的。它很神秘，作为中国乃至全世界最大的苗族聚集区，依旧是保存苗族原始生态文化完整的地方。 一次说走就走的旅行，下了凯里南高铁站，坐上苗寨的专线大巴车，一个小时的路途，当汽车拐过一个山湾，就远远地望见对面形如牛角的寨子，那就是著名的西江千户苗寨了。 对于长期生活在繁华都市里的人们来说，那种紧张的快节奏生活逼得你简直喘不过气来，有时也会产生寻觅一处宁静恬淡的自然环境来抚慰自己疲惫心灵的想法。走进西江千户苗寨，这里的清新舒缓和原始拙朴，也许会让你眼前一亮。 在苗寨中，走过风雨桥，沿着寨子里蜿蜒石板路，缓步在青山绿水之间，欣赏着苗家特色的吊脚楼，偶尔有芦笙传入耳中，彷佛置身于世外桃源。 你可以在古街上沐浴冬日阳光的温暖，穿梭在嘎歌古巷，体验一次苗族工艺。你可以在苗寨赏一次花。在白水河畔邂逅花香，遇见春暖花开的日子。你可以在苗寨的观景台看一次晚霞。俯瞰全寨，美丽的山水之间，霞光映衬出苗寨的温柔、宁静、美好。你可以在苗寨穿一次最美的盛装。穿着苗服入乡随俗，夜游西江拍照打卡，享受苗寨的慢节奏生活。你可以在苗寨看一场演出。大型原生态苗族歌舞剧《美丽西江》，是你不可错过的选择。你可以在苗寨寻一道美食。体验一次苗家的长桌宴，高山流水让你懂得有一种酒可以让你喝到怀疑人生。你可以在苗寨感受浓郁的民俗风情。体验苗族迎宾最高礼仪十二道拦门酒；去鼓藏堂参观鼓藏文化，去西江苗族博物馆感受苗族历史、服饰、农耕、建筑等文化。你可以在苗寨等候一场雪景。一场雪，才知道素颜的苗寨多美。 西江千户苗寨，春有花香满园，夏有热情演出，秋有梯田如画，冬有白雪缀景。2021年，到苗寨寻找属于你的诗与远方！ 旅游小贴士： 西江千户苗寨 地址：贵州省黔东南苗族侗族自治州雷山县西江千户苗寨； 开放时间：1、景区全天售票及开放。 2、观光车运营时间：北服务区到小北门24小时，上下观景台早8:00-24:00。 门票： 西江千户苗寨套票含景区门票、景区观光车票（4次）、观景台、博物馆、鼓藏头家、活路头家、刺绣坊、蜡染坊、酿酒坊表演场等，110元/人（我们去时贵州游优惠活动5折）。 门票、车票均当日内有效；即从购买门票时起，在当天之内可凭门票进入景区，每个景点仅能入园一次。
5.0,neg,0.6394388675689697,好多人觉得西江苗寨太商业化了！ 但是大家可否想过，如果没有外来资金投入，那么我们的入住条件以及就餐环境会不会也会打折扣呢？这是一个相互矛盾的问题。我们既希望原生态，又希望住宿条件好，这两者不可兼得。 旅游在乎不不是目的地，而是沿途的风景以及路上的心情，如果我们带着一双善于发现美的眼睛出来玩，那么我们到哪都舒心。如果我们带着挑剔的眼光则就是回自己家都闹心。仁者见仁，智者见智。
5.0,pos,0.9859280586242676,多年以前去过的西江千户苗寨。在古代这里一直被称作蛮夷之地，直到新中国以前苗族都是一个被驱赶迁徙的民族。如今这吊脚楼却展示着一个不老而顽强的民族，苗族人民也安定幸福地生活于此。 🎯推荐理由： 🌈西江千户苗寨是中国乃至世界最大的苗族聚居村寨。是一座保存苗族原始生态文化的活的露天博物馆。 🌈大山深处无论是清晨的雾霭缭绕还是入夜后的万家灯火都是世外桃源一般难得一见的美景。 🌈吊脚楼、风雨桥这些典型的苗寨建筑也是世界建筑美学上的奇观。苗寨歌舞、银饰苗绣都是极具民族特色的人文艺术精品。 🌈苗王鱼、酸汤鱼、鼓藏肉、米酒等，苗族美食也令人流连忘返。 🎯tips： 🌈苗族有一些很有特色的节日，比如苗年节、吃新节、十三年一次的牯藏节等等，苗寨都会有特别的庆祝。 🌈如果时间允许，建议在西江过夜，体验下苗寨清晨的雾霭、傍晚的千灯、入夜吊脚楼里安静中的流水淙淙，非常令人难忘的美景和经历。 🌈目前西江的旅游开发非常充分了，但旅游旺季游人比较多。最好提前预订客栈等。 🎯交通： 从就近的凯里客车站去往西江中巴车很多，十分方便。
5.0,pos,0.9795536994934082,西江千户苗寨是世界上最大的苗寨，位于贵州省凯里市，如今交通也比较方便，有多种方式进入苗寨…… 来之前看到网络上各种苗寨美景，心生向往，所以去年夏天的时候就来到了贵州，贵州真是漂亮，风景优美，有很多著名的景区，西江千户苗寨夜是其中之一…… 夏季来的时候，最好提前把交通住宿都订好，规划好来去时间，另外夏季是旺季住宿也比较贵，也要选好住山下还是山坡上，因为上下确实需要体力，但是住的高一点风景好…… 苗寨主要有两条街道，一条小河穿寨而过，河上有五座桥吧好像，座座都是一道风景，苗寨的夜景特别漂亮，流光溢彩，璀璨生辉，战在高处往下看，可以忘掉一切烦恼…… 其他的看照片吧，值得一去～…～
5.0,pos,0.994672954082489,贵阳工作一年，对我最大的吸引是可以行走于贵州大地，西江千户苗寨是必须打卡的地方，贵阳高铁40分钟到凯里南下车，广场上既有大客车直达35元车票，车程一小时到达苗寨，正门口苗家欢迎仪式很带感，苗家女子敬的欢迎酒一饮而尽，汉子们芦笙吹起高高的，进门没有乘坐观光车，步行进寨，小吃美食溜达着，风雨廊桥述说着古老的故事，相信有一对爱旅约会于此。廊桥上的字一个都不认识，晚上17:30有苗家歌舞表演赶不上时间没去看，贵州酸汤鱼是必须品尝的佳肴，魅力西江酒吧的歌声穿透整个西江的月夜，一首我在贵州等你好听的不得了。酒吧内认识的不认识的跳起舞蹈合着美酒，放下烦恼开心今朝。 早晨的观景台，炊烟袅袅，整个苗寨尽收眼底，租一套苗服我就是漂亮的苗家女子一枚。
5.0,pos,0.7827857732772827,西江千户苗寨景区，门票100元，电瓶车费用30元，停车场停车按小时收费。电瓶车就两站，观景台和一号风雨桥，观景台可以俯瞰整个苗寨，非常壮观。千户苗寨，据说从一号到七号风雨桥，全部走到就游玩了整个景区，其实不是，景区很大，除了那几座桥之外，还有一些小巷很漂亮，嘎歌，也东，侯家庄等等，另外，还有一些地方必看，博物馆，歌舞表演，古法造纸，苗族古法造纸等等，仔细玩，这里可以玩两天。
5.0,neg,0.9601442813873291,从凯里汽车站有班车到门口，十六块钱，一个小时到，回来时也是在那景区门口买票回凯里，另外景区里面还有一个车站，到雷山的，太坑，90门票，刚到门口就好多人问这问那，二号风雨桥对面6号客栈，说带去他家住，然后就被坑了，去他家开了个100块的单间，房间又小，说好的空调也不给遥控器，第二天早上出去，我十一点半回来已经把我房退了，我什么东西都还在房里，门也打开着，本来开心来玩的，没什么心情了，建议大家还是网上订吧，门口拉客那些比较坑，惑者进到里面再订房，里面大把房，也没什么可看可玩的，去一次还是可以的，不建议去第二次，都是商业街，客栈酒店，听说这开店的人差不多都是外地来的
5.0,pos,0.661406397819519,停车场下来后会看到苗寨大牌坊，但从这里走到景区入口还有1.5公里，路比较平整，拉杆箱拖起来还是比较轻松的，走到第二块苗寨大牌坊才到真正的检票口。我们是中午到的，门口吃了花溪牛肉粉后进景区。下午在寨子上逛逛，先来到河的北面，从东头靠近梯田的一号风雨桥出发往西走，这条街上的建筑都是苗寨吊脚楼风格的，但全都是商业店铺，已经完全商业化。沿途参观了苗族博物馆，差不多参观一下半小时。然后上山看去了苗王鼓藏头的家，位置在北面山坡的最高处，鼓藏头负责守护对苗族人意义重大的鼓，算是苗族自治时期的领袖，所以也叫苗王。我们只看到一个空空的院子，还有一间放鼓的房间。鼓藏头家往下走不远就是活路头家，活路头是生产领路人，目前寨子的活路头就住在这栋房子里，对游客开放，活路头在门口贴了纸条，如果他不在家，游客可以自行进门参观，离开时记得关灯关门一切复原即可。在活路头家可以看到老百姓的生活场景，很朴素，甚至有点简陋和艰苦，和商业街上的热闹繁华，民宿的舒适华丽形成极大的反差。从活路头家出来，再回到商业街继续走到西头，回程沿河岸边走，从五号风雨桥走到四号、三号风雨桥，这一段比较漂亮，可以拍到倒影，还有很多穿着当地漂亮服饰的小姐姐站在岸边或者桥上拍照，是一道靓丽的风景线。走到三号风雨桥差不多六点了，我们就去吃晚饭了。晚饭后再跑去观景台俯瞰苗寨夜景，灯火的映衬下很美，千户人家连成片，很壮观！我们住在河南岸最东面最高处的民宿里，第二天起床推窗俯瞰北岸千户苗寨的美景，早晨的苗寨炊烟袅袅，烟雾缭绕，是另一种美。苗寨玩一圈差不多大半天，建议住一晚，感受白天和晚上两种不同的意境。景区电频车包含四程，大门口到观景台和观景台到一号风雨桥各算一程，往返就是四程，其实走走不远，但进出拉着行李还是坐车省力些。自驾车停在第一块牌坊外面的停车场，我们停过夜，不到24小时，停车费30。
5.0,pos,0.9892162084579468,西江千户苗寨，我的心愿之旅。下午3点离开镇远古镇，到达苗寨已是5点半多了，天色已渐渐暗淡下来。刚一进苗寨就被眼前随着地形的起伏变化鳞次栉比、密密麻麻的上千户吊脚楼所震撼了，虽然这么多年在云南、广西 、湖南见过了不少的苗寨和侗寨，但规模如此之大，如此壮观的还是第一次。苗寨四面环山，层峦叠嶂，梯田依山顺势直连云天，清澈见底的白水河穿寨而过，将西江苗寨一分为二，七座风情各异的风雨桥，又把两岸紧紧地连接在一起。苗寨的主体位于河流东北侧的河谷坡地上，吊脚楼依山就势层叠而上，直至山顶，羊排坡和东引坡形如一对水牛角状，正是苗族同胞最喜欢的图腾。放下行囊，迫不及待的赶往景区最佳观景台的观光车乘降点，心急火燎的排了不下20分钟终于在熙熙攘攘的人海中得愿所偿站在最佳观景台上，苍山、吊脚楼、白水河，点点闪烁的灯光，背靠青山，脚踏玉带，整个苗寨尽收眼底，微微的夜色下蔚为壮观。
5.0,pos,0.9719627499580383,晚上万家灯火给的震撼，早晨袅袅炊烟给的宁静，现在云亭轻奢全景美宿酒店阁楼上或者趴在房间阳台上，整个千户苗寨一览无余，这份在躁杂喧嚣的城市里难得的一份清净！站在吊脚楼上穿上苗族服饰，来一张美不胜收的美图，留下美好的记忆！
5.0,pos,0.9405519366264343,《到苗寨寻找属于你的诗与远方》 去贵州一定要去一次西江千户苗寨，这似乎早已是约定俗成了的。它很神秘，作为中国乃至全世界最大的苗族聚集区，依旧是保存苗族原始生态文化完整的地方。 一次说走就走的旅行，下了凯里南高铁站，坐上苗寨的专线大巴车，一个小时的路途，当汽车拐过一个山湾，就远远地望见对面形如牛角的寨子，那就是著名的西江千户苗寨了。 对于长期生活在繁华都市里的人们来说，那种紧张的快节奏生活逼得你简直喘不过气来，有时也会产生寻觅一处宁静恬淡的自然环境来抚慰自己疲惫心灵的想法。走进西江千户苗寨，这里的清新舒缓和原始拙朴，也许会让你眼前一亮。 在苗寨中，走过风雨桥，沿着寨子里蜿蜒石板路，缓步在青山绿水之间，欣赏着苗家特色的吊脚楼，偶尔有芦笙传入耳中，彷佛置身于世外桃源。 你可以在古街上沐浴冬日阳光的温暖，穿梭在嘎歌古巷，体验一次苗族工艺。你可以在苗寨赏一次花。在白水河畔邂逅花香，遇见春暖花开的日子。你可以在苗寨的观景台看一次晚霞。俯瞰全寨，美丽的山水之间，霞光映衬出苗寨的温柔、宁静、美好。你可以在苗寨穿一次最美的盛装。穿着苗服入乡随俗，夜游西江拍照打卡，享受苗寨的慢节奏生活。你可以在苗寨看一场演出。大型原生态苗族歌舞剧《美丽西江》，是你不可错过的选择。你可以在苗寨寻一道美食。体验一次苗家的长桌宴，高山流水让你懂得有一种酒可以让你喝到怀疑人生。你可以在苗寨感受浓郁的民俗风情。体验苗族迎宾最高礼仪十二道拦门酒；去鼓藏堂参观鼓藏文化，去西江苗族博物馆感受苗族历史、服饰、农耕、建筑等文化。你可以在苗寨等候一场雪景。一场雪，才知道素颜的苗寨多美。 西江千户苗寨，春有花香满园，夏有热情演出，秋有梯田如画，冬有白雪缀景。2021年，到苗寨寻找属于你的诗与远方！ 旅游小贴士： 西江千户苗寨 地址：贵州省黔东南苗族侗族自治州雷山县西江千户苗寨； 开放时间：1、景区全天售票及开放。 2、观光车运营时间：北服务区到小北门24小时，上下观景台早8:00-24:00。 门票： 西江千户苗寨套票含景区门票、景区观光车票（4次）、观景台、博物馆、鼓藏头家、活路头家、刺绣坊、蜡染坊、酿酒坊表演场等，110元/人（我们去时贵州游优惠活动5折）。 门票、车票均当日内有效；即从购买门票时起，在当天之内可凭门票进入景区，每个景点仅能入园一次。
