score,sentiment_category,sentiment_score,comment
4.0,pos,0.869441568851471,"西江在苗语里的意思是""有鬼的地方""，这源自苗族人民一段辛酸的历史。几千年来，苗族受制于汉族，被迫辗转到大山里生存，但仍然不时遭受到侵扰。论实力，苗族打不过汉族，他们想到一个办法，就是装神弄鬼来吓退敌人。这里是个回归淳朴的地方，适合喜爱清静的人，坐在苗家吊脚楼上，倚着美人靠，听听自然的声音，喝杯浓香的苗家米酒，真的很惬意。"
4.0,neg,0.8650233149528503,千户苗寨是目前中国最大的苗族聚居村寨，商业开发让这里少了往日宁静。外来的车辆不能开进景区，进景区须乘景区大巴。千户苗寨嘈杂、更商业化，旅行社的队伍一批批涌来，人多，很热闹，太过喧闹，还说是淡季，若是旺季该如何？千户苗寨适合拍照，但实地的确有些乱。个人觉得那个球场败挺笔，它在那里与周围环境太不协调，球场设置在这个位置总觉得有点不伦不类，实在破坏古寨原本古朴的整体效果。
5.0,neg,0.5728810429573059,现在的苗寨的商业气息非常浓厚，到处都是小吃、酒吧、纪念品和酒店，而淳朴的苗寨人家也变得非常少了，虽然大部分的商铺都是有着苗寨的风格，身上穿的衣服也都是苗寨的，但是这些人并不是苗寨人
4.0,pos,0.6453125476837158,这个地方推荐大家去，三五朋友一起去住两天还可以，吃酸汤牛肉，喝点米酒，别有一番风味，风景还是不错的，有种回归自然的感觉，就是节假日住宿有点贵
3.0,pos,0.7660730481147766,一、已被商业化的苗寨东西就不要买了。但是喧嚣中你可以去博物馆听一下讲解一个人应该50不就是100有点忘了。苗寨的人文文化值得听一听。 二、轮景色可以远观山上的建筑，到观景台看全景，如果时间可以，可以留宿一晚看夜景。 三、西江千户苗寨不需要抱团。我建议可以自由行然后到博物馆找讲解你就可以了解到文化了。
4.0,neg,0.8098074793815613,千户苗寨｛门票、4趟交通（北门-小北门来回、观景台来回）、餐饮（厨禾餐厅）｝¥148 西江千户苗寨由十余个依山而建的自然村寨相连成片，是目前中国乃至全世界最大的苗族聚居村寨，居住着“西”氏族苗族。山坡上层层叠叠苗家木质吊脚楼，咖啡色的老房子依着碧绿的群山。 观景酒店基本都在半山上，不建议带太多行李，这里没有搬运的纤夫。 虽说是千户，由于商业发展，这里已经有三千多户人居住。 凯里南高铁站只有到景区北门的车，定的酒店靠近西门，景区的路大部分是鹅卵石路，拉着行李箱真的很奔溃，大概走了半小时。 路上有电瓶车，只是供村民乘坐的。 厨禾餐厅 套餐的指定餐厅，一家廉价的长桌宴，口味跟卖相一样，就不用多说了。期间会上一些推销食品试吃。 不是很习惯跟陌生人一起吃饭，6个人一个锅，30人围着吃，有些尴尬。 重点是开始服务员并没有配勺子，有些人直接把筷子放进锅里夹，后来叫服务员上了勺子，其他人还是直接夹，看着很不卫生，都不敢吃。 看着长桌宴的高山流水灌酒仪式也就撤了。
3.0,neg,0.6395323872566223,西江千户苗寨慕名而去的，结果看到了一个开发无序的现代化苗寨。苗寨里的房子里三层外三层地都开了住宿店，还大部分把普通的农家乐住宿店，说成是民宿…而且住民宿的房费奇贵，旺季一房难求……
5.0,pos,0.9856625199317932,很方便，非常好。苗寨值得住一个晚上，车程太远，我们住了两个晚上，直接凯里火车走，不累。如果当天来回是什么都看不了的。苗寨不要错过造纸跟古法蜡染，小朋友会很喜欢的
4.0,neg,0.9873964190483093,虽然商业化严重 但是还是能感受到苗寨风情 里面吃的真没有什么好推荐的 唯一挺满意的是美丽西江的表演 比较震撼 原生态的歌舞 但是感觉大码大爷们纯粹是表演 不是热爱和享受 一副生无可恋的表情 长桌宴要选择有气氛的酒家 感受一下。纯属商业化运作。没有真正意义上的苗家人的长桌宴的意义 住上山三天二夜 算是比较的深度游了 好好的享受了一下慢生活 以及感受到了一些苗族不同的民俗文化 可以这种风格的 可以来体验一下
3.0,neg,0.9906778335571289,苗寨看远景尚可，经不起细细品味。而且已经完全商业化了，夏季人超级多，完全体会不到那种心情！景区交通糟透了：车停西门下面的停车场，等电瓶车送到景区售票处，等半小时不来，甚至来了也直接走，只好拖着箱子顶着烈日步行几百米去售票处，再拖着箱子通过商业行街步行几百米去大门口。进门再拖着箱子，一哄而上抢上景交车，进入景区内的停车场后，再拖着箱子排队转乘电瓶车进入苗寨。好在我们订的客栈可以来停车场接送，减少了一次拖着箱子排队坐电瓶车，而且客栈楼顶的观景台非常好，又减少了一次排队电瓶车。旺季这里的住宿超出你想象的贵！订房时一定要注意客栈的位置，否则会很远，很不方便！这里，来一次就够了！不来，也可以！
3.0,neg,0.9962215423583984,什么好风景如果经过百般折腾的话都是没有心情的。这是来西江的第一大感受。来西江苗寨，首先必须看攻略，我们是什么都没有准备就来了。那真是一个苦字。一，路堵的慌，在高速路上出来就是堵车的。一直堵到西门门口。10公里的路程走了一小时，到达西门已经是17点多。西门有很大的停车场，自驾车车必须在此停。从停车场进入景区门口有很长一段路，商业建设已经超发达，会让你错觉是不是走错路。没错，按着指示牌一直走吧。这里提醒一下，自驾游的务必放下所有行李，只带换洗衣服好了。轻装上阵，要不后面更后悔。二，我们是不清楚状况，带了所有行李就进来的，还拖儿带女的，那真是苦。排队等观光车的阵势已经会吓一跳，不过还好了，往返的车是够多的，虽然人特别多但还是能够坐上车。等待时间不会很长就到了景区观景台停车点，抵达这时间已经快19点。三，呵呵，拖着行李箱走300米左右的路到达观景台乘车点，真正的噩梦才开始。我们定的酒店是苗丽主题酒店，在极大的嘈杂声中听老板说沿着马路步行150米左右看到指示牌。公路就公路非他妈的说马路，接了几次电话也不派人来接。只会说到哪里打电话，黑夜中，到处都是人，都分不清哪里是路。抱着娃，拖着行李箱，从人群中百般无奈的穿到马路上，走了150米左右并没有看到老板说的指示牌，倒是手机导航提醒需要转弯咯。问了人，确认往下走。往下走是啥概念？就是重庆式的山城楼梯。狭窄的楼梯，有上下的游人，我们拖儿带女，提着行李箱，疲惫不堪，饥饿交迫，还得痛苦的一步一步往下走，一个劲的后悔来了这地方，什么风景此时都觉得是狗屎。再一次百般无奈的好不容易找到酒店，时间已经快21点了。一群人除了愤怒找不到别的感受了。四，静下心来看了看，苗丽酒店地理位置是很不错的，能看到全景。但住宿条件和服务态度就一般般了。可能是喝了咖啡缘故，竟然睡不着，才有了现在的吐糟时间。总之，来西江千户苗寨，1不要在旅游旺季来凑热闹，那是恐怖的，我都不明白这里为何不限制人流。已经超负荷运行了。2来之前要做好攻略，进来一定要从简。
5.0,pos,0.9888644218444824,位置就在观景台旁，给我们升级了房间，千户苗寨全景尽收眼底，很美！在接待美女的指点下，徒步游玩很方便，参观了博物馆，乘车回观景台。地理位置佳！
5.0,pos,0.7633482813835144,西江千户苗寨是世界最大、天下无双，唯一保存最完整的苗寨，有千年以上的历史民族文化。值得去探讨的地方。
4.0,pos,0.8368234634399414,网上订票很方便，如果多人出行时，建议分开订票，如果有人不能来，可以随时取消订单，而不影响其他人员。我这次就是临时人员有变，取消了一个人的订单。在游客中心兑换的纸质门票。苗寨的游客还是很多，商业气氛还是较浓，但夜景很漂亮。
4.0,pos,0.7295193076133728,虽然都在说很商业化，但还是值得一去，尤其是夜景的确漂亮。只是感觉游客中心在应对蜂拥而至的游客时有点力不从心。自助取票时居然一直说没有购票信息，打电话问景区客服也说没有查到信息，最后还是在窗口电子取票处才取到票。
5.0,pos,0.8243934512138367,西江千户苗寨，其实很值得一去，可惜有些商业化。当时11月去的游人不多，感受并不非常强烈，但听人说旺季这里人满为患，街头都是人！晚上在制高点欣赏夜景很赞，下午还会有苗寨特色的表演，大约下午三点会有一场，持续40分钟左右。 苗寨的中心大街卖的东西大多大同小异，特色性不是很强，宁可多花些时间在苗寨上走走看看。苗寨里不少小吃，但个人还是觉得炸土豆味道更赞一些。可以选择在小店里租借一套苗族服饰拍照哦，很应景。
5.0,pos,0.9798110127449036,景色很好，站在观景台上俯瞰绝对震撼，走进密密麻麻的苗寨建筑中完全的沉浸式体验，携程上老人小孩成人的各种项目票很齐全，订好票刷身份证直接进，美中不足是西门停车后要走很远才能到检票口
5.0,pos,0.9359512329101562,夜景很美，应当住景区门口的酒店，玩的晚一些，但确实很值得。
5.0,pos,0.9007692337036133,西江千户苗寨是贵州知名的旅游景区 是古镇和古寨游的天花板，这里非常有特点，来贵州旅游一定要到这里来，一定要品尝当地美食。
5.0,pos,0.9021997451782227,到贵州必打卡的景点，很有民族特色，一进去就有苗族美女和你拍照，景区的楼大部分都是新的，不知道是不是为了房体加固，里面很多餐厅比较推荐，没有宰客，都很货真价实。
5.0,pos,0.8929603695869446,买的B区票，现场一看，人海茫茫，果断售票处升级VIP，先进场，中间位置，B区在两边，网上有人说乱坐的，我感觉分区放行很严格啊，还是值得一看
5.0,pos,0.9048477411270142,西江千户苗寨是苗族聚集地，规模很大。苗族气息很浓。站在观景台上可以俯瞰整个苗塞全景，夜晚更是景色迷人，非常值得去看看，了解苗族的风土人情！
5.0,pos,0.9386484026908875,整体不错，景区不算太大，走一圈下来差不多20分钟，景色挺美的，跟凤凰古城的风格很像，都是夜晚人更多，风景和商业古街结合，夜晚入住第二天下午离开一日游就可以逛完了，还可以都体验一下
4.0,pos,0.828667938709259,比较漂亮的地方，尤其是这里的夜晚，因为过来的时间比较特殊，甚至还能够看见烟花，经常过来的人还是挺多的，尤其是暑假的时候，简直就是订房都难。
5.0,pos,0.8626905679702759,月里的风，暖洋洋的，如同有一双温柔的小手在抚摸着我的脸庞，感到有一种说不出的畅快。我披着和煦的阳光走进了黔东南苗族侗族自治州雷公山麓河流谷地。这儿坐落着中国最大的原生态的苗族寨子
5.0,pos,0.9431295394897461,西江千户苗寨还是一个非常值得去的地方。个人觉得，晚上住在那里呢，看着万家灯火更振憾！那里有许多的就是住宿的地方，挑一个，山顶的能看得更远。
5.0,pos,0.9953420162200928,小姐姐们太热情了，初来乍到热心接待，不懂路况会细心告知并且帮我们扛行李。房间风格温馨，全景落地玻璃，苗寨景观一览无余，贴心准备水果点心，都是一群热爱生活的小姐姐，期待二次再续。
5.0,pos,0.9875453114509583,只是想找一家景色好的民宿，办理入住是小哥给我办理了房间免费升级，进到房间惊艳到我，窗外景色太美了，房间特别的大，整洁干净，布置简洁温馨，第一时间小哥送来水果和下午茶，非常感谢。
5.0,pos,0.9674407243728638,千户苗寨夜景非常美，到这里一定要拍一套苗族服饰的写真。非常值得去的一个景点！
5.0,pos,0.9722489714622498,门票非常非常非常实惠 是一个非常值得去的旅游景点 里面白天和夜晚的景色也很很很好看 是一个非常值得去look watch 的景点 推荐大家可以去游玩
5.0,pos,0.8386783599853516,风景不错，建筑也很有特色。景区内交通也很便利。就是进出景区都要经过长长的商业区，也是没办法的事情。景区内各种租用服装拍照，可以选择有专业摄影师的，效果更棒。
5.0,pos,0.7670655250549316,贵州今年对八省市游客免门票，还是挺值得来的。西江千户苗寨只要20块钱的车票，挺划算的。苗寨挺大的，走路距离不短，最好是晚上能住一晚。商业化有点严重，不过还是能接触到很多当地人。
5.0,pos,0.9699192047119141,很值得去的地方，推荐住在西江临枫居，风景很好。四号风雨桥是小吃街，一号风雨楼和田园风光在一起。还有这家的肉串一元一串的肉串和肉皮串一定要吃。还有阿侬家的苗家菜，带起黄牛肉好吃。
4.0,pos,0.6195586323738098,西江苗寨景区体现黔东南苗族侗族自治州少数民族聚居特色，木质结构房屋成片，规模宏大，防火压力超大。苗寨附近的石桥村景色不错，一样直得前往。
5.0,pos,0.9602959752082825,感受西江千户苗寨的苗族文化，到周边梯田观赏田园风光，穿梭在满满的古式古香的木屋群当中感受当地人生活气息，品尝贵州特色酸汤鱼，羊肉粉，张氏牛肉干，腊肉。西江千户苗寨绝对值得推荐。
5.0,pos,0.9602959752082825,感受西江千户苗寨的苗族文化，到周边梯田观赏田园风光，穿梭在满满的古式古香的木屋群当中感受当地人生活气息，品尝贵州特色酸汤鱼，羊肉粉，张氏牛肉干，腊肉。西江千户苗寨绝对值得推荐。
5.0,pos,0.9865720272064209,喝了拦门酒；吃了苗族美食：中午酸汤鱼，晚上酸汤牛肉；看了最美的苗寨夜景：一到傍晚人流就都挤到了观景台，要提早去找好位置；体会了苗家的民俗文化，感受了苗家人的热情好客。不虚此行！
5.0,pos,0.6052981615066528,还不错，吊脚楼依山而建挺有民族特色，虽然商业气味重了点但这些在市场经济发展中不可避免，值得一起。
5.0,pos,0.7352685332298279,苗寨的酸汤牛肉很好吃，是鲜牛肉，这是我重要要说的。其实还是可以一去的，说消费贵，住宿的确对比是贵州之行最贵的，但是住一晚还能接受，其他东西你不买就好了，苗家风情不错，还好去了！
5.0,pos,0.5877575278282166,一个具有神秘色彩的民族，苗人的智慧在于他们所处的环境，可惜现在浓郁的商业气息让这种美丢掉了沙衣！
5.0,pos,0.707048237323761,西江千户苗寨，在贵州的凯里。一共有十多个依山而建的，自然村寨，居住着上千户人家。它是目前中国乃至世界居住最集中的苗族村寨，且以西氏为主。
4.0,pos,0.5703079700469971,非常壮观的苗族人的寨子，不过很商业化了，家家户户都在做餐厅和客栈，随处可见，到处在建房子。稍微走走，就可以看到当地人的家，还是有点贫困。
5.0,pos,0.9512618780136108,这是我们国内最大的苗寨了，有电瓶车直接开到观景台，可以俯瞰到整个苗寨，苗寨前还有一条河蜿蜒流过，还有一些特色的吃的，一般都是在那里住一晚
5.0,pos,0.8106890320777893,挺喜欢千户苗寨的感觉，苗家文化，客栈非常多，住宿都很有特点。站在山顶观景台，从这里居高临下，俯瞰整个苗寨，挺壮观的。
5.0,pos,0.8917456865310669,这里的晚上风景不错人也很不错很好玩
5.0,pos,0.9749201536178589,景区管理非常优秀，四程观光车非常有必要且价格适宜。所有服务一条龙，井然有序。让游客到时不迷惑，离开时不迷路。 寨子很有特色，连成一片十分壮观，夜晚更是好看。
5.0,pos,0.7756750583648682,感谢(❁´ω`❁)在我年轻的时候，曾以为金钱是世界上最重要的东西，现在我老了，才知道的确如此。
5.0,pos,0.8843488693237305,【景色】 夜景非常美，再穿上苗族服饰，超赞👍🏻 住宿 推荐花筑陌上花开客栈 因为在半上腰，需要趴上去，不过视野非常好。
5.0,pos,0.8437420129776001,值得一去的地方呀，浓浓的少数民族气息，体验感也很强，华灯初上，在观景台拍个夜景，有万家灯火、也有平凡人家的悲欢离合。消费不高，可以一试
4.0,neg,0.8389896750450134,苗寨真的就是适合拍拍拍的地方 哈哈哈哈，不是千户苗寨，是千户民宿 喜欢拍照的妹子可以来，但是真正的感受寨子风情就没必要了。侗寨也是很坑的。
5.0,pos,0.6765949130058289,建议白天和晚上都去一次观景台，吃的不怎么样 最好还是淡季来 民宿 价钱优惠的太多 位置也可以选择多点 高点的晚上拍景色就巴适
4.0,neg,0.6407300233840942,强烈建议年轻人只买45元门票，不要买那个景区小车票，很近的。景色还好，就是吃的不好，小吃没特色，北方人表示吃不饱！
5.0,pos,0.7971650958061218,电影《无名之辈》《地球最后的夜晚》让贵州成了许多人的打卡地。由十余个依山而建的自然村寨相连成片，山坡上层层叠叠苗家木质吊脚楼，咖啡色的老房子依着碧绿的群山，在阳光下格外好看。
5.0,pos,0.9655700325965881,西江千户苗寨，应该是贵州必游的景点了。可以用不虚此行来形容。浓郁的雾气缭绕在山间，也笼罩在苗寨上空。寨子里的水很清澈，清晨走走，静谧。
5.0,neg,0.539676308631897,总的来说还不错呦，民族文化风情气氛浓，古城治安也还可以，管理上还是需要再进步一点，比如车辆行驶，车辆行驶在古寨里面速度很快，有危险因素
5.0,pos,0.9559488296508789,过年和家人一起去了贵州，比起凤凰个人觉得苗寨更美一些，错落的房子很有感觉，特别是早上起来，看着雾气萦绕，很美，寨子不大，却可以细细品尝
5.0,pos,0.9636773467063904,千户苗寨目前中国乃至全世界最大的苗族聚居村寨。它是领略和认识中国苗族漫长历史与发展之地。西江每年的苗年节、吃新节、十三年一次的牯藏节等均名扬四海，西江千户苗寨是一座露天博物馆
5.0,pos,0.8154929876327515,值得一去，环境不错，很有古镇的味道
5.0,pos,0.7407352924346924,看西江知天下苗寨，很有少数民族气息的一个村寨，特别是长桌宴，可以体验一下，感受苗族妹子的热情。
5.0,pos,0.8700143694877625,西江千户苗寨，一个名声在外的地方。保留了很多苗族特色的东西，特色小吃、文创纪念品都有，旅拍更是遍布河道两岸，晚上的夜景就系明灯三千的感觉，使得人人都在屋顶上享受旅拍的快乐。
5.0,pos,0.8323066234588623,西江千户苗寨是非常具有民族特色的景区，依山而建的吊脚楼非常有气势，整洁的石板路，潺潺的流水，绿树成荫，鲜花不断，值得游览。尤其是夜景，灯光璀璨，炫丽迷幻，仿佛童话里的世界。
4.0,pos,0.775629997253418,和其他古镇最不同的就是有很多身着苗族盛装的女孩儿在旅拍，尤其万家灯火的时候，你可以看到很多这样的可爱的有趣的人，也是股债的一道风景线
5.0,pos,0.9121828079223633,苗寨景色真的很不错，这里很适合用2-3天去体验一下闲适的生活 ，慢慢的游到高处，静静的体验苗寨
4.0,pos,0.9024624824523926,值得一去，少数民族传统特色很让人感到亲切，疫情期间人流量也不算大，适合在哪里住几天，四处闲庭漫步，江景房也是价格亲民，出乎想象中的好
5.0,pos,0.9894129633903503,很值得去，而且对杭州人免票。最好是住在苗寨里，也可以看到壮观的夜景，淡季去价格便宜很多，还可以尝尝他们的稻田鱼，把六座风雨桥来回走遍
5.0,pos,0.9767133593559265,看吧，啥也不说了，美的让人窒息了。就是寨子交通不方便，商业氛围太浓了。想体验纯正的苗寨已经很难了。山上的吊脚楼还有继续搭建的，山区人民致富心情迫切需要。
5.0,pos,0.7357957363128662,景色是无可挑剔的，节假日来最揪心的是排队，感觉像是难民迁徙大队。景区河边小店坐下喝个小酒吃个酸汤鱼，离开人流，感觉还是惬意的。最好往寨子深处走，可以发现属于自己的观景平台。
5.0,pos,0.9773992300033569,携程上订的门票，取票时告知杭州人免门票，意外惊喜，苗寨很壮观，依山势一河两岸，流水潺潺，芦苼声声，小吃喷香，我一个人足足逛了五个小时
5.0,pos,0.9317406415939331,贵州黔东南-千户苗寨 很美，喜欢这种古老而神秘的地方！
4.0,pos,0.9408732056617737,中国文化博大精深，西江苗家民族文化精髓的完美保留，展示了苗家风彩，苗家服饰，苗家生活习惯苗家人的喜、怒、哀、乐，都体现得淋漓尽致……
5.0,pos,0.8068510890007019,踏青季节去，花开正好，所幸没遇上人山人海，悠闲好去处
5.0,pos,0.7021362781524658,带着最初的好奇、揭开千户苗寨神秘的面纱。体验民族特色、万家灯火载歌载舞。
5.0,pos,0.6800041198730469,太商业化了沿途基本都是旅拍为主，就缺少了一些氛围，但是本地人还是很热情，介绍当地的特色美食和风俗节日。夜景很美很好看很治愈，早上可以爬到山上的咖啡厅晒晒太阳，很舒服很安逸
5.0,pos,0.9598565697669983,非常有趣的一次游玩体验，非常独特的民族风情，大门入口就有民族活动表演，非常震撼，景区里面的吊脚楼木材建造在山腰，晚上的夜景非常漂亮，很多穿着民族服饰的游客逛街，感觉很棒。
5.0,pos,0.9187359809875488,贵州西江千古苗寨，迷人的夜景犹如千万颗星星闪耀着，每当夜晚降临，依山而建的苗居风光齐放，美不胜收，早上晨曦出放，云雾缭绕，犹如仙境
5.0,pos,0.8564100861549377,建议买苗寨的来回的电瓶车车票，不然上下山腿都走废了，苗寨的环境和景色是很不错的，值得一玩，租借苗族服装拍照超出片，但是选择拍照的服装店需谨慎，水平高低不齐，我们就踩坑了。
5.0,pos,0.6543306708335876,风景还是挺好的，但是因为疫情，很多店里都没有开门，游客也不是很多，没有旺季的时候那么的热闹，但这样也好，房间什么的都大降价，之前1000多的景观房，只要几百块钱，挺好的。
5.0,pos,0.9424691796302795,国家4A级旅游景区，是一个保存苗族“原始生态”文化完整的地方，是中国乃至全世界最大的苗族聚居村寨，它是领略和认识中国苗族漫长发展与历史之地，值得一游。
5.0,pos,0.9700614213943481,很好，有机会还会再去。每年暑假都要考虑去哪里玩，选好线路出发，好的地方会一去再去，不好的地方就pass掉，如今已经形成多个精华线路，这里就是其中之一。
5.0,pos,0.9371249079704285,西江千户苗寨是领略和认识中国苗族漫长历史与发展之地，它由10余个依山而建的自然村寨相连成片，是一个保存苗族“原始生态”文化完整的地方，是中国乃至全世界最大的苗族聚居村寨。
5.0,pos,0.823958694934845,是一个很大的寨子。 个人认为还是很值得一去的。寨子里有小学和中学。从这点来判断，这还是很有生活气息的一个地方。 在寨子里走走逛逛很惬意
4.0,pos,0.9077667593955994,很值得一去，苗族人喜欢把集中建在一起，从山上至山顶，依山建筑，颇为壮观，讲究山型风水。尽管房子都是木结构，他们的防火安全意识强，注重安全教育和保护，据说从来没有发生过火灾
4.0,pos,0.887016773223877,贵州之旅的第五天，来到了美丽的西江千户苗寨，真的壮观。很巧正赶上一场婚宴，吹吹打打，煞是热闹，看到了伐，还有18只蹄膀[偷笑]，以前只是听说，现在是目睹[呲牙]，厉害了！
4.0,pos,0.5446463227272034,西江千户苗寨就是苗族人居住聚集区，在观景台看全景感觉不错，在山谷里的苗寨，下去后就是商业街。据说晚上夜景不错，但是没住这里不知道。
5.0,pos,0.9419519901275635,千户苗寨，千年历史，记载了苗族人们勤劳勇敢，与大自然抗争，顺应自然发展，求得生存的历史，记载了苗族人们的历史文化，载歌载舞，高山流水的酒文化兴趣陡然提升，让人久久不愿离去
