score,sentiment_category,sentiment_score,comment
4.0,neg,0.9795531630516052,首先先说下我们去的时间是2020-10-4，国庆假期外出人最多的一天，因此从开车下高速开始就是不太好的体验，而且整体感觉非常商业化。 1.应该在西江下的高速路口因交通管制封闭了，往前开到雷山县高速路口也封闭了，没人在路口解释为什么封闭，只让往前开。一直开到第三个收费出口，终于见到工作人员和聚集了大量的车在不知所措和询问中。这才明白前面两个路口已经被去西江的下高速车堵上了，下不了。现在我们需要调头从另外一侧的下高速口下去…… 2.艰难的下了高速 出了收费口，过了景区设置的健康检查卡口，在往西门停车场开的路上，又被堵在半路，半路一个公司的停车场提示，西门已满，外来车停在此停车场，于是到处可见巡逻一样开的缓慢的车主在找可以停车的夹缝，以及已经停好车，在收拾行李，准备轻装上阵的游客。 3.停好车，我们也捡了需要用的带下车，剩下的行李都放在了车上，步行约500米，顶着烈日和爬坡，终于见到游客中心，这里的十字路口还有交警在疏导交通，坚持开上来的车依然有地方让你停，所以，如果坚持开上来，也是没问题的。 4.从游客中心到西门，又经过长长的商业街，人挤人的多，而游客中心其实在商业街尽头，西门对面。但在商业街另一头却给了引导走商业街才能到的提示，这是赤裸裸的商业引流。 5.西门门口又拍了长长的几条验票入园的队，进去之后又是长长的排队等车的队，先做摆渡巴士从西门经盘山路到观景台，再从观景台换电瓶车坐到寨子里，其实走的还是一样的柏油路，不过弯路的大小不同而已。由于观景台排队的人实在太多，地图显示距离酒店不过一千米，于是我们选择走路下去…… 6.到酒店办好入住以后，进入寨子核心区，商业街、古街、小吃街、表演场等，人是真的多，走哪都像排队一样往前挪，所谓最大荷载量的50%不知道是怎么计算出来的。 7.第二天一早有时间再清晨逛了逛寨子的半山腰，基本也都是酒吧、客栈、餐馆……整体感觉非常商业化 【趣味】 免费表演场每天有定时的表演，这些大多是当地的老人在沿袭，因此可以看到他们的朴实和特色，比如被拽的长长的耳朵和耳洞。我们看是有点吓人，但对他们来说是美的象征吧。 实用tips： 清晨可以趁寨子还没苏醒，游客还没进来的时候，四处转转，去半山腰走走，找找机位拍几张照片。观景台和电瓶车下寨子那条马路的对面都是不错的拍全景的好地方。
5.0,pos,0.8214654326438904,苗族最大的聚集地，景色很美，小吃种类丰富，感受苗族文化体验苗族生活，各种小商品可以做为旅游纪念品收藏，苗族的银饰很牛角梳朱砂饰品具有收藏意义
4.0,neg,0.6546508073806763,景色可以，比较单一。到处都是各种店铺，与国内其他古镇差不多。交通还是比较方便的，乘高铁到凯里南站，下车就有景区直通车，大巴，车况不错，滚动发车，票价35，车程一个小时，直接到景区门口。景区内各种民宿林立，非高峰期根本不用提前预定，到了现找都很方便。八月底后过了旺季，住宿价格陡然跳水，几乎半价以下。
4.0,pos,0.9436700940132141,值得来看看，吃货一定要来❗️有一处小河可以趟水，小朋友可以穿凉👟来玩，小吃一条街，商业一条街，尤其是夜景，一定要住到半山腰上，晚上观景绝佳，我们住的是想宿，可以看夜景还有驻唱，来这里要慢慢地逛，缺点就是商业化比较重，苗族气息并不很浓厚，但是值得一玩。还有苗服体验一定要试！
5.0,pos,0.8586902022361755,住在苗寨里面的，住的民宿价格有点贵，但房间跟酒店比比还是有点差异的，床上还有小虫子。但是住景区内，夜景真的是很美的，图2图3都是用餐的时候拍的，现场更美，酒店房间看出去比这美，但是拍下来不是很好。图1是新弄的一个景点。里面兜一圈大概二个小时，餐厅也挺多的，可以选择田园旁的餐厅用餐。进门有班车，里面的观光车20元也可以不买，体力好的话，走走逛逛好了不累的。
5.0,pos,0.8252922296524048,森林覆盖率达31.6%的贵阳，被誉为“森林之城”。来贵阳便一定要体验一下这个城市慵懒、慢节奏的生活。 西江千户苗寨由十几个依山而建的村寨组成，是个超大型的苗族村寨。寨中是独特的苗家木质吊脚楼，夜晚灯光亮起，璀璨夺目。
4.0,pos,0.773626446723938,西江千户苗寨，号称世界上最大的“千户苗寨”，其实想象，本身世界上就没多少苗寨，如今越来越商业化，在这儿住的也大多是做生意的外地人，几乎全是卖旅游商品的，进寨子还要收100元的门票。在买票时最好别买观光车票，虽然可以来回从门口到寨里再到观景台坐四次，但实际上走路也不过十来分钟，完全没必要，我买了后只用了一次。 观景台是俯拍苗寨全景的最佳位置，晚上也可以再拍次夜景，每天有2场歌舞表演，只有20几分钟，要看的话注意时间别错过了，一人只能看一次。苗寨旅游开发的很成熟，最出名的就是那里的长桌宴。这边的口味偏酸，酸汤鱼，酸菜腊肉、糍粑都不错。苗寨木楼依山而建，视觉上很有气势。夜晚满山灯火亮起犹如繁星点点点缀夜空，令人陶醉。 黔东南是我们口中常常提到的“苗乡侗寨”，这里是全球18个生态文化保护圈之一（亚洲只有2个，另1个是西藏）。如果你是来旅游的，黄果树瀑布、荔波是你必去的，如果你是来旅行的，黔东南的民族村寨则是你必去的。这里浓浓的民族风情让人心驰神往，景点主要也是以少数民族村寨为主，一个个独具特色的村寨，鼓楼、风雨桥、层层叠叠的古老吊脚楼值得细细品味。 春夏秋三季都比较适合到黔东南，但是建议避开黄金周等节假日，清净的寨子才会让人安静下来。旅行时间就看自己能有多少时间了，因为寨子太多，除了最热门的西江千户苗寨，还有朗德上寨、南花苗寨、车江三宝侗寨、肇兴侗寨都是很有代表性的。建议以州府凯里作为旅游中转站，去西江和朗德都是在凯里洗马河车站坐车，再留上2天时间去下从凯里坐火车1小时就能到的镇远古城。
5.0,pos,0.948349118232727,想要领略少数民族苗族的原生态生活，那么贵州西江的千户苗寨非它莫属。这10多村寨相连成片，依山而建。据导游说，这是目前最大的苗族聚居村寨。苗族的历史发展，在这里可见一斑。这里民风淳朴，能歌善舞的苗族人民生活在歌声中。小河悠悠，碧水长流，青山环抱，鲜花簇拥。苗寨，真是世外桃源！
4.0,pos,0.9527593851089478,西江千户苗寨现在的却是商业化十足，但是我依然认为是个值得一去的地方，有不一样的风光和景致，最好是住一晚，这样夜景和日出、夕阳都可以拍摄到，毕竟这么大的寨子不多见，依山傍水，吊脚楼层层叠叠，甚为壮观，贵州有直达西江苗寨的旅游巴士，也可以到凯里客车站坐往西江镇的中巴，另外自驾游也是不错选择，但是贵州多山，盘山公路和隧道多，安全驾驶尤为重要！
5.0,pos,0.9681882858276367,游览完秀美的自然风光，傍晚时分来到雷山县的西江千户苗寨。这里是一个保存苗族“原始生态”文化完整的地方，由10余个依山而建的自然村寨相连成片，是目前全世界最大的苗族聚居村寨，露天的苗族文化博物馆。苗寨对面的观景台上可以俯看西江千户苗寨全景，村寨绵延在高坡上，蔚为壮观，夜晚灯火通明与天上繁星相呼应。苗族是一个擅长歌舞的民族，所以苗族原生态的歌舞表演千万不能错过。奔放的苗族姑娘和小伙，可爱的苗族小朋友，在芦笙的伴奏下，跳起热情洋溢的民族舞蹈，让人沉醉在浓郁的民族风情中。苗寨周边的田园风光也非常旖旎，梯田从山脚一直延伸到山顶，层层叠叠的梯田与苗寨村落遙逢相对。恋恋不舍的回到贵阳，正好可以吃晚饭。
5.0,pos,0.7693102359771729,位于贵州黔东南州，苗岭山脉的深处，是最大的苗族村寨，据说有人口七千多，虽然商业化比较明显，但是夜晚满山的灯光和晨曦中满山层层叠叠的吊脚楼的景观还是很壮观震撼的。
5.0,pos,0.7987492680549622,到了西江，有一台演出是一定要欣赏的，那就是《美丽西江》大型苗族风情晚会。因为苗族是一个能歌善舞的民族，“能言便会歌，会走便能舞”，苗族的歌舞，最富有山野味，有着古朴而粗犷的迁徙烙印，最能表达他们真挚、纯朴的思想情操，也最能使人感受到民间艺术的真、善、美
4.0,pos,0.9488754868507385,尽可能的安排在苗年前去，很棒~ 普通时候过去，与大部分古镇无异，并不值得专程前往~ 千户苗寨的苗年每年由鼓藏头和活路头商议决定，时间并不固定，但基本是在国庆期间～ 苗年期间前往苗寨是最棒的时候～ 前往千户苗寨的最佳时间就是在苗年初年的时候，几乎所有的苗家人都会倾巢而出，穿带满全身家当，极具特色～ 而且能体验到，苗寨平时绝无仅有的十二道拦门酒、祭祀及摆满整整一条街的原始长桌宴～ 苗年信息：（各地的苗族苗年时间不一样，以下信息只限于千户苗寨） 比苗年更为隆重盛大的是每隔13年才一次的鼓藏节，由于过于盛大，会导致消耗太大，鼓藏节后的三年，不再有苗年～ 而下一次鼓藏节是在2022年 11月（有兴趣的朋友可要记住啦）～
4.0,neg,0.5408541560173035,苗寨有两个门，一个是北门，一个是西门。北门是公交车和出租车停靠点，西门是私家车停靠点。进出时，问清楚，因为没有人特意告诉你，也没有标志牌写。 苗寨开发极度商业化，没有什么特别的古迹，主要就是体验风情，实际上，没有什么苗族人可以看到，他们的日常生活你也看不到。据说只有两个广场上的表演群众是苗族。这个寨子就是卖吃的喝的玩的。而且小贵。 夜景要看看，下午去，住一晚，上午回。河北的上山路可以通到山顶，可能是过去苗族人的进出山路，喜欢的话走一走。
5.0,pos,0.9312152862548828,许多人为了西江千户苗寨的夜景赶至，其实白天的风景也别有一番趣味。整个苗寨很大，风景很美，选个在半山腰的客栈可以直接观景。还有长长的栈道，沿着漫步，俯瞰整个苗寨。
5.0,neg,0.8475816249847412,基本都是木楼，依山而建，很多都是新修的，感觉一般吧，没多大看头。不过到了观景台，看下全景，还是蛮赞的。夜景也还可以，但是没有想象中那么震撼。 从五号桥开始，沿河很多小吃摊，糍粑、猪肉串个人觉得还是可以一尝的。
4.0,pos,0.9784308075904846,千户苗寨虽然有点商业化了，可是景色是真的不错，特别是晚上，美得没的说。白天如果遇到下雨的话，山头上会有雾，氤氲的感觉让人沉醉其中，无法自拔。没来过西江的朋友值得到这儿来看一看，心灵和身体都会很放松，会忘掉很多的压力和不愉快。至于购物的话，景区内的东西的话就只有牛角梳值得买，其余的在其他景区都是能买到的。
5.0,pos,0.8740030527114868,每到黄昏时分，千家万户就亮起了灯。随着天色越来越暗，西江千户苗寨变成了灯的海洋，可以看到苗寨呈现那牛头的形状。为使游客更好地观赏西江千户苗寨夜景，景区在山坡高处的路边修建了观景台，还开通了观光车。我们晚上坐电瓶车上山观看苗寨夜景真的很美。灯光璀璨。
5.0,neg,0.5922738313674927,贵州省内开发最早的少数民族聚居地景区，所以商业配套很完善，同时也会因此感觉商业气氛过于浓厚缺少原汁原味的民族特色。当然整体上还是一个山清水秀的美丽苗寨，相比较而言个人更喜欢原生态一点、开发更晚的肇兴侗寨。
3.0,neg,0.9963303208351135,名气大，人多，太不值得去！商业化气息相当严重，全是卖东西的，而且一条街全是烧烤的烟子，河水也很臭，完全影响我们旅游的心情。国庆期间还严重堵车，景区外面的路太窄了，非常不爽的一次旅游，还要给门票，观光车只有一公里，还要收费，太坑人了！绝对不会再去，也不会推荐任何朋友去这种鬼地方！
5.0,pos,0.8542671799659729,夜景很美，来之前猜到商业化，不过就为了看看苗寨文化还是值得来的，里面的小吃摊一家连一家但是卖的东西基本都是一样的。味道都不错，唯一让人苦笑不得的就是白天的表演场里开场说今天攒上景区建立8周年，觉得自己很荣幸！紧接着说有幸请来名画家刘高升，然后就开始卖画了，美其名曰仅收装裱费500元，台上的就开始抢咯。哈哈，屡试不爽，然而机智的我早已看穿一切！不过后面的表演真的赞哦！
5.0,pos,0.643875002861023,个人认为还是因该去一趟的地方，很有地方特色，要是住上一晚还是很有意思的。 西江千户苗寨是一个保存苗族“原始生态”文化完整的地方，由10余个依山而建的自然村寨相连成片，是目前中国乃至全世界最大的苗族聚居村寨。
5.0,pos,0.8933588862419128,不错 十一人多 我六号去的 还能接受 里面管理好 小吃多 观景台看下去很棒 唯一缺点 演出太 low 门票太贵 我买的VIP 演出却像乡村大舞台 买60-80差不多。
4.0,neg,0.5478651523590088,风景不错，拍照出来的效果不错，但是到处都是商铺 卖的东西和小吃同质化严重。过度商业化导致缺少了苗寨本地文化味道 。 景区的规划也有问题，街道有车走，人行道走着走着就没了。 另外，不推荐国庆去，淡季去还可以悠闲拍照，旺季去只能看人了……
4.0,pos,0.9759261012077332,千户苗寨现在西门不开放，只能去北门，买了门票做景区公交上去。个人不建议买景区公交，因为里面要走的路并不是特别夸张，如果要去观景台可以做景区公交，只能在风雨桥这做，一次5块，来回也就10块。 苗寨的夜景是真的漂亮，我们是住在半山腰的酒店，看夜景非常好，不比观景台差多少。而且也能请酒店老板联系车从下面直接接到酒店，也就10块钱，能省好多事。 苗寨中午有免费表演，广告比较多，晚上也有表演，我们住的酒店可以远观，好多人看过说不好看所以我们没看，就通过窗户看了点大概，个人并不喜欢。 苗寨有很多新的旧的路，尽量不要用百度导航，有很多路都不是特别准，要找什么还是问问路吧，我们就被骗了好几次。 第一天晚上到的，有点晚了，当天晚饭在飞翔时光吃的，他家饭烧的超好吃，后面在别的地方吃着都没这么好吃了，菜的话一般。
4.0,neg,0.7314192652702332,自驾去的苗寨，收费是正常景区消息，30元包第一天，后面开始按小时收费，车位很多，停车方便，买票很方便。电瓶车的票不建议买，一次只有一小段，走走很快。可以问问那些面包车，10元基本包送所有地方了，我们就过景区公交的亏了，做了一段到入口，然后自己走到客栈，对了对了，百度导航在那是骗人的，还是多问下好，拿着大包小包的行理爬山路的感觉真的不好，哎。 苗寨除了表演就是远看风景不错了，住在山上是不错的选择。中午有免费表演可以看，但广告较多，晚上的灯光会好点，我也说不好好不好看，反正个人觉得没杭州的宋城千古情好看。 美食的话，通过大众点评找的，都不算不错吧。 最重要的一点，这的人都不太主动给你介绍什么，实在的很，有什么问题还是主动问下，问仔细点好。
3.0,pos,0.8642924427986145,山峦轻雾弥漫，远处炊烟袅袅，小雨还在不紧不慢的下着。街上的人群哈着白气，苗族女人担着青菜沿街叫卖，手工银匠在聚精会神制作，大木锤一下一下捶打着苗族糖酥。烟雨朦胧中，空气潮冷但又觉得很舒服（没有昨晚感觉那么冷，估计适应这里气候了～～徒步1.5公里登上观景台 。俯览苗寨全貌，楼阁梯次、雨廊石街、水秀的稻田、尽显千户苗寨山水家园风情......一群苗族大爷大妈围坐在长廊，唱着山歌。虽然听不懂唱的什么，感觉很好听。在这个商业化气氛愈来愈浓的地方，这也许就是对民族传统一种传承与坚守吧......
5.0,pos,0.9179952144622803,当然，值得一去，一定要住一晚，看看美丽的夜景，看看民族表演，再不然，穿上苗族服饰，去拍拍美照，让你会忘记世俗的烦恼，进入另外一个美好的世界
5.0,neg,0.5092428922653198,西江千户苗寨开发已十几年了，得益于国家对西部的战略和高铁；其实，在广东有座千年瑶寨，至今1400多年历史，同是国家AAAA级景区，又是中国首批历史文化名村、中国民间文化艺术之乡！
5.0,pos,0.7614889740943909,半山建造独具特色的吊脚楼，上千户吊脚楼随着地形的起伏变化，层峦叠嶂，鳞次栉比，蔚为壮观。西江千户苗寨是一座露天博物馆，展览着一部苗族发展史诗，成为观赏和研究苗族传统文化的大看台。
5.0,pos,0.970704972743988,大美苗寨，进入景区，有观光车，方便。住宿选择观景台附近。景区晨起，夜间景色美丽，苗寨下午4点的原生态歌舞非常值得观看。太棒了，非常震撼。
5.0,neg,0.7257063984870911,★【西江千户苗寨】拥有深厚的苗族文化底蕴，一栋栋的吊脚楼沿山坡依次第上，上千栋吊脚楼相连成片，形成一个整体的环形～～现在已经完全商业化，失去了原本的模样～～
5.0,pos,0.9415308833122253,跟着地接导游来到了美丽的少数民族，墨戎苗寨！导游也是苗寨人，自称阿妹，阿妹很是热情，为我们介绍当地的文化，历史，经济，生活，还带我们到处参观，喝茶，用餐，看表演，真的特别开心！
5.0,pos,0.8015049695968628,西江千户苗寨，是一个保存苗族“原始生态”文化完整的地方，是目前中国乃至全世界最大的苗族聚居村寨。每到黄昏时分，千家万户就亮起了灯。随着天色越来越暗，西江千户苗寨变成了灯的海洋。
5.0,pos,0.541603684425354,这里面最要说的就是住宿了，观景台哪里都有又不要钱，所以，住宿就不用特意去住所谓的观景房。开那种在离观景台近点的位置酒店就行。可以省100多。用来在苗寨底下买晚会票，可以更划算！
5.0,neg,0.6486064195632935,寨子不大，虽然有很多桥，但主街走路不多久就可以完成，有很多小巷子很多上下楼梯，主街商业化严重，建议穿一穿小巷子，看看田园风光，日出日落，还有当地的建筑民族服饰之类的，还是很美的
5.0,pos,0.7345254421234131,淡季人少，然后很多建设的设施在进行中。晚上的演出也取消了。 白天看看寨子，在各条街道上溜达一下。晚上在观景台看夜景，繁星点点，美丽之极！
5.0,pos,0.8684920072555542,苗族聚居地。这里山清水秀、空气清新，全部都是苗家建筑，门口有穿苗族服裝的当地人定时表演苗族歌舞；有的店家还当街打糍粑，游客也可以体验噢。
5.0,pos,0.8188148736953735,西江悦堂看西江，千星万点苗人家。日出映得山花美，苗家阿妹踏歌至。租苗服梳苗发，人瞬间清秀起来，怎么拍怎么美。注意衣服10元，梳头20左右
5.0,pos,0.7943879961967468,西江千户苗寨的夜景非常美丽，寨子里游人如织，各类店铺都开门营业，很多网红在拍照打卡，几座桥头都是灯光璀璨，和山坡上的苗寨灯光交相辉映。
4.0,pos,0.6767498254776001,千户苗寨不管白天还是晚上都很漂亮，但商业化太严重了。太多的商铺了。到了看看就好什么都不要买。租住在观景台早上起来就可以看到苗寨的全景。
5.0,pos,0.7600512504577637,还是值得一去，尤其是夜景，一定要找个高点的酒店，可以俯瞰全景。 贵州的美食都差不多，作为广东人只推荐黑猪肉串和牛肉粉了，其他还是吃不惯
5.0,pos,0.9514099359512329,这次住在观景台附近，交通便利，景色优美。景区商业开发较为完善，基本没啥原住民了。苗服拍照，夜景都是不错的选择，暑假高峰期人很多。到停车场距离较远，需要拉着箱子走半天。交通服务还是需要完善提高。
5.0,pos,0.9075808525085449,西江千户苗寨，像极了千与千寻 来到这里仿佛让人有一种请带我逃离现实世界的感觉，又有一种想把我带到天空里的那个彩虹里的冲动，图三是千户苗寨晴天看到的彩虹🌈
5.0,pos,0.8264978528022766,到凯里站后租车自驾去的，这样方便些，车只能停在游客中心的停车场，然后乘坐景区摆渡车前往，景区内的民宿可以通过网络预订，价格300内，很漂亮，待了3天都没等到太阳，雨水比较多
5.0,pos,0.8649614453315735,夜景很美，万家灯火的感觉。在当地遇到了一位很热情的“活地图”对苗寨18县的风土人情了如指掌。景区服务人员要求同一着装（让70岁的老奶奶头戴大红绢花…）。景点商业化，在向着丽江景区的道路发展……
5.0,pos,0.9615293741226196,西江千户苗寨是我去过的很多民族聚居地中最有人情味的地方之一…这里没有很多地方那么商业化，民族的东西感觉非常醇厚，非常值得来…极力推荐
5.0,pos,0.9648511409759521,喜欢这个地方，青山绿水、悠闲自在，苗寨很有特色，美食街的美味佳肴书不胜收，夜晚在山顶的咖啡厅坐下，看千户苗寨浓郁的风情，好不惬意！
4.0,neg,0.9877862930297852,大名鼎鼎的西江千户苗寨，看起来很美好，其实让人很疲惫，翻山越岭，交通不便，住宿又差又贵，人超多，嘈杂喧闹，管理混乱，商业化严重，不去又后悔，当作打卡啦
5.0,pos,0.9744164347648621,2016暑假去的，苗寨吊脚楼很有特色，夜景星光点点，清晨雾气缭绕，长桌宴，高山流水般灌酒，广场的演出，千亩水稻田，都让我印象深刻！
5.0,pos,0.892343282699585,美丽的西江千户苗寨，不如趁假期的时候，亲自来感受一下这里的苗族风情吧！也许，在这里，还会有不一样的邂逅......不一样的感受……
5.0,pos,0.8649753332138062,西江千户苗寨是一个保存苗族“原始生态”文化完整的地方，由10余个依山而建的自然村寨相连成片，是目前中国乃至全世界最大的苗族聚居村寨
5.0,pos,0.8395431637763977,冬天的苗寨，游人甚少，清清静静，宛如恬静温柔的少女，娇羞默默，惹人怜爱。建议住到高一点的山上的民宿，这样就能不出房门但可将整个寨子的风景尽收眼底了。
5.0,neg,0.7384421229362488,去这里还得是晚上，看夜景，白天商业街没什么意思，如果可以在那里住，我觉得可以走进更深的宅子里去看看。跟着团去的地方商业化太严重了
5.0,pos,0.9478747248649597,这里是我第一次看到的这么大的苗寨，寨里保持原有的景象，风景秀丽。在寨里吃饭还有苗族人在表演她们的舞蹈，喝苗家酿的米酒。还会再来。
4.0,pos,0.9388272166252136,虽然说网上差评不断，人很多是真的，但是我觉得还是值一去的。夜景，长桌宴，手打糍粑，苗王酥……唯一不好的就是景区交通，我一个人拉个大箱子，走在凹凸不平的石板地上还真是费劲
5.0,pos,0.995644211769104,非常好的名宿，老板好，搬运行李的小弟和大叔都是非常非常好的，很感谢他们！！ 房间很棒，床很舒服，干净，最爱它家吃早餐的调调，下次还住那儿！性价比高，总体超赞，景色不错，
5.0,pos,0.8356442451477051,西江千户苗寨景色不错，风景宜人，空气清新，自然、舒适，原生态自然风景，令人心旷神怡，趣味性强，性价比超高的，建筑风格独特魅力。
5.0,pos,0.8468140959739685,在貴陽跟團走了一圈。。。個人感覺這個寨子完全可以自由行的。。。這個寨子交通有直達，山路較為難走。。。環境不錯，很典型的苗寨。。。民風淳樸，極大成都還原苗家人生活。。。
5.0,pos,0.7140344381332397,值得一去的地方，不过没有什么特色，两个小时就可以全部转完，如果只是感受一下建议早上过去，下午就可以去别的地方了，如果是情侣可以住一晚，千户夜色中万家灯火也是很浪漫的。
