date,ip 属地,评分,comments
2024-12-15,广东,5,兴坪古镇是玩法分漓江和古镇内 1，漓江：必去，是漓江九马画山的人精华段和20元人民币景点 2，古镇内：已经很商业了，去里面坐坐，喝喝东西可以，至于购物就算了，都是义乌商品。 3，喜欢照相的可以去去照相，真的很美
2022-09-17,湖南,5,桂林阳朔兴坪古镇漓江最精华路段免费一日游 1.抵达兴坪古镇之后，先导航去20元人民币观景台，去这里可以直接走路去，沿途风光秀丽。2.如何不想做竹筏又想省钱做一次游轮的话，直接往后导航走到老寨山登山口下就是做轮渡去对面的小岛上往返是10元。3.最后做轮渡返回老寨山登山口等老寨山看最美日落。
2021-03-31,未知,5,刚刚从兴坪古镇回来。总体对兴坪古镇的感觉是满意的。第一次来到广西阳朔，看到了如此的山水美景，内心真的非常激动。 作为第一站的旅游目的地，兴坪古镇也是推荐来走一走的。 【景色】首先，兴坪古镇保留着原来的古镇气息，在漓江和山下看古镇，再品尝着当地有名的桂林米粉和啤酒鱼，确实别有一番韵味。 【性价比】其次，从阳朔站到兴坪古镇，五块钱的大巴车，距离不是很近，但是在阳朔站来说，真的特别方便了。 【趣味】最后，在兴坪古镇出来之后，沿着漓江边的马路租一辆电动车（20块钱左右，可以讲价），或者坐上漓江的轮船，可以打卡二十元人民币取景地，幸运的话还可以和人民币上的老爷爷合个影（需要花钱），再往前走就是九马画山，最后在山上看夕阳落下，非常有意境。 不过走过兴坪古镇之后，确实也发现了一系列的问题。 【景色】第一，景区内的环境问题，景区内的垃圾太多了，好像也没有专业的清洁人员打扫卫生，在山脚下就能看到很多垃圾。 【趣味】第二，推销问题，一到景区就是各种各样的老年人推荐吃饭和景点门票，推荐吃饭还好，就 是推销景区门票和船票有点烦人，这些老年人很有毅力，不推销一点东西出去绝对不罢休。 第三，兴坪古镇这边的汽车站很小，是临时的那种，不是特别规范。
2018-04-19,未知,5,非常值得去的地方，除了古镇还有古镇旁边的老寨山，不用门票爬上去45分钟左右，漓江大拐弯和兴坪古镇全景尽收眼里，附近还有20元人民币背景，黄布倒影，九马画山，漓江湾后山，相公山，漓江的精华都在兴坪古镇，黄布倒影的日出更是美美的，一年内来了2次，住兴坪古镇的杨家村，漓江边的一个小村，老板非常好，这也是一年来2次的原因，老板家就在漓江边，可以途步，坐竹筏，吃住也不贵，有时间可以住上半个月慢慢享受漓江美景
2017-09-15,未知,5,兴坪古镇还是值得一去的，古镇离阳朔火车站很近，那边也有码头，古镇的商业化不很浓厚，去那边可以感受到当地人的生活习俗，那天去时好像刚好是农历七月十五，家家户户在门口放鞭炮，烧香纸，那边的物价也不高，当地一些老婆婆卖些小玩意儿也不错～
2016-06-27,未知,5,兴坪古镇不是很大，距离阳朔稍微有点远，但是漓江大部分景点都在兴坪，最美的景色也在这里，兴坪古镇比较破，跟其他古镇相比，这里景色也就是一般古镇的样子，但东西是便宜，不想其他景区专宰游客，这里的商品是真便宜，尽情买吧
2016-03-04,未知,5,3月初旅游淡季、从广州南直接坐车到阳朔火车站（16年1月就开通了阳朔站距离阳朔30公里左右直接有车到阳朔），因阳朔站靠近兴坪古镇（5元车费）直接就奔兴坪本人计划去三个重点景点白天游完傍晚坐8元巴士到阳朔入住吃饭逛西街第二天游十里画廊遇龙河。兴坪是漓江精华段的终点、现可以在兴坪正规售票窗口直接买票、有六十到两百多的逆流竹筏马达驱动、俺只游了98的兴坪到马山（这个马山好像不是九马山）或许是为了吸引游客票面上这样写兴坪--马山。因为现在政F参与管理景点分段游玩不同价格、淡季一般下午人多游竹筏可以跟别人（有很多广东游客的在排队的时候听他们说粤语就感到亲切直接问凑够四人了没）拼竹筏就不回有付空位费的问题（当然不排除个别恶劣现象、防人之心还是要有的），兴坪景点除了游漓江竹筏、二十元钱风景还有一个不得不说的地方就是老寨山、相公山，游阳朔在兴坪不山看风景你就白来了一趟、趁年轻可以爬山看在地面看不到震撼宏伟舒心景色、视觉一高一低感受桂林山水甲天下！
2024-10-12,广东,5,兴坪古镇：最值得打卡的就是20元打卡地了 真的跟20元人民币上的景色一模一样 就是没有那个老爷爷👴在了 带父母一起游玩，性价比很高。
2018-07-15,未知,4,都说桂林山水甲天下真的不枉此行，总共98多块钱门票，可以沿着兴坪古镇街道一直走，然后就会发现有好多吃的玩的可，供观赏的艺术品，然后坐观光车去坐竹筏沿着漓江欣赏漓江的美景，漓江的水清澈见底，漓江风景如画，游玩时犹如置身诗画般的感觉，竹筏是电动的要是换成人工竹筏就更完美了
2017-10-06,未知,4,景区整体还是值得一去。国庆节去人较多，古镇卖水果和小吃饮品的不算很贵，饭店有点坑，我们之前那桌点的剑骨鱼300多一条，饭店没有给人做那条称过的活鱼，上的是之前剩下的。我们三人点了三个菜246块钱。田螺酿好吃，竹筒鸡除了汤基本咬不动，还有一个炒青菜味道一般。古镇距离码头很近，坐船可以去看20快人民币背景图。摆渡到河对岸，包车120可以去相公山拍整个漓江的全景，60一张票，国庆不能网上订票。整体玩的还不错，主要狗狗很开心！
2016-08-09,未知,4,我们去的时候是早上，大多数店铺还没有开门，这样反倒是显现出这个小古镇的特色了，安静的街道，旧旧的街景，保持很久的建筑，还有那缓慢的生活节奏，都是我喜欢的氛围。但是这个古镇也就是很小的范围了，步行走了1个小时基本全数逛完了……
2016-06-12,未知,5,贵广高铁的开通，极大的方便了周末游，兴坪是有着一千七百多年的古镇，镇子不大，也加入了不少外地人，类似于早年的阳朔西街，河对岸的大河贝村值得去走走，风景秀丽，宁静舒适，主要是生态环境保护得很好，非常适合休闲放松，除了在江边漫步，还可以走腾蛟庵、爬螺狮岩、相公山，尽揽千峰叠翠，周边春天可欣赏烟雨漓江，秋天是青峰倒影。
2016-02-24,未知,4,早餐后退房，目标兴坪古镇，手机及车载同时开启，一路车子不少，省道转县道，双向双车道，路上人多车多，不过还算顺畅，40分钟这样到达古镇，人车更多了，到了兴坪旅游客运站，见左拐的车道上很多车，怕塞死在里面，没敢进去，直接停产客运站内，30元，贵！上个洗手间还要每人1元，可笑可气之举也。不过兴坪古镇感觉挺不错，古镇有保养修缮过并保留古色，有民俗有文艺有特色，不像大圩古镇那样残旧没人气。古镇虽不大，不过走着的感觉挺好的，也许是大清早人不多的缘故吧。慢慢的走慢慢的看，刚进去时满地红色炮竹铺地，很有年味的感觉，后面街区已打扫的干干净净，偶见街角摆着木桌木凳，或见一两间特色小店的，很有古色古镇之感。 古镇不大，半个多小时就走完了。
2015-11-07,未知,4,兴坪古镇位于阳朔县城东北部25公里处，素以山水秀丽，景甲天下而著称，景色秀丽的山山水水，引得无数骚人墨客为之陶醉，还有被印制在99版贰拾元人民币背景图案上的秀丽风景，古镇因为有两个总统足迹，吸引了不少中外游客慕名前往，原汁原味的感觉很不错。
2017-08-07,未知,5,不错啊，性价比还可以，还是选携程，正规安全放心开心！携程在手说走就走，果然没错！推荐大家来阳朔直接在携程上预定自己想要的想玩的，省去很多麻烦，也不会上当受骗！
2016-09-07,未知,5,阳朔高铁站就在此镇。而漓江两岸的风景也属兴坪段最美！二十元人民币取景点就在兴坪镇，从这坐车到阳朔县城，车非常多票价五元。建议到漓江游玩，第一站应选在兴坪。
2016-08-17,未知,5,兴坪古镇不错，没有西街的嘈杂，有古镇应有的姿态，古物保存的不错，就是还是沾染了很多商业气息，感觉上去就有点掉价了，在古镇吃了个艾叶凉粉，很有特色，棒棒的。
2023-08-24,江苏,5,20230314下午： 1、“兴坪古镇”位于5A景区“漓江”江畔。漓江是桂林地标式山水风景名胜，桂林山水的精华，是1999年版20元人民币背景和《刘三姐》等著名电影电视剧的拍摄地，其“百里画廊 ”般的喀斯特地貌是世界自然文化遗产，是桂林旅游必打卡的景区，历史上留有孙中山、叶剑英、徐悲鸿、克林顿与其夫人希拉里等名人的足迹。漓江属于珠江水系，已开发的100公里区域北起桂林市区解放桥附近，南到阳朔县，另有一段位于北端的灵渠与湘江交界处，占漓江总长214公里的将近一半。 ①地址：桂林市阳朔县兴坪古镇。 ②交通：公交直达，开车很好停。 ③旺季：无。 ④用时：5小时。 2、从桂林游船码头到阳朔的漓江段全长约60公里，单程4.5小时，单向无往返，所以要从阳朔乘车回桂林，或是自由行的话将漓江作为桂林市区的最后一站，阳朔结束后直接北上去其它县市逛。出发的码头有两个：“磨盘山码头”（三星级游船）和“竹江码头”（四星级游船）。由于桂林已经5个月没下雨，漓江已经断流成了几个大湖，所以此次没能坐游船逛遍漓江，只能在携程上找了个一日游产品坐大巴到“兴坪古镇”的“兴坪码头”附近游江，绕一圈后返回兴坪码头再坐车回桂林。 3、兴坪古镇是一个古色古香的江南小镇，最早记载于三国时期吴国甘露元年（265年），2006年重修，1998年还是渔村的时候接待过美国时任总统的克林顿和她夫人、后来的美国国务卿希拉里的到访，目前街道上青色砖瓦的古建筑颇多，饶有韵味，“古戏台咖啡馆”所在的建筑颜值很高。漓江兴坪段有“20元背景图”、“螺狮山”等景观。
2019-07-21,未知,4,以古鎮來說，的確不及蘇浙那邊的。遊客主要是在觀光船碼頭下船來的，基本他們就逛那麼一條街，賣的東西都和全國大小旅遊區賣得沒什麼分別。不過相比於陽朔縣城那邊，這裡商業氣息已經淡很多。而且也找到一兩家很用心在經營，賣自家製造的小店。早上和傍晚時間是最好逛的，大部分的店都關門，也沒有吵鬧的遊客，在河邊走走，像本地人一樣散步，才是正確的打開方法。可能鎮上大多都是本地人，遇到的人都很友善，做生意的即使不光顧他們，還是會很親切指路。當然感受當地氣息還是要到菜市場，不一樣的食材，小攤檔，會讓你有不一樣的發現。
2024-08-14,广西,4,不用门票 去码头坐船穿过古镇 路不宽 游客和车辆很多 路两边餐饮多 稍微有点乱 古镇里面有不少服装拍摄的 出片效果应该是不错的 时间充裕可以逛下。
2023-04-18,四川,5,兴坪古镇，一弯漓江水静静地绕镇而过，山重水复，流水行云。 柔和的阳光照耀着古镇，川流不息的竹筏轻轻划过江面。阳光、倒影，拉近了天与地，山与水，自然与人的距离。古镇外面就是九马画山和二十元人民币背面图案的取景地。有时候远方不远，就是一车轮的距离。没有距离的伤感，只有对诗和远方的向往。 对古镇，有一种别样的情怀，至今已经记不清听过多少古镇的故事，看过多少古城夜晚的那轮明月。古往今来岁月的流逝模糊了古镇的记忆，淡忘了古镇许多的曾经。那些远去的岁月，消失的年华，在斑驳的粉墙、长满青苔的乌瓦、光滑的石板街之间刻上许多看不懂的文字和乱七八糟的符号，让你读不出年代。古镇仍然保留着原来古朴沧桑的脸庞。镇内那些饱经风雨、原汁原味的古街、古桥、古戏台、古庙等众多古老的文物古迹，它们就像是记忆的胶片，记载着古镇一千七百多年的历史。
2018-03-02,未知,5,从桂林北搭高铁到阳朔，从阳朔站搭旅游大巴到兴坪古镇只需要五块钱，兴坪古镇是漂流的终点，可以在兴坪古镇漂流逆流而上，每个人98，和男朋友总共两个人，凑不到四个，只能加50包一个竹筏，景色很美，整体感觉很不错。出游时间：2017.8.30~9.1
2017-06-28,未知,4,兴坪古镇有啥好玩？ 1、看20块背面图，这个可是来阳朔的标配啊。从古镇到观景台走路大概10分钟，景色确实不错，但那里有3个观景台，我们在第一个看了，那里有私人拍照收钱的，因为刚好背光，手机拍的都是看不清脸，当然我们没有要那种游客照，没有20块现金，跟旁边的一个帅哥借来拍了，所以还是要带上好呀。出来往前走还有2个观景台！呵呵，原来第一个是私人搭建的。 2、九马画山，传说毛爷爷在那看到9匹马，好厉害的，但这个路程有6.7公里，所以我们租了当地一个3轮车30块来回，一路上大叔跟我们介绍，最近去桂林旅游的人很少，很多买东西的啊姨会过分热情要你买东西，到了九马画山后要渡船到对面才能看到原图，渡船10块来回，因为好奇心我毫不犹豫过去了，结果好吧，一匹也看不到。。。 3、古镇的桂花糕不错，很好吃哟，40块2盒，还是决定贵了，你们下次去记得讲价哟！ 需要注意的事： 1、古镇只有个高级厕所要收钱！一次1块。 2、当地人带着道德绑架式的推销，我朋友在其中一个摊子买了漓江炸鱼，结果隔壁的阿姨就说你也买我的，不能只跟她买不跟我买，所以要拒绝！ 3、当我一个人在岛上看九马画山的时候，一个挑着鱼鹰的阿姨就主动过来指引我如何如何看，结果说完就要我挑着那鱼鹰拍照，说5块就可以，我真的不想啊，那么可怕的东西，她一直说我，真的有点受不了。可能因为游客太少了，当地人都想能赚一个是一个，但对游客来说伤害太大。 4、兴坪到桂林是要经过阳朔的！当时我们没有查清楚，走了冤枉路。 5、从阳朔到兴坪有直通的大巴，但是坐车的地方不明确，所以很麻烦，当时我们去了西站，结果撤站了，然后路边暴晒等车，心塞啊，最后还是拼了一个人滴滴直接到兴坪，一共60多块，坐直通大巴是8块一个人，看来出门还是滴滴方便啊，提前预约，方便快捷。
2016-08-12,未知,4,第一次去兴坪时，小伙伴们逆向徒步漓江边，第二次去，是从桂林坐船到兴坪码头上岸，古镇风，旧戏台值得一游，第三次，从阳朔坐汽车来，上了码头边的老寨山，不同角度地看兴坪。也看了她多年的变化，总体不错。适合休闲度假。那些假竹筏（PVC）就无兴了。
2016-02-19,未知,5,我们在这里住了一夜 古镇的风貌还是很不错的。但是看到很多的工地。这里被开发的程度太大了 不知道以后会怎样？
2019-06-28,未知,5,"兴坪古镇位于阳朔县东北部,距县城25公里,20元人民币的背面图景就在兴坪取景,兴坪镇素以山水秀丽,景甲天下而著称,是""中国旅游名县″阳朔县的旅游重镇。历来有""阳朔风景在兴坪,兴坪别有风光好,人在丹青画里行″的说法。境内不仅有九马画山,黄布倒影,螺蛳山,莲花岩,灵宝阁等景观。 古镇江边有游船码头,可乘游船畅游漓江,兴坪一九马画山一黄布倒影,返回兴坪码头。也有电动四人竹筏漂流,兴坪一黄布倒影后返回。20元人民币背景图取景最佳地在码头对岸,有估20元人民币背景图观景台。 阳朔县城客运站有去兴坪古镇的班车,在阳朔高铁站也有阳朔高铁专线车到兴坪汽车站,自由行阳朔交通很方便。"
2017-05-24,未知,4,漫步漓江边，看如画的岩峰耸峙，看小小的竹排悠然荡弋，看丝丝缕缕仙雾与黛峰缠绵，看曼妙的凤尾竹随风摇曳，看自己的心飘向无艮的快乐……
2016-12-06,未知,4,古镇物价高，到处大兴土木，尘土飞扬。离镇中心远点，感觉不错，景色好，早上晨雾在江上飘来飘去如同仙境。在这里住了两个晚上很逍遥
2021-05-31,未知,5,漓江是世界上风光最秀丽的河流之一。漓江素有“江作青罗带，山如碧玉簪”之美誉，江上山青、水秀、洞奇、石美。竹筏漂流是比坐游船更能亲近漓江山水的游览方式，乘竹筏平稳地行使在江面上，感受微风环绕，伸手便能触摸到清冽的水流。 想看到漓江最美两岸景色，一定要去兴坪到杨堤那段，棒级了。
2018-03-22,未知,5,兴坪真的好美，做为漓江精华段，有漓江第一美的美誉。交能便捷，坐阳朔站下车，5元的车票十分钟车程就到古镇。在九马画山前的石滩，山是尖的，树是斜的，有点林芝的味道。傍晚的漓江美得更让人窒息，一缕青烟绕群山，心难填，老翁渔火，杨家博山沉水香。
2017-06-08,未知,5,阳朔兴坪镇依山傍水，风景荟萃，粉墙乌瓦石板小巷，是漓江沿岸最美丽的古镇。 这里的古桥、古渡、古亭、古戏台、古庙、古寨、古树和古村落建筑群，比较完事地保持了原有的历史环境风貌，身临其境，仍可领略“老街长长，古巷深深”的意趣。
2017-06-08,未知,4,"去过了很多古镇，兴坪古镇不是很大，古风也不是很浓郁。 总的来说，兴坪给人的感觉不是特别的有感触。 乘坐了从阳朔到兴坪古镇的中巴车，10元/人。车程时间大概是1小时20分钟左右。 车不是很干净，汽车北站的环境比较差，灰尘很大，其它的车站没有去过。 在兴坪古镇下车后在汽车站门口租了一辆自行车，10元,押金100。 慢骑的话几分钟就能穿过兴坪古镇，古镇上店铺主要是卖吃的，特色的东西没什么，还有就是水果很多，但也都是到处都有的，我在那里买了三块石头，共30，其实在阳朔，也算给高了。"
2016-11-06,未知,3,从老寨山下来，吃过早餐后进兴坪老街逛了半小时。整条街被修复一新，街上游人如织，商业味极浓。房屋修得太新，街道太整洁，商店和客店太多，没有古镇的感觉，只剩下一个空架子而已。十年前的房屋虽破旧，但还是一个热闹的集市，很有看头。
2023-06-20,江西,5,漓江积聚了桂林所有的精华，兴坪就是坐船游漓江的精华。码头对面就是黄布倒影，二十元人民币的背景所在。镇里面游客中心买票有车送过河上船，船到九马画山返回，一个小时左右，景色确实让人不忍离开。
2024-01-15,河南,5,来桂林怎么能够不去阳朔呢？来到了阳朔怎么不到兴坪呢？传说在5年之前兴平古镇都是一处非常安静的地方，但是现在的兴坪古镇已经变成了人山人海，因为这里有20元人民币的打卡地更有登高可以望喀斯特地貌的绝佳之地。 👍最推荐： 1.既然来到了古镇，在古镇里面转一转是肯定的，建议大家选择两个时间段逛古镇，一个是早上清晨的时候，另外一个则是在傍晚时分，因为过了早上9点之后就会有大批大批的旅行团来到这里，实际上古镇是免费的呢。 2.20元打卡地。虽然那位摆拍的爷爷已经不在了，但是20元的打卡地依然还是每一个人来到古镇都要去的地方，其实从古镇步行到20元打卡地并不是很远，建议大家不要被小车所欺骗，慢慢的散步走一走的确是不错的景色。 3.老寨山。腿脚不是很方便的朋友就不推荐去老寨山看一看了，上面的景色固然很漂亮，但是有很多处的梯子还是非常陡的，并且都是比较原生态的梯子。那如果你的腿脚好，一定要走上去看一看，登高望远在这里能够得到充分的体现。 4.当然了，这边还有很多值得大家去游览的地方租一个电动车，慢慢的沿着漓江边行走，你会发现很多有趣的东西，期待着你过来探索更多的秘密。
2021-05-18,未知,5,兴坪镇位于阳朔东北部，距阳朔县城25公里，漓江在此绕了一个大弯，形成了一条美丽的碧波玉带。兴坪依山傍水，风景荟萃，粉墙乌瓦石板小巷，是漓江沿岸最美丽的古镇。 阳朔兴坪古镇是漓江沿岸最美丽的古镇，古镇不收取门票。
2018-04-04,未知,5,一座侗族的古镇 比想象中棒很多 母系氏族 听导游讲他们的故事还蛮神奇的 里面的建筑也很有特色 能看到听到他们唱歌 做手工 没有导游的话就是在里面随处逛逛了 有导游可以听里面的故事 但是导游都是购物导向的有点烦了 而且最后出口位置超级大的银饰店和其他特产店 不论买不买东西都必须走很久的路线才可以出去 太商业化了哎
2017-10-21,未知,5,兴坪古镇 位于阳朔北部漓江江畔 面積不大 是一座拥有一千七百多年历史的古镇 如今古镇内仍存有古街 古桥 古戏台 古庙等景物 众多的文物古迹 主要集中在古街 及离镇约2公里远的渔村裡 古镇的江邊 即是的乘遊船的码头 因為是二十元人民币背面图案的取景地 遊客特別多 取號後 排隊乘船 在每個景點拍拍照 返程時 可以登上遊船頂層拍照 360度漓江美景 美的秀麗 美的脫俗～
2017-03-12,未知,5,本人很喜欢兴坪古镇，第二次来了，这次是带老人过来玩，老人也很喜欢这里，空气好，沿漓江行走，没有坐船，边走边看，边拍照，云雾笼罩下的座座山峰，虚幻飘渺，很有意境，十足的一副中国山水画，美妙！住宿，吃饭都非常方便，去杨溯，桂林非常方便，适合慢生活节奏的人，边走边看很是惬意
2016-11-05,未知,4,風景優美，在汽車站租了一台自行車 經過興坪碼頭＄20人民幣及九馬畫山方向。騎了一半在公路邊看到黃布人家的告示牌，往河邊騎進去，才發現河邊有步行道，風景更美。小後悔租自行車啊⋯⋯河邊不到不少人走，點讚。至於九馬畫山根本看不到，回程租了一台車，人帶自行車載回汽車站。司機才跟我說，九馬畫山要在對岸才看得到，坑爹啊⋯⋯我騎這麼久......
2020-07-09,未知,5,老街老巷，适合点杯饮料发呆。一直以为拦路兜售的都是骗人的，但今天确实赚到了，没有坐码头的游船，五个人200元搞了个私游团，坐轮渡上的岛，玩得很开心🥳
2017-12-10,未知,5,兴平去总统渔村，68元。在那个渔村只给二十分钟，不能超一分钟，船上导游态度蛮横，没有去总统渔村的强没有去的同学强烈不建议去。，，，
2023-07-14,广东,5,漓江为兴坪古镇绕了个弯，形成了九马画山、20元人民币背景等景观。镇里好些明清时代的砖木房子还在，改成了一个个茶水酒吧、小食店。选一处水吧点杯饮料发发呆，确实很休闲。
2023-05-16,广西,5,兴坪古镇作为阳朔的第一站目的地，20元背景图不愧是名不虚传，好山好水好风光，置身其中，大自然的水墨丹青长卷徐徐拉开，令人震撼，让人赞美！另外加个小贴士：坐早上7点48分从桂林北出发的动车，半个小时到阳朔站，然后坐高铁专线大巴（5元一位）半个小时即到兴坪古镇，经典游玩项目：坐竹筏去看九马画山。第二天早上可在汽车站坐7点半的大巴去阳朔县，阳朔之旅第二站遇龙河漂流在等你来。
2020-10-25,未知,5,兴平古镇也在阳朔，去漓江再来趟这里真的很合适，但是估计大多数人是为了20元人民币来的，因为有名的黄布倒影，20元人民币的拍摄景点就在这里，来拍这张照片的人真的好多，还有老翁可以一起照相，在这里吃了啤酒鱼，真的一股啤酒味但是很好吃
2020-07-31,未知,5,来到古镇后，第一感觉就是这里的空气好好啊，风景美，东西也不贵，看看古镇，据说里面有一千多年的历史，古香古色的东西总能吸引我们的眼球，住在一家民宿里，名字很洋气，叫紫气东来酒店，位置很好就在码头，在顶楼可以看到漓江景，简直太棒了
2020-03-13,未知,5,兴平是整个竹筏的终点站 竹筏到这里就把漓江的行程给结束掉了 有一个观景台是和我们钱有关系的景观 在这里会有拍照的人 整个古镇感觉还是有一种开发过的痕迹。或许是因为我们淡季光顾的关系 这里的人气不是很足 而通往汽车站道路后面的区域还有一些残破
