date,ip 属地,评分,comments
2021-08-06,未知,5,很不错的一个地方，免门票，很多卖特产的小店，风景秀丽自然
2018-03-02,未知,4,在古镇的专用停车场停车方便，也免费，没完全开发，不需门票
2018-03-27,未知,5,可以去走走看看的地方，文化气息浓厚
2017-01-06,未知,5,传统特色风景，习俗浓厚。未开发，没有改造过的痕迹！！！
2021-12-07,未知,4,景色很好，有许多原住民还在里面生活，所以还没有过度的商业开发，可以感受到一些古朴的古镇味道
2017-12-08,未知,5,广西四大古镇之一，暂未开发，并不商业，还比较古朴。
2016-10-23,未知,5,千年古镇，历史底蕴深厚，悠然自得的闲逛的好去处
2015-10-31,未知,4,大圩古鎮、广西四大古名镇、保存的较为完整、古镇古朴、青砖青瓦、很具民族气息、值得一游。
2021-04-22,未知,5,百年的青石板底，古香古色的房子，很值得一去
2021-03-06,未知,4,大圩古镇在桂林郊区，其实商市区不是很远，公交车半个多小时就到，景色很美，值得一游。
2017-02-04,未知,5,历史悠久，风光好古朴天然真是修养的好地方。
2017-08-04,未知,4,古镇上逛得人不多，估计我去的时候是白天太热了，小吃旅游商品，每个古镇不用韵味。
2017-05-25,未知,5,有很多老建筑，有待开发，小商品有点多。
2022-09-29,广西,5,古色古香的小镇，值得一游，国庆快乐！
2017-05-15,未知,5,挺不错的古镇，还未完全开发，味道很足
2016-10-01,未知,5,去各处看人海，不如去古镇品味一种心静
2018-04-04,未知,5,我喜欢去各类古镇溜达，这个地方不错
2017-12-19,未知,4,这个古镇离桂林比较近，历史非常悠久了，青石板的古街是这里的特色，值得参观。
2017-05-19,未知,5,古镇人家保持着良好习惯和饮食习惯。
2020-08-23,未知,4,非常不错的一个古镇，这里的建筑特色非常不错，让人耳目一新，推荐来看看。
2017-03-20,未知,5,保存的很好民风淳朴值得一游！
2020-11-07,未知,3,怎么说呢，景色不错，就是当地向导拉客有点烦人，想自己走走一直缠着你说个不停，有点反感。
2016-08-04,未知,4,商业化不强，去的时候大雨，很适合拍照的古镇。
2018-08-03,未知,1,如果没有那几个彪悍的人确实是好地方。我拍的这个店在西面停车场那，里面一个长相丑陋的女人乱要价，坑人，我们去找还很凶。旁边就是派出所有事就找几个男人过去围着。
2017-04-21,未知,4,有山有水，还不错。。。。。。。
2016-12-12,未知,3,在不宽的街道上铺着青石板，石板路两边是保存完好的老房子。也没有怎么开发，游人不多，很安静。
2016-11-13,未知,4,大圩古镇是广西四大古镇之一，名气次于黄瑶古镇
2020-06-07,未知,1,昨天看了勺朵朵的攻略，今天去古镇果然碰到同样的骗术，借口脱身了。希望当的部门查处这类老千行当，给古镇一个干净的环境
2019-03-08,未知,4,这个古镇一般般，不是特别的理想。
2017-12-08,未知,3,商业化了，没什么意思，如果有时间且顺路的话，可以去看看，否则就不用去了。
2019-08-29,未知,5,大圩古镇里面的个万寿桥，都说万寿桥上走一走活到99
2020-07-03,未知,3,很远，没有什么特别好玩的地方，很枯燥，不过骑自行车还是很舒服的
2016-09-26,未知,3,我去的时候还不是很知名，几乎没有人过去。
2017-08-28,未知,3,比较原生态，商业开发有限，没什么吃的，娱乐性一般。
2017-08-29,未知,3,古镇都差不多，外行人看看热闹，孩子不是很喜欢，反正不要票，没事逛逛可以。
2020-10-04,未知,1,不像什么古镇，就是脏乱差，有个关帝庙的被外包出去了，内有二骗子一个叫你付香火钱别一个叫你付什么祈福钱，你付少了还说你心不诚。就像拍聊斋的古镇，第一感觉就觉得阴深深的。
2021-04-15,未知,1,去大圩古镇一定要警惕极个别不良卖中草药尤其是卖壮仙草的商家，会用托欺诈游客。千万问好买的药价格是每克多少钱，而且要先称重算钱，后打粉。不然奸商会让你先打粉再称重，当你发现要付的钱超过你的预期时，已经打粉了，奸商会逼你付款的。
2016-07-13,未知,1,超级不好玩几个破房子超级无聊不明白怎么还有人说好！我们一团人都说白来了不应该到这！
2023-09-12,广西,2,太垃圾了，感觉、非常差，车停在马路边都有老太婆过来收停车费，抢钱感觉
2020-10-02,未知,1,这里很小，半小时就逛完了，没什么玩的
2019-08-31,未知,1,不怎么好玩，没有特色，能不去可以不用去。
