date,ip 属地,评分,comments
2021-08-05,未知,5,金水岩距离月亮山不远，也在十里画廊景区，是一座巨大得地下河岩洞。坐十里画廊的电瓶车就可以到，交通很方便。 与各地很多大型溶洞差不多，这里洞内也有很多的天然形成的钟乳石、石笋和地下河。特别喜欢看的是从洞顶垂下的石质帷幔，很大一片，有规律的波浪状的弯曲。虽然是石头，但感觉很薄很轻，就像织物的帷幔被风吹形成褶皱一样。 洞内有地下河，可以坐小船顺流划过，和在洞中走体验不同，可以尝试。也可以走地下河畔的玻璃栈道，有时候河面会高于栈道地面，透过栈道两侧玻璃，可以看到水中的情景。 洞内还有泥浆浴，不过灯光比较昏暗，不太敢尝试。 洞内湿度很大，非常潮湿，地面也很滑，走路要小心。
2018-02-20,未知,4,金水岩就在聚龙潭前面一点点，其实感觉两个里面选一个玩就好了，金水岩比聚龙潭大一点，都是溶洞，东西都差不多，里面可以免费泡30分钟温泉，所以要去的话带好装备再去。游完还有场免费的演出，虽然演员就那么几个人，但是都挺卖力的，挺不容易的。
2018-02-02,未知,3,来桂林最不开心的就是在金水岩了，十里画廊有非常多景点基本都是看钟乳石的。一开始并没有了解清楚就选了金水岩。来了本来挺开心的，在进入景点后有一些卖东西的都能理解。走到后半部分有卖手链夜明珠的各种乱七八糟的小东西，但价格都还好可以还价，还有鱼疗，价格比外面贵没必要在这玩。冬天来的人特别少，我们同学十几个人进洞，走到最后两个卖东西的地方就很气了，说是什么免费开珍珠，就是一些贝壳自己捞一个他给你打开里面会有珍珠，大小不一，景点工作人员说好的珍珠形状大的就要给你加工就是加了条链子，要收三十多。我们十几个人开了都有珍珠，每一个都说珍珠很好要给我们加工就是要收钱的。我们觉得没必要，就不要了。知道我最后一个同学弄完，他也选择不要那颗珍珠，景点的人觉得没有赚到我们钱就开始凶我们了。说“一开始就说了是自愿的，如果开了好的珍珠就要加工给加工费的” 可是一开始他们也说了不好的珍珠就不给你加工啊，我们怎么知道里面是好是坏肯定都去开啊。开了就点强制逼你买走的意思。还骂我同学耳聋。真的非常生气！！别人的地盘不敢撒野，我们走还不行？辣鸡！
2017-03-25,未知,4,岩洞很大，挺壮观的拍了好多照片，导游声音好听，里面还有泥巴浴和温泉，不过泥巴浴没敢下怕冷全老外在洗，后面的温泉体验了一把，躺着舒服，感觉值了，不虚此行！夏天再来体验一下泥巴浴哈哈！
2017-09-01,未知,4,因为是来自广东阳江的，所以这种岩石对我来说并不突出，泥巴和温泉挺吸引人的，只是都没带衣服没有下去，门票是学生票36元，现在坐等听戏2333在岩石里面买了桂花酒，一时冲动，其实也就普通的酒，要30元，还是别在景区买这些东西吧，感觉很不正宗，虚名而已。
2017-03-21,未知,5,金水岩是阳朔境内很具特色的溶洞，洞内钟乳悬积、石笋林立，有水洞旱洞之分，水洞内有温泉，还有一个泥浴区，可以进去泡一泡泥巴汤。
2017-05-06,未知,4,去的时候是淡季 人不多 等了一波人才进去 以前没看过这种 还挺稀奇的 泥巴浴和温泉个人感觉有点坑 你泡的话得买泳衣吧 男士的50一条 有点贵 我去的时候 泥巴浴那里黑的一批 谁会去泡 温泉倒是有几个人去泡 想体验的可以体验一把 个人感觉里面人少泡温泉有点吓人啊 拍照照的不错 坐了龙王椅 景观也还可以 商业化气氛有点重 不过也没强迫买 门票有点小贵 还强行兜售了泥巴浴的票 anyway 出来玩么
2019-08-09,未知,5,桂林山水甲天下，阳朔山水甲桂林，名副其实啊。金水岩溶洞色彩缤纷，美轮美奂，凉爽无比，大自然的奇妙尽显其中，体验感很好。不虚此行，快来吧。
2017-06-16,未知,5,很漂亮的地方，还有一个小温泉，你们要是需要泡温泉可以带上衣服泡温泉，离大榕树景区遇龙河挺近的，那边可以滴滴的，全程会有导游讲解的，里面地形复杂，要注意哦
2018-05-24,未知,4,金水岩是一个溶洞，里面很凉爽，里面可以免费泡温泉和泥巴浴，这个是包含在门票里面的，喜欢的可以带上换的衣服去感受一下，然后就是这个景点也有表演，但是这个表演可看可不看，如果时间多，去坐坐当休息也不错，如果时间赶完全可以不去浪费时间，溶洞的景色感觉一般般吧！不是很多。
2018-12-13,未知,5,金水岩的溶洞地貌真是神奇，钟乳石千年形成过程叫人赞叹不已，在半山腰还可以看到九马画山峡谷景区，溶洞里面的黑泥有保健疗效可以来个泥浴！
2023-06-03,安徽,4,金水岩是阳朔的一个溶洞景点景区独特，有较强的观赏性。 【景色】溶洞式景色，以西游和神话故事为情景， 【趣味】有独创性之处， 【性价比】较好。 景点门票七十元，还行！只是景区的商业气息太浓！
2018-03-20,未知,4,阳朔金水岩溶洞非常的漂亮，值得去看看，溶洞内景色非常美，有特色的溶洞，在灯光的照射下，五颜六色，五彩缤纷，美极了，令人赞叹不已。
2019-07-30,未知,5,值得一玩的景区。此景区没有多做宣传。嗯，玩了十里画廊的所有项目最值得玩的就是金水岩，《西游记》的水帘洞竟然就是在这里。景色真的很美。，还有温泉。有泥巴浴，逛完还有表演看真的超级棒哦！
2018-09-25,未知,3,金水岩位于阳朔县，范围非常大，距离也非常长，穿越了几座大山。也是桂林旅游比较有名的溶洞之一。桂林市的溶洞尽管很多，但每个有各自的特点，可以选择性的挑选几个参观。
2018-07-16,未知,3,如果按照原价买票的话是真的很亏了，携程上30就行，但要提前一个小时订票，门票还包含泥浴和温泉浴，要换上泳衣才能玩。金水岩进出很麻烦，买大巴车的话要60元来回，我是做得当地摩托车40来回金水岩和西街，也可以租辆电动车骑进去，更方便。景区是分批游览的，十五分钟一批，有导游带着讲解，等候区有卖泳衣的。进去之后，导购团就开始了，从洞口到出来，一路上起码有三个消费点，卖夜明珠的卖珍珠的卖酒的，还有“免费拍照”，免费拍，花钱取那种。不过抛开这些洞内景色还是很不错的。
2017-08-12,未知,4,金水岩 里有泥巴浴和温泉，有兴趣的朋友记得带上泳衣。岩洞自带天然空调，在炎炎夏日非常舒服，参观整个岩洞不玩泥巴和温泉的话大概需要1个小时的时间，下午2点半和4点多会有表演看，这表演的钱也是包括在门票里的，大家要去的话千万不要错过喔。
2019-04-29,未知,5,说实话，金水岩也挺好玩的，挺大的，钟乳石也很多，而且还有个演唱节目，挺精彩的，表演得淋漓尽致，还真专业呀，哈哈哈哈
2017-10-06,未知,5,挺好玩的，这个地方值得一去，里面的眼屎真的是很漂亮。
2022-07-24,四川,3,下大雨只能找点室内的景点看看，来桂林嘛肯定要看看钟乳石，商业气息特别重的一个景点。景点入口就卖小锤敲说什么祈福，洞里面稍微有点无聊，看看钟乳石，里面有漂流，泥浴，一些项目另外花钱，价格不便宜，走到最后全是卖小商品的不好玩的一个景点
2017-10-06,未知,5,洞不大，但里面的温泉非常好，还有泥巴浴，由于出来的时候已经，快下午五点钟，问洞口制作相片的工作人员们温泉可以到几点，都是一群小姑娘，他们说马上就下班了，还实际上是可以泡温泉到晚上八点，可能他们想要马上下班了，所以告诉我温泉五点多就会关门。
2024-02-06,广西,5,游了金水岩，一世不缺钱，就冲着这句话，带了家人买了票进去，里面的钟乳石非常的漂亮，壮观，景区小姐姐服务态度也很好，值得一游
2017-03-15,未知,5,岩洞很大，很漂亮。。刚好去的那天下了雨，空气很清新，拍出来的照片非常漂亮。。景区导游的服务也非常周到，，值得一看。。。
2018-07-14,未知,4,总得来说还是很不错的 ，老人证和学生证都能半价，在景点外有很多黄牛卖票的，比较划算，里面比较湿滑 是一般的岩石洞，有一条旋转长梯，一路走下来。最后还有表演看。
2017-07-11,未知,3,有点像盘丝洞，商业气味太浓，里面还是有点点险峻，进去敲下钟就收两元，里面卖东西的多，祈福都收钱，温泉和泥池一点点大，没芦笛岩好玩，芦笛岩导游解说详尽，金水岩就知道钱。
2017-05-17,未知,5,大自然的鬼斧神奇 淡季去人少点感觉更不错 不过里面也不大 不一会儿就看完了 泥水澡可以玩玩
2019-12-07,未知,5,金水岩市一个需要收费的景点，如果只是看看里面的钟乳石，还是不错的，属于喀斯特岩溶地貌 ，可以看到不同形状的钟乳石，都是天然的。
2017-04-06,未知,5,在溶洞里面泡温泉，真的爽yy。这种体验真的好，记得带上泳衣泳裤。更衣室就别幻想了，钟乳石旁一个围闭而已
2016-11-03,未知,4,没看过钟乳石的可以去看下，看过的话就算了，很多地方都有，不过那有点特别的，可以洗泥巴浴，对身体好的，但天气特冷就没去了！
2015-11-28,未知,4,找了家旅行社买票，70元每人，拿着旅行社的收据到目的地换门票，最好拿张旅行社的名片。因为时间关系没有选择骑行，而是到汽车站直接坐车到金水岩 ，3元每人。溶洞分三层，下到第三层的时候有个人工的19米的天梯。准备了泳衣，洗泥巴浴很冷，然后泡温泉。是当天最早的两个，感觉不错。回的时候，站在路边等到了一辆当地人载客的面包车。 虽然时间短，但总比没去的好，以后也要争取。
2019-12-08,未知,4,金水岩在十里画廊里、这个景点需要点时间来、里面有导演讲解的、比较小比较暗、所以导演一次不会带好多人进去了、里面还有一场表演、一小时的时间吧。还是可以来看看的。
2016-05-22,未知,4,这个金水岩 也是岩洞，要导游带才能进去，但是感觉比聚龙潭 好多了，而且里面有泥巴浴和温泉(我个人不习惯泡这些)，那个，如果你们要泡温泉的话，要买件泳衣。忘了说，门票用学生证36元。
2019-03-27,未知,5,还不错 表演很精彩 工作人员热情，还有内部景点导游，介绍很详细 我们赶在看最后一次表演还好没错过 表演还有和观众的互动
2017-11-25,未知,5,美的一塌糊涂！带不同的家人来过好几次了，每一次都有不同的感观，耐人寻味，值得欣赏！也就咱大中国才有的天然美景！
2018-09-19,未知,4,桂林山水甲天下，金水岩美景尽收眼底，名不虚传，趣味性强，值得推荐给大家，山美、水美、大自然的秘密更美，感觉非常不错哦！趣味性强。
2016-01-06,未知,4,因为卡斯特地貌的岩洞风景大多有点相似，所以就选择了了在十里画廊沿途上的金水岩，可以骑过去，比较方便。Look，Gold Water Gave，这个翻译真是简单明了，哈哈~ 一进入口有一排象征着吉祥、祈福、生肖之类的小钟，可以用木槌敲击求平安吉祥，可以按心意给点小费。
2017-03-25,未知,4,人好多，洞里好漂亮还有泥巴浴可以玩，可是不敢下去哈哈?，都是老外在洗，不过有温泉可以泡，舒服?，值了 夏天还来得体验一下泥巴浴，赞！！
2017-11-25,未知,5,美不堪言！我和老公来过好几次了，每一次都有新的惊喜、新的品鉴，耐人寻味，值得欣赏！
2023-03-22,浙江,5,金水岩位于阳朔月亮山景区历村，是阳朔最大、最有特色、最令人开心刺激而且是世界闻名的地下河水晶岩洞，它横穿三座大山，约五公里长；“金水岩”景区主要有旱洞区、地下河水晶区、泥浴区、岩洞温泉区组成。
2018-05-01,未知,5,景色宜人，表演精彩，就是下了大雨，结束的时候回不去
2018-01-01,未知,5,值的观看，洞内景观奇特各种惊艳
2018-02-22,未知,5,里面的景色特别漂亮，就是山洞里的梯子有点抖！年龄大的老人建议别上去
2017-03-24,未知,5,第一次来这里，真的很漂亮，人间仙境！美不胜收！有时间还会再来的！
2016-10-04,未知,3,所谓的岩洞都是灯光后期加工出来的后果，但里面有泥巴浴、挺好玩
2017-10-18,未知,5,总体还行，温泉和泥巴浴没有体验。灯光太强，有酒吧的感觉吧。
2018-03-26,未知,5,很美，钟乳石千姿百态，值得一看，洞穴有上有下，可锻练身体
2017-05-19,未知,5,金水岩分三层，是个纯天然的岩洞，主要能洗泥巴浴和岩洞温泉
2017-03-24,未知,5,岩洞很大，钟乳石都保存得很好，挺漂亮的一个岩洞。讲解员的服务也很好，值得一去的景区。
2017-10-05,未知,4,溶洞不大，一路走来是各种变着法收钱的点子，一会是拍照，一会是敲钟，一会是摆摊卖东西。好好的地方给搞得不成样子。说是地下温泉，但感觉真的不像。整体感觉就是花钱走一段又远又热，人挤人的路，然后自己选择要不要泡温泉或泥巴浴，因为有更衣间，但是导游却消失了。呵呵呵
2017-04-10,未知,3,刚刚开始进入的时候，可以看到非常漂亮的钟乳石，但是不算很多。接下去后面商业化严重。而且，特意买了泳衣进去，结果发现所谓的温泉和环境很黑，也很小，没人泡。。。所以，就没有泡。出来后，感觉一般吧。本来朋友推荐银子岩的，因为摩的司机推荐结果来了这，有点失望
2019-08-08,未知,1,1、其实就是个喀斯特溶洞，不算很大，景观也一般； 2、里面不是很大，导游带着讲解走的很快； 3、里面很多项目都会另外收费的，有些还不提前说需要费用，有点坑人！
2017-07-28,未知,5,感觉不错，带小孩可以玩泥巴浴、又可泡温泉，纯天然地下温泉，干净，水流动。
2017-11-02,未知,5,感觉很好，非常值得大家去游玩
2020-01-10,未知,5,真心不错，门票不贵，而且里面能玩的挺多的。泥巴浴，泡温泉等都是不错的体验。除了鬼斧神工的各种形状的钟乳石还有少数民族的歌舞表演。总的来说挺不错的。
2021-02-26,未知,5,"是阳朔最大、最有特色、最令人开心刺激而且是世界闻名的地下河水晶岩洞,洞内以观赏到天然形象的“神灵菩萨”，为镇洞之宝"
2017-11-24,未知,4,眼前一亮！赞叹自然界的鬼斧神功，值得推介！
2017-04-29,未知,5,还不错……里面还有龙王宝座，西游记取景宝座
2017-07-15,未知,5,我们一家三口早上先去的银子岩，下午再去金水岩，如果让我再游，我绝对选金水岩！理由1.银子岩过度开发，人多，空气没金水好，只是奇石形状交多。2.银子岩没特色，景点单一，金水有地下河、泥浴、温泉，虽然小，但不觉得单调
2016-02-13,未知,4,携程门票便宜很多！值得一看，灯光再好一点更不错，建议自带泳衣温泉一下，应该更爽
2015-11-23,未知,4.6,感觉很划算，比在景区便宜了30。这个景区门票性价比还是算不错了，里面有推销，但不强制。一路上有岩洞逛，又有温泉泡，够值了。泥巴太冷不敢去。温泉换衣很简陋，一定要自带泳衣，拖鞋，毛巾。总之还不错，值
2017-11-11,未知,4,还好看，不错的地方.站着自作主张在
2017-03-21,未知,5,好玩，超值，下次有机会再去玩。
2017-02-08,未知,5,金子岩值得推介啊，有机会再去。
2016-01-07,未知,5,里面的人时非常的漂亮五彩斑斓五光十色里面还有温泉还有泥巴浴可以值得一去
2021-06-03,未知,5,金水岩洞里很美，但是它们的表演很商业化，明码标价买字还好，演员跟观众搞活动搞完了还要跟观众要红包就不好了，
2017-10-06,未知,5,节目质量一般。金水岩 里有泥巴浴和温泉，有兴趣的朋友记得带上泳衣。岩洞自带天然空调，在炎炎夏日非常舒服，参观整个岩洞不玩泥巴和温泉的话大概需要1个小时的时间，下午2点半和4点多会有表演看。
2017-04-21,未知,5,是阳朔最大、最有特色、最令人开心刺激而且是世界闻名的地下河水晶岩洞
2015-10-18,未知,5,钟乳石真的很壮观形成那样的景观真的好难得去十里画廊一定要去那里玩
2022-07-25,未知,3,商业气息太重，非得跟导游才让进，里面一堆推销的，景色只能算溶洞中的中规中矩，有些光线打在墙壁上面看着很难受，总体体验真的很一般，看溶洞建议去贵州 后面的那个演出，被拉下去硬要给39，还想要188，真的我完这么多地方过来，桂林这边总体的商业气息太重了，说实话有点失望
2019-06-20,未知,2,溶洞很一般，沒有銀子岩的壯觀，景點導遊一直趕行程，沒有什麼時間排照，沿途的商業活動倒是很多，導遊也很盡力的行銷，感覺非常的差，基本上覺得去的很不值得，白花了銀子，裡面的泥沼池跟溫泉都是不開放的，建議看到這篇文章的遊客不要去，還有十里畫廊裡面雖然不能開車，可是可以從312國道從後面繞進去，不要跟我一樣被騙錢去租什麼電動車.....
2019-02-11,未知,4,金水岩景色不错，特别是里面的民俗表演很好看，超赞的一次旅行。
2018-08-10,未知,1,溶洞里面景色不错，消暑是个好去处，但是自然景色好是一方面，景区管理很差劲，除了一段纯看溶洞风光以外，其他区域被各种售卖纪念品占领了，景区工作人员素质也很差。进去有几个取景点不允许自己拿手机拍照，有景区的工作人员拿相机拍照，拍的时候说的是会免费给一张小照片，需要放大水晶相框照片的话要另外付费，出门的时候工作人员态度很恶劣，我们说了不要水晶相框之后就说话也不理，很大声地说完全没有承诺过要小照片，我们要求把不要的大照片现场销毁，工作人员还向我们索要相纸费用，很不愉快。
2022-10-03,广东,5,"这里景色真美!泉水清如明镜,山上盛开着五颜六色的野花,在蓝天白云的映衬下,真像一幅漂亮的风景画。"
2017-03-24,未知,5,真的是一个很漂亮的地方 有机会还会再来！带上家人✌
2018-07-31,未知,5,请问直接要泥巴和泡温泉门票60？？携程可以直接买吗？能用吗？还有，我想问一下，值得玩吗？
2023-01-15,广西,1,这里绝对是我去过最恶心最最不好玩的景点，一些小野景点，收那么贵的门票。导游带到门口还要把我们堵在那里要给钱敲钟，要我们准备现金，没现金的扫微信，到处是求财的项目和祈福，爱钱爱疯了吧。。。 里面宣传的图片外面保安还在那骗人说是进去一模一样，实际那个温泉池子一股尿骚位，什么泥巴浴看着就恶心。。。 那个导游看我们一开始都不给钱，自己还一个人先出洞了，本来一开始给钱敲钟是自愿行为，那导游站在那逼着我们给钱，还拦在那儿。。。 破地方还好意思收那么贵的门票。。。
2022-07-15,未知,1,景区商业气息太浓，吃相有点难看。 金水岩景区一进来，就是一个很简陋的入口，需要景区内导游带入溶洞中，带我们的是一号导游。沿着山边走一段，就到入口了，套路就开始了，首先导游把你拦在门口门口询问你要不要木锤敲金钟，我就开始感觉到不对了，后面走进去，没有什么特别的景色，比起这个我更加推荐去广东清远的溶洞，性价比高观赏性强。 走入溶洞一小段就有个拍照的地方，然后导游就把我们拦在那，让我们一家人先走。因为我们在木锤那说了一句怎么那么多套路，这不是乱来吗，然后第二个拍照收钱点就把我“逐”出队伍了，非常不可思议，但是没关系，然后我们继续往前，有很多卖东西的地方，还有溶洞漂流，但是另外收费168元一艘船，过了漂流，就来到了泥水浴的地方，说实话真的脏，还有一股骚味，实在玩不起来。 后面到了温泉的地方，很多水蒸气，有点热，但是也没有泡的欲望，看不清水是怎样的，高度不高，成年人不太方便玩。 总而言之，不会再来，印象很差
2018-08-25,未知,1,金水岩景区被开发成这样，真的让人伤心，钟乳石需要上万年或几十万年时间才能形成，看了很多岩洞，金水岩是见过最差的，不说你们怎么商业化，怎么赚钱，你们赚钱是正常的，问题是你们把原生态的钟乳石毁坏的那么严重，被类似水泥的物质抹成平的，用自己的笨拙刻意打造什么动物形状，把太多钟乳石打断了，不到十米一个卖东西的，造孽，干的事是对不起子孙后代，积点德吧！
2018-02-23,未知,5,景点很美，有诱导消费，但价格不高可以接受
2016-11-02,未知,5,地处十里长廊里面，其实岩洞都是差不多，不过最特别的是里面有温泉还有泥巴池，酒窖等
2017-03-06,未知,5,岩洞很好看，景观挺美，保持了大自然的原始，值得分享的景区。
2018-08-17,未知,4,还行吧，中规中矩，溶洞都大同小异，里面挺凉快的。在十里画廊里面，骑车去方便。
2016-12-09,未知,4,桂林溶洞各有特色，金水岩主要以状形龙宫，龙王宝座，泥巴浴池，地下河闻名
2016-09-13,未知,5,特别美丽的风景，特别开心的一次体验特别美丽的风景，特别开心的一次体验特别美丽的风景，特别开心的一次体验。
2017-07-08,未知,5,挺有意思的！内容很丰富，感觉挺值得一来！
2017-02-01,未知,1,千万别去！那么小一个溶洞，关键是里面还设了一个祈福点，设卡宰客，给你一条拴着塑料牙齿的破祈福带，硬要十块钱，不给不让过。良心话十块钱不算什么，可实在让人不舒服。
2017-12-27,未知,5,这是第二次来了，还不错的，溶洞冬暖夏凉
2015-10-31,未知,4,在阳朔历村后山、它是地下河水晶岩洞、溶洞很奇特、岩洞上下三层、长约5公里、穿三山、非常的壮观美丽。
2016-08-14,未知,5,一般般吧，比起英德水晶宫还是有差距
2016-10-31,未知,5,泥浆浴好过瘾！洞里很凉，玩泥浆浴只有父女三人。泥浆好像牛奶巧克力那样又细又滑～玩得好开心哦！
2019-06-01,未知,1,我就放话在这了，这就一个乞丐景点，看他们一个个乞丐似的求你买，不买还骂人，买的少更骂人，真的搞笑，仗着里面没信号胡作非为，这都2019年还用2006年的营销，真笑si人。
2017-07-09,未知,5,十里画廊去的三个景点中比较值的一个（另外是大榕树和月亮山），典型溶洞奇观，西游记的龙王宝座的取景地点，景区有安排拍照，效果还不错。
2015-12-24,未知,5,我在里面享受了泥巴浴。还有温泉。还有很漂亮的山岩。
2018-02-23,未知,5,挺不错，千年形成的天然景观，月亮山就在附近
2016-10-10,未知,5,在携程订的门票很不错，取票方便，价格又有较大的优惠，很不错，以后还会考虑在携程订票
2017-06-01,未知,4,泥水浴很有特色，不过有点凉，据说能在上面浮起来，但我没成功，同行其他游客成功了。
2020-07-27,未知,3,很普通很普通的溶洞，景观不及芦笛岩的三分一，到处都是人工的加工，还有一站接一站的购物店才能离开洞口。景区的表演更是有点无趣，浪费时间的。
2019-11-06,未知,5,好玩，神秘，刺激，当然我没去过而已
2019-06-08,未知,2,两星给自然景观，在阳朔体验最差的一个景点，从买门票就可以看出管理不规范，看表演一开始就卖了十几分钟的东西，进溶洞就推销木锤敲钟，后半段什么夜明珠，手链，酒一个商店接着一个，总的来说不值这个票价
2016-06-03,未知,4,金水岩不泡泥浆浴的话真的不值得去，主要是性价比太低了，其他很多可以选择。
2019-07-09,未知,5,这里可以参观游玩，还是了着的。
2019-06-13,未知,5,景色优雅，趣味盎然，性价比很好
2018-04-12,未知,4,景点还不错，里面好凉快，造型也挺震撼。不过泥巴浴都变泥汤了，温泉太浑。
2017-09-22,未知,5,景色真不错，推荐给大家去看看。
2018-02-17,未知,4,很漂亮，有导游带着讲解，但是里面什么照相之类的太多了，感觉欣赏的不好
2015-10-26,未知,4.6,这次的金水岩游玩挺好的，里面的岩洞挺好看，骑了一天自行车在里面泡了泡温泉感觉不错，还有泥巴浴不过没有尝试。
2017-10-10,未知,4,这价格性价比还行！4A景区也就这样！！nn
