date,ip 属地,评分,comments
2024-02-13,广西,3,各种洞没啥意思，景区不大2小时足够，按照景区推荐路线上山走路下山坐车，其实可以上山坐车，下山走路，一小段峡谷和山上观景台值得拍照，沿途附近有个鹿鸣谷到是可以带娃去玩，还有路上的油菜花不错
2018-01-01,未知,5,很好，适当去运动一下。而且门票又不贵又可以欣赏到那么美的风景，值！
2024-06-25,广东,5,5月份去的天下着小雨还好人不是很多，总的来说面积不是特别大的只是前面一个小景点到后面一个景点路上话费的时间比较多，比较有观赏性的就是图中的两个地方 其他的还行只能说是
2023-04-07,广西,4,实际上景区并不大 门口验票竟然还是最原始的手写记录 停车5元 很便宜 车位也不少 景区主要是有个自然形成的类似桥的景观 但是拍照不好拍 还有个不怎么大的溶洞
2019-08-01,未知,5,山青水秀，幽静绝美，天桥，溶洞和山水没的说，作为北方人，跟桂林比觉得这有桃源的感觉，强烈推荐。不累，走上去，做观光车下来。强烈推荐自驾游来此。黄皮果3元一斤，香瓜大个三元一个，冰粉5元。人厚道，景绝美，简直像私家风景
2024-12-15,广西,5,鹿寨香桥岩溶洞公园，地质景观奇绝！天生桥壮美，九龙洞梦幻，峡谷清幽，集山水洞石于一体，是自然馈赠的喀斯特地貌瑰宝，是人们休闲娱乐的圣地！
2024-04-25,广东,5,在携程上买门票40元，景区九点半才开门，九龙洞十点半才开，建议大家不要太早过去。最好的玩法是先坐五元环保车上到九龙洞，游览九龙洞后再步行下山，边走边看，不用走回头路，方便省力。
2019-11-22,未知,5,非常不错的风景点，有一种深藏隐处独灵一秀的美，虽然景区范围不大，规划的却很好！值得跋山涉水一游。
2018-02-20,未知,5,第一次来，觉得非常棒，夏天来估计更好
2022-06-11,未知,3,这里是到了鹿寨可以顺路去的一个景点，里面结合了天生桥、溶洞、地下河为一体，附近还有响水瀑布和响水石林。里面的溶洞风景不错，对面的月亮山有空可以登上看看。
2018-03-21,未知,5,景色非常不错，物有所值！特别是九龙洞的盛景空前，第一次见这么美的钟乳石！还有纯朴的柳州人民！
2017-11-06,未知,5,园区位于群山环抱之中，空气清新，入园之后，进入香桥，青山碧水，峭壁环绕，犹如位于天坑之中。九龙洞，洞内钟乳石形态各异。景区中，到处是风景，出景区时，意外发现了远处的月亮山。不多说了，直接上照片
2023-07-30,广西,5,挺好，如果是天气不那么热的时候更好，溶洞里面很凉快，观景台那里特别美。去鹿寨很方便。我们从桂林开车一个多小时，往柳州去途径中渡镇。
2021-05-10,未知,5,大自然馈赠的礼物，绝了～用心感受一下还是挺好的
2019-10-03,未知,4,位置有点偏，里面有两处比较好点，一处是浮桥溶洞，一处是九龙洞，特别凉爽，其他处没什么特别的，进门处有很多小摊，吃的比外面贵点。
2024-10-12,上海,3,怎么说呢，景区规模偏小，景色还不错，但特地前来好像不太值得，交通车五块钱确实不算贵，四十块钱的门票也不算贵，但和河池的龙江第一湾（十块钱门票）相比，性价比不算很高。
2024-05-24,江苏,5,到柳州玩的时候，看网上推荐鹿寨，就在去的前一天包了个车过去了，去的时候人不是很多，体验还是不错的，有山有水有喀斯特生态景色。
2020-05-20,未知,5,不错，值得一看。去的时候刚好是淡季，人很少，很不错的。值得推荐，体验很好，景色不错，
2021-02-18,未知,5,比较小众，但是风景非常不错的景点。空气清新景色秀丽如果将景区范围扩展更大那玩的更加有意思，比如增加一些围绕喀斯特地貌的游。
2020-12-11,未知,4,值得一游，景色很美，溪水澄澈，唯一不足的就是交通不方便，从鹿寨北下火车没有到公园的车，必须叫车前往，可能因为淡季的缘故吧。
2024-02-15,广东,3,其实感觉没什么好逛的，假期人挺多，进去的门牌不够大，不留意就错过了，就是把车开进景区收费5元，停在外面收费10元，而且线上订票比窗口订票便宜5块，电瓶车价格挺良心，一程5元，九龙洞没啥看头，灯光昏暗，台阶比较窄，老人建议不推荐近入。
2022-07-14,未知,5,风景独特，与众不同，清静宜人。避暑胜地，适合亲子同游，点赞
2018-04-29,未知,5,景色很美！景区设施齐全！以后会经常去的
2024-06-02,广东,4,2024/6/1出发，当天没有观光车（听说是5月份停运一段时间）徒步还是很远，楼梯比较多，老人小孩可能比较吃力，景区内比较阴凉，爬起来还好，景色确实漂亮，不过要看完真的累人😰
2024-10-08,广西,5,景色不錯的，天氣好的時候值得來走走，徒步遊覽時的小吃飲品補給點也很充足。
2015-11-01,未知,5,自己的地方也不知怎么说，年年都去的，真不知道怎么夸了
2023-02-27,广东,5,景色很美，大自然鬼斧神工天生桥很壮美！去的时候是枯水期，丰水期会更美！
2019-09-23,未知,3,山青水绿，没有让我失望。身临其境，晃若置身世外桃源。九龙洞一小时进一批，赶不上只能等下一小时，很让人郁闷，最后因须等待时间太长，还是放弃了进洞参观。应该调整改进做法，半小时内一批应是最好的。
2022-09-24,广西,5,很不错的景点，价格不贵，趣味性也不错，自然风光也很美，人又少，很不错
2020-10-27,未知,5,目前景区有一个溶洞不开放，在门口买票20一人
2019-04-06,未知,5,香潭，香桥，九龙洞都很赞，景点基础设施也不错
2017-04-14,未知,5,天生桥是画龙点睛，石质地质公园也让人增长了知识，尤其是溶洞里的莲花龙门阵，灯光投影，恍恍惚惚仿若穿越千年
2016-01-29,未知,5,很好，很漂亮，值得一去，如果在夏天的时候去最合适了，很凉快！
2024-09-28,广东,4,从柳州包车过去，三百，有四个点，瀑布没什么水没去，一般般吧，我们去的时候没什么人，里面有电瓶车，走下来大概两小时足够了，观景台不错景色优美
2018-02-17,未知,5,风景很好，水很清很凉快，不错，值得推荐
2019-06-02,未知,4,鹿寨香桥景色不错，游人也不是很多，慢慢游览大概要两个小时，空气特别清新，适合一家人慢慢游玩，话不多说，直接上图吧！
2018-07-06,未知,5,感觉非常好，非常喜欢，下次还会再去
2024-09-20,广西,4,出票快，服务也好，景色一般。这里空气好，走楼梯大部分路都有树萌，也凉快，里面的九龙洞很凉快，解说员也解说到位，整个景区不算大，不坐观光车两个小时也能游完
2019-08-18,未知,5,鹿寨香桥名气不大，但风景绝对值得一看，景区建设也很好
2016-08-13,未知,5,好玩，清凉，夏天的好去处。风景好
2024-10-25,广东,5,去走走还是很舒服的，水特别清，特别绿，环境很舒服，走上去也不远，边走边拍照📷还是很出片的，去完九龙洞可以在门口吃个清补凉啥的，可以坐接驳车下来，下来的时候会经过观景台
2022-09-05,江西,5,景区虽然没有很多人，但是非常值得一去，锻炼身体！
2022-07-28,广东,5,很漂亮的地质公园，天生桥好神奇，九龙洞天然冰箱。
2018-01-01,未知,4,风景特别美，感慨万千，大自然的魅力真强大！！！
2019-11-30,未知,5,停车方便，有山有水有溶洞，还有讲解员的讲解，山上最里面的哪个溶洞是收费的，门口第一个洞免费，里面有一条河，水很清大约走两个小时就走完了，这里的风景还是值得一游的！
2023-06-02,广东,4,鹿寨香桥岩溶国家地质公园地处广西柳州市鹿寨县中渡镇，“桥奇、洞绝、弄幽、坑险、水魅、峡美”为特点。公园共分四个景区，分别为老虎岩景区、香桥仙境景区、响水涌泉景区和中渡古镇景区。公园主要地质地貌类型为岩溶峰丛、峰林、峡谷、溶洞、天生桥和石林，以香桥岩溶峡谷、天生桥、九龙洞、响水石林、响水瀑布及中渡至芝山一带岩溶峰林最具观赏价值。地质公园奇峰林立，坑洞密布，河流明暗交替，地质遗迹类型多样，珍稀典型，是经漫长地质作用形成的自然遗产，是大自然赐予人类的宝贵财富，被地质学家誉称为中国名符其实的喀斯特地质博物馆，具有重要的科学价值、观赏价值和开发价值。
2018-10-04,未知,5,10月4号去，2小时内走完，景点不大，但刚好免门票，从县城进来的路刚修好，很顺，很快就到，经过中渡古镇看走进去，20分钟走人，完全不是古镇，都是人工的，沒人去的
2020-09-20,未知,5,还在开发中的旅行景点吧，交通：从柳州坐火车到鹿寨北，然后打滴滴三十多元吧就到；风景很美，直得一游。
2024-05-05,广东,4,鹿寨公园没有看到鹿，天生桥很漂亮，还是值得去看看，景区不大，3个小时可以逛完
2023-11-27,北京,5,天生桥和蜘蛛洞都是大自然赐予的美景，九龙洞中的镇洞之宝是一根从溶洞顶部垂直到地面的藤，令人惊叹于它的顽强生命力。
2024-08-03,广东,4,风景优美空气清新，推荐先步行至九龙洞然后坐观光车返程（5元/人）。
2023-10-28,广西,5,一条非常好的亲子线路，孩子很喜欢，导游非常耐心细致帮我们讲解，对孩子也很有耐心，还给我们推荐了很多柳州本地人玩的路线，非常赞！
2023-04-28,广东,5,好，景点值得一去，很美很清新，就是打不到车，略略遗憾的就是离市区有点远，路程有点麻烦。不过拍照是很漂亮的，观景台比我想象中小，拍照的话需要排队。
2020-10-06,未知,5,风景很优美，景色宜人，山清水秀，溶洞很梦幻，有机会可以再去一次啊
2023-07-30,广西,4,河边可以泡脚，洞窟很凉爽，不过爬山挺累人的，下山可以考虑搭车
2021-03-14,未知,3,景区内主要地质地貌遗迹有香桥岩天生桥，香桥岩峡谷，响水石林，九龙洞，响水瀑布等。集石奇，洞幽，水秀于一体。具有很高的科学研究价值和旅游观赏价值，是大自然赐予人类宝贵的自然遗产，被岩溶地质学家称为“中国喀斯特地貌的缩影”和“天然的喀斯特地貌地质博物馆”。公园的地质遗迹十分丰富
2022-05-06,未知,5,岩洞还是很有特色的
2023-08-04,广东,5,非常好 值得去哦
2022-05-06,未知,5,爸爸很喜欢这里
2023-04-24,广西,4,没想到鹿寨中渡有这么一个美丽的地方。香桥岩龙国家地质公园，景色虽然稍微单一，但是仍然很美。
2023-06-24,广东,4,和想象中不太一样，去之前一天下雨了，水变浑浊了，如果没下雨的话应该比较清澈就很不错了。每个平台订票有对应的窗口取票，还算方便
2023-05-02,广西,3,不值得去，那个天生桥的水怎么没有照片的蓝色，那个九龙洞也没什么好看，比广东那些溶洞差远了，没其他景点了，景区卫生情况也不太好
2024-04-20,广东,5,环境优美，客房卫生整结，服务质量很好，大厅高大上，早餐丰富多彩。卫生间设施齐全，性价比超棒，总体来说，各方面都是超级棒的！
2021-06-26,未知,5,景色秀丽，人还少，感叹大自然的鬼斧神工
2021-04-07,未知,5,景色绝美，游人很少，价格超低，非常推荐
2018-10-05,未知,5,超值，名气小，但景观真好，有山水相依，洞奇特！与古镇游串联是不错选择，游完可坐高铁走，也可吃正宗石山山羊肉，实惠有味！
2017-01-23,未知,5,这个地方是我们鹿寨人必须要到过滴。特别是夏天的时候 靓拐多多
2021-05-18,未知,5,柳洲城租个扫码车！一天往返，真的是十万大山既视感！！！拍十万大山全景，要入口靠右反着步行15分钟，有个彩虹道，15分钟直达观景台！！！！
2020-10-09,未知,3,比较一般，除了水库那里风景比较好，那个钟乳石石那里就是几个五颜六色的灯和你说这块石头像什么，那块石头像什么，博物馆没开，只有水库和钟乳石
2020-11-09,未知,4,山清水秀，景色、空气都很好！山上的狗尾巴草在阳光下金紫色，非常漂亮！景区吃的东西价格公道，味道也很好。愉快的一天！
2024-09-04,广东,5,51一早去的，没什么人，不坐观光车的话，步行一个多小时可以走完全部景点。
2018-01-17,未知,5,洞奇，山美，水灵秀，服务热情，赞
2018-03-28,未知,5,风景优美，空气质量好，景色迷人，是值得去看看的地方
2017-07-23,未知,4,今天去玩了，太阳很大很晒，但是风景却很漂亮。洞里真的比空调都凉快。
2020-07-18,未知,4,鹿寨香桥岩地质公园是休闲，游玩，闭暑的好地方，那里有有鸟语花香的树木更有小桥流水，以及清凉美丽的溶洞，洞内自然景观优美加上灯光的点缀格外的漂亮！
2022-05-06,未知,5,风景秀丽，不虚此行！
2021-09-30,未知,5,十一前来的，人不多，自然景观丰富。半天时间游览。喀斯特地貌。
2022-05-06,未知,5,家庭亲子游的好去处
2021-08-04,未知,4,景点不大，比较好看的地方只有一小段，溶洞也不大。区间车比较便宜，只要5块钱。
2016-12-01,未知,4,香桥以地质奇观著称，是融亚热带喀斯特地貌景观和生态景观为一体的景区。公园内植被丰富，有重点保护植物岩溶山花和树龄逾千年的古榕，不错很好。
2018-02-18,未知,5,挺好玩的，春节去太多人，下次再去。
2024-09-23,上海,4,不是自驾或者包车还是别来了，滴滴打不着现场乱加价，景色再美也经不住这么折腾人呀，鹿寨北本来是有景区的公交，还取消了，不与民争利是吧？
2023-06-29,湖南,5,风景挺好的
2022-08-11,湖北,4,40块门票很划算了，有山有水有溶洞。距离不远，可以先走到下面峡谷，沿路一直往前去溶洞，然后坐景交车5元到观景台。还是很美很出片的。
2018-01-12,未知,5,好漂亮，去过一次，风景特别的美
2024-02-21,广东,4,其实可以不买门票，门票只是最后一站的九龙洞，没什么看头，倒是沿着仙人洞路线走进去就可以了
2024-02-13,湖南,5,习惯好评，设施建设还好，景区旧的山路更加吸引人。
2023-02-03,广东,4,景区很漂亮，但感觉没有完全开发，除了售票窗口一个人，其他地方都没见过工作人员。很多地方没有路标，找不到景点，适合探险和散心乱走，不适合带一家人旅游。
2023-08-28,广西,5,这个不错哦，票是手写记录，停车在外面一次性七块钱，里面也有停车位，不过容易满，里面溶洞很小，十几分钟就走完了，下午是一点开始进去，半个小时一轮，有导游小姐姐免费讲解
2018-02-20,未知,5,第一次来，很棒的体验，人非常少，景点很漂亮呢
2015-12-18,未知,5,近年来发展很快，美丽的纯天然风景及土土的食物
2020-08-09,未知,5,很奇特的地貌，一座天然的石桥连着两座高山，山脚下还有地下河的水流出来，风景很好看！
2023-08-07,广西,4,公园人流量不是很多，挺好的，喜欢人少一点；因为是地质公园，所以就不谈什么娱乐了，主要是看风景；风景还不错，就是点太少了，主要就一个天生桥和九龙洞，九龙洞半点有讲解员讲解，里面挺凉快的；有蛮多野生动物的，步行道上挺多蜘蛛；然后就是感觉开发的道路还是少了一点，希望后期增加一点观光道；门票性价比一般，三十左右比较合适，毕竟只有两个好玩一点的点；合适家人朋友一起去徒步，一圈下来大概三四公里这样，还不错吧
2016-01-17,未知,4,景色不错，空气清新，就是基础设施还不够好
2017-09-08,未知,5,鹿寨县著名景点，门票便宜，很多人去玩的
2018-09-21,未知,5,景区不算大，最后那个洞游览隔一个小时进一批，最好在景区门口问清楚时间，不然去到那里要等久就不爽了，我记得好像是9.30/10.30/11.30/12.30/
2020-09-05,未知,5,风景很美，值得一去 风景很美，值得一去 风景很美，值得一去
2017-04-20,未知,5,空气太好了，奇特的地貌，值得一逛。
2022-05-06,未知,5,老人游玩也可以，不会太累，风景好
2020-10-05,未知,5,风景很美，景色不错，值得推荐，
2024-12-11,湖北,5,很原生态的景点，门票又不贵，空气很好，景色也美，周边还有小景点免费的，也都非常棒，我这里的村民也很热情，工作人员态度都非常好，总之，是超赞的一次旅行
2023-12-28,广东,4,一般 ，自驾来还行，没车就算了
2020-12-11,未知,5,非常值得一看的景点，漂亮得仿若仙境！景区步行道很人性化，而且是彩色的
2024-08-27,广东,5,作为鹿寨的主要景区，肯定要去啊！ 大自然的美，必须亲自去打卡！ 可惜就是电瓶车说正在维修，小朋友不愿意走。只走了一半的路就折返了。 只打卡了图片的地方。
2022-09-21,广西,5,散散步，休闲好去处，门票不是很贵。 步行路程也不长，所以也不累。
2021-10-14,未知,5,景色很好 天生桥非常震撼 鹿寨北站可坐私人小车抵达目的地，还会再来
2017-04-18,未知,3,有门票，九龙洞小，峡谷空气好，天生桥可以。
2024-01-17,湖南,5,值得一去，景色很好。
2021-08-22,未知,5,环境不错，绿化覆盖率比较高，空气质量不错
2020-12-26,未知,3,柳州去桂林路上想顺便玩下，但鹿寨北站无法提供行李寄存，只能包车。火车站前有很多黑车，开价较高。到了公园，按逆行路线走到九龙洞为下午2:50分，但九龙洞要半点才开放，工作人员说一定要等讲解员。但前批4位游客出来后，也不同意我们进去。硬生生在洞外等了40多分钟也就7位游客，进洞不到20分钟就看完了。等的时间比参观的时间多的多，工作日根本就没几个游客，搞不懂为何规定这样死板。因为等九龙洞花了太长时间，为了赶火车只能牺牲天生桥不玩。九龙洞就是普通的喀斯特溶洞，不自驾的话，不推荐
2021-02-25,未知,5,环境不错，空气清新宜人，度假好地方……
2021-02-08,未知,5,风景很美，非常有特色，非常值得一去，唯一觉得不满意的是那个溶洞，里面太一般，还那么辛苦进出。鸡肋！千万别去，浪费体力。总体超赞，景色不错，
2018-02-22,未知,5,这个地方确实挺不错的，玩得让人开心的了
2022-12-15,广东,5,【景色】 【趣味】 【趣味】 【景色】很美
2017-01-10,未知,5,不错，安静，不是很高大上，但是很值得看，值得到此一游。
2016-02-21,未知,5,很不错，风景优美，感觉还不错呵呵呵
2020-10-08,未知,4,小众景点，喜欢清净的朋友可以去。
2018-03-03,未知,5,这里还是值得一去的，风景挺美的
2017-11-13,未知,5,第二次通过携程购买门票，比到景区售票窗口现场购买优惠多，停车很方便，适合一家人自驾游玩。
2017-05-06,未知,5,美景如画，地下水清凉，清澈，岩洞是冬暖夏凉的！
2015-12-26,未知,5,非常好玩，风景如画，空气清新，感受大自然的美好
2022-08-11,广西,5,景区不错的，有两个京东可以看，水池那里的水特别凉快，还有溶洞也很凉快。这个地方距离市区很近的，一会就到了，里面也不错，推荐。
2017-11-08,未知,4,这里地貌独特，是典型的喀斯特地形，溶洞多，风景秀丽，公园内植被多，花盛开时分外漂亮。
2023-08-27,广西,5,鹿寨香桥岩溶国家地质公园景色很美性价比很高
2018-01-13,未知,5,美团价格很实在，景区不大，全程三小时左右，青山 碧水，休假放松的好去处，周围的农庄菜也不错，鹿寨特色菜
2024-09-01,四川,4,景区里面的溶洞景色还不错，里面很凉快，就是有点小。从观景台看天生桥处的风景也不错，但如果要走进去的话，需要经过林间石板小路，我们遇到了一条小蛇，所以就没进去看了
2022-03-31,未知,5,好好好好好好好 【景色】 【趣味】 【性价比】
2021-04-22,未知,3,1、公共交通太坑，火车站坐公交车可直达景区门口，上车之前确认好了到景区只要3元，到了古镇说要➕30元。回程在门口坐的公交车只要了我3元。 2、景点其他方面都是可以的，很值得来逛一逛。
2021-05-02,未知,4,景色很好，但是售票点的工作服务不到位，没有明显的携程兑换实体票标志。游客排队后才知道这个窗口不是携程兑票点要重新排过。服务对不起这个景点。
2017-04-02,未知,5,空气清新，很多人去玩的，装备设施都不错
2021-07-10,未知,5,这里很不错，景色优美，有山有水有溶洞
2022-06-23,未知,5,非常值得去，很推荐，景色很美，可以
2020-11-09,未知,4,天桥和九龙洞是景区的灵魂，尤其是九龙洞，值得一看，景区人不多，我们是遇到淡季，景区免门票，离柳州88公路，有点远。
2023-10-28,浙江,4,景区并不大，全程徒步也就两个小时。最漂亮的就是天生桥的观景台了，可以看到天生桥的全景以及喀斯特群峰。九龙洞比较没有意思，定时开放，就是一个很普通的溶洞。
2023-05-01,广东,5,人少，景美。 适合自驾，我坐高铁到鹿寨北站下，没有公交车去景点，只能打车，跟司机约好回程接，车费较贵(比高铁票贵)
2020-10-06,未知,3,自驾游，本来有景区车的，当天据说坏了，自己的车不给开到里面，一波人走山路，因洪水，一半景点不开放，只能走到最里面的山洞，快到时，一辆私家车开过来，不是不能开自己车？一次糟糕的体验，不会再来了。
2019-11-14,未知,4,挺好的，实惠
2022-06-04,未知,5,自然景色相当美好，环境非常好。
2020-12-14,未知,4,还可以😊性价比不错有趣好玩，总体超赞，性价比高，值得住。不过遇到有酒席就会吵闹一点。值得来住。周围吃饭也方便，可以值得一试一试？
2018-03-21,未知,5,水色很蓝，风景很好，适合游玩。
2017-03-31,未知,5,自然而奇特的喀斯特地貌 美丽清新
2019-04-02,未知,5,香桥岩洞湿地公园公园不大，游览三4个小时就完了，门票不贵，学生票12块。进去九龙洞有解脱，一个小时进一次。
2021-10-07,未知,4,柳州周边老景区，老妈几十年前去就是一个洞。我们自己是第一次去超预期，岩洞山边的风景和水真的不错，颜色象九寨沟的海子一样漂亮。
2018-03-09,未知,5,带了小学生， 两个三口之家， 携程订票实惠方便！ 除了地质公园位置比较偏， 几个景点还在开发。仍然值得一去！！
2024-05-24,广东,5,环境和卫生多不错，梅花鹿挺多的，性价比挺高的，很好的一次体验。
2023-08-02,广西,1,风景是挺美的，就是工作人员态度不好，我们买票进去被她们园区工作人员骂不是个人，还用看不起我们的眼神说什么你们这些。你们这。的骂。当场打了景区投诉电话，对方一个字都不愿搭理地偶尔嗯，哦一下，搞得是火上加火，问难道你们一个景区发生这种事情都不给一个态度一个处理结果吗？对方突然来了兴致，大声质问你想要什么结果，想要什么！这个公园一生黑
2024-06-21,新疆,5,国家地质公园景色非常不错，公园人不多，离柳州市区也不是很远。第一次来柳州，很难得的一日游首选之处。
2023-07-22,广西,5,非常漂亮，尤其是天生桥，从未在其他地方见过。环境清幽美丽，游人不多，而且容易爬，对老人孩子很友好。
2022-10-04,广西,5,即买即用，非常实惠
2022-05-06,未知,5,没去过的值得去一趟
2021-05-02,未知,4,景色很好，但是售票点的工作服务不到位，没有明显的携程兑换实体票标志。游客排队后才知道这个窗口不是携程兑票点要重新排过。服务对不起这个景点。
2017-12-15,未知,4,真心有特色的地方，值得大家都来感受下的
2024-12-09,广东,5,景色好，很喜欢。
2024-10-15,广东,5,值得去，景色不错
2018-03-09,未知,5,溶洞其实不错的， 之前去的地下河的河水值得一看！ 但是这个地质公园比较偏。携程购票给力！方便实惠！！
2024-09-18,广西,3,中秋節14:30關門 真的不理解. 搞到超級趕時間的走走走
2024-05-06,北京,5,景色太美了
2019-09-18,未知,4,还是蛮可以的！虽然人不是很多，但看到的景色还不错！主要，刚好去的时候，60岁老人是免票，所以老妈不用票～喜欢玩水的可以呆大半天～
2024-07-24,云南,4,整体还不错！空气环境都挺适合休息度假的，建议举家一起出游感受大自然，含氧量特别高，而且溶洞风貌很神奇，很凉快，是暑假避暑胜地
2024-05-06,江苏,5,非常漂亮的地方，山清水秀，空气清新，景色宜人
