date,ip 属地,评分,comments
2015-11-04,未知,5,1、三江大侗寨的核心景区，在新县区，连接多耶广场，侗族鸟巢什么的，非常值得一游！！！ 2、门票15元，虽然只能上4楼，觉得必须进，原因在下一条～ 3、是在02年新建的，但是用的是传统工艺！！！整栋楼不用一颗铁钉！大家可以看图，细节之美淋漓尽致！！！ 4、交通很方便，毗邻游客集散地，设施齐全～
2016-11-26,未知,5,三江鼓楼很美，尤其是晚上亮灯时。 虽然是新建筑，但是按照侗族传统工艺建的，棒！ 应该进内参观，很壮观。 鼓楼紧贴月亮街，但有几层楼的高差，鼓楼高，月亮街低，有台阶相连。
2020-03-15,未知,5,一乡风俗 只为一楼 我在楼下只为等你 侗乡的民俗非常的独特，每组必有一鼓楼，当然族群越是规模，鼓楼也是宏伟！来到三江侗族自治县这里可以来看看得不登鼓楼不需买票的，附近的停车场不收费，但是好难找停车位的，不过广场上拍个照还是很快的！作为三江侗族最大的鼓楼留个影赞的！ 【景色】 【性价比】 【趣味】
2015-11-05,未知,5,三江鼓楼位于广西柳州市三江县多耶广场附近，主体为全木结构，总高42.6米，共有27层瓦檐，飞阁重檐，是2002年11月由当地著名的侗族民间工匠杨似玉为首的民间楼桥师傅队伍携手建造而成，整栋楼一颗铁钉都没有用，挺不错的，突出了侗族的特色，登楼走一走看一看，非常值得推荐。
2016-09-17,未知,5,景点值得一看，侗族村落鼓楼的结构很独特，侗族的工匠真的很有水平，整个鼓楼没有一个金属钉子，内部的柱子和横梁错落有致，一层一层牢固的镶嵌在一起，高高的竖立在寨子中间，外观看起来气势雄伟，很气派，是侗族人民村寨聚会和议事大厅。
2020-12-26,未知,5,三江鼓楼位于三江侗族自治县多耶广场，集文化，观赏，旅游等多项功能于一体。鼓楼有60根柱头着地，有27层瓦檐，除楼顶两层外，其余层瓦面等距收分，层层紧缩，使楼面呈金字塔形，显得端庄平稳。每层檐角轻盈起翘，精巧的雕塑以及鲜艳的檐板彩绘，与庞大，粗犷的楼身形成鲜明对比。登上鼓楼台顶，三江全景可尽收眼底。鼓楼是侗寨的标志和灵魂，是侗乡第一鼓楼，被誉为“世界第一鼓楼”。
2017-04-29,未知,4,免费的公共场合，举行大型活动的广场。有座地标性建筑而且是侗族人民的心灵聖地，具有民俗文化的代表性！很值得大家停下来看看！赞！
2020-07-02,未知,4,我在一个炎热的季节来到了三江县城，县城不是很大，江边两排紧密的房子就形成了三江县城，看上去和现在的建筑都差不多，直到走到了他的月亮街，才看到了浓郁的民族风情，有一个公路风雨桥，还有这鼓楼，鼓楼位于它的广场边上，对面就是鸟巢，是一个值得看一看的小县城，
2016-08-12,未知,3,去完龙脊梯田后再顺便去看，没有太多惊喜，算是当地标志建筑之一吧，木质结构的楼，保养得还可以。楼上视野不够开阔，从缝隙中可以眺望江面和桥。附近就是月亮街，不远处是风雨桥，也可以一并看了。专门去我认为就不必了。
2019-12-29,未知,5,鼓楼就在三江多耶广场中央，高铁站坐3路公交车在广场站下车对面就是，离侗族鸟巢和三江风雨桥及月亮街都很近，售票处凭取票码取票入园，鼓楼全木质结构，很高，里边只开放到三层，造型宏伟，展现了侗族人民高超的建筑设计技术，鼓楼外部装饰了彩灯，晚间开灯后非常漂亮，是个拍夜景的好地方。
2019-01-12,未知,4,三江鼓楼位于县城的中心区域范围，对面是鸟巢。这是一个侗族特色的建筑，其实里面没什么看的地方，但可以感受一下全木的结构，15元的门票也不太贵。
2018-09-30,未知,4,三江鼓楼位于三江县城浔江河边，于2002年建成，支撑鼓楼的4根杉木主柱直径均在70厘米以上支，是三江最高最大的鼓楼。它属木质结构，整座建筑不用一枚铁钉，形似宝塔，巍峨壮观，是三江县标志性建筑。
2015-11-19,未知,5,参观鼓楼门票15元，凭学生证可以打折，只用10元就可以进去参观。鼓楼出于安全考虑只开放登到4楼，而我登楼时也发现，楼层的栏杆很矮
2017-10-15,未知,5,看上面的介绍这个鼓楼真是凝结了能工巧匠的心血，没用钉子就这样建成。和对面的木质鸟巢交相辉映。旁边是很大的广场，大妈在跳广场舞。
2020-01-29,未知,5,鼓楼的夜景美，所以建议晚上去观看。如果想进去到鼓楼内部参观，得在白天，15元的门票，套餐是13元。在鼓楼里面观看，爬到鼓楼的四楼，还是挺震撼的。
2018-02-26,未知,5,鼓楼前是个宽敞的广场，对面有侗乡鸟巢，还有公共停车场。鼓楼是世界上最高的木制鼓楼，建筑古朴，很特别，进入观赏，成人25元。
2023-12-13,广东,4,来到三江似乎必须到这逛一逛 鼓楼前是一个超大广场，摆满了大型充气玩具，以及各式摊档，超级人多。 走到三江鼓楼，发现原来要买票，其实在门外基本可以看到楼内的结构，如果是相关专业人员看看确实值得买票，一般人也只能惊叹古人对榫卯结构鬼斧神工的应用。
2019-12-01,未知,5,三江鼓楼，位于广西三江侗族自治县月亮街，于2002年11月由当地著名的侗族民间工匠杨似玉为首的民间楼桥师傅队伍携手建造而成，集文化、观赏、旅游等多项功能于一体。
2019-02-12,未知,5,三江鼓楼是世界上最大的侗族鼓楼，整个鼓楼造型蛮壮观的，可以进去参观爬四层，第一层是图文介绍，第三层放了几年鼓可以敲打... 门票现场买15元一张，网上买10元到13元不等，既然来到了，建议还是进去看看好一点... 爬上去感觉还蛮高的，越往上爬楼梯越陡学窄，可能这就是不开放五楼以上的原因吧，毕竟安全第一...
2015-12-16,未知,5,鼓楼是侗族村寨的标志和灵魂。三江鼓楼是侗乡第一鼓楼，被誉为“世界第一鼓楼”，是中国国家4A景区中国三江大侗寨景区的景点
2019-08-21,未知,4,过了风雨桥，一下子就到了，停车也方便，周边虽说是个缓坡，车位倒是还多。可惜的是我们到时晚了，关门了，只能在外围看看，只看外观就很满足了，完美的侗族特色展现。
2017-12-24,未知,4,鼓楼是侗族文化的标示，在侗族有很多鼓楼，三江鼓楼位于广西三江侗族自治县月亮街的鼓楼广场上，鼓楼设计集文化，观赏，旅游一体，尽显侗族特色。
2018-08-16,未知,5,三江古楼位于三江县城的多耶广场！是三江县城最大的古楼！
2017-03-31,未知,4,鼓楼是全木质结构，非常漂亮，夜景更美丽！对面就是三江侗族鸟巢，有坐妹演出，还有斗牛，美丽动人的地方，真是好地方，每次都有新的变化！
2020-06-26,未知,4,三江鼓楼位于三江侗族自治县月亮街，鼓楼共有27层瓦檐，层层紧缩，使楼面呈金字塔形，每层檐角轻盈起翘，精巧的雕饰以及鲜艳的檐板彩绘，与庞大、粗犷的楼身形成鲜明对比。
2018-02-19,未知,5,独特的建筑风格叹为观止！高大的鼓楼完全是榫卯结构，不用一根钉子。四根立柱都是树龄超过200年的水杉，这些水杉以另一种形式实现了生命的永恒，让人唏嘘感叹。 如果你对三江侗寨游感兴趣，可以考虑坐动车到三江后，在目的地攻略柳州地导里找侯祖光地导，方便省心惊喜不断，值得一试。
2016-08-12,未知,4,位于县城河边的侗寨鼓楼是世界上最大的，晚上夜景更加漂亮。三江县为旅游在城区中心沿江建设的的大侗寨景区（免费）拥有三项世界吉尼斯记录：世界最大侗族风雨桥、最大侗族鼓楼（晚上亮灯时漂亮多了）、最大鸟巢式侗寨（侗文化商业建筑，外观更像圆型的客家土楼）。
2018-08-08,未知,4,晚上关门之后在外面看的，灯光很美。晚上关门之后在外面看的，灯光很美。晚上关门之后在外面看的，灯光很美。晚上关门之后在外面看的，灯光很美。
2018-08-19,未知,5,有特色的侗族建筑，有良心的收费，在现今动辄几十块的门票，十几块的收费真的是很划算了。即买即用，很方便。可以登上四层，可以击鼓，还可以了解一些鼓楼知识。
2016-08-19,未知,4,还行，因为拍照点多，租衣服都20块一套了！
2017-04-08,未知,5,被誉为“世界第一鼓楼”的三江鼓楼，作为三江侗族自治县50周年县庆项目，于2002年11月建成，是当地著名的侗族民间工匠杨似玉为首的民间楼桥师傅队伍携手建造而成，集文化、观赏、旅游等多项功能于一体。三江鼓楼创“四个”之最： 一
2019-10-06,未知,5,三江最大的鼓楼就是这座了，可以进去看看，算是比较新的建筑，为了这个地方的旅游应运而生吧，里面还有程阳八寨各寨鼓楼的说明。先到这还是可以的。
2018-08-03,未知,3,当地人说鼓楼是三江的标志，围着鼓楼转不收费，进去鼓楼里面15元一个人，倒不贵，进去刚看到有表演，就看了会，太多的意义不大，或许是因为建筑都是榫卯，没用一颗钉子，而成为历史名建筑
2020-05-05,未知,4,五一出行，健康码登记什么的很严格，最高能爬上四楼这样，楼梯有一点小陡，看看神奇的建筑，前人的智慧，还行还是很不错的，值得一看
2016-12-09,未知,5,誉为“世界第一鼓楼”的三江鼓楼，作为三江侗族自治县50周年县庆项目，于2002年11月建成，是当地著名的侗族民间工匠杨似玉为首的民间楼桥师傅队伍携手建造而成，集文化、观赏、旅游等多项功能于一体。
2017-07-26,未知,4,鼓楼是侗族村寨的标志和灵魂。三江鼓楼是侗乡第一鼓楼，被誉为“世界第一鼓楼”。这个景点，楼主是晚上去的，周边很漂亮，霓虹灯五彩变化，周边街道大红灯笼高高挂，给人感觉回到了另外一个时代！ 晚上鼓楼前广场喷泉与灯光相映，更有民族特色演出，着实不错。
2016-10-08,未知,3,鼓楼为近代建做，很有侗族民族特色风格，位于县中心民族广场后面，不用门票，白天在蓝天白云下和晚上华灯点缀各有其独特的观赏性
2023-10-07,云南,5,这是三江最大的鼓楼。鼓楼由四根很粗很高的杉木做支撑，气势磅礴。整个鼓楼全木结构，没有使用一颗钉子，楼高42.6米，是世界第一大鼓楼。
2019-06-06,未知,3,昂视鼓楼内的楼顶结构——感受非凡的美丽建筑艺术。 鼓楼中部有几个大鼓，古时候是遇到入侵、打劫、偷盗、火灾等不祥事件都会响起，警示作用。
2017-12-11,未知,3,"三江鼓楼位于月亮街和鸟巢之间，一共27层，是9几年的时候建造的，现在大概20个年头，小孩门票10元，大人15,没看过的可以去看看。"
2016-01-23,未知,5,风情三江是个旅游的好地方特产多多美景多多美女也多多
2019-09-15,未知,5,不错！在县城里的醒目位置，是侗族最大的鼓楼啦！
2023-05-17,广西,4,三江鼓楼，作为侗族精神图腾在县城的集中展示，缺少的是侗族群落开放式公共活动功能，被演绎成了一个城市雕塑，缺乏互动性，建议当地政府能够吸取侗族文化的精髓，将三江鼓楼还给当地居民，免费开放，让大家乐于在其中活动，复刻侗寨的活动场景，看电视，下棋，议事，观影，烤火，织布，
2023-01-28,浙江,5,鼓楼作为侗族的特色建筑，值得一游。游玩时间半小时足够。携程上的票比现场买票便宜一点，不需要提前买票。现场买好票直接进去。
2017-06-12,未知,4,三江鼓楼是侗族村寨的标志和灵魂。它属木质结构，以榫穿合，整座建筑不用一枚铁钉，几层至几十层不等，以单数居多，呈四面、六面或八面形，一般高十多米，最高者达几十米。形似宝塔，巍峨壮观，飞阁重檐，结构严谨，做工精巧，装饰细致，色彩朴质。
2023-08-06,湖北,5,入住柳州三江万怡酒店，景色十分秀丽。
2023-02-05,广西,5,侗族的鼓楼，标志性建筑，雄伟壮观。
2019-12-06,未知,5,民族气氛比较浓，比较值得一去。
2016-12-25,未知,5,大气高端，非常完美的世界遗产。
2017-04-23,未知,5,我每一次难过就独自看一眼广场！！！！！！！然后就所有一切都会好起来！
2020-04-19,未知,5,应朋友邀请，来到三江玩几天，朋友第一站就带我们去了月亮街，观看三江的标志性建筑——鼓楼，很壮观，很有侗家特点，晚上在灯光的照射下，更加漂亮！
2019-08-31,未知,4,号称世界第一鼓楼，高42.6米，位于多耶广场是三江县城的标志性建筑，门票15元，65岁以上免票，晚上20:30左右会有当地演出团体表演。
2017-04-02,未知,4,三江侗族自治县在群山环绕之中，不是很大，三月三人很多，县城很干净，讲桂林柳州话，和贵州湖南接壤，好地方，鼓楼是全木结构，侗乡特色！
2021-09-19,未知,3,一个比较大的鼓楼，但是没有什么特色，不值得收钱。因为其他地方都有，也都免费。比如从江鼓楼。。。周边也没有啥，只是顺路看看外观就好，不用特意去，也不用买票进去
2016-03-15,未知,5,新造的一个鼓楼，特别大，但属于现代化建筑了，还是程阳八寨里的鼓楼更值得一看。
2016-06-22,未知,4,美食，美女，夜景，三江鼓楼，倒影
2019-09-15,未知,4,在三江县城的正中央 很壮观 我是差不多傍晚六点到的 正好买上了携程的当日票 只可以上到四楼 楼上的鼓也可以试着敲 很棒
2019-07-20,未知,5,纯木质结构。走起路来，吱吱呀呀作响，但是结构很稳定。但在楼上往下看时，还是有些心慌慌...非常值得参观！
2016-02-12,未知,4,去看坐妹，顺道看看鼓楼，晚上去的，灯火通明，很漂亮。
2020-07-16,未知,5,广东户籍只要十元，因为柳州是广东的扶贫对像。
2020-09-19,未知,5,虽然是现代的建筑，还是很震撼的，值得一看。
2016-11-25,未知,5,这里是免费的，很特色的建簇，带北方朋友来，很值得一看
2016-06-07,未知,4,外边看看可以，15块进去不值得
2021-04-20,未知,3,集文化，观赏，旅游等多项功能于一体。鼓楼有60根柱头着地，有27层瓦檐，除楼顶两层外，其余层瓦面等距收分，层层紧缩，使楼面呈金字塔形，显得端庄平稳
2020-04-16,未知,5,你值得拥有，三江民族风情，欢迎大家来体验。各种特色小吃，节目演出。
2017-08-17,未知,5,鼓楼很漂亮！很雄伟！透着古老的气息，有一种复古美的感觉，非常喜欢！
2022-04-08,未知,5,鼓楼是侗家的会所，寨里有大小事都会在那里处理
2016-02-11,未知,5,号称世界最大壮族鼓楼，就建在县城江畔的高台上，晚上亮灯时更加美。
2017-06-20,未知,4,反正我是天天去就是没有健身设施，就是散散步
2019-02-10,未知,5,值得去参观。木结构能做到如此高，不容易。
2019-01-28,未知,5,三江的又一大名片，都上了吉尼斯世界记录，侗族能工巧匠的巨作
2017-07-20,未知,5,鼓楼建筑令人惊叹，在鼓楼门前的广场举行的百家宴挺好玩的。
2023-07-24,广西,5,不错，下次还来
2016-02-07,未知,5,景色很好登上最高层可以尽览三江美景
2016-02-07,未知,5,少数民族的特色，登上最高处的一望无际的感觉真的很好！
2015-10-22,未知,4,值得一游，好山好水好地方，地方人又热情，性价比比较好
2022-11-13,广西,5,代表三江的网红打卡地，奇特的侗乡民俗风情的建筑设计
2016-10-19,未知,5,非常有民族特色的建筑。晚上当彩灯亮起时，非常美。
2019-02-25,未知,5,有着侗族风情的三江鼓楼门票实惠，值得一游。
2022-10-16,广西,5,好奇特的建筑风格设计很漂亮是必去的打卡地
2019-03-16,未知,5,没有铆钉的鼓楼，值得去看看！一定要上楼！
2018-01-15,未知,5,三江一个特色景点，上去要钱的，纯木头制成
2017-09-30,未知,5,鼓楼历史悠久 值得一看 是三江的著名景点之一
2019-07-12,未知,5,三江鼓楼非常雄伟，位于三江广场之上。
2017-03-15,未知,5,威武霸气，全是木头做的，很有民族特色
2016-11-06,未知,5,三江鼓楼是著名的侗族古楼，很值得一看
2017-10-29,未知,5,15元门票五分钟之内完成四楼转一圈
2021-04-29,未知,5,侗族民族风情，木质建筑的奇观。
2021-04-29,未知,5,木结构建筑奇观，侗族民族风情。
2020-01-01,未知,5,非常壮观的侗族建筑，值得参观。
2019-10-05,未知,5,技艺高超，世界一流，中国代表作
2019-04-13,未知,5,特色景点，建筑悠远，历史文明。
2016-03-11,未知,4,感觉还可以，大家可以过来玩玩！
2023-01-27,广东,5,很有特色，值得一看。
2020-09-04,未知,5,非常好，通过这些建筑不得不佩服这个名族的智慧；只是可惜以后不会再延续下去了；大家现在都改住楼房了；
2019-03-12,未知,4,本人对建筑不了解，如果有时间，可以去走走。这里的空气很好。
2018-01-23,未知,5,值得一去，建筑非常有特色，是我国的瑰宝
2018-02-26,未知,4,值得一去，很壮观，三江标志性建筑。
2017-01-07,未知,4,很有民族特色的一个地方！唯一不足的就是进入要收钱
2018-12-03,未知,4,很壮观，做工很不错，值得来看看，也不贵十五块钱
2022-04-26,未知,4,yg一个非常不错的地方很好玩风景很美值得一去
2021-04-13,未知,2,第一次来柳州 听闻3月3有大型的对山歌之类的活动 就过来了 酒店环境还是可以 璟象酒店 吃的在月亮街一家特色菜馆吃的 实在太垃圾 完全就是一个快餐小炒一般 吃完就上了三江鼓楼 大晚上的也是看着灯饰不错 上去了 一个木头结构的塔楼 不知道还有哪里比较有特色好玩的地方
2016-01-08,未知,4,不错很好看很有特色非常的喜欢下次还会来
2017-05-03,未知,4,三江鼓楼位于县城的广场边，风景一般。
2022-11-25,广西,4,风景优美，趣味性强，性价比超高
2017-02-15,未知,4,挺有意思的，也是很有历史的建筑
2019-07-09,未知,5,双人合抱的大木头为主体、榫卯结构做成的木楼，真的令人震撼，值得一去
2018-12-13,未知,5,古色古香的超大木工艺品，还行，就是不太值票价，票价应该在5元合适。
2023-02-20,广西,5,体验下侗族人文风情。来看看没有用钉子怎么搭建起来的鼓楼！！！！！
2023-07-13,湖北,5,三江市区2010年代建设的大型木结构鼓楼，非常推荐，值得一去！
2019-02-12,未知,5,进去之后，可以免费打鼓，夜景会更加的好看
2021-11-24,未知,5,大可不必买票进入，看看外观就足够了！建筑外形像极了宝塔肉
2021-04-18,未知,5,性价比非常高，知识性强，值得一看。性价比高，总体超赞，。
2024-03-04,广东,3,看完照片，感觉不用看这个点了。单景点，特色也不多。
2021-08-01,未知,5,就是4层木楼梯，可上可不上。
2016-09-23,未知,3,古老的建筑，古人的智慧令人惊叹，美与智慧的结晶
2020-11-21,未知,5,巧夺天工，目不暇给！值得慢慢欣赏及体会。
2019-08-21,未知,5,古香古色的侗寨建设，也领略了侗乡风情。
2023-03-29,广西,5,进到鼓楼内部才更加感觉到建筑的壮观
2021-08-19,未知,3,很壮观啊，值得一看就是了，可以的
2019-09-08,未知,5,三江鼓楼仍侗族所特有用于庆典的。
2018-12-05,未知,5,最大的鼓楼，无钉建造，很是壮观。
2019-10-10,未知,3,感觉很一般吧，不大值得特地去玩
2020-07-30,未知,5,有趣好玩，体验很好，不错
2023-05-21,广西,5,木结构建筑体现中国技术
2019-12-23,未知,5,很赞，民族鼓楼还有表演
2020-09-08,未知,5,有趣好玩，体验很好，
2023-08-07,广西,5,还可以，值得一看。
2020-12-25,未知,5,景色不错，古色古香
2024-01-25,云南,5,可以不错可以不错
2020-07-04,未知,5,鼓楼鼓楼鼓楼
2021-04-16,未知,5,景色不错，
2018-08-20,未知,4,三江鼓楼真的体现出侗乡人民的智慧，壮观，值得一游
2019-06-25,未知,4,值得一去，但得注意安全，有点窄，
2018-11-11,未知,4,人少，没有一个钉子做的，工艺不错
2021-07-23,未知,4,值得一看！
2018-10-05,未知,3,一般般吧，门票15，里面没什么，到不了顶，从外面看比里面好看多了。
2021-09-08,未知,4,还好吧，优惠了小小
2018-10-02,未知,3,看看外观其实差不多了 进去看意义不大。。
2018-10-31,未知,3,一个很值得去的当地历史文化塔。
2024-05-08,湖南,3,慕名而来，结果一般般啦
2019-08-11,未知,1,就一个空楼，没什意思，说走表演也没看见
