date,ip 属地,评分,comments
2018-02-05,未知,3,里面有个大钟乳石很像蝴蝶，如果有看过其它溶洞的，就大同小异了。还有一小点爬山的，上面风景还可以，其它就没有什么了，景点不是特别大
2018-01-06,未知,5,下雨，不下雨的话还可以逛逛，算十里画廊比较好景点
2017-11-02,未知,5,蝴蝶泉值得回味的景区，玻璃桥让我有心无胆没敢过。
2017-10-13,未知,5,景区不大，可游景点不多，但是民族舞表演太精彩了！
2017-10-04,未知,5,在携程买门票很划算，景点一般，下次还会在携程购票
2017-10-04,未知,5,挺好的一个景点，有景观又有少数民族表演。值得一看
2017-09-21,未知,5,这是第二次来了，非常不错，风景不错，节目也不错哟
2017-08-23,未知,5,还行吧，可惜那个玻璃桥没弄好，不然应该体验不错。
2017-08-04,未知,4,阿里上订了两个双人票，这里订了一个学生票。到了景区验证码还发不过来，打了客服电话才搞定。
2017-04-29,未知,5,恩，整体感觉不错，身临其境感受大自然的鬼斧神工，
2017-04-19,未知,5,真山假景，洞内景观全都是假的，好心痛我那50元哪
2017-04-09,未知,5,值得去的景点，演出不错，有些商业项目也不让人反感
2017-04-01,未知,4,景色除了蝴蝶泉外其他的一般，侗歌苗舞的表演很棒！
2019-07-06,未知,5,强力值得推荐，有表演还有溶洞，价钱还比较实惠。
2019-03-01,未知,5,演出非常不错，很有意思，就是到处都是拍卖字画的
2018-11-14,未知,5,去的有点晚 有个玻璃桥很早就关门了 剩下的景色还行
2018-08-31,未知,4,景观不错，但看表演晚了合影照相感觉是套路是个坑，按合影人数收费，有不提前告知，体验不好
2018-02-19,未知,5,取票方便，第一次体验玻璃桥、滑索，挺有意思的。
2018-02-18,未知,5,景點景色很美，又有小數民族表演，感受风土民情！
2018-01-31,未知,5,风景秀丽，十里画廊尽收眼帘，进口溶洞非常有特点
2018-01-20,未知,3,人工景点，很小的一个洞，很小的瀑布，不值票价。
2018-01-09,未知,4,还好吧，个人觉得吸引力不值得，只是山上有一个滑道，可以滑下来还有趣，不过都是要单独收费
2017-12-06,未知,5,有个窑洞，二十分钟走完了，还有个30分钟的表演
2017-11-20,未知,5,蝴蝶泉很漂亮，景点演出很有民族特色，很好很好！
2017-10-18,未知,5,瘦身道，滑梯，演出都很有意思，侗族大歌印象深刻
2017-08-20,未知,5,蝴蝶泉表演不错，但图腾古道绝对坑爹，不值得去。
2017-07-11,未知,5,骑电动车去的，感觉很不错，歌舞表演父母很喜欢。
2017-06-21,未知,5,不错，挺好，方便快捷。自由行的可以选择网络购票
2016-08-12,未知,4,离住的地方很近，下午临时决定去的，一个小岩洞，其余都是人造景点。演出还不错，值得一看。
2019-09-24,未知,5,挺好玩，路边的叫花鸡也很棒，桂林山水果然不错
2019-06-20,未知,3,因为没有选择自费拍照项目，问个路就故意给我们指了一条回头路。景点工作人员素质有待提高。虽然没有强迫消费，但是体验感真心不好。
2019-02-05,未知,5,***
2018-08-02,未知,5,景点美什么特别，不过门票比在门市卖平宜很多。
2018-01-01,未知,5,蝴蝶泉还是值得一去的，两座山的连接意境很美呢
2017-11-17,未知,5,还可以吧！就是拍照有些还要收费，总体还可以了
2017-10-20,未知,2,蝴蝶泉本身没有什么可看的。景区里面有一个山可以爬到山顶，眺望远方。还有一座玻璃桥，但是走玻璃桥要单交钱，玻璃桥离地40米高。
2017-10-08,未知,5,个人认为，第一次来桂林的话，还是应该去看看。
2017-07-02,未知,5,不错，滑滑梯好玩。表演的几个妹子长的好美。
2017-05-24,未知,4,人太多了，但是桂林的景点不多，所以都算好的了，里面有表演看，但是一半时间都在拍卖字画
2017-04-17,未知,5,蝴蝶泉主要就是爬山，不过有场表演还是很值的看
2017-03-26,未知,5,取票顺畅，很满意。比门市价便宜很多，值得选购
2017-03-20,未知,5,非常好，景色优美，鬼斧神工，大自然力量真神奇
2016-08-27,未知,4,取票比较方便，里面主要是看那一场表演，没去过的可以去看看，阳朔都差不多，去一次就够了
2016-07-19,未知,4,一般般，就是桥好玩一点…………一般般，不知道说什么，凑字数中，还有7个字，4个字.1
2019-08-23,未知,5,溶洞很凉快，演出互动很开心，就是流程短了点
2019-05-17,未知,5,很不错(*๓´╰╯`๓)♡很满意的一次行程
2019-02-01,未知,5,蛮好的里面看的东西虽然不多，但是还蛮新颖的
2018-02-25,未知,5,门票价值与景点太不相符了，就一个小溶洞而己
2018-02-25,未知,5,溶洞很不错，还有里面的天籁之音感动了我们，
2017-12-19,未知,5,不错的景点，人很少，就是人造的迹象太明显。
2017-11-12,未知,5,景点不大，表演很热闹，再加些趣味性就更好了
2017-10-20,未知,4,歌舞表演很逗。演员能唱会跳会搞笑。演出最后单独合影 10元一个人给演员。不设上线哦。
2017-10-09,未知,5,里面跟阿妹照相是要收钱的喔，20元一张……
2017-10-03,未知,3,一般般，没什么很值得看的东西但门票也不算贵
2017-08-26,未知,4,还过得去 前期卖字画的时间感觉比表演时间还长
2017-05-26,未知,5,名族表演还不错，反正出来玩，放松心情最重要
2017-04-30,未知,5,表演很出色，我们全家都喜欢，下次介绍朋友来
2017-04-11,未知,5,特地过来看表演，环境很美。姑娘们也很漂亮。
2017-03-28,未知,5,性价比不错，有表演。挺精彩的，各种民族的。
2016-07-18,未知,4,整体感觉还行，里面的风景一般，就是最后的演出给人的印象还比较深刻，随便走走还行吧。
2023-02-17,广西,1,巨坑，千万别去。蝴蝶泉就一块石头。上山的景色一点也不好，喜欢山景的建议去月亮山。就一直推荐你做滑梯和走栈道，真的没有好景全是坑。那个表演就不说了，烂到不行。而且45块钱啊，贵死了。滑梯和栈道各30。有这个钱干啥不好
2020-10-14,未知,5,体验很好，景色不错，有趣好玩，值得推荐，
2018-09-01,未知,5,有溶洞，暗河，景观丰富。没什么人，还不错
2018-01-13,未知,5,景点比较小，不过溶洞里的蝴蝶泉还是很漂亮
2017-12-18,未知,5,风景很美，侗族姑娘更美，表演很有民族特色
2017-10-07,未知,3,这个还可以咯。有玻璃桥，有吊桥。有表演。
2017-10-03,未知,5,整体还好，只是节日人太多，都来为祖国庆生
2017-09-28,未知,4,还好，可以进去看下。就是演出结束不想合影的话就不要到场地中间了，一张合影10块钱
2017-08-27,未知,3,看过银子岩，再游蝴蝶泉，感觉真没必要去。
2017-08-25,未知,5,第一次来，感觉环境很差，旅游跟发展不协调
2017-05-01,未知,5,进去主要看了看表演，了解了少数民族的文化
2017-04-22,未知,5,还不错吧，就是去欣赏一下。值得到此一游！
2017-03-26,未知,5,非常优惠，还会继续关注和支持的，很满意的
2017-03-02,未知,4,今天天气好好，但景点内很多人，水塞不通。
2016-06-22,未知,4,在十里画廊的一个景点，很快就能逛完，正好赶上了表演还算对得起票价，总体来讲一般。
2016-03-30,未知,1,50块的门票，相当不值得去。首先蝴蝶泉就是溶洞里的一汪泉水，许多其他的岩洞里司空见惯的东西。这里的溶洞规模非常小，做的也不精致，也没什么特殊的，跟银子岩或者冠岩的溶洞比起来简直不值一提。“南天门”也没啥值得看的，说能俯瞰阳朔（其实并没有，只是看到些桂林常见的山而已）。有个几百米的石头滑道从南天门直下山地，另外付费20，戴着手套可以减速的，因为曾在哈尔滨的冰滑梯墩过尾椎，所以对这类项目敬谢不敏。而苗族舞蹈，我的娘，那（低音嗡嗡高音飘）大喇叭简直震到人心脏都要跳出来了，舞蹈歌唱都比较粗糙，“洞房”项目在许多少数民族聚集地都有类似的表演；要我说，这类歌舞放在阳朔中心区的开阔场地做个免费娱乐项目还行，50元门票啊。。真不值得。
2020-08-31,未知,5,值得去的小型经典，可以消磨两三小时时间
2018-12-13,未知,5,还行，大理附近有名的景点，还是要看看的
2018-09-23,未知,4,淡季没什么人，景色也没以前那么好看了。
2018-02-09,未知,5,很多……景点不错，值得来；导游是免费的
2017-12-14,未知,3,蝴蝶泉的景点有个另外收费10块钱的玻璃栈道可以试试。演出也可以看下，服饰很好看
2017-12-08,未知,5,蝴蝶谷的表演还行，与观众互动得比较好。
2017-10-08,未知,5,订票方便，下次还会游玩的，主要是有优惠
2017-10-04,未知,5,总的来说挺不错的，50块钱玩了2个小时
2017-08-10,未知,5,很有趣，酒酸甜可口，金华很美，多才多艺
2017-08-02,未知,5,还可以吧，两个人门票也不贵，风景挺好的
2017-07-09,未知,5,外面蝴蝶泉几个大字很吸引人，表演不错。
2017-06-22,未知,5,少数民族的表演很不错。玻璃桥要开就好了
2017-05-01,未知,4,最后的民族表演很好，很精彩，孩子很喜欢
2017-04-09,未知,5,景色一般，交通方便，演出很好，增色不少
2016-11-30,未知,3,溶洞风景一般，但爬上山后的风景不错，但门票50元有点贵，毕竟里面可以玩的不多。去了一次不会再去第二次了，没什么留恋的。
2021-05-25,未知,4,这个景区的重点是一场民俗表演，个人觉得比较一般。喜欢民俗特色的朋友可以推荐。
2020-02-09,未知,5,景点挺好的，一直想去，终于如愿以偿了
2019-10-05,未知,5,很好玩啊，比较小的景点，很好玩很好玩
2019-06-09,未知,3,还可以吧，一般般 里面有很多收费的东西 个人感觉不是很好。。。。。。。。。。。。。。。。。。。。。。
2019-02-17,未知,4,原始的风光，清新的空气，没有过度开发
2018-07-20,未知,5,还可以吧，适合孩子，尤其是喜欢蝴蝶的
2018-03-29,未知,5,出票速度很快，取票也方便，不错的旅行
2018-02-28,未知,5,景色可以，主要是一进门的钟乳石不错！
2018-02-25,未知,5,溶洞梦多奇，侗族舞蹈很好看。米酒香甜
2018-02-17,未知,5,蝴蝶泉景区总体不错，很适合带小孩去玩
2018-02-12,未知,5,名气大，但是就是一个岩洞，灯光还行。
2018-02-10,未知,5,优惠幅度最大，取票比较方便，还不错。
2017-11-05,未知,3,景点没有想象的好，表演的服装很漂亮。
2019-06-09,未知,3,还可以吧，一般般 里面有很多收费的东西 个人感觉不是很好。。。。。。。。。。。。。。。。。。。。。。
2019-02-17,未知,4,原始的风光，清新的空气，没有过度开发
2018-07-20,未知,5,还可以吧，适合孩子，尤其是喜欢蝴蝶的
2018-03-29,未知,5,出票速度很快，取票也方便，不错的旅行
2018-02-28,未知,5,景色可以，主要是一进门的钟乳石不错！
2018-02-25,未知,5,溶洞梦多奇，侗族舞蹈很好看。米酒香甜
2018-02-17,未知,5,蝴蝶泉景区总体不错，很适合带小孩去玩
2018-02-12,未知,5,名气大，但是就是一个岩洞，灯光还行。
2018-02-10,未知,5,优惠幅度最大，取票比较方便，还不错。
2017-11-05,未知,3,景点没有想象的好，表演的服装很漂亮。
2017-08-10,未知,5,不同民族表演精彩，各具特色，歌甜人美
2017-08-05,未知,5,很不错，比图腾古道好多了，表演很好玩
2017-05-26,未知,5,一个不错的景点，玩的很开心，值得一玩
2017-04-15,未知,5,蝴蝶没怎么看，但是歌舞表演挺不错的。
2017-03-18,未知,5,上有蝴蝶下有泉，还有侗苗文化可以体验
2016-08-30,未知,3,带孩子去的，进去的唯一看点可能就是歌舞表演了................。。。。。。。。。。。。。。。。。。。。
2022-11-01,安徽,3,一个山洞里的表演，感觉并不很惊艳。
2019-01-25,未知,4,溶洞景色真心一般，和银子岩的差距太大了。不过演出确实不错，就是简短了一些。
2018-08-22,未知,5,去迟了表演没看到多少，不过总体不错
2018-08-03,未知,5,3人票性价比很高，游玩很愉快，很好
2018-03-02,未知,4,其实也是看看钟乳石，就是后来滑滑梯下山还是有点创意的。
2018-02-20,未知,5,还可以，，，，，，，，，，，，，，
2018-02-19,未知,4,还可以，就是里面再收费的项目太多，最后与表演的演员合影居然还要收费，汗的很
2018-02-17,未知,5,很好！！！！！！！！！！！！！！！
2018-02-16,未知,4,带朋友一起去的，有岩洞、玻璃桥，吊桥，小孩玩得开心，表演半小时，挺不错的！
2018-02-03,未知,3,景色不错。演的节目太粗糙，糊弄人。
2018-01-25,未知,5,表演不错，特别是朱宏镐先生的书法！
2017-12-08,未知,5,蝴蝶谷的表演挺好看的，观众互动不错
2017-12-06,未知,5,最好看的还是民族表演，其他的一般吧
2017-11-20,未知,3,一路平平无奇，没必要买门票进去～～
2017-11-10,未知,5,有点玩头，但未赶上表演，有点遗憾。
2017-10-31,未知,5,很好，，，，，，，，，，，，，，，
2017-10-14,未知,5,侗族节目不错，门票也不贵，值得一游
2017-10-08,未知,5,风景很漂亮，值得一去，表演很好看，
2017-10-08,未知,5,挺漂亮的溶洞，还有民族歌舞可以欣赏
2017-10-05,未知,5,总体还不错，岩洞很漂亮，就是短了点
2017-10-04,未知,5,取票挺方便的，人也不多。小孩子喜欢
2017-09-11,未知,5,还好，都是帮朋友预定的。没听到抱怨
2017-09-08,未知,5,取票方便，订票比原价实惠，所以值了
2017-08-30,未知,3,蝴蝶泉并没有把泉水作为主要景点，参观乐芦笛岩或者银子岩再看这个景点就一般了，里面有个壮族和苗族民俗表演还是不错的。
2017-08-27,未知,3,这个景点真没什么好看的，不推荐去～
2017-08-16,未知,5,景点不错，表演有民族特色，很受欢迎
2017-08-07,未知,4,总体感觉不错，就是有点小～有一小段溶洞，看了场表演，1个小时左右就逛完了～
2017-07-19,未知,5,取票方便，比实际购票便宜，推荐一下
2017-06-19,未知,5,真的很不错。 给个好评吧。 嗯嗯嗯嗯嗯
2017-06-09,未知,5,还可以。山顶的风景好。地下还有表演
2017-05-31,未知,5,溶洞景观很漂亮，还可以看表演，不错
2019-05-03,未知,4,还不错的景点，第一次走了玻璃栈道
2019-02-11,未知,5,陪父母旅游，他们说这个最好玩了。
2019-02-06,未知,5,很漂亮的景色，融入自然的感觉真好
2018-08-10,未知,3,一般，不太建议去。还要门票。一般
2018-05-16,未知,5,吊桥有点意思，表演感觉特点不明显
2018-04-20,未知,5,里面有表演，风景也不错，值回票价
2018-02-22,未知,5,还不错演出精彩，讲解详细，很不错
2018-02-20,未知,5,景区很美，空气清新，工作人员热情
2018-01-27,未知,5,好怀念，当地民风很好，很热情，！
2018-01-04,未知,5,天籁，蝴蝶泉。还算行吧，也就那样
2017-11-08,未知,5,还可以，下次还会再去，带朋友们去
2017-10-09,未知,5,感觉很好，一个非常值得旅游的地方
2017-10-06,未知,5,好玩，风景漂亮，表演精彩，棒棒棒
2017-10-04,未知,5,石洞很独特，节目很好看，值得来此
2017-08-31,未知,5,第二次去了，很不错的，带父母去的
2017-08-28,未知,5,门票偏一贵，时间短，主要看表演。
2017-08-19,未知,5,景区不错，携程网订票方便、优惠。
2017-07-31,未知,5,孩子玩得不亦乐乎，表演也挺精彩的
2017-07-27,未知,5,入门的溶洞里很凉快～表演很热闹！
2017-07-18,未知,5,还好吧。来旅游有时间的话总得看看
2017-07-02,未知,5,挺好的。............
2017-06-03,未知,5,非常好，景点挺好的就是时间太短了
2017-05-15,未知,5,性价比挺高，演出还不错，推荐游玩
2017-04-30,未知,5,很好，很漂亮…………………………
2017-04-29,未知,5,太好玩了，下次有机会还会再来的
2017-04-29,未知,5,第一次见到这么大的榕树，太漂亮了
2017-04-28,未知,5,非常好非常非常好非常非常好非常好
2017-04-24,未知,5,很不错的景点，里面演出更有意思！
2017-04-13,未知,5,景色很漂亮，服务也很好 以后还会来
2017-03-31,未知,5,蝴蝶泉边！侗族和苗族唱起了情歌！
2020-07-26,未知,3,去的路上滴滴司机说快撑不下去了，没什么人。果不其然，确实没人，快速通过就出来了，还打到了送来的滴滴。这…唉😔
2019-09-17,未知,3,确实没什么玩的，不明白为什么门票价格还不便宜。走过一个溶洞，过一个玻璃桥（要另外收费），看一个演出，就出来了。
2019-08-10,未知,5,感觉还不错 因为不是自己去玩 哈哈
2019-07-09,未知,5,景区工作人员热情好客，表演精彩
2019-02-16,未知,3,蝴蝶怎么看都不像天然形成的，民族歌舞表演不错，与演员合影是需要收费的。
2018-12-22,未知,5,出票好快，隨買隨去，真是方便的
2018-08-23,未知,5,游了半路，剩下的天气太热没去爬
2018-08-19,未知,5,整体还不错，有个小溶洞，有表演
2018-07-20,未知,5,还可以，尤其是喜欢蝴蝶的孩子。
2018-05-02,未知,5,很美哦，空气很好，大自然的美～
2018-03-15,未知,4,还好吧！就上去转了一圈，有个小型的玻璃栈道，民族舞还有山歌还是可以的！
2018-02-14,未知,5,很好，不错的址之，我们很喜欢。
2018-02-07,未知,5,景点商业化很浓，景色大同小异，
2018-02-03,未知,3,一般，不是十分推荐，性价比不高
2017-12-23,未知,5,还不错，还有表演，全五分。。。
2017-11-17,未知,5,很好！！！！！！！！！！！！！
2017-11-11,未知,5,值得去的景點，也適合小朋友的
2017-10-28,未知,5,订票换票很方便，景区很美，满意
2017-10-07,未知,5,蛮好，老婆带孩子这边玩的很开心
2017-10-06,未知,5,还好吧，累…………………………
2017-10-05,未知,4,网上购票，比现场买便宜5块钱，山上溶洞不如银子岩，不过山下的表演不错。
2017-10-05,未知,4,很不错的地方，有机会一定再来。
2017-09-26,未知,5,景色很好，导游态度十分友好！！
2017-08-28,未知,5,门票偏贵，时间短，主要看表演。
2017-08-25,未知,4,景点比较小，一个熔洞没什么看点，40分钟的侗苗族表演很好看，门票贵了点
2017-08-25,未知,5,景点不大，有很多营销，有演出。
2017-08-23,未知,5,还可以看看拉，表演挺好看，！！
2017-08-20,未知,5,出票很快，又便宜，非常满意！！
2017-07-29,未知,5,蝴蝶泉还可以，图腾古道就算了吧
2017-07-21,未知,5,性价比很高超级好、很有民族特色
2017-07-19,未知,4,没有蝴蝶也没有泉水，不明白这个名字怎么起的？民俗表演还不错，其他都不行
2017-07-13,未知,5,不大的一个天然形成的景点。。。
2017-07-03,未知,5,不好玩，环境也一般，导游不好。
2017-06-25,未知,5,好舒服总休还不错，门票有一点贵
2017-06-03,未知,5,好好好嗨哦好好嗨哦好咯还没好好
2017-05-25,未知,5,携程购票方便又优惠，十分满意。
2017-04-11,未知,5,工作人员很热情。值得再去一遍。
2017-04-06,未知,5,来阳朔一定要来玩哦 名族风情浓郁
2017-03-20,未知,5,景色不错，山水阳朔。老人喜欢。
2017-03-04,未知,5,地方不错，很好的景点，值得一去
2017-03-04,未知,5,方便实惠，好玩好看，心情愉快！
2017-03-02,未知,5,太一般了，没意思了，不值得一去
2019-08-18,未知,4,还好吧，到出来的时候就有点坑咯，人都在门口拦住了，想不买东西都不行啊
2017-06-25,未知,5,好舒服总休还不错，门票有一点贵
2017-06-03,未知,5,好好好嗨哦好好嗨哦好咯还没好好
2017-05-25,未知,5,携程购票方便又优惠，十分满意。
2017-04-11,未知,5,工作人员很热情。值得再去一遍。
2017-04-06,未知,5,来阳朔一定要来玩哦 名族风情浓郁
2017-03-20,未知,5,景色不错，山水阳朔。老人喜欢。
2017-03-04,未知,5,地方不错，很好的景点，值得一去
2017-03-04,未知,5,方便实惠，好玩好看，心情愉快！
2017-03-02,未知,5,太一般了，没意思了，不值得一去
2019-08-18,未知,4,还好吧，到出来的时候就有点坑咯，人都在门口拦住了，想不买东西都不行啊
2017-06-25,未知,5,好舒服总休还不错，门票有一点贵
2017-06-03,未知,5,好好好嗨哦好好嗨哦好咯还没好好
2017-05-25,未知,5,携程购票方便又优惠，十分满意。
2017-04-11,未知,5,工作人员很热情。值得再去一遍。
2017-04-06,未知,5,来阳朔一定要来玩哦 名族风情浓郁
2017-03-20,未知,5,景色不错，山水阳朔。老人喜欢。
2017-03-04,未知,5,地方不错，很好的景点，值得一去
2017-03-04,未知,5,方便实惠，好玩好看，心情愉快！
2017-03-02,未知,5,太一般了，没意思了，不值得一去
2019-08-18,未知,4,还好吧，到出来的时候就有点坑咯，人都在门口拦住了，想不买东西都不行啊
2020-11-10,未知,5,好好好 很好有趣好玩，
2019-11-11,未知,5,还好吧*******
2017-09-20,未知,4,就是个溶洞，加上民族歌舞表演，商业感很浓，喜欢的话可以去玩。
2020-10-08,未知,5,景色不错，非常满意
2020-08-25,未知,5,有侗族表演，免费哦
2018-02-26,未知,4,门票50还算实惠，公园里可以爬山，有表演看，细细玩可以半天
2017-12-09,未知,5,不错的值得推荐不错
2017-08-16,未知,4,小巧型的，因为有老年人，没有爬高，看了个节目，小孩挺高兴的
2017-03-04,未知,3,感觉一般，进去前后玩了半个多小时就出来了，门票太贵，不值！
2023-08-01,广西,5,游客打卡 没啥意思
2020-12-12,未知,5,还是可以去逛逛的
2019-11-16,未知,5,非常方便瞬间出票
2018-12-29,未知,4,園內景色不錯，有表演觀看，在南天門位置拍攝陽朔風景不錯。
2017-10-15,未知,4,还不错，在十里画廊里面，中午去的人比较少，学生证可半价。
2017-06-20,未知,3,一般吧，景区里有个溶洞，但感觉像人造的，然后就是看了一场苗族和侗族的歌舞表演
2016-10-18,未知,3,来的时候是中午，没有表演，所以很快就游玩了，而且之前看过银子岩，就没有那个壮观，比较小的一个岩洞
2023-11-23,广西,5,是售票处的五折
2023-07-01,安徽,4,景区的溶洞小，但洞内景色还可以，侗族和苗族歌舞表演精彩
2019-12-12,未知,5,小孩玩的很开心
2018-02-17,未知,4,还行吧，有个玻璃桥需要单独收费，不去走旁边的桥也可以。
2021-09-15,未知,5,哈哈哈哈哈哈
2020-10-07,未知,5,演出挺好看的
2020-03-17,未知,5,代人多次预定
2019-10-22,未知,5,景点非常漂亮
2018-02-26,未知,4,有演出看，有岩洞，还有玻璃桥，不过要收费，景色一般！
2017-08-24,未知,4,还值得一去，景点无趣，唯一可看的是少数民族的歌舞表演
2017-08-20,未知,4,个人感觉景区一般，只是没去过想去看看而已，仅供参考。
2017-07-29,未知,4,还行，岩洞景色肯定不如银子岩，但民族表演还是可以的。
2023-11-11,广西,5,。。。。。
2020-10-07,未知,5,景色不错，
2020-10-07,未知,5,体验很好，
2020-07-19,未知,5,有趣好玩，
2017-11-09,未知,4,对最后表演里唱的山歌好比春江水印象深刻，确实唱的好
2017-08-24,未知,4,阳朔实在令人失望，乱、嘈杂，这个景点只有歌舞可以看
2017-08-15,未知,4,还不错，还有个表演，应该算是十里画廊里最好的景点了
2016-05-20,未知,1,"真的很小很小,而且那个表演有点简陋,我只能用这个词来形容了,演员偷懒偷懒的,感觉不是少数民族的,太作太作....如果知道是这样,就绝对绝对不会进去看的...气死个人了.."
2019-07-27,未知,4,还可以吧，票价不贵，但长期要被人照相，有点不舒服
2017-10-05,未知,4,十里画廊之中的一个景点，还可以主要可以走一个吊桥
2017-10-03,未知,4,蝴蝶泉这个地方不错 挺美的 不过一小时就差不多看完了
2017-05-05,未知,4,景点不多，民俗表演还可以，在酒店旁边，方便过来。
2020-10-07,未知,5,体验很好，
2020-07-19,未知,5,有趣好玩，
2017-11-09,未知,4,对最后表演里唱的山歌好比春江水印象深刻，确实唱的好
2017-08-24,未知,4,阳朔实在令人失望，乱、嘈杂，这个景点只有歌舞可以看
2017-08-15,未知,4,还不错，还有个表演，应该算是十里画廊里最好的景点了
2016-05-20,未知,1,"真的很小很小,而且那个表演有点简陋,我只能用这个词来形容了,演员偷懒偷懒的,感觉不是少数民族的,太作太作....如果知道是这样,就绝对绝对不会进去看的...气死个人了.."
2019-07-27,未知,4,还可以吧，票价不贵，但长期要被人照相，有点不舒服
