date,ip 属地,评分,comments
2018-07-07,未知,5,挺方便的，玩得很开心。那里工作人员态度也很好，会建议年纪大的老人不要玩溜索，导游不管你是否参团，都会给予帮助，令人暖心。就是草鞋质量有差异，建议以后去玩的朋友，鞋子随身带着，玩好瀑布可以随时换。另外公园很大，建议带些干粮，山上有卖饮料的，但除了台湾香肠，其他吃得饱的食物很少。
2017-02-22,未知,5,古东瀑布乘大巴车距离桂林市区一小时的车程。上午8点乘车从桂林市区出发，沿途欣赏了桂林的母亲河漓江的大好风光。9点到达古东瀑布景区。到景区后换上草鞋，穿上雨披，开始体验水中长廊的美妙。瀑布第一阶非常陡峭，但也是最刺激的，小朋友在这一阶是不允许攀爬的。由于出行时间是7月下旬，所以穿上草鞋，慢行在水中的阶梯中，感觉甚是惬意自然。所以去桂林出游，古东瀑布一定要去呦，淳朴的民风、优美的精致、慢节奏的水中漫步，定会让自我与大自然相融合，全身体的放松。
2023-06-08,上海,5,古东瀑布：位于桂林大圩古镇南，景区内有地下涌泉汇集形成的多级串连瀑布，是距市区最近、面积最宽、最具特色的一处森林公园。 最吸引人的是穿草鞋攀爬瀑布，可让人尽情体验溯水而上的乐趣。
2017-04-19,未知,5,古东景区的滑道溜索，有别与其它景区的空中缆车，让你体验一把惊险刺激，速度与激情一溜到底精彩瞬间。流泻的瀑布的，使得攀岩更具挑战性。
2018-07-25,未知,5,热带雨林风光，纯天然瀑布加上人造攀爬设施，有利于亲子游乐攀爬的瀑布，景色宜人，风光无限孩子们玩得不亦乐乎！值得一游！体验佳
2021-05-16,未知,5,位于桂林漓江的古东瀑布，是4A级景区，也是全国唯一一个由地下涌泉形成的多级串联的瀑布，更是原生态的瀑布群。CCTV新闻曾经报导过，“这是可触摸的瀑布”，形象生动的彰显了瀑布的壮观，漂亮，以及不可多得的地方。 游客可以乘坐当地的竹筏船，通过水路的方式，到达古东瀑布的登山口，也可以徒步到达登山，这里确实是一个非常值得前往游览的好地方。
2021-03-19,未知,5,古东森林瀑群旅游区位于大圩镇古东村蝴蝶山麓——草坪公路8公里处，漓江外事码头对岸，距桂林市25公里。古东瀑布溪水清澈，四季不枯，河水平均含沙量仅0.1克/立方米，年平均流量5立方米/秒。瀑布共分13级，全程落差90米，平均宽度为20米。古东森林瀑群旅游区森林覆盖率达96%，占地面积约300亩，其中原始生长林2000亩。林区古木参天，红枫诱人。藤缠树，树缠藤，野趣横生。景色秀丽，鸟语花香，空气清新。是距桂林市区最近，面积最宽，瀑布最具特色的一处森林公园，也是登山探险、森林寻幽之佳境。
2018-08-27,未知,5,网上订票很方便，取票窗口就在入口的旁边，瀑布很刺激，爬瀑布必备头盔和草鞋，在景区内购买，可以选10元或者15元的装备，就是含不含雨衣的区别。15元的装备包括一个头盔，一双草鞋（领取的时候报自己鞋码），一件雨披，一个防水手机袋，还有一个小袋子放自己的鞋子，自己的鞋子可以寄存在山下，也可以一路带上去，爬完瀑布还有一小段路要走才能到山顶。尤其是第一个瀑布很陡，水花也很大，都冲溅到脸上，戴着眼镜爬都要看不清路了，还好都是抓着铁链走的，而且穿草鞋完全不会打滑。爬完瀑布可以选择下去再爬一次，也可以直接还掉头盔，继续往山顶上走。下来的时候会走过一段吊桥，然后坐了滑索和小火车，都很刺激，滑索分两个高度，体重超过110斤的在低的滑索，没有超过就在高的滑索，滑过去20秒左右吧，工作人员开玩笑说一秒一块钱，哈哈。往下走一点就是小火车了，可以选择一人一车或者两人一车，都是四辆车一起走的，前面有工作人员开，自己是不能控制车速的，转弯的地方速度很快，感觉要飞出去了，但是小火车基本都是平行下降的，所以不用担心落差太大，小火车是可以直接坐到山下的。上下瀑布都可以选择旱路，但是爬瀑布、滑索和小火车都值得尝试哦！
2016-06-14,未知,5,如果没看过瀑布的建议去看看，由于赶时间就走了两小时，景色美的不要不要的
2019-01-26,未知,5,很赞的，景区内部导游也很贴心，大冷天的只有我们两个人去爬瀑布，一个不认识的景区导游还主动说帮我们把鞋拿上去等我们，贴心，很棒！
2020-06-03,未知,4,桂林有个漓江古东景区，这是个喀斯特地貌山水景区！景区不大，有个瀑布，可以沿着瀑布攀爬，爬瀑布，感受山水之乐，总体来说不错！
2021-06-19,未知,4,购票需要提前4小时确认这点很不好，希望可以改进，毕竟临时想去的话，也是1小时前定票了的，但是售票处还是还给我处理好了，值得点赞👍。手摇竹筏10元/人，走路过去也不远，10多分钟。不可以游泳，爬瀑布需要购买雨衣和草鞋。徒步游玩也是可以的，中途休息可以泡下脚，水很清凉。滑索20元，山顶小火车🚉50元/人直达山底。全程大约4.8公里，有氧运动，空气清新宜人。
2018-06-21,未知,4,上午去冠岩，下午去古东瀑布，五元雨衣和十元草鞋加租个头盔，这不贵。进入景区，又要我们花10元钱，坐船，其实不坐船走10分钟也可以到的。到了瀑布下，上第一级的瀑布有点陡，水量也稍大，但是也刺激。手拉着水中的铁链，一步一个坑地踩好，往瀑布上爬。后面的容易些，有六级瀑布。我都一一爬上去了。山上面还有一个吊桥。有一小段滑索。下山的路也不长。
2017-08-28,未知,5,可以攀爬的瀑布，很有特色！不过小孩太小不适合哦！景区有草鞋，雨衣，安全头盔，手机袋租用，考虑蛮周到的。环保提示很有创意！
2016-01-06,未知,5,古东瀑布是桂林景区中满意度比较高的一个景区，爬瀑布很好玩，陡坡中会有铁链拉着往上爬，价钱也实惠，门票中还包括了草鞋和安全帽的费用。景区进门口还可以坐一小段竹筏，湖中有一个小岛，还可以跟岛上的阿妹对歌，也可以喂鱼…
2020-05-14,未知,4,桂林是经典的喀斯特地貌旅游城市，景点很多！漓江古东景区是个小景点，这里植被茂盛，环境不错！该景区有非常多的小型瀑布，感觉不错！
2019-02-28,未知,5,下了飞机包车直达古东景区，太棒了！天热但是依山傍水感觉还可以。第一次爬瀑布，很有劲，就是没手拍照了。哈哈！留点美景纪念一下吧
2019-04-22,未知,4,漓江古东景区是瀑布，绿植茂密，溪流潺潺。整个瀑布由八瀑九潭组成，有“神龟饮涧”、“空谷连理”、“书生展卷”、“龙吟在潭”、“绣幕牵丝”等各具特色的瀑布，游客脚穿草鞋，在攀爬的过程中体会到瀑布的秀美、壮观、惊险、刺激。
2018-03-22,未知,5,古乐原始森林瀑布群是4A级景区。进入景区走的游览路线：走三姐湖上的浮桥（也可坐竹筏），到吊脚楼水谷冲，继续向前到达生态广场，然后向山上走观看瀑布。山路两旁长满各种植物，有毛竹、金竹、龟背竹（海芋）、滴水观音、古东鸟巢等。古东鸟巢是长在树杈上的一种叶像青菜的植物，看起来像一个鸟窝建在树上，也称古东鸟巢长青菜。瀑布从山下至山上分为六级，第一级瀑布最大，落差17米。每个瀑布根据形态都有对应的名字，如，第一级瀑布叫神龟饮涧，第三级叫天不转水转，第五级是连环瀑布，叫书生展巻，第六级叫繡幕牵丝。看过瀑布群，到了山顶，走过一个架于两山之间二百米多长的吊桥，开始下山。下山可坐溜索和滑道，也可步行。下山的石阶上刻有一些桂林话的方言，用普通话标准发音标出，可供游客学几句地方话。
2017-08-01,未知,5,适合亲子游，小孩爬瀑布爬的很开心，来回玩了三四个来回。上山逆流而上，下山有200米吊桥，小索道，缆车。青山绿水中穿行。 今天入园有景区的实习导游带我们一家三口，完全免费，小姑娘桂林理工大二学生，来这里打工，服务周到热情。 下山出来，刚出景区门口，买了份炒饭，酸辣粉，桂花凉粉，一共25块，大勺炒饭煮粉确实香，酸辣粉是用米粉做的，先用辣椒，酸笋，肉丝炝锅，再煮粉，加青菜，葱花出锅。 再往外走一点，很多卖水果的小摊，推荐芒果，香瓜，葡萄。水果小吃都很便宜。 交通我们滴滴桂林过去90元，回来在景区商务车拼车20，回程在景区外停车场，包车的话100-120。 总结适合亲子游，亲近自然。
2017-07-18,未知,5,游古东瀑布，这里最大的特点就是可以在瀑布上爬行，绝对是玩水的圣地！强烈推荐，一定要来！图三是第一级瀑布，最陡，得1.4米以上的孩子才能爬但是接下来五级瀑布都是可以爬的，玩得全身湿透，还好有带多一套衣服换[耶]第二个推荐的就是那里有一条200米长的吊桥，在上面奔跑很刺激！第三个推荐的理由就是那里有溜索，是少数名族的特色交通工具，可惜现场称体重，小家伙居然比要求少了两斤，坐不成[捂脸][捂脸][捂脸][捂脸]最后坐了滑道下山。累并快乐着！
2016-07-02,未知,4,位于桂林市区东南面，但处于漓江东岸，不在主游线上，平时不会有太多游客前来。这里可与冠岩、大圩古镇串成一日游线，而爬瀑布这个创意也很有特色，其实就是在瀑布旁边开凿坑洞，设置铁链，游客可以沿着陡坡爬上瀑布顶部，这在炎热的夏季将是不错的体验。景区的设计不错，可以走一个环形路线，空气清新，适合散步。
2017-09-08,未知,4,这里的景色很好，溪水清澈见底，瀑布是分多层流下来，并且可以从瀑布中攀爬而上，其中一个十几米高的瀑布爬起来最过瘾，当然淋湿全身是避免不了的。
2017-02-07,未知,5,瀑布超级小，但是绿树多，适合呼吸大自然
2018-11-13,未知,5,都说桂林附近到处是美景，这句话一点都不假，古东景区就是这样，但是这里山、水美景之外，森林植被和瀑布也是这里的一大亮点，还是值得过来看看。
2017-12-02,未知,5,风景如画，如人在画中景，随便抓拍都能处处是景，绿树环绕，真正是大自然的巨肺。
2020-10-08,未知,5,不要在景区外面买大姐大婶卖的草鞋！只有草鞋不能爬瀑布！里面要求租借头盔（套装包含草鞋）才能爬！我们上了一当，只能把多出来的拿回去留念了
2019-08-11,未知,5,位置挺偏僻的，而且交通特别的不方便，如果人多的话可以租一个车过去，门票也挺贵的要60块钱。夏天的时候特别适合来这里，穿着草鞋玩瀑布会感觉到很凉快，很刺激。
2018-11-09,未知,5,距离桂林市区大约有三十多公里，景色秀丽迷人，风光优美，这里的森林覆盖率非常高，是我国较大的红枫林区，而且这里的瀑布非常壮观，虽然不大，但是还是觉得很漂亮。
2017-11-12,未知,4,景点大门外店铺林立、有点杂乱无章。看起来像当地政府自己开发的景点。没有想象的那么好玩！可能秋天雨水少的原因，另外，我本是大山里长大，对高山流水不觉新鲜吧
2015-12-29,未知,5,很新奇有趣的一次体验。爬过山爬过梯田，爬瀑布也是另外一种体验。虽然那天突然下起了大雨，瀑布变得洪水一样不可爱了。
2019-04-14,未知,5,景色很好，一路上山清水秀，空气清新，还锻炼身体，青山绿水就是金山银山。不怕湿的可以买套装，进行草鞋攀登，里面有雨衣之类的，更多美景图片青岛我旅拍上看哦
2017-08-08,未知,4,景色怡人，大小天然瀑布尽收眼底，适合一家大小旅游。
2018-08-12,未知,5,看到攻略上的评论，都说古东瀑布景区，爬山涉水，感觉好，于是我们就决定去古东瀑布游玩～来到景区门口，租了涉水装备，就开始向瀑布进军～哇噻，太刺激啦。
2019-08-06,未知,5,桂林山水甲天下，确实挺美。可以游览的地方挺的，漓江，古寨，梯田，七星崖等等美景都不可错过。还有古东瀑布就非常棒，值得一游啊！
2017-05-05,未知,4,如果游玩时间多，可以来爬爬山，鸟语花香，溪水潺潺的氛围。里面有个瀑布可以攀爬，不包含在门票内，要另算钱。
2019-09-14,未知,5,漓江这里的古东景区还是第一次来玩啊，这里的人很多啊，景色不错还有一个地方可以爬瀑布啊好多人都去玩了感觉还是挺有意思的啊。
2019-08-09,未知,5,暑假带儿子游桂林，古东瀑布是最后一个景点，可以攀爬的瀑布，水质清澈，有好多小鱼的，我俩买了草鞋，佩戴好安全帽（10周岁以上可以从第二段攀爬瀑布，14周岁才可以攀爬第一段）从第二段瀑布攀爬，儿子玩的可开心了，我们还参与了滑索项目，整个游玩时间3-4小时，非常值得带孩子游玩的一处美景！
2017-05-27,未知,4,首先要肯定的是爬瀑布非常好玩，可以从水里面走，第一饭一定要穿戴草鞋头盔整齐才能爬，否则工作人员不给。 小孩和老人可以从二三级走水。 天热的时候非常凉爽，爬完瀑布以后就是游山，客观的说坐溜索的话就是一小段个人觉得价钱贵了。 都想省脚力坐后面的滑车下来还是很好玩的，觉得这个价钱也还可以。特别是老人小孩也还安全，可以节约脚力。 重点说最不公平的就是景区是私人承包，所以对于老人没有优惠。只对残军有优惠。 桂林的旅游市场还是有参差不齐混乱的现象。 小年轻人谈恋爱这种地方还是不错。最大的特点就是瀑布，其他的一般般。 停车场也不规范，外面的村民忙着收停车费，车也没看好，还刮了。你出来后人也找不到。其他的吃的没敢去，认真规范管理好，应该还是有潜力。
2019-12-22,未知,5,风景是相当不错的，比较休闲，适合带老人游玩，不太累，人非常多，要早点去，去晚了，排队要排很久，过年也很多的人，我们玩好出来，看到好多人排队
2018-11-23,未知,5,古东景区门票55元，老人没有优惠，上山路上会看到很多瀑布群，非常幸运，这么凉的天，看到有人涉水爬上瀑布，沿途风景优美，来桂林值得看的景点
2019-07-04,未知,5,好美的地方，景色宜人，在当地报团去的有机会还会去玩儿
2020-05-22,未知,5,漓江上游河段为大溶江，下游河段为传统名称的桂江。灵渠河口为桂江大溶江段和漓江段的分界点，荔浦河、恭城河口为漓江段和桂江段的分界点。
2017-07-29,未知,5,瀑布比较好玩 还有可以爬山过桥
2018-11-11,未知,5,在阳朔和桂林之间，距离兴平非常近，这里的山水与漓江一样，但是森林覆盖率非常高，而且景区内的瀑布非常好看，来这里交通方便。不错。
2022-01-05,未知,4,主要就是体验一把攀爬瀑布的，带头盔，穿雨衣，穿草鞋，爬上一小段，也不会太累，夏天凉快，上面还可以溜达一圈，空气不错，其他一般
2019-09-12,未知,5,漓江古东景区这里的游客真的是相当的多啊，来这里的时候天气实在太热了一定要放暑啊，这个怕瀑布的人很多啊但是没有尝试就看了看。
2020-04-09,未知,5,古东森林瀑群旅游区位于大圩镇古东村蝴蝶山麓——草坪公路8公里处，漓江外事码头对岸，距桂林市25公里。古东瀑布溪水清澈，四季不枯，河水平均含沙量仅 0.1克/立方米，年平均流量5立方米/秒。瀑布共分13级，全程落差90米，平均宽度为20米。
2017-08-11,未知,5,很不错，除了第一个和最后一个瀑布，其他的小朋友也可以爬，门票之外只需要再支付一人10元的装备钱就可以爬瀑布了，下山的滑索一人20，小火车俩人50，价格还算合理，就是冰棍饮料很贵，照片20一张也不便宜，不过自己照也是可以的，除了吊桥那不让停留，瀑布那管的不是很严
2017-08-05,未知,3,和初中的弟弟一起来玩的，弟弟很开心，最有意思的应该是爬瀑布，看起来水流不大但挺好玩，溜索也不错。 瀑布有两种票：1.安全帽，草鞋，鞋套，手机防水袋，RMB10；2.前者＋雨衣，RMB15。只租安全帽也是10块。推荐方法是外面小摊买雨衣，5块钱2件，然后再去景点选择第一种套票（安全帽只有景区内能租的）。 溜索：20RMB一位，还是有点小刺激的，弟弟很喜欢。 PS1：景区内有照相，但真心不建议，20RMB一张，不划算。但有些地方比如瀑布溜索和吊桥这些没办法拍照的，自己喜欢就要一张也没关系。 PS2：人很多，排队还是需要时间的。建议不要带太多行李，一个挎包或者背包就够了，瀑布是第一个景点，这里就需要换草鞋，鞋子能免费寄存，但行李不可以，需要收费。 PS3：未满14周岁及未满150cm都不能爬第一道瀑布，但其他瀑布也是能爬的，也不错 PS4：外面的苹果芒5RMB一个，很大挺好吃的，火参果没见过买了一个，里面有点像黄瓜，讲真不怎么喜欢吃。还有一种自制的水果冰棒，5-8RMB一个，也很好吃 PS5：外面有一家餐厅忘了什么名字，但一出景区就能看到，不贵，三个人60RMB，建议多点青菜，真是自家种的，特别好吃。老板老板娘人也很朴实，菜是老板自己炒的 PS5：从桂林过来是先坐车到大圩（2-6RMB一位）（据说有2块钱的空调车但我没看到，我坐的是6RMB的破公交）然后大圩就有公交（2RMB）到古东。后半路比较抖，毕竟在农村附近。回程是拼车，20RMB一位，6人座坐了5人，司机师傅挺热情，一路和我们聊过来 以上
2016-10-04,未知,5,从桂林市区驱车一小时过来古东森林瀑布群，景点不是很壮观，特色的是亲子攀爬，带着小孩一路溯溪上山，穿一双草鞋很搞笑！
2024-08-02,江苏,5,个人觉得挺好，值得一去。主要是带孩子冲着爬瀑布去的，确实不错哦。景区植被茂盛，整体游玩也不会太累，老人孩子皆宜，因为有山有水在景区里不会觉得太热。
2019-09-09,未知,5,这是一个唯一可以攀爬的瀑布。特别适合夏天去玩水。门票也不贵，游玩的时间也比较长。可以拍出许多美美的照片。特别适合年轻人去游玩。
2019-09-09,未知,5,漓江的古东景区，风景非常棒，如果是两个成人，我建议可以在网上订两张成人票，非常的划算，一张才50块，这边的风景秀丽，非常不错。
2018-02-17,未知,5,古东瀑布，景色怡人，攀爬瀑布、溜索、小火车，都是非常不错的体验。携程订票快捷又优惠
2017-10-15,未知,5,能够攀爬的瀑布，适合带孩子来玩，就是人多的话要排队一个把小时，跟团的话就耍不尽兴了。我们携程包车去的，包车师傅相当不错，守时客气，不催客，就在景区门口等着，客人玩够了电话一声马上到位，哪里吃饭，哪里好玩都门清，差不多当半个地导。
2017-08-04,未知,4,山里流下来的水真的很凉呢，穿草鞋感觉好新奇啊，而且一套下来也不贵就15块而已，挺好的。瀑布还是挺值得一玩的～森林里的空气真的很好，而且留意一下阶梯上的那些小小的字哟，也是挺有趣的，长知识，总体还不错吧
2022-10-05,广西,4,总体上挺好玩的，就是一件事情提醒大家，草鞋可以在第一个瀑布下面买，不要在进门不远的地方买，要穿草鞋走很远没必要。不要在门外听小店忽悠买，里面是雨衣草鞋等套餐
2018-07-08,未知,5,自己玩的话位置有些偏，而且也怕不认路，不过正好去的时候有很多团，所以我们混在其中，跟着别人一起，哈哈，昨天下雨，只能爬瀑布第一阶，虽然有点可惜，不过好歹体验了一把还是不错的
2019-09-15,未知,5,漓江这里的古东景区还是非常有意思挺好玩的，这里最有特色的就是爬瀑布啊，虽然不是很大的一个瀑布但是这个项目增加了一点趣味性。
2017-08-12,未知,5,很适合亲子游！！小孩也可以玩！我们是直接包车去的，250元推荐
2019-10-19,未知,5,最好建议傍晚赶到梯田附近，入住当地民宿，价格实惠，可以吃点当地美食，味道一般般啦，因为我们都吃不习惯，不过还行哦，早上7点起床可以在房间阳台看日出，7点半吃了早餐出发到金佛顶观景台，观赏美景，然后返程会宾馆吃饭
2017-04-14,未知,4,一直特别喜欢瀑布，所以特地来古东瀑布。虽然瀑布不算特别大，不过天热的时候许多人沿着绳锁爬瀑布，这应该是景区最大的亮点了。
2016-09-12,未知,3,70元门票，景色挺美的就是里面不是很大，下雨了爬瀑布也没人爬，玩水也没啥意思，总之70元门票还是很贵。玩了没多久就出来了一张照片20元也贵，一个一人20一个50元两人又单独花了吗110，还不如游乐园好玩了。
2020-09-26,未知,4,瀑布攀爬没有什么难度，草鞋可能会不舒服，最好准备几片创可贴。现在头盔+草鞋是10元，头盔+草鞋+雨衣是15元，头盔要归还，其他可以带走。我们整个景区玩完只花了1个半小时。
2018-02-20,未知,5,旅游散心好去处～非常适合体质差的我，够锻炼身体！
2017-09-17,未知,5,很适合家庭亲子游，建议直接穿凉鞋，穿草鞋玩了水后上山下山脚走路很疼。交通有点不便，很早就没有车回城里，只能趁黑三轮到路口做私人中巴，关键中巴收费还看你要是外地人就收的贵
2018-06-01,未知,5,空气比较清新，山也不算高，一年四季都很有看点；门票不算贵，性价比比较高；没有强制消费，服务态度还可以；如果要爬瀑布需要购买草鞋，草鞋可以带回家。
2018-07-07,未知,5,挺好的，票务挺快，换票就在售票处，很方便。学生票当场买有优惠，就是除广西当地老人外，其他地区70以上的老人仍需买全票，不合理。景区里面很舒适，满眼翠绿，一步一景，导游和工作人员态度都很好。自己开车过去，停车费10元一次。停车场挺大，还有当地人揽客停车，不用担心没停车位。玩瀑布一定要在景区里买有头盔的草鞋雨衣，没有头盔不让上的。草鞋质量有好有坏，建议鞋子随身带，出了瀑布群，可以随时换。
2018-08-18,未知,5,景区不大，爬瀑布玩水孩子很喜欢。山青水秀，夏季旅游好选择。
2023-07-11,广西,5,个人觉得非常适合夏天带着老朋友和小朋友一起玩，小朋友玩水玩项目，老朋友坐在瀑布下面喝茶 吃水果，非常舒适也不闷热，
2017-06-06,未知,5,古东瀑布特别好玩，我们可以迎着瀑布往前走，很爽！
2015-11-09,未知,4,可以攀爬的瀑布，要带一套衣服换，景区有草鞋安全帽出租，草鞋可以留作纪念，攀爬瀑布的时候很有乐趣，一路上都是上，景区有水路和陆路。
2019-09-14,未知,5,阳朔漓江这里的自然风光很不错啊，好玩的景点都很多，这次和朋友一起来了这里的古东景区里面挺大的玩的东西很多有一个瀑布可以爬上去。
2017-11-28,未知,5,这次游玩在淡季，游人不多，玩的十分惬意和满意.
2017-06-04,未知,5,这是个休闲娱乐的好地方！尤其是带娃娃玩水也可以
2019-11-23,未知,5,漓江古东景区在桂林，夏天去非常不错，很清凉，适合避暑的地方，可以在网上买票，非常方便，推荐一下，有机会可以去看看，挺不错的。
2019-07-19,未知,5,还不错，去过一次，蛮好玩的。暑假本来准备带孩子再去一次，结果连续下雨就泡汤了。唯一不足就是离市区太远，自驾游蛮远的，坐大巴又觉得浪费时间好纠结！
2019-06-10,未知,5,古东瀑布景区都没有怎么拍照，光顾着玩水了。确实很好玩，胆子大的，时间充足的可以从溪流开始的地方一直走到上面，当然是在水里。下山时候的小火车也很好玩，虽然需要另外买票，但是体验感真的不错，而且也减轻了下山的路程。
2018-10-06,未知,3,门票偏贵，不适合老人，比较适合孩子娱乐，里面自费项目多，几乎小景点都要自费，包括爬瀑布，70元门票不知道是怎么定出来的。
2018-04-20,未知,4,在古东景区，网上一般都评论说玩1-2小时，千万不要相信。如果你不爬瀑布、不观赏，2小时肯定是够的。但如果旺季，爬瀑布排队，再加上景区比想象中的大多了，建设地也挺好，你用心慢慢观赏，肯定会超过3小时的。
