date,ip 属地,评分,comments
2017-06-10,未知,4,小镇依山傍水，风景荟萃，粉墙乌瓦石板小巷，是漓江沿岸最美丽的古镇。这里的古桥、古渡、古亭、古戏台、古庙、古寨、古树和古村落建筑群，比较完整地保留了原有的历史环境风景。
2016-03-31,未知,4,去的时候人不算多，很小的地方，一会儿就能逛完了，我们沿着路标走到了二十元取景处，很美的
2016-03-27,未知,5,风景真的很不错。 值得一去！
2017-10-15,未知,5,兴坪古镇，漂流的终点站，小镇很小，里面的东西都很便宜，竹筏下来就是20元人民币的背景
2017-06-24,未知,5,古镇手工艺，漓江风景都可以，搭配27元青年旅舍，perfect！
2017-05-10,未知,3,简直跟西街差不多，全是旅游巴士旅游团，卖的东西也和西街一样，本来古色古香的房子也是改建了，部分还保持原有的样子，住了当地人
2019-01-17,未知,5,桂林山水甲天下，这次 切身体会到了，风景如画，景色跟 网上看到的宣传照 一模一样的，之前去其他好多地方旅游过的，其他 旅游景点的宣传照 水分很大，跟 实景 相差大，这次 漓江的景色 没让我失望的，强烈推荐大家来 阳朔 兴坪镇 体验 坐竹筏游漓江！
2018-03-08,未知,5,兴坪至九马段的竹筏游，是漓江精华中的精华，可看到20元人民币中的背景“黄布倒影”和著名的九马画山。坐在竹筏上，两岸连绵不断的奇峰怪石，连成带状的凤尾竹，往来穿梭的竹筏，宛如一幅彩墨山水的画卷，令人心旷神怡，流连忘返。坐完竹筏，再到古镇上的特色小街走一走，非常惬意，不虚此行。
2017-08-01,未知,4,筏体是塑料的，用引擎的，上船的地方能看到20元人民币的案的风景，感觉航线不长。有几个人背着鸬鹚给人拍照，注意这个是要收10元的，小孩一上岸就被背着鸬鹚的人强行给放在肩膀上了，收了10元。银子岩很漂亮。同行的人十分没素质，等他们等了整整半时，总体价格还是贵。
2015-10-28,未知,5,真心不错！小古镇、拍照最佳点，古色古香！
2017-03-19,未知,4,阳朔的一个小镇，在漓江旁，风景很好。.
2015-10-29,未知,4,一个很有历史韵味的古镇、距阳溯十公里左右、古色古香、距今已是千年历史、周围群山叠嶂、有三岩、五井、十二山等名胜、小镇清洁、整齐、人们热情好客、很适合休闲居住。
2019-08-11,未知,5,满四个人开船，人不够可以包竹筏，一个空位25，风景很好就是夏天太热了，有条件的话还是做游轮吧，游轮开的更远风景更好
2018-08-10,未知,3,古鎮看來復古但有現代的風格，小店無当地特色，附近飲品店及飲食店賣的差不多。附近有汽車站，往汽車站街頭人潮開始減少，街道中後段出租房增多，實際運營商家較少。
2017-12-13,未知,3,兴坪古镇最值得看的是人民币20元的风景，可惜时间不够没看成。在老街转了一圈，如同大多数古镇的老街一样两边都是小店，由于不是旅游旺季，人不多，生意不太景气。
2017-10-04,未知,4,这个古镇是免门票的，没有特别的特色。小工艺品也是每个古镇都有的。。。。。。。。。。。。。。。。。。。。。。。。。。。。。。建议多花些时间去古镇旁的江边玩耍
2017-08-21,未知,4,离开阳朔时临时决定去看看，太赶脚了，有机会再来慢慢欣赏
2021-06-08,未知,5,阳朔的精华所在，远离西街的喧嚣，这里才是原汁原味的桂林山水，除了泛舟漓江，还可以徒步骑行爬山，呆上两三天也不闷。
2015-11-25,未知,4,很安静的古镇，就在山脚下漓江边，比起喧闹的阳朔，我更喜欢这里。旁边的老寨山据说很美，因天气原因没去成有点遗憾。
2018-07-06,未知,3,兴坪古镇已经没了当年感觉，和所有古镇一样，都是特产，人头，一样的货品
2017-05-22,未知,5,非常值得一游，古香古色，趣味古朴、建筑古典、还有一些院子里有着戏樓！
2018-11-08,未知,4,古镇范围不大，都是些卖旅游商品的或者餐馆，没太大特色，没什么文化传承的介绍，随便看看就行了，没必要专门来。
2017-12-29,未知,5,烟雨中的漓江，静悄悄的古镇！大美，很好很漂亮！感谢携程的周到服务！
2017-10-10,未知,3,兴坪古镇位于阳朔北部漓江江畔，己有几一千七百多年历史。街道两边的商铺很多，价位比西街便宜，这里的特产小吃艾叶粑粑，桂花糕很好吃，大约30分钟就逛完，古镇离码头很近，哪里能看到20元背景地
2022-08-27,广西,5,桂林山水甲天下，不虚此行
2020-04-07,未知,5,讲解详细到位，定位准确。
2024-08-14,四川,5,方便，随买随用，价格实惠，一艘竹筏4个人，为了不跟别人拼竹筏补了一艘竹筏75元的差价，价格合理可以接受
2016-12-04,未知,5,在漓江河畔，就有这么一处地方，兴坪古镇中西合璧、国色天香，却与世无争、依山傍水、宁静安详，却万态千姿。
2023-10-06,湖南,4,怎么说呢，还是可以的有优点有缺点 首先缺点就是噪声很大，这是毋庸置疑的一点，要是对声音很敏感的人就不用去了。 然后说一下优点，他可以看到九马画山，派大星山，相公山，还可以看到20元打卡地的全貌。 风景确实是好风景。
2018-02-20,未知,1,景点不错，但是那里有团伙会在道路中间导你去收费的停车场，一进去就30元，不论时间，团伙作案，防不胜防，建议大家小心再小心
2017-03-06,未知,5,小镇古朴，小店很有特色，住在古镇，傍晚人少在古镇漫步很有意境
2017-12-20,未知,5,很适合慢节奏的生活，漓江很美，民风淳朴
2017-05-29,未知,3,节假日人多的不行，而且沿途在修路，整个古镇灰尘很大，感觉这古镇没点古镇的样子，真正的才一小条街，完全商业化了的地方，古镇的一些吃的还不错。
2016-10-04,未知,5,有点味道！有山有水！去桂林必去的地方！
2019-07-04,未知,2,漓江的水很黄，很浑浊。开车过去一路上都种了很多橘子树，当地人叫黄金橘，导致水土流失很严重，当地人告诉我们每逢下大雨江漓江水就变的很黄了，刚好我们就是大雨之后的很多天去的，水还没变回来( ๑ŏ ﹏ ŏ๑ )
2022-09-12,广西,4,在兴坪玩了3天，值得来。漓江风光属兴坪段最好，游玩古镇只需30分钟，整个九马画山景区玩了2天，九马画山、相公山、漓江漂流、黄布倒影等等
2018-04-13,未知,5,这一次的旅程很满意、 银子岩的景观太赞了。 夜明珠美呆了。
2020-06-02,未知,5,【景色】这里很美丽哦，环境特别好，空气也特别好，是个很优美的地方，我很喜欢这种便生态的环境
2017-11-18,未知,5,比起阳朔县，这里的游客少了许多，清静多了，尤其晚上特别宁静怡人。高铁站也在附近，交通方便。
2017-02-08,未知,3,兴坪古镇，不收门票，就是感觉古镇的感觉的不浓烈，古镇比较小，感觉规划的还有待提高，一般般吧，旁边也有码头还是比较方便的，可以游江。
2023-07-23,广西,5,第四次游漓江，第二次竹筏游漓江，还是很快乐！以前有停筏靠岸的，现在没有了，哎！舟行碧波上，人在画中游！兴坪变化很大，有了高铁站！
2018-10-21,未知,3,因为等着家人在漓江坐竹筏无聊逛了这里，这里明显是当地人卖东西的小集市，但是东西没有特色都是旅游纪念品，感觉都出自中国义乌，而且很乱，可逛的地方不大，没什么意思，不建议去
2017-09-01,未知,5,真心特别的美，金典段杨堤到兴坪！要游就游这一段！
2018-02-02,未知,5,兴坪车站出来右拐就走到了古镇，卖些小工艺品和地方小吃，古镇不长，穿过去很快就到了漓江边
2017-11-30,未知,3,坐船在兴坪下船必经之路，厕所都收费，古镇没有古镇的样子，吃饭的地方贵的离谱，古镇里是古镇外的两倍 我跟你们讲 广西这地方再也不会来，都是在搞神魔恋？。
2017-06-07,未知,2,"游过漓江去古镇转转 真的很糟糕,没有景点 外面景色还可以，戏台什么的我好差，都是卖东西的。有几家比较文艺的店。真心不建议去，也不建议吃吃饭卫生条件不好"
2017-05-30,未知,5,值得去，相公山看日出，九马画山徒步，20元景观看日暮，老寨山观日落
2018-02-18,未知,5,还好，值得一看。广西人不到桂林就枉为广西人了，广西山水桂林为首也
2022-06-14,未知,5,兴坪古镇位于阳朔，不错的地方，环境很好，古镇很漂亮，推荐来看看
2019-10-02,未知,5,很好很好很好很好很好很好很好很好很好很好很好很好很好很好很好很好很好很好，很好很好很好很好很好很好很好
2019-04-02,未知,4,天气不怎么好，但是还是不错的，船家很好人，兴坪古镇很多人啊！但是也值得走一走，有几家店在装修，附近有免费电瓶车。导游也不错
2017-03-27,未知,4,阳朔的一个小古镇，这里的景色还是可以的。.
2017-02-08,未知,5,这里非常值得去玩的、从南宁坐动车去十分方便
2016-03-24,未知,5,不像大城市里的一些商业化的古镇，兴平古镇比较有原汁原味。走在其中仿佛回到民初时代。
2020-10-27,未知,3,是否值得去見仁見智  但要嚴重投訴的是去取票時  一個在散客票窗口的中年女人竟然對我說:“我們沒有放在攜程上賣票  要怎麼處理你自己打電話給攜程”  當我把訂單裡的詳情說明給她看時  她還是堅持不管  直到我發火提高音量指責她  旁邊團體票窗口的一個女孩子才問什麼事  讓我過去辦理取票  讓我們同行的夥伴們都感到很鬱悶有待改进，
2016-06-28,未知,4,20元人民币和桂林山水甲天下，九马画山等等美景都在这，没事在这边住一住沿漓江走走是不错的选择，爬一爬老寨山从上面的视角看漓江水环绕山是另一种感觉，这里是竹筏漂流杨堤-兴坪的终点，兴坪古镇很小，一眼望的到头，除去商业化和四处施工，景还是好的，都在盖房应该是做旅馆用的，但盖得都一样四四方方的水泥房，没多大意思，山好水好人也不错，就是缺乏政府统一规划，如果能依据本地特色做全面规划建设就好了
2016-01-28,未知,1,广西兴坪古镇---一个极不推荐您来的地方。比黄姚古镇差远啦，尽管它的历史更久远。一条街走到底一拐弯就完了，规模极小，保护的不好，四周全被不伦不类的新房子包围了，脏乱差一直延续到几公里外的二十元人民币图案拍摄点。可惜漓江岸边这么好的地段了。只有一个古戏台还可以。唉，吃祖宗饭却不懂得珍爱祖宗，管理者的能力呀……混饭吃一级的
2021-10-13,未知,5,各方面都可以！就是5.1去的时候人太多
2021-08-02,未知,5,可以不去桂林，但必须到阳朔，不虚此行！
2019-08-22,未知,4,一般般，船工也不介绍，也不给时间拍照，路上到处都是黄牛，桂林旅游市场有点乱，感觉是个人都可以帮你买票，帮你包车，有块地就可以给你当停车场。
2018-02-10,未知,3,很一般的景点，街不长，去完后悔，只有个二十元背景图，其余没什么，从阳朔到这三十公里，小巴走了一小时多，招手即停，无语了
2017-10-10,未知,5,值得一去哟……景色很美很美…特色小吃！
2017-04-16,未知,4,兴坪古镇位于漓江边，竹筏漂流的终点。古镇比较小，但一些老街老巷也挺有味道。这里还是20元人民币背后的取景处，值得一到。
2019-07-30,未知,5,虽然是机械划筏少了点意境、但是沿路风景还是挺好的。推荐打卡地点吧、遇龙河是人工的但是价钱贵沿途没什么值得欣赏的风景。
2018-08-05,未知,5,美得很，虽然排队很久，但值了，美如画
2019-10-13,未知,5,兴坪古镇，漓江边一个特色的古镇，风景好，从阳朔回桂林的路上，专程去欣赏了。
2018-02-26,未知,3,很方便，酒店附近接送，我们带着两个孩子，全是按照成人的价格买的票，景点的门票是1.29以下是半票，我们一个1米的，一个1.3的孩子，联系带宝宝的去景点购买半票，问导游，爱答不理的，也不给个说法
2020-09-16,未知,4,"非常不错的地方，这里的建筑非常有地方特色,让人有新鲜感，推荐可以去看看。"
2018-10-18,未知,5,兴坪古镇，就是购物景点，卖银子！
2017-03-21,未知,5,携程的一日游特别好，没有隐形消费。就进了一个卖银子的店，导游也不强制消费，只是在车上等。银子岩很漂亮，游船有点短。玩的很开心，导游人不错，还唱山歌给我们
2022-03-24,未知,5,兴坪古镇依山傍水，风景秀丽。。
2021-02-23,未知,3,里面真是没有什么东西，非常差的
2019-05-11,未知,5,環境不錯，還有20元人民幣背景
2019-02-06,未知,5,漓江竹筏好玩，值得去，范导游美女的讲解很好，有经验，赞一个，五星好评。
2018-02-07,未知,3,兴坪古镇的金钱气息太浓了，早失去了古镇应有的宁静、祥和气氛，到处都是修路的灰、问你要不要竹筏的当地人。停个车一天就要70元，还不让讲价、不开任何收据。
2017-05-19,未知,5,兴坪古镇，有历史价值，有特色。
2022-03-23,未知,5,兴坪镇位于广西壮族自治区桂林市阳朔县东北部，漓江在此处绕了一个大弯。
2017-04-13,未知,5,主要去了兴坪码头游船，没有逛古镇，下次可以来逛逛
2023-08-01,广东,5,暑假旺季，网上买票后，有工作人员提前电话联系我，告诉我停车停哪里方便，如何取票。到的时候已经提前帮取票了，我拿票后直接去坐电瓶车就行了，非常方便。
2022-12-15,江苏,5,桂林市阳朔县的兴坪古镇很具有当地特色的旅游景点
2019-05-23,未知,5,20元人民币必经小镇，小小的镇，以前的房子，走在石板路上，感觉很好
2020-06-03,未知,4,非常漂亮的古镇，看着非常不错，建筑都是古色古香的，保存的非常不错，值得过去看看玩玩。
2017-11-29,未知,5,兴坪古镇位于阳朔北部漓江江畔，是一座拥有一千七百多年历史的古镇。
2017-11-09,未知,5,非常划算的竹筏票，旅行社会帮忙拼筏，下船后有电瓶车送到景区门口。
2023-12-06,海南,5,风景优美，漂流安排也挺好的，希保持。但周边环境希望能改善一下！
2020-03-31,未知,5,特意找了张20元人民币去，风景很美，值得去
2018-10-19,未知,5,一个戴眼镜男导游在车上推销东西 最后买的人很少 导游开始不高兴啦 说你们不买他连买菜钱都没有 还有在古镇好象有人没上车 就不等 说我们就这样处置不守时的人
2017-05-31,未知,5,去的时候比较早，不是节假日，人少，很不错。
2020-08-24,未知,4,离市区颇远，交通不便，古镇没有特色，机器船噪音太大，时间太短，性价比没有遇龙河好
2020-05-02,未知,5,20元人民币打卡，如果水位再高一点就更好啦。阳朔的旅游业非常成熟，专业化，标准化
2017-09-09,未知,5,比较不错的地方 值得一去 大家参考下来这游玩
2024-12-06,河南,5,在很多年前来到兴坪古镇的时候，这里还是非常的安静。如今这里又成为了一个网红打卡地，所以就没有了那时的安静，不过当你向远处多走一走走到村庄里的时候，还是比在古镇的商业街要舒服得多。
2021-01-23,未知,5,来此后别忘尝尝兴坪有名的“松花糖”，清甜香脆，入口即化。.
2016-11-03,未知,5,风景美丽的古镇，依山傍水，石板小巷，也有不少景区，很不错的
2023-07-27,广西,5,非常好的一次体验
2017-08-25,未知,5,商业化太浓了，到处都是有小商贩，但是他还是很值得一去的。
2016-08-13,未知,3,虽然叫古镇，但其实已经被现代化商业充斥了。古镇不大，一下子就逛完了。没啥特别。但倒是离开商业化部分，有一些当地居民的民宅很有古老的味道。
2015-12-08,未知,3,这个镇不怎么样，因为是漂流起点，一天到晚吵吵闹闹的。优点是江边有座山可以上去，俯瞰漓江非常漂亮。
2023-06-03,广西,5,打卡20元的背景山水，美极了。真不愧是桂林山水甲天下。
2020-10-09,未知,4,来阳朔，漓江竹筏当然不能错过！竹筏轻快地飘过，两岸风景秀美，是电动竹筏，椅子高度可以，不会湿身。国庆期间，水量足，也很绿！旺季建议网上提前买票，码头现场太火爆，哪哪都是长龙。
2018-06-16,未知,5,去过，不错，有点冷清，可能不是旅游旺季，有很多店铺关门
2016-12-12,未知,3,古镇已没有昔日的风采，古街上的建筑也不少是新建，而且样式不算协调，古街周边有些脏乱，古街内车辆乱停放，影响景观。这里最大的优点是免费。
2016-06-05,未知,3,古镇不大，但是蛮好玩的，拍照不错的。只是古镇的汽车站上厕所还要收费，第一次碰到在车站坐车上厕所还要收费的情况。真是穷山恶水啊，够黑的！
2016-02-16,未知,4,美国前总统克林顿来过，在桂林与阳朔的半道，很美的小镇。
2022-09-07,福建,5,【景色】美 【趣味】多 【性价比】高
2018-07-24,未知,5,古香古色，在游览漓江的同时感受到了当地人民的生活状态
2018-04-22,未知,5,风景很美环境漂亮。值得一去。很美
2018-04-17,未知,5,和全国大多数古镇一样，商业味比较浓，到处逛逛还是不错
2017-07-22,未知,5,不错的体验，漓江半日游！来回接送省时又省心，值得一试
2017-04-20,未知,5,兴坪古镇是旅游重镇，完好保存古建筑群落，值得前往看看
2016-02-10,未知,4,以前免费的，如今又被收费了。阳朔有大巴前来，约一小时可到，码头是观赏漓江美景的最佳地方之一。
2023-03-22,上海,5,处处是美景 如果人少些就更好了 比桂林和阳朔县城都美好
2019-12-05,未知,5,非常值得去了，漓江风景甲天下。
2019-08-15,未知,5,跟阳朔西街不同，这里非常安静，很适合三五知己来度假
2018-09-10,未知,5,兴坪老街比阳朔西街要安静的多！这才是老街该有的味道
2016-09-02,未知,4,从这里登船去漂流漓江。古朴的小镇很迷人，我们还去一家咖啡馆坐了一会儿，读会儿书，放松一下。
2024-06-02,广东,5,不错不错不错不错不错，服务态度很好很好，很温馨，也很贴心，不错不错不错不错不错，风景也是不错的，值得一去，一路很美，人美心善的地
2022-06-20,未知,4,据说漓江最好的风光在兴坪，这里的山水也确实不错。
2020-10-26,未知,5,天气晴朗的时候带着家人一起去溜达溜达非常棒的选择
2019-08-10,未知,4,验票的人不咋地，我们三个人要求加25元，我们要求拼，她说那就在旁边等，还是印度老外主动来跟我们拼船，对老外的服务比对我们还好，筏工服务是可以的！景色不错，还是这段最经典
2019-07-06,未知,4,山水美的，没话说。但是居然公共厕所锁起来了，不让上，还得出钱到附近农家上厕所，也是醉了。说好的十一点集合回家，有些人就是要迟到，白白让大家等半小时，这也是报团的无奈吧！
2018-06-23,未知,5,风景名胜区当然名副其实的，都是很喜欢哈哈哈哈哈哈
2016-09-18,未知,5,房间非常不错，玻璃房，江景房
2023-10-14,北京,5,需要排队，十一国庆节人比较多，要到游客中心取票
2023-06-02,广西,5,兴坪古镇，主要去坐轮船，看看20元背景的景色。
2019-08-18,未知,4,"漓江的水,蜿蜒曲折，清澈如镜，幽雅宁静。乘船的时间说长不长，一路上的景色差不多，船的声音有点大，和自己想象中还是有一定的差别。"
2017-10-17,未知,5,这是原汁原味的，很有历史沧桑感，很有地方特色。
2017-04-07,未知,5,很难得的古镇，原汁原味的保留了原有的纯朴味道。
2024-11-12,湖南,5,值得一去，离江很近，就在路边上，周边住宿吃饭都很方便，古香古色。
2023-07-06,江西,4,竹筏往返游，欣赏山水美景，不错的体验。 但要吐槽的是，携程上订票，不能到售票厅取票，得等携程的人送票（不知道是不是黄牛），票面名字还不是自己的。。
2023-06-07,广东,5,商业化很浓，到处都是兜售食品，竹筏票的小贩。
2019-08-04,未知,3,竹筏还是不错的，但不明白景点卖80元的门票，为何携程订票92元，更贵。取票后才知道，后来就再也联系不上***，如果下单是联系这个号码的最好退票处理。
2018-07-19,未知,3,怎么说呢，古镇很小，300米吧，唯一特色，就是20块的风景，和九马化山在这可以看到。
2018-02-19,未知,5,古镇建筑风格独特，村民很淳朴，小吃很多且特色
2017-09-01,未知,5,复古优美 景色怡人 热情好客
2017-08-15,未知,5,简单逛了一下，很古老的一条街，房子都很老旧。
2020-05-08,未知,5,景色超级美丽，古色古香有韵味，还会再来的。
2017-09-26,未知,5,很美，很舒服，照相是不错的，下次还会再来。
2016-08-15,未知,4,兴坪古镇商业化不高，走在老街上，感觉很好。
2021-06-06,未知,3,行程非常不错，酒店接竹排游漓江，景色非常美。但是导游在结束回程路上因为推销的产品没有多少人买而言语冲人，并且到了各个酒店也没有说明地方提示。一开始是很尽心的导游，但是最后真的太拉胯了，感觉有被道德绑架。
2021-05-23,未知,5,【景色】20元人民币背面景色就在这里👍
2020-12-09,未知,1,这个地方真的需要好好整改了，景色挺美的一个地方，到处都是野导，还是跟着你的那种。甩都甩不掉，烦的很。古镇那个古戏台里面全是卖东西的，只要进去了，还必须强制参观，走到最后会有一帮人套路你摸龟捐香火钱，总之，就是一个坑人骗钱的地方。本来冲着阳朔山水甲桂林去的，结果体验感差到爆。
2019-12-25,未知,3,因为是淡季 竹筏人数不够 我们还补了差价 好在不贵可以理解 不过去兴坪有点不爽 我们竹筏已经到了兴坪附近的码头 但是等了司机大概二十分钟 上了车 去了兴坪 一开始师傅说不能逛了 因为十二点要回阳朔接人 但是我特意买的这个就是为了可以逛一下 后来师傅说 就等我们半个小时 我们如果超过半小时 他就走了 可怜我们兴坪就没怎么看 虽说这个地方据说没什么特色 但是总感觉不太爽 希望下次携程能安排好行程 给出一些宽裕时间 省的司机和游客发生不愉快
2019-10-07,未知,3,导游解说很好，自身可能是文化水平低，就是订票前所看的详细内容导致误认为不跟团是不能到达真正的景点，想起来都一脸懵逼，竹筏（胶管筏）感觉多余的时间非常多，重点位置逗留时间短，还好开船的师傅开得比较慢，可以为这门票多呆一会
2019-10-05,未知,5,时间准确，解决问题及时。比现场买票方便太多！尤其旅游旺季一定提前预约取票时间！用跑的！加油，哈哈哈哈
2017-11-26,未知,5,兴坪古镇，环境真的不错，地方也干净整洁。
2017-10-30,未知,5,古镇风情万种！特别好玩的哦！好吃的也多！
2017-10-19,未知,4,挺小的，有空可以去逛逛！旅游开发的有点过度了！空气因为巴士车搞得很差，很大灰尘！
2017-10-11,未知,5,古镇建筑富有特色，美丽而俊秀，山水相亲。
2017-05-22,未知,5,整个游玩时间给的很充裕，景色也很经典，应该是最精华的一部分。真的很值得。价格也很合理，比当地旅行社价格便宜多了。很推荐。
2016-10-19,未知,3,一般吧！古镇没什么好玩的很小！船费拖好多
2024-10-27,广东,5,电动竹筏，两人到场后补150差额度包船游，比较安静，整躺行程往返非旺季会比较舒服，自然景观推荐观赏
2023-08-01,广西,5,比较小的古镇，正儿八经的老街只有两条，
2022-01-12,未知,4,特意去看古戏楼，惊出一身冷汗，能不能建议一下把里面的蜡像拿走呢？太吓人太吓人了
2019-10-12,未知,3,性价比不高，古街，还是旧了点，看起来不是挺干净的，风景值得看，还是西街那边热闹。来的时候到场都是装修、拆屋，观感不好。
2019-08-09,未知,5,20元人民币风景区，上车地点清楚，导游也交代景的区上车地点清晰，坐船上，慢慢游，确实是很美的地方，记得带加20元人民币
2017-12-31,未知,3,同全国知名古镇一样，完全商业化，没意思
2017-11-15,未知,4,也是个不错的地方，休闲的地方，20元人民币的背景，九马画山
2017-09-24,未知,5,古镇不旺，古镇不大，景色很美，交通方便
2016-10-27,未知,4,从桂林坐竹筏到兴坪上岸后在古镇坐车去阳朔，古镇不大，保护完好值得花点时间逛逛。
2016-07-30,未知,4,值得去看，这里真的是漓江最美景点之一！
