date,ip 属地,评分,comments
2020-01-08,未知,5,阳朔西街（步行街）也称作益田西街，位于广西壮族自治区桂林市阳朔县中心。这是一条中国著名的的街，既有自然风光，也有许多人文景观。在白天倒是显得有些冷清，但一到晚上，这里热闹非凡，人来人往。在阳朔步行街上，有许多富有当地民族特色的餐饮店，也有许多旅游品纪念店。我们是在2020年的新年第四天，从桂林乘坐三星级游轮，一路上欣赏了100里漓江的自然风光，桂林山水，于当天傍晚来到阳朔的，并入住在阳朔步行街旁边就是的新世纪大酒店。晚餐后，领略了西街步行街的美景，为我们这次广西之旅，划上圆满句号。
2020-09-02,未知,5,兴坪古镇绝对中心区老街，很小范围的，有漂亮仿古建筑，记得上次来是特意入住某网站免费的200多元的复式古雅小阁楼，还带有楼下小院，情调十足，可惜2018年活动结束了，如今只能自费住性价比高的酒店了。
2020-09-01,未知,5,兴坪古镇之夜――本来团购秒杀了一份10元的菠萝炒饭，那小餐厅环境看着也挺有情调，可气居然没有开门，马上投诉到客服获赔10元券！只能绕着不大的古镇转圈找晚餐，干脆吃碗桂林米粉。
2020-08-31,未知,5,兴坪古镇――因为阳朔高铁站实际就在兴坪古镇附近，客车过来才5元，到阳朔则20元。因此俺每次来游桂林，都喜欢选择先到兴坪古镇玩一天住一晚。
2022-04-22,未知,5,免费开放的一座古镇，依山傍河而建，规模不是很大，里面建筑古朴，主街两旁商家林立，售卖各种旅游纪念品，服务热忱，消费适中。
2020-07-09,未知,5,商业化很浓的老街，商品雷同，但是店里的人都很和蔼可亲。
2020-09-05,未知,4,与国内多数古镇一样，街道两旁都是商铺，往深处走可以看到一些老房子
2020-03-21,未知,5,在古镇步行街走了一圈，挺有趣点的地方
2020-12-17,未知,1,太商业化了，村子里的人也商业化了，体验感不好，不会再来第二次了
