date,ip 属地,评分,comments
2022-08-07,北京,5,车沿江行，一烟火甚旺小镇在侧，信步其中，掠几幅小巷、屋前、古桥、江畔之照片，揣入怀中，体味人间百年温暖。大圩古镇是广西古代“四大圩镇”之一。大圩古镇始建于公元200年。古老的大圩老街顺着漓江绵延2公里长，不宽的街道上铺着青石板，石板路两边是保存完好的老房子。大圩古镇在漓江东岸，父子岩东南，磨盘山北，距桂林23公里水程。史载，古镇始建于北宋初年，中兴于明清，鼎盛于民国时期，距今已有千年历史，远在600年前，大圩以其“大”，成为广西四大圩镇之最。大圩古镇曾名长安市、芦田市，通称大圩。汉代已形成小居民点，北宋时已是商业繁华集镇，明为广西四大古镇之一。其商业初兴于宋，曾设税官；中兴于明，清光绪三十一年《临桂县志》称“水陆码头”，抗日时期有“小桂林”之称，赶圩人数高达1万余人，泊船多达二、三百艘，地方商业文化积淀深厚，特色鲜明。来桂林旅游，一定要大圩古镇，除了古色古香，还有热闹的集市。镇内还有许多名人的活动遗迹，当年孙中山北伐时，到桂林设立大本营就是在大圩塘坊码头（1921年12月4日）起岸，并在江边扎台发表演说。灵川最早的中共组织--中共桂林东乡区委员会和中共毛村支部就是1928年8月在大圩建立的。毛洲磨盘山下还有清末抗法、抗日名将台湾巡抚唐景崧的墓地。古朴的大圩镇，电影《刘三姐》在此取了很多外景，十几部电影，电视剧均在这里进行外景拍摄。到大圩，万寿桥是必去的地方。万寿桥始建于明朝，重建于清光绪二十五年（1899），单拱石桥，位于马河与漓江汇合处，是一座石块砌起的石拱桥，桥面的石头已被磨得溜光发亮，间杂些许小草，古朴自然。桥的西面是漓江，是欣赏漓江及对岸螺蛳山的极佳位置。
2016-10-08,未知,5,喜欢古镇古宅古建筑的朋友一定要来！非常好！而我的收获是发现了一家老中医的药店！地道的中国传统中药材……专治跌打骨伤，骨痛！老爷子71岁行医40余年，聊过之后才发现原来好多骨折患者会慕名而来……老爷子的草药膏药特别有效！朋友骨折一月余……老大夫给开了三副草药膏药！棒棒棒！
2016-09-17,未知,5,可以一去！去一次就够了，走走逛逛感受下气氛还不错啦，从桂林市汽车站坐车到大圩下车10块钱！古镇不需要钱！很有农家感觉很多人家都是那种很早前的生活状态，完全没有商业化，值得去逛逛哦，里面卖的吃的什么的都很便宜啦不用担心被宰！
2016-08-27,未知,5,大圩古镇是广西古代“四大圩镇”之一。始建于公元200年。古老的大圩老街顺着漓江绵延2公里长，不宽的街道上铺着青石板，石板路两边是保存完好的老房子。 史载，古镇始建于北宋初年，中兴于明清，鼎盛于民国时期，距今已有千年历史，远在600年前，大圩以其“大”，成为广西四大圩镇（此外还有扬美古镇、黄姚古镇、芦圩古镇）之最。 图片是今日随拍， 踏着石板路漫步在古镇老街，时间仿佛在这放慢行进的脚步！
2016-11-06,未知,4,大圩古镇位于漓江边，码头景色很美。清晨在码头跳进漓江游泳半小时，碧流击水，仰望满天朝霞，环视青峰倒影，悠哉游哉。 早餐后各自进老街游览。 大圩有千年历史，为广西四大古镇之一，民国年间仍然十分繁华。近几十年公路运输发展，漓江水运衰落，沦为被遗忘的角落，逃过被大拆大建，旧貌得而幸存。昔日的石板道，老商铺，会馆，钱庄，镖局和庙宇等仍完好。目前不收费，可自由进入在老街上漫步，感受历史的沧桑。但近年也被打造成旅游景区，修旧翻新，商店餐馆环立，与几年前看到的已大不相同。
2016-04-09,未知,4,古镇小吃是不错的，很多现做的，毛洲岛上农家乐也不错，鸡鸭鱼都是活的现场做，上岛乘船只要7元，包来回了。 想看漓江风景也可以乘竹排，包一艘船80元，来回大约50分钟，几个人一起上就很便宜了。 拍照可以拍一些老建筑、老装饰和老家具。 小纪念品小食品也很多选择，古董和旧书也有，但是你要会鉴别。 想住下也可以，有客栈，周边有草莓，葡萄，琵琶黄皮果等等，可以抓一把回家。 交通有公交，自驾有停车场，环保有自行车旅游道，到市区步行要20公里，呵呵，搞拉练也行。 总之玩法多种，费用可高也可低。至少没有门票，小吃不贵，农家乐丰俭由人。
2015-12-13,未知,4,会去大圩完全是突然之间的心血来潮，早上刷微博看到于是匆匆搜了搜地址与具体信息就在吃过午饭后在三里店等待小绿皮，到达大圩步行了一段距离才到古镇，所幸有指引牌，那天刚好没下雨，但由于是独游，也就没有去到毛洲岛，自己在古镇里来回走走看看，环境都还不错，却也感到莫名的悲哀，因为大都是老人留守在这里。商业化不严重，在古镇上买了瓶酱料，带回去朋友都说不错，建议有条件的朋友可以考虑骑行，那条骑车道沿途的风景我不知道，但是骑车道修缮得不错。
2015-11-23,未知,5,大圩古镇-----广西古代“四大圩镇”之一。古镇始建于公元200年。古老的大圩老街顺着漓江绵延2公里长，不宽的街道上铺着青石板，石板路两边是保存完好的老房子。古镇现在还保留着许多竹编作坊、草鞋作坊、传统的丧葬用品店、草医诊室、老理发店等一批古老的手工作坊。闲着无事的老人们或是在街边看些发黄的书，或是聚集在一起喝茶打牌，平静地生活着，守望着这最后的古老。 明清时，大圩已是南北商贾云集之地，各种商行应有尽有，明初解缙诗曰“大圩江上芦田市，百尺清潭万竹围，柳店积薪晨昏后，壮人荷叶裹盐归”。各地商人在此均建有会馆，有名的广东、湖南、江西会馆及清真寺等。到民国初期，大圩已形成八条大街。沿江亦形成十多个靠码，有“逆水行舟上桂林，落帆顺流下广”之说。铺面商号有“四大家”、“八中家”、“二十四小家”之称。体现出当时大圩的繁荣状况。
2023-08-04,广西,5,大圩古镇，我只能用一个词来形容：“震撼”，我摸着腐朽的古木，走着早已光滑的石砖，看着历史悠久的古城，似与古人同步，见过太多的古城，我甚至觉得我之前去的不是古城，而是打着“古城”名号的商业街，我认为真正的古城应该是质朴的民风，切实做到古城与文化相融合，少一点商业化。固然，商业化减少，当地人民收入也会减少，可我认为，过多的商业化会使古城原有的韵味丧失，为保护这种文化，应做到商业化与古城相对平衡的状态。而恰恰这点，大圩古镇做的十分好，有相当浓厚的古城文化，在不打破原有生活的基础下，确确实实地将古城与人民的生活融为一体，建议来感受一下这种慢生活，远离喧嚣的城市。
2017-12-10,未知,4,我们是去看海洋乡回来的路上去看大圩古镇的，大圩古镇是免门票的，总体感觉那个小镇不太干净，朋友是免门票吧，收不到钱，与旁边那个贺州的黄姚古镇相比就差太大了，，黄姚古镇是收门票的，地方干干净净的，维护的比较好，大圩小镇就两条街道，没什么看？有一些古迹，但是维护的很破落，旁边的渡口也是很原始的，来的时候包车师傅就说那个龙很好，漂亮。不多说了，大家看看图片吧。
2017-01-23,未知,3,位于桂林市东南18公里处，距灵川县城30公里。地处漓江中游，在漓江北岸由西向东沿江而建，古风浓郁。广西古代“四大圩镇”之一，古老的大圩老街顺着漓江绵延2公里长，不宽的街道上铺着青石板，石板路两边是保存完好的老房子。房子多为青砖、青瓦的两层明清建筑，历史沧桑随处可见。每栋房子设计十分合理，集商住于一身，均由门前、天井、正房、厢房、后院组成。靠街的一般作铺面从事商业，有楼梯可上二层。往里走是天井，一般都栽有花草，利于采光；天井后是正房，高大宽敞，供着神像及祖宗牌位，是主人活动、会客的地方；两边是用来居住的厢房。正房、厢房的门窗上都雕有花纹；正房后有门可到后院，后院临江并建厨房和厕所，有石阶可到江边取水、洗衣。
2016-01-02,未知,5,大圩古镇给我们非常大的惊喜，因为看过南方太多人为的商业古镇，和死气沉沉的老城，觉得南方特别是西南没有太多有特色的古代城镇，但是大圩给我们展示了它当年的气势和今日的灵秀，在桂林市区具有很大的游览性，因为桂林周边的地标旅游景点多数已经老化，有些疲倦了。在此提醒各位游客，古镇里有一个叫广昌布行的大户人家，里面免费开放展览一些古代家具建筑之类，会有人在暗中观察你，如果你是外地人、具备一定经济实力的模样，他会热情的带你去参观房子后面的私藏文物，然后会送你一些宝贝、或者给你内部价挑一些玉器之类的东西，请大家千万不要上当，也不要在此浪费过多的时间。另外，由于这个不愉快的经历，我非常怀疑里面的古代家具和牌匾题字都是赝品。
2023-04-18,四川,5,大圩古镇始建于北宋，兴于明清，鼎盛于民国，已有千年历史。古镇昔日的繁荣与昌盛已随漓江水消失在天际，古街石巷，深院高墙。顺着漓江绵延2公里长的老街铺满光滑的青石板，街道两边的老房子基本保持着当年的格局和风貌。蜿蜒的街，窄小的巷道承载着百年的岁月，千年的时光。现在还保留着许多竹编、草鞋作坊、中医诊室、传统的理发店……一批古老店铺，它们守望着古镇最后的古老。而今古镇已经没了昔日的景象，像一位岁月中目光里充满忧郁的老人，让人有一种无法言说的感觉。长满了苔藓的墙脚、屋檐，经年的雨滴“水滴石穿”的台阶，处处都是时光与年轮的痕迹。然而，我们在宁静的古镇上，在斑驳的青砖黑瓦的记忆中，依旧可以寻找到远去的文明，依旧可以感觉到曾经的喧嚣，依旧可以看到当年古镇四大家、八中家、二十四小家的辉煌和历史对这座古镇的铭记。
2021-11-26,未知,5,大圩古镇是广西古代“四大圩镇”之一。大圩老街顺着漓江绵延2公里长，不宽的街道上铺着青石板，石板路两边是保存完好的老房子。古镇在漓江东岸，父子岩东南，磨盘山北，距桂林23公里水程。古镇始建于北宋初年，中兴于明清，鼎盛于民国时期，距今已有千年历史，远在600年前，大圩以其“大”，成为广西四大圩镇之最。
2017-10-17,未知,4,古朴宁静的古镇平静温暖，伟岸的关帝庙，门口屹立盘龙柱的真武庙给人以震撼！村口的村庄格外宁静，偶缘居的临江房让人心旷神怡！还有九十岁的老爷爷自力更生卖水果，且享受读书时光，美好的回忆！ 警示游客朋友，广昌布行游览时有个带眼镜，圆脸，个子不高，满脸亲切又显精明的年青人，号称该布行正在建设会馆小吃街及客栈，并热情介绍，要提高警惕！当其提出有缘份相识，可以带游客去参观其私人藏品时，不要进他的藏品小屋，那明显是个卖玉器制品的，东西嘛，自己想吧……
2017-03-15,未知,5,漫步在大圩古镇依旧可见青石板铺就的老街，抬头可见沿街的骑楼和木结构的铺面，漫步在古镇内随处可见各种历史古物，处处充满着古风。
2016-06-24,未知,3,大圩古镇从桂林开车过去大概20多公里镇子不是很大但里面的老建筑不少古镇里有一个码头可以坐筏子游江我们去的时候不是旺季100块一条船可以玩一个小时也可以搭船到对面的小岛上去玩半天足够了
2017-04-20,未知,5,桂林的大圩古镇，非常的美。这里主要还有一个，骑自行车的环镇游，自行车骑起来非常的轻松，沿着漓江边骑行，非常的魅力。还想再去一次？
2023-07-01,广东,5,大圩古镇有千年历史，“逆水行舟上桂林，落帆顺流下广东”，因而宋代开始便有商贾集聚。镇里留存最多的是明清及民国时期的构筑物，的多是融合了古今中外不同风格。游玩内容可以旅拍、竹筏游漓江、参观博物馆、尝各种地方零食。
2022-04-28,未知,5,从兴安古镇出发绕过桂林市区向南就到了大圩古镇，大圩镇中心公路穿镇而过，到漓江边渡船码头附近沿江边保留一条老街，这老街有些味道，两边高挂的红灯笼还显示着当年老街的繁华。老街两边的老宅基本都开辟为商主要经营土特产、小吃、古董老物件等。
2022-02-03,未知,5,这里是灵川县大圩镇的上桥村，与500多年香樟树相依相伴的是一座双孔石拱桥，全用巨石砌成。桥下的河为支马河， 为漓江的一个支流，桥叫关龙桥，看起来已十分破旧。村中的碑文记载，此桥修建于明代弘治元年（1488年），至今已有530年。关龙桥因挨着路边的关帝庙而得名，据称，石拱桥北端曾连接有一段旱桥，1958年被洪水冲走，仅剩下双孔石桥。 在上桥村北，还有一座古桥， 名为马蹊桥，用巨条石砌成也是双孔石拱桥，为明代古桥。 上桥村之所以多古桥，是此村过去位于湘桂古商道上，当年商贾车马川流不息，这些桥都曾发挥着重要作用，只是商道废弃，这些桥也随之价值不再那么大。[强]
2021-05-06,未知,5,广西自古传承至今保留着“四大圩镇”，沿漓江兴建的大圩古镇便是其中之一。 圩镇距离桂林市区很近，早年间的名气又远盛于桂林，得益于流传下来的历史和商业文化。临水依山而建的民居、街巷平直的石板路、古朴的建筑、不变的民俗，都让游客仿佛穿越时空一般，绝对是值得你停留下来仔细品味的好地方。
2016-11-03,未知,5,大圩古镇在桂林的漓江边，幽静古朴，保存了原生态的风貌，石板的路，木头的屋，悠闲的时光，一切都那么自然，美好。古镇免费，有很多看点与惊喜！
2017-11-08,未知,4,桂林市区旁的一个小镇。不远，也不算大，小镇靠江边有几条街，据说历史很悠久。经过这些年的整修，现在看起来更有些景区的样子了。呵呵呵呵。看图吧，还是挺有意思的，可以去看看。
2016-01-09,未知,4,市区坐车也就四块钱，游客挺少的，也安静，建议有自行车的可以骑车去，一路上有自行车道
2021-10-19,未知,4,是桂林四大古圩之一，北宋时期就开始存在，往日的繁华落尽剩下旧宅老街满眼斑驳，在加上来时是淡季，冷清得很。但是国内已经很难找到这么真实（老旧）的古镇，它没有像其他城市的古镇一样商业化，同时也缺乏管理和维护。 也就是说，没有了管理，当地居民有了商业空子可钻。 古镇没有正规停车场，路边可停，但是各户门口都站着“热情”的老太太，我为了不占人家家门口，停到了垃圾桶旁边，自以为安全哦，结果一老太太马上走近了收10元停车费，她说“这里是我的地盘”，我说如果我停到对面呢，她说：你停哪里都要交钱。我问：那你们有没有条例规定，交费有没有给我票，她说你要票跟我回家拿……反正最后是乖乖交了10块钱。 里面有间“汉王庙”最不能进去。我从门口经过看它很奇怪，三层楼高的大庙破旧不堪，而且牌匾上“汉王”二字用水泥糊掉，只剩庙字，我很好奇。恰巧门口两个中年大叔接话，叫我们进去免费参观，给我们讲解背后的故事。我这么好学一下子就上钩了。他一口顺溜的边背台词边把我们往里带，带到佛祖面前叫我们双手合十三鞠躬祈祷平安，接着就指向了添油箱二维码。我们赶紧乖乖的扫码添油。结果还没完！ 接着给我们两人一人一条祈福带，把我俩分开两边，说去写名字求平安。两边的大叔已经等着了，给我看面相，念祷告词之类的，然后拿出个本子说：留个名字。 写了名字，写户籍省份，写年龄，接着一行写功德，他说，你随便写个数字添点功德，就圆满了。 好家伙！！ 我看前面一串串299的200的399的，原来都是这样上勾的！ 实在是防不胜防。
2021-05-05,未知,5,挺好玩的，推荐去拍拍照，逛逛老街，自己带东西去江边露营，看看江景，精力旺盛可以去对面岛爬山，岛上除了爬山就是农家乐了。 镇上还有家咖啡店，在老街里面，有奶茶有绿豆沙还有手磨咖啡，老板娘特别好！ 关公庙对面有家桂林米粉店米粉好吃，炒粉也好吃，比我在桂林吃过的米粉都好吃！
2019-09-04,未知,5,”桂林山水甲天下”这句诗家喻户晓，却鲜有人留意到18公里外的大圩古镇。这座号称广西“四大圩镇（集镇）”之一的宁静小镇，已在漓江边默默守候了1800余年。 古镇老街上还保留着许多竹编作坊、草鞋作坊、老理发店等一批古老店铺，仿佛在诉说着一个又一个古老的故事。街上偶然能遇到捕鱼归来的渔夫，相邻的妇女在悠闲地聊着家常，脚边是酣睡的猫狗，在这里，仿佛时间都慢了下来，岁月静好。
2018-07-27,未知,4,【大圩古镇】是广西古代“四大圩镇”之一。大圩古镇始建于公元200年。 大圩古镇曾名长安市、芦田市，通称大圩。汉代已形成小居民点，北宋时已是商业繁华集镇，明为广西四大古镇之一。其商业初兴于宋，曾设税官；中兴于明，清光绪三十一年《临桂县志》称“水陆码头”，鼎盛于民国时期，在抗战时有大量的沦陷区人们逃难于此，人口激增，有“小桂林”之称，赶圩人数高达1万余人，泊船多达二、三百艘，地方商业文化积淀深厚，特色鲜明。 古老的大圩老街顺着漓江绵延2公里长，不宽的街道上铺着青石板，石板路两边是保存完好的老房子。尤其是老街上的高家大院，尚属首户，可以看看。
2018-05-07,未知,4,这里其实本来应该叫大墟吧，所以大圩要读da xu。大圩古镇其实真的很小，如果时间紧专门跑来一趟都没必要了。像我明天飞机，下午没事干，就专门跑来一趟，在桂林三里店广场公交站台那里坐306，2元。不过那里站台居然没有306的牌子，不过问了个本地人有，后来这里确实停的。这里老房子多，而且有木头的，也有以前就有七八十年代的房子。时间多，可以来逛逛。
2020-04-16,未知,5,广西桂林灵川大圩古镇。景色很好，有许多原住民还在里面生活，所以还没有过度的商业开发，可以感受到一些古朴的古镇味道。如果游桂林的时候有时间，可以到这里来看一看。
2017-11-17,未知,5,大圩古镇是广西古代“四大圩镇”之一。大圩古镇始建于公元200年。古老的大圩老街顺着漓江绵延2公里长，不宽的街道上铺着青石板，石板路两边是保存完好的老房子。
2016-10-09,未知,5,这里真的好悠久呀！听说比桂林的历史差不多，当年在河运的高峰期，这里才是商贩的中转站，最好玩的我竟然在漓江边看到了马匹，太意外的发现
2018-02-24,未知,5,非常不错的地方，离桂林很近，小镇较好的保持了原始风貌，没有那么多商业气息，村民也很淳朴，静谧而又原始，值得一去。希望能够保持下去，不要被过度开发。
2023-02-13,山西,4,暮色昏昏，光阴静默。深巷摆放的木板门是岁月的见证。 大圩古镇是广西古代“四大圩镇”之一，古镇始建于北宋初年，中兴于明清，鼎盛于民国时期，距今已有千年历史，远在600年前，大圩以其“大”，成为广西四大圩镇之最。大圩古镇曾名长安市、芦田市，通称大圩。明初解缙诗曰“大圩江上芦田寺，百尺深潭万竹围。柳店积薪晨爨后，僮人荷叶裹盐归”。 大圩镇上路旁的房子多为青砖、青瓦的两层明清建筑。每栋房子设计十分合理，集商住于一身，均由门前、天井、正房、厢房、后院组成。靠街的一般作铺面从事商业，往里走是天井，一般都栽有花草，利于采光；天井后是正房，高大宽敞，供着神像及祖宗牌位，是主人活动、会客的地方；两边是用来居住的厢房。正房后有门可到后院，后院临江并建厨房和厕所，有石阶可到江边取水、洗衣服。 古镇的房屋很多看上去有广东沿海地区的风味，所有的房屋都是砖木结构，房门是一排木板，早晨把木板拿掉，家里的一切是透明的；到了晚上，再把木板装上，就与外界隔绝了。而这些房屋，每栋都有数百年的历史，岁月的沧桑随处可见。当你踏着青石板走在这一条条不规整的街巷里，你会发现城市中人们天天挂在嘴边嚷嚷的人间烟火气，其实就在路旁人家看电视的声音里，在柴火熏肉啪啪的爆裂声里，在阿姐淘米哗哗的流水声里，在漓江边棒槌打衣服的声响里，在外地人听不懂的方言的聊天声里。那牵绊我们一生、时而让你哭、时而让你笑的一地鸡毛，才是生活中唯一的真相。 小桥遇见流水，江南遇见烟雨，石板遇见古镇。 铜环锁住一镇烟尘渺茫的往事，消散在嘚嘚马蹄下的繁华翻滚而过一页页故事，瓦当无声腐木留痕。时间煮水，泡了一壶名为“古镇”的茶，赋予一盏唇齿间的留香与诗意。 老街的光藏在石之苔、木之隙里，除了爱听自行车压过石板的声音，还爱大门前“咕噜噜”吸着水烟的老人以及趴在老人脚边打瞌睡的黄狗。 TIPS： 📍位置：导航搜索大圩古镇即可。 💰门票：古镇免门票。 🅿️停车：古镇附近有停车场。 ⏰游玩时间：3-4h 🍓古镇位于漓江边，顺着主路走到漓江边，可以体验坐竹筏于漓江之上，感受不徐不疾的慢节奏生活。 🍭古镇里有关帝庙、广昌布行、高祖庙、祠堂、廖宅等可以参观，这些建筑有浓郁的广式风味，并且老建筑经风见雨，矗立在历史结尾的今天，本身就是一本讲不完的故事书，非常值得一看。
2017-07-19,未知,4,大圩古镇位于山水旅游名城桂林市东南18公里处，距灵川县城30公里，地处漓江中游，在漓江北岸由西向东沿江而建，古风浓郁。 大圩古镇是广西古代“四大圩镇”之一。始建于公元200年。古老的大圩老街顺着漓江绵延2公里长，不宽的街道上铺着青石板，石板路两边是保存完好的老房子。古镇现在还保留着许多竹编作坊、草鞋作坊、传统的丧葬用品店、草医诊室、老理发店等一批古老的手工作坊。闲着无事的老人们或是在街边看些发黄的书，或是聚集在一起喝茶打牌，平静地生活着，守望着最后的古镇。
2017-03-25,未知,5,离桂林市区不到20公里，古镇不大，但是古香古色，镇上节奏很慢，人也不多，看着漓江，漫步古道，品着小虾小鱼，别有一番韵味。没有景点收费，没有人山人海。在镇上还遇到一位琴棋书画的高人，演奏的古筝女儿情，特别多动听。
2021-07-10,未知,5,大圩古镇是广西古代“四大圩镇”之一。大圩古镇始建于公元200年。大圩古镇在漓江东岸，父子岩东南，磨盘山北，距今已有千年历史，远在600年前，大圩以其“大”，成为广西四大圩镇之最。
2016-09-25,未知,4,虽然离桂林市区不远可从住的宾馆出发到达古镇还是费了点周折。 古镇游玩免费，是不是因为工作日的关系游客不多，许多街道空荡荡的感觉非常棒。
2017-10-19,未知,4,比较古朴，民风也不太商业化。特别一些老人长年生活在那，值得一访。石板小径配合木制古宅，是逃离尘世的好去处。为此，专门安排了一次自驾游，真的很满意！
