date,ip 属地,评分,comments
2023-09-28,吉林,5,很好很好，下次还会去
2024-10-06,广西,5,小众景点，值得一游
2024-07-10,四川,5,环境不错，空气清新
2022-11-03,广西,4,买了5张成人票，其中有一位65岁老人。没有人提醒可以优惠。
2022-10-05,广东,5,风景很好，值得走走
2021-01-04,未知,5,很安静的一个小镇
2020-09-29,未知,4,景点在岛上，岛上好多柚子，好少人，环境挺好，腊鸭好便宜
2024-08-09,广东,5,好好好好好好
2018-08-05,未知,4,小而宁静！走走看看体会历史痕迹。
2024-07-05,广西,5,很值得去。
2024-04-21,广东,5,值得一看。
2023-11-27,广西,1,避坑避坑，完全不值得去。说好听点是古村落，说难听点就是落后的农村建在了岛上，仅此而已。没有风景如画这种说法，有活动的时候可能稍微热闹点，但也就那样，很多观光的景点直接也没开门，就是瞎走，漫无目的在农村里绕行，关键是你去山里免费，这里是要收费的啊，算上渡轮一人35，非常不值得。
2022-10-29,广东,4,下小雨，随便走了走就回去了，没怎么看
2021-10-06,未知,4,一座古城，一般般
2019-10-10,未知,3,主要是坐船过对岸有点特色，岛上全是购物，已经被经济淹没了
2020-09-07,未知,3,可玩性低，景色一般，比较商业化
2020-08-21,未知,3,原价20 性价比低，景色一般，可玩性低，
2024-12-15,重庆,1,从没见过这么冷清的地方，游客几乎没有，商店基本无人，关键是本地人也没瞧见几个。
2021-05-06,未知,3,特色不突出，商业化严重
2019-10-03,未知,1,不好玩！！！！！是真的不好玩！！！！只是一个小岛，岛上也没什么活动！！！！而且还偏僻。好难受啊啊啊好伤心！！！！
2018-08-21,未知,2,不会再去，一个江中岛，什么都没有，就是一条小小的村，还是以前的怀远县旧址？旧址就是一块石碑，走一圈用不了20分钟
2022-06-30,未知,1,买票上船见别人扫船上的二维码才2元，在景区售票处买票一张18元，太坑了了，里面没什么值得看，疫情人有少，很多店铺不开门。
2023-02-16,广西,1,谁去谁后悔，检票员还有保安拽的像二五八万一样，谁都欠他钱
2023-07-02,广西,1,不比以前做得好，没有人气，景区工作人员态度也不好，停车场收费人爱理不理，不欢迎游客。
2024-10-28,广东,1,这个门票+船票就是欺负老实人的，其实根本不用买票，轮渡就可以坐私人船，2元，来回4元
2023-10-17,广西,2,淡季找个餐馆吃饭都找不到
2024-10-30,广东,2,基本没啥可看到
2023-10-04,广西,2,不及当年了。
2023-02-01,广西,1,没人去，很无聊的地方
2023-04-24,广西,1,没意思，浪费钱
