date,ip 属地,评分,comments
2018-02-19,未知,5,广西之行最大的惊喜就是丹洲游了。丹洲是一个被融江环绕的小岛，需要坐船抵达，不过，船程不到两分钟哈！建议站在甲板上，可以一面看山一面看水，也许还可以一面想起某个人。船票20元，是往返的，也算是上岛门票。虽然家家户户也都被开发成客栈和饭店，但是因为岛上没有机动车，在车轮滚滚车声鼎沸的今天，真可谓世外桃源。 岛上的特产是柚子和腊味，粽子和一种炸完裹上白糖的糯米点心非常美味，边走边吃，肚子也填饱了。 丹洲游的不足是交通不便，从三江县过去要50多公里的国道车程。所以包车游三江是明智的选择，如果你既想深度游侗寨，又想感受山水田园的宁静，就要留出2天的时间，慢慢走细细看。你可以尝试选择三江地导侯祖光，人多的时候更划算更方便。 如果可以有更多的选择，我愿意在柚子开花时节留宿丹洲，看江上日出，品腊肉吃粽子，乘小船绕岛一周，在古榕下发呆。
2016-02-06,未知,5,和男朋友一起去的，租了个双人车差不多两个小时就全部逛完了，风景不错，水特别的清，那天很开心，不过广西好像真的没什么好吃的，这点挺遗憾的。
2016-09-14,未知,5,一个很安静的小岛村，和其他农家乐不太一样，安安静静。。没太多繁华的商业街，可以自己岛上逛逛，傍晚才舒服，吃好饭去洲头的鹅卵石那里走走坐坐，河边的风徐徐吹来，很舒服！适合疗伤和需要释放压力的游客。
2017-03-09,未知,4,古城四面环水，须摆渡登岛，沿着石板街可见古城墙、古城楼、天后宫、丹江书院、古县衙遗址、闽粤会馆等，岛上随处可见柚子树，还可品尝老腊肉，丹江鱼，喜欢幽静的还可在岛上住 住 一晚，到处有客栈。乘船返回，有车去融安，在融安乘车去融水落住 住 。
2020-12-27,未知,5,丹洲景区即丹洲古镇，位于融江江心的一个小岛上，是个唯一四面环水的古镇。上岛需坐渡船，在东岸码头坐渡船。漫步在小岛上，可以看到气势恢宏的丹洲明代北门楼，历史悠久的明代书院，供奉妈祖的闽粤会馆，还有古县衙礼堂等历史遗迹。丹洲称柚子岛还很贴切，家家户户都以种沙田柚为主产业，门前是柚树，门后是柚园。全岛除了房屋和菜园，几乎被柚子树占领。四月柚子花开时，清香宜人。十一月柚子丰收时，热闹非凡。
2018-02-26,未知,4,古城环境不错，很干净。问路的时候那里的人很热心，特别是去古城的路上，乘坐去板江大巴的大巴司机还把我们送到景区门口，很感谢。丹州古城的油堆好好吃。
2016-02-13,未知,4,一个比较有古朴气息的岛上村落，四周都是柚子林。没有太多娱乐项目。
2022-03-30,未知,5,柳江河三江段的丹洲是一个四面环水的小岛，把车子停在路边农家的停车场后坐船上去，10块钱一个人。丹洲曾是明清两朝时期的县城所在地，现遗留了不少下古迹。岛上最有名的是柚子、腊味。镇上有许多的农家乐可吃可宿，价钱都不贵。小岛不大，晚上吃完饭可以延岛散步非常悠闲。镇上主要景观有福建会馆、北门楼、古城墙、古书院、东门、柚子林、古县衙门、城皇庙、古民居建筑等。
2017-05-02,未知,4,丹州古城属于三江县境内，丹州古城四面环水，是柳江河上一座椭圆型的岛屿。曾经是明清两朝时期的县城所在地，遗留下许多400年前的古迹。古城不大，给人的感觉就是一个湖中小村落。登上岛去发现还是有不少历史的厚重感。有时间的，可以看看，关键是不收门票，只有来回二十元船票。还有停车场居然也不收费，如今的景点真是少有。
2020-08-19,未知,4,是个有些历史的地方，据说最早能追溯到明代万历年间，曾经是府衙所在地。由于各种各样的原因，奇葩与否且先不论，这座面积不算很小的岛屿始终没有架设桥梁，这样，通行和经济都受到了不小的影响。有些讽刺味道的是，这样反而在很大程度上保留了历史古迹。直到今天，这里仍能感受到旧时代的光影和气息。
2019-05-05,未知,4,其实我觉得这个景区处于好与一般之间，最让人吐槽的是，本来已买了景点门票(即上岛的船票)，可是在售票处服务人员却交待，现在是洪水期，等会坐船要交1元钱洪水费，坐船离岛时也要再交1元钱洪水费，而且原来是免费停车的，可在五一却要收10元停车费，还不提供票据。
2021-07-29,未知,5,丹洲景区位于三江、融安、融水三县交界209国道旁，处在融江河中四面环水的一座小岛上，景色不错，趣味性强，坐船游览，很舒服，棒棒的。
2022-04-14,未知,5,环境干净卫生，空气清新，丹洲村古村街道原生态古色古香，很多自产自销的腊猪头、腊肉、腊猪脚、腊鸭等腊系列，生态的果园也很多，甘蔗、桔子、柿子、最多最有名气的柚子，还有柚子皮的柚皮糖，柚皮做的菜色，还有历史悠久的丹洲书院，寓古色古乡的景色、生态游玩、吃于一体的综合性景区
2020-11-07,未知,4,柳州三江县丹州景区，据说是唯一不通桥梁的小岛，小岛不大，西西拉拉有几个码头，小岛上面最多的是柚子，腊鸭腊肉，在一个晴朗的秋日，来到了这里，五颜六色的糯米饭，又好看又好吃，建议有时间一日游的可以看看去
2018-08-19,未知,5,丹洲古镇保存了许多当年建筑物的原来的面目。古镇的客栈，饭馆，风味小食应有尽有。尤其是各种河鱼干，香菇酱，虾酱味道别具风韵。
2019-07-27,未知,5,我开车去融水路过就顺便去玩了，自己一个人去的，真的一个游客都没有，有也可能是居民吧。岛上的居民说过几天节日才会有人，我把岛上逛了个遍，有好多柚子，街道建设得蛮好的，如果人多的话可能会很热闹，值得一去，门票又便宜。
2017-04-30,未知,5,距离柳州市区约一百四十公里，是一座位于柳江河上的小岛，古城已有数百年历史，明清时期县治所在。岛上栽种了很多沙田柚，所以这里也叫“柚子洲”。
2020-03-31,未知,5,丹洲，是一个去了就不想离开的地方，丹洲和黄姚一样，是我认为在广西值得一去，且一去再去的地方。那里有远离喧嚣的宁静，残亘的古朴记忆，原生绿色的地道美味，满眼的沙田柚，还有静静流淌的江水。
2023-03-09,广西,3,大概是因为淡季。啥也没有。店不开门。街上没人。所有店里有人的都在打牌。想着喝杯蜂蜜柚子茶也没得。根本没人招待你。想吃个饭也没人搭理你都在打牌。除了打牌的，见到人很难。柚子树上也没几个柚子。卖柚子的有两件。一家五元一个，一家十元三个。立的手写牌子。喜欢安静可以看看。不推荐特意来。
2020-11-11,未知,4,金秋时节，柚子成熟了，又到一年柚子节，来到三江丹洲，小岛很不错，天气又给力，乘上渡船，踏上岛屿，悠闲自在小岛逛起来，柚子腊鸭糯米饭，样样都喜欢，值得一看好地方！
2017-12-29,未知,4,四面环水的丹洲古城位于柳州与湖南边界，古城没有过多的商业化，城里布满着明清时期的遗迹，由于并不知名，所以游客不算太多，另古城保持恬静，可以静心游玩。
2021-10-05,未知,4,交通：门口有通勤大巴车，车次不多，建议自驾。自驾路线沿融江两岸，左侧国道，右侧高速加省道，我们从三江县城出发走右侧，后半段省道路不太好走。景区服务中心停车5块，但是服务简直了，开车排队等了十几分钟，自己下车走进去停车场转一圈发现停车场划线不合理，大片空地不让小车进去，把门的逻辑是要不你是大巴车，要不然你得同时开两台车，景区可能是为了接待团体游客，但是真没有几个团来这里。来一个，司机和把门的吵一架，循环往复，门口堵车严重。门外路边停车村民收费小车20，第一次见这种景区，可能是故意给村民留点生意的。 门票➕往返船票携程预订18，现场二十，当地人可以白嫖 古城那物价不会。满大街都是卖柚子的。国道上¥5一个，景区门口¥6一个，景区内8块一个。干货有腊肉腊鸭笋干菜干。 顺路可以过来花费两三个小时看看
2020-05-31,未知,5,要坐船才能到的古城，在融江的一个江心岛上，四边柚林环抱，古朴而幽静，没有太多的商业化和喧嚣的游客，景色不错，晚上江边的竹林和柚林中还能看到星星点点的萤火虫。
2021-01-29,未知,5,性价比高，去年我去过，旅行有时候也只是一种心情的释放，好比沉在水底的鱼儿，在雷雨到来之前感觉烦闷，迫切的想要到水面透一口气。远离一个城市，奔赴另外一个城市，无论这个城市给你好与坏的感觉，但有点不变的是，对于未知的风景，我们总抱着憧憬和好奇。
2018-02-21,未知,1,停车免费，可是车位满了，私人的停车场收费20. 洲上全是客栈和卖蜡味的，做腊味的鸭子是从山东沂南县批发过来的。一家饭馆，一斤多的一条江团做大鱼炖豆腐，来一桌客人分为两分，再来一桌分成三份，一份要七十。70一份的大鱼炖豆腐，不到半斤鱼，真是可以了。除了半截子废城墙，都是新修的伪古物。
2015-12-20,未知,3,坐车时间比在古镇时间还长，没有很古老的感觉，就是些买东西的，感觉不值得再去……
2018-09-29,未知,4,丹洲景区是融江中的一个江心岛，曾经是三江的古县城，岛上还有不少古迹文物，如明代北门楼、明代书院、闽粤会馆。我去的时候，书院正进行保护维修，会馆荒废无人管。
2018-12-16,未知,3,丹州的门票主要是停车费和渡轮费共30元，景色一般，古迹主要是旧城门和城墙，适合一家人住宿的民宿游，有部分的古迹还是荒废没能重整，两个小时走完全岛
2016-02-19,未知,4,长时间的劳累去趟丹洲走走也不错，去过很多次了，古风比较浓，但是要玩的话并没有什么可玩的，重在观赏
2024-02-18,广西,5,丹州，一个四面环江的小镇，须靠渡船往返，时间约五分钟，镇上安静，休闲，有很多古老的建筑和旧址，仿佛时间又回到了以前，是一个休闲的好去处
2024-10-08,广西,5,兰丹州古镇是一个在水上的小岛。出入都要靠坐船。所以早上还留有一些古风民俗。一帮朋友相约在这里住一下，喝点小酒，烤点烧烤还是很惬意的。
2020-10-05,未知,4,20门票还包括来回船票，良心 村民很朴实，去的时候恰逢国庆，还有县太爷接驾，很多土特产，我们买了腊鸭腊肉橘子柚子，有条件住在那边，以前的县衙门，静静感受一下历史的沧桑
2024-08-18,北京,5,从三江县城到丹洲从河东汽车站坐公交车大概两个半小时，12块，便宜但是浪费时间，到了丹洲买门票和往返船票，坐渡船上岛，这里就是世外桃源，非常的安静古朴，最喜欢的就是这里的书院，拍照出片，老街随便逛逛即可，最喜欢的就是去西边的河边，从小就在这条江上玩水，现在带娃来玩，要注意安全，河水还是很深很急的，不要往太深的地方去，家长时刻看紧孩子，如果你没把握还是别带孩子去岸边玩。 住宿:沿河的风景好，尽可能选择岸边高楼的客栈，我住在顺丰假日酒店，她家有四层楼，就在东岸，三楼南侧标间可以看到九十度江景，非常的美，住宿条件就是普通农家院标准，还算干净，有空调可洗澡，菜做得还好吃，米饭特别香，推荐吃笋、南瓜苗，吃鱼要提前定。
2021-01-29,未知,5,性价比高，去年我去过，旅行有时候也只是一种心情的释放，好比沉在水底的鱼儿，在雷雨到来之前感觉烦闷，迫切的想要到水面透一口气。远离一个城市，奔赴另外一个城市，无论这个城市给你好与坏的感觉，但有点不变的是，对于未知的风景，我们总抱着憧憬和好奇。
2021-01-29,未知,5,有趣好玩，去年我去过，旅行有时候也只是一种心情的释放，好比沉在水底的鱼儿，在雷雨到来之前感觉烦闷，迫切的想要到水面透一口气。远离一个城市，奔赴另外一个城市，无论这个城市给你好与坏的感觉，但有点不变的是，对于未知的风景，我们总抱着憧憬和好奇。
2021-01-29,未知,5,总体超赞，去年我去过，旅行有时候也只是一种心情的释放，好比沉在水底的鱼儿，在雷雨到来之前感觉烦闷，迫切的想要到水面透一口气。远离一个城市，奔赴另外一个城市，无论这个城市给你好与坏的感觉，但有点不变的是，对于未知的风景，我们总抱着憧憬和好奇。
2021-01-29,未知,5,有趣好玩，去年我去过，旅行有时候也只是一种心情的释放，好比沉在水底的鱼儿，在雷雨到来之前感觉烦闷，迫切的想要到水面透一口气。远离一个城市，奔赴另外一个城市，无论这个城市给你好与坏的感觉，但有点不变的是，对于未知的风景，我们总抱着憧憬和好奇。
2021-09-07,未知,5,做了一期几分钟的片子，但是只能传30秒，更多旅行视频可以关注视频号：喜橙爱自驾
2023-04-02,湖北,4,丹洲古镇是1591年（明代万历年）至1914年（民国三年）三江县的县治所在地，时称怀远县，至今已有400多年的历史，是中国唯一一个建立在河岛上的古镇。
2021-10-07,未知,4,县级主干道不太好走，风景秀丽，小众景点吧，历史文化底蕴厚重，很适合放慢脚步去感受每个街角每个柚园，但商业氛围有些浓。如果时间多建议留宿民宿。
2024-02-18,广西,5,丹州，一个四面环江的小镇，须靠渡船往返，时间约五分钟，镇上安静，休闲，有很多古老的建筑和旧址，仿佛时间又回到了以前，是一个休闲的好去处，
2016-08-26,未知,3,因为不是柚子节去，所以很清静，古城里全是柚子树，用柚子做的食品很多，我爱吃柚子皮做的糖，在住宿方便的古城，到处都有带很大的柚子园宾馆。
2016-06-06,未知,4,古镇上就是两个城楼和丹洲书院是特色，古街已经没有原来的模样了，比较商业化。是三月三去的，有点小雨再配上到处的柚子花香，很是舒服
2020-01-21,未知,4,雨夜下的丹洲古镇，没有喧闹的商业氛围，安静的逛下有不一样的感觉，夜景下的这个特色古镇有不一样的味道，蛮适合静静的感受了。
2022-03-03,未知,5,景区没什么人 价格也不贵 要坐船上岛 还算有点特色 岛上的建筑就没多大看头了 感觉有点杂乱 都是当地人在里面生活的景象 .
2024-10-08,广西,5,丹州小镇不是很大。上种了很多柚子树。当地的特产就有柚子糖。味道不错。还有很多辣腊味。进岛要靠坐船，进出岛都是一样。景色也还可以。周末的一个好去处。
2016-06-21,未知,4,独特的性：位于河中央的古城。一个没有车声喧嚣的地方。古城被郁郁葱葱的柚子树和柳树覆盖。一个安安静静、郁郁葱葱站在水中央的古城。
2020-05-22,未知,5,丹洲古镇位于广西柳州市三江县南端，西邻融水，南靠融安县城，209国道贯穿全镇7个行政村，西有枝柳铁路线和融江航线。往南140公里达柳州，北上55公里到三江县城。镇人民政府驻板江街。
2017-07-21,未知,5,柳州三江丹洲古镇曾是明清两朝时期的县城所在地，抗战期间，包括社会学大师费孝通、著名文学家鲁彦在内的众多文人墨客、专家学者集聚丹洲，使丹洲名噪一时。
2023-08-17,广西,4,适合周末带孩子来度假，人很少，一点都不像景区，很安静，都是岛上的原居民，游客不多，住宿条件很一般
2021-04-22,未知,3,位于融江江心的一个小岛上，是个唯一四面环水的古镇。上岛需坐渡船，在东岸码头坐渡船。漫步在小岛上，可以看到气势恢宏的丹洲明代北门楼，历史悠久的明代书院，供奉妈祖的闽粤会馆，还有古县衙礼堂等历史遗迹。
2016-12-22,未知,5,价格便宜，景色迷人，民风纯朴，吃饭是农家乐，如果当季的时候还有柚子
2019-03-21,未知,4,这是一个小小的独立在外的水乡。要进去得借助渡船。青砖路和保留完好的城墙、书院，让人感受到古城的韵味。
2017-08-24,未知,4,村里挺挤的，也有挺多新盖的房子，旧建筑还是比较完整，相关服务不完善，买了40元的票，没人查票，也没有什么服务，溜了一圈，大约一小时就走了，可以随便看一下。
2017-03-17,未知,5,当地政府十分重视文物保护和项目建设。近年投入不少资金对丹洲明代北门楼、明代书院、闽粤会馆、古县衙礼堂等古城文物进行保护修善。
2024-06-03,广东,5,群山环绕，环境很美，古城四面环水，清早或傍晚沿着河堤路漫步尤其美丽。最好的体验是北部湾情人堤那段。古城夜景没啥看的，整个城里人很少，但环境不错，家家户户都有绿植，古城以柚子闻名。居住在古城里看日落和日出是很好的安排。
2020-12-19,未知,4,一个位于江心充满了人间烟火气的小岛，时间充裕的话可在岛上住一晚，可欣赏岛上的日落与日出。小岛不一人，慢慢转有个2-3小时也可转完了，没去过的还是值得一去的。
2018-08-15,未知,1,可能是因为期望值太高了，真的到了以后感觉很失望都是统一规划的新房子，完全没有古镇该有的韵味。满街都是旅馆和小摊子，也没什么值得玩的地方。建议大家不要在里面吃饭，特别是在一入景区的地方，又贵态度又不好，丝瓜苦到我怀疑人生(◔◡◔)
2017-03-08,未知,5,每年秋天，古镇都会举办盛大的柚子节，很多外地朋友都慕名而来，这里的柚子汁多清甜！
2021-10-09,未知,3,开车到景区门口，就算你停车在路边，不停在停车场，保安还是会过来收停车费，没什么游客，古镇上都是民宿和餐饮，但基本都关门，风景一般，唯一的亮点就是要坐船过去
2017-03-14,未知,5,门票二十一人，包坐船过河，很有民族风情，还有农家乐
2017-01-22,未知,5,景色迷人，有农家乐有特色小商品，农家土货纯正
2017-01-30,未知,5,在老家融安县就这家好吃点了，在家都没什么好吃！也就这里人多！
2016-02-13,未知,5,丹州古镇，小古镇好景色，朋友一起来看看
2021-11-17,未知,3,确实没啥玩的……上去散散步还行
2020-12-29,未知,5,景区有几个古建筑，12月份不收门票，只收轮船摆渡，五元一位往返，从三江县城过来，走的是国道路比较窄，如果时间充裕，可以过来看一看当地的特产是腊肉和柚子
2023-01-29,广东,5,一个十分值得游玩的水上古镇
2016-12-09,未知,5,丹洲是座文化古城。位于三江、融安、融水三县交合处，地处融江江心洲上
2018-11-05,未知,4,想去的朋友不用买这个票、直接下去到河边上船1元一个人可以过河了。
2017-07-21,未知,5,每人20元门票，价格便宜，里面还很多农家乐，还有古城墙，很有特色
2021-10-07,未知,4,县级主干道不太好走，风景秀丽，小众景点吧，历史文化底蕴厚重，很适合放慢脚步去感受每个街角每个柚园，但商业氛围有些浓。如果时间多建议留宿民宿。
2019-07-28,未知,5,古城，历史，环境优美，农家小院，适合度假
2016-12-23,未知,5,很漂亮，世外桃源，农家乐，值得一去，好评
2015-10-25,未知,5,去玩过1次，空气很好，岛上居民很热心，很赞！下次有空还会去。
2023-01-29,广东,5,值得一游的水上古镇
2016-02-13,未知,4,这里是个休闲景区，特别适合拍拖的去走走拍拍照或朋友聚会的地方，岛上有几家农庄，有烧烤，钓鱼，野炊等
2019-08-19,未知,4,丹洲是个四面环水的小岛，环境幽静，空气清新，值得一去。
2016-02-07,未知,3,丹州古镇比较好玩的是有民族特色和农家乐，东西便宜
2023-10-03,湖南,5,好好好好好好好好好好好好好好好好好好好好好好好好好好好好好好好好好好好好好好好好好好好好好好好好好好好好好好好好好好好好好好
2018-05-08,未知,5,去三江经过的一个小岛，超出我的预期，值得一来
2021-02-17,未知,5,盛产柚子的小岛，景色还不错。四周被水环绕。
2017-08-24,未知,4,丹洲村是座古城，保持原貌，民风纯朴，景色不错，值得去休闲渡假。
2020-12-29,未知,5,丹洲古镇一个小众景点，镇子不大，有几处古建筑，是一个小岛往返古镇，需要坐摆渡船，官方售票价是五元往返，正值冬季，不收门票
2024-02-13,广西,5,时间不赶的话去小住几天，非常清静，来回城区都只能坐船，镇上都是不大的石板路，没有汽车跑动，民宿后边是柚子园，环境很清幽
2023-04-22,广东,4,古城，可能刚开发没多久，亦或是因为疫情原因导致开发停滞了。总得感觉景色不错配套不行。价格上也还不错，跟着岛上居民赶集了，价位还是挺便宜的
2016-08-24,未知,4,石头多，淳朴的人民风景优美很适合外拍
2016-04-14,未知,5,我身边的古镇，平时周末都会去那里过的
2023-09-27,广西,4,岛上安静，比较休闲，度周末好地方
2018-03-25,未知,5,一个安静的小镇，适合慢生活……
2020-05-06,未知,4,被水包围的古镇，柚子的故乡。就是交通不太方便。
2018-10-05,未知,4,古镇历史悠久，作为三江县治所在有三百多年，但历史建筑保护较差，如闽粵会馆仅剩大门。游客主要是周边的。20元的门票其实是和摆渡费在一起，价格低廉。
2017-04-04,未知,4,有历史意义的地方，古城不大，是个小岛，岛上的米酒，柚子印象深刻！
2023-01-19,广西,5,携程买票半价优惠很好！
2020-03-12,未知,4,很有特色的古镇，要坐船才能上去，柚子的故乡，到处都能见到柚子。
2021-11-12,未知,4,一个岛屿一样的小镇，岛上没有汽车，可以休闲度假住上几天。
2022-04-24,未知,4,非常值得一去景色很美很好玩 强烈推荐
2023-11-19,广西,5,需要细品的地方，只是走马观花地看的话可能觉得无聊，如果喜欢发呆或者散步的话这是个不错的地儿
2016-10-10,未知,1,这是一个去了一次没兴趣再去的地方，都是4A差别很大，岛上除了风格统一的建筑，没有什么娱乐活动了，除了安静的发呆干不了什么别的…
2017-08-06,未知,4,三江南面的小镇，到岛上游玩还是有点乐趣的。
2023-07-09,广西,1,比去年涨价15元，除周末外，人气冷清，态度也不好，吃饭的地方也很少。实话实说，35元门票不值！凤凰古城，镇远古镇，平遥古城都 不收门票。游客来玩，吃饭住宿消费就是为地方增加税收了，城小也没有什么娱乐消遣项目，收过渡费足矣。值得表扬的是三江公交车司机很敬业，服务态度超级赞！本人遗落一个袋子在4路公交车上，后乘坐10路公交车，该车司机尽心尽力帮找寻，致袋子完碧归赵！精神可敬可贵！
2017-11-29,未知,4,可以欣赏诸多文人骚客遗作，一处好风景
2022-11-24,广西,4,风景秀丽自然风光无限风光，环境优美
2020-11-16,未知,4,小岛上的古镇，四面环水，很有特色。
2021-08-13,未知,4,应该还是不错的，有机会去试试看。
2017-01-28,未知,3,烧烤之地。。。。。。。。。。。。
2018-08-25,未知,3,商业味很浓郁，传说中的古迹跟周围建筑挺不搭的，也没有维护的很好的样子。然后北城门有个招牌写着百香果汁三块，收费就收五块，诚信不足。
2016-10-21,未知,3,好地方……
2023-04-02,四川,3,一座只能坐船而入的古镇，静心宜人
2018-10-05,未知,4,还行，就一个水上村落，进出靠船，离的也不远，不过里面有一些是历史遗留的建筑，感受下也挺好的。
2018-04-17,未知,5,水上景区满不错的，世外桃源一样，
2020-08-21,未知,3,就一个岛 里面没啥古迹 有也破破烂烂的 根本没重视
2016-02-05,未知,3,不错的地方，毎次去都喝醉。下次一定清醒
2023-12-02,广西,5,总体还可以，就是卖票那妇女有点厉害
2020-08-10,未知,3,还可以，就是交通不太方便。。。
2019-09-11,未知,5,非常好玩的地方，很安静。。。。
2019-09-11,未知,5,非常好玩的地方，安静。。。。。
2016-06-09,未知,3,柚子节有活动可以去玩活动赢柚子
2022-10-05,广西,5,取票方便，工作人员态度好
2023-12-19,贵州,5,我挺喜欢这个江上小岛的
2022-10-05,广西,5,坐船才能到，不同的体验
2024-05-16,广东,5,景色非常好，值得推荐
2024-03-30,广西,5,没有想象中古镇的特色
2023-10-03,广西,5,景区很休闲，卫生很好
