date,ip 属地,评分,comments
2019-08-04,未知,5,我的小孩说在桂林这么多天，最好玩是这里了。有样东西注意一下，不要听门外带你停车的人的话，一大堆骗子。雨夜在门外的商家买5元两套，再在景区内租一套十来元钱的爬瀑布装备就行了。
2017-09-03,未知,5,非常适合10岁左右小孩子，夏天在瀑布里攀岩，有点挑战又不危险。是个夏天纳凉戏水的好地方。建议包车去吧，大巴超载严重不知道现在治理没。
2017-05-08,未知,5,相当不错，雨后，环境很好，很舒适
2019-05-24,未知,5,可以的，去的时候人特别多，可能是因为刚好遇上周末假日吧。风景还算可以，一圈逛下来也就一小时多吧。有一些收费的活动项目，也有一些免费的活动项目任君选择。
2017-08-16,未知,4,可以攀爬的瀑布，一项亲子运动。
2018-06-27,未知,5,漓江做了竹筏~还蛮舒服的~
2017-10-06,未知,4,古东瀑布景色宜人、山青水秀，还可以攀爬瀑布（三段）、坐溜索和滑道。
2024-10-08,江苏,4,主要是冲着爬瀑布去的，的确不一般的感受和体验，绿植覆盖率很高，景色也挺好，但除了爬瀑布，其他也就没有什么亮点了。而且交通不便，需要自驾或者跟团。
2017-08-22,未知,5,这里真的值得去，特别是适合一家人有小孩的去。小朋友玩得非常开心。
2022-07-18,未知,5,玩水很不错，还有滑索，小的过山车下山，好玩
2019-08-10,未知,5,提前一天网上买的票，因为没有直达班车，所以往返都是打车去的。水比较干净，玩得开心。
2018-07-05,未知,5,"夏日避暑宝地啊！而且可以亲近大自然，走进瀑布，真的游水！很开心，很满意，值得一去！ 下山很多种方式，溜索和小火车等，我们做了过山车，真心觉得不好，一点不吓人，时间没多久，划不来！不过对于父母来说可以去坐坐，既省了走路，又坐了过山车（关键是刺激的过山车他们不适合，而这个就刚刚好） 省钱……千万不要买草鞋（因为景区里必须租头盔套餐15元包括防水袋+草鞋+头盔),需要买雨衣的话，在外面买，我们砍价5元两个吧。内部是10元一个吧，不太记得了。你穿草鞋后有一个地方免费寄存你自己的鞋子，此时你不嫌弃的话可以把你的衣物用袋子装好和鞋子放一起或者跟那人说个好话！ 至于一套衣物必须带，不玩水可以不带。入口不远有一个更衣间。"
2017-08-19,未知,5,古东瀑布真的好玩。属于攀岩瀑布，如果下次来我还会去的。因为这次来桂林发水，我只攀岩了第一个瀑布，剩下的全淹的看不见路，水流急而且大，太危险
2017-07-21,未知,5,炎炎夏曰，古东瀑布不愧是纳凉的好去处，大面积绿树成萌，最让人兴奋的是它是能攀爬的瀑布，亲距离接触水。携程订票方便快捷，从桂林去的路上订的，客服态度好，到售票窗口就可取票，赞一个。
2017-08-17,未知,5,感觉还行，就是他那里需要购买草鞋和雨衣等一些装备，不要着急，走到瀑布边上有一家，总体来说还不错哈
2016-06-28,未知,5,一家三口包车去那儿，凉爽开心。攀爬瀑布，既锻炼身体，也锻炼胆量，孩子玩得很欢。这个景点真心不错！
2019-10-11,未知,5,山感觉整个南方都是这种山，但是走水路爬瀑布的卖点很不错，第一次这么玩，很有意思。买了10元套餐有草鞋、手机防水袋、鞋子寄存以及安全帽租赁。所以千万别买景区门口兜售的草鞋，进了景区还是要花钱买的。
2017-08-29,未知,5,亲子游最好的景点，风景优美，瀑布孩子可以尽情的玩耍和攀爬，孩子大人一起爬，边爬边合影留念，玩得特别开心！景区门票68网上订，超值景区！
2017-08-26,未知,5,非常适合孩子玩耍，年纪小的不能爬第一级瀑布。儿子玩得很开心，不过由于时间关系，没能玩索道和天桥。下次有机会再来玩！
2017-12-01,未知,5,乘一叶扁舟，荡漾于满江之上，做一日快活神仙，巴适哦!
2017-08-20,未知,5,有特色，孩子喜欢，就是路程略远
2017-08-29,未知,5,超美的自然风景，只有自己去了才能感受到真正的美
2017-09-20,未知,5,古东瀑布很好玩，孩子玩水玩的很尽兴，还平身第一次穿了草鞋。公共交通不是很方便，我拖老带小从正阳街附近打滴滴去的89元很顺利。景区的指示牌不是很清晰，票务中心要在绕完很多小商店才看得见。
2017-08-03,未知,5,非常好玩，里面环境很好，古木参天，空气质量高，带着孩子跋山涉水是一次难忘的经历，不过里面的人真的好多好多
2017-08-28,未知,4,锻炼身体，适合亲子活动，培养孩子活动能力。
2016-07-08,未知,5,此次桂林旅游，我们玩的开心，特别是古东森林瀑布，带小孩玩水，绝对的值得推荐，既安全，水又干净，比遇龙河玩水更来得开心和刺激
2024-05-06,海南,5,非常非常不错，瀑布很大，很美，很多，感觉物有所值，遗憾的是，由于去之前桂林一直下雨，导致瀑布水流很大，为安全起见，景区不允许游客进行爬瀑布玩耍，这可是这个景区最吸引人的地方啊，不过可以理解，毕竟安全第一嘛。
2020-12-11,未知,5,灵州的漓江古东景区是非常著名的旅游景点，很多游客不远万里慕名而来，在此打卡拍照留恋，大家快来看看吧！
2018-08-24,未知,3,景色还好，爬瀑布有一段距离。 报了桂林中国国际旅行社的四天三晚散拼团，去爬瀑布之前导游会收午餐费，大人小孩一律30元，但是在餐厅里一桌不够十个大人就不上够菜，和他们理论，为平息，上了一盘萝卜干。太坑人了！只想着赚钱！
2018-08-08,未知,5,趣味性很强，小孩子特别喜欢。注意第一级瀑布要15岁以上才能攀爬，最后一级要10岁以上。但是8-9岁的小孩最后一级瀑布可以考虑最左边一条比较缓和的，但是要有家长陪同。换草鞋的话建议还是把自己的鞋子随身携带，因为后面还要爬一段山，穿着不太舒服。背包可以随身带，爬瀑布其实并不是很吃力，就是拍照的时候要注意手机不要掉水里了。雨披我就没有穿，穿着比较闷热，裤子也一样会湿掉。草鞋一定要绑紧，否则在水里会掉。溜索和小火车都可以去尝试一下，直接到山下。
2018-08-07,未知,5,咕咚瀑布是我在桂林最喜欢的一个景点，没有之一哦。我是七月去的，景区里面比较凉爽，五六岁以上的孩子应该就可以爬瀑布了，穿上草鞋和雨衣，迎着倾泻而下的水，是一种很新奇的体验。孩子们也都玩儿的很嗨，主要是价位也合理。
2017-10-11,未知,5,十一带着家人游览了古东瀑布，真实不虚此行，景色宜人，气候适宜，是桂林游览的必去之处。从桂林出发全程高速，很方便，换上草鞋、攀爬瀑布，别有一份情趣，感觉真好，停车也方便，孩子大人都玩得很开心，明年十一还要去玩一下，建议大家可以去看看，真实太美了。
2017-08-26,未知,5,孩子玩她非常喜欢，个人认为也不错，我们是自己过去的，从解放桥坐14路到三里店广场下车，专小巴士，碰巧遇到这种巴士，解决了到古东的问题，到了古东站下来，花了20元租了辆双人自行车骑到景点，。我的门票在这里买的68元，女儿的票是出示户口本买的学生票35元。里面有好几个项目，坐筏10元，瀑布15元租防护用具，溜索20元，马车道30元，过吊桥溜滑道坐小火车时会抓拍照可以打印，1张8寸的20元，我们选了自己喜欢的2张。景点游玩骑车出来，又跑到自行车专道溜了一圈。刚好看到回桂林的车在那边停着，想想赶紧上班别走了，没想到司机说专门等我们的，实在是太暖心了。
2017-08-15,未知,5,很不错的一次旅行，之前考虑了很久要不要来这里玩，来过以后真的是叫不虚此行。瀑布群除了第一段和最后一段小孩子是不能玩的其他都可以玩的。如果要爬瀑布一定要要准备草鞋和安全帽（这个好像是硬性规定，雨衣可以不用，有人没有穿，不过会湿身哦！）如果需要雨衣可以在外面在，我们买的是五块两件，草鞋可以不用在外面买，因为进去之后是要租安全帽的，安全帽和草鞋是一个套餐。所以没有必要买，不然就浪费了。 10元套餐:草鞋 安全帽 鞋袋 手机防水袋 15元套餐:10元套餐基础上加一个雨衣。 小孩子在这里玩得很开心，问他在桂林玩了些什么，只会说玩了瀑布。
2017-08-03,未知,4,我们是一家三口自由行。出游建议: 取票方便。入景区一会，如果跟团，导游会建议做10元一人的竹筏，说辞是可以节约多少多少体力，省好多时间，其实走栈道跟竹筏是差不多时间到第一级瀑布的。所以不要花那个10块。鞋子雨衣等有15/10元的，区别应该就是那件雨衣，因为我们有准备换的衣服，就买了10元的，个人觉得，大夏天还是不用雨衣了，热是一个，再者，爬瀑布有雨衣一样会湿了衣服。其他的就是常规的了。
2016-09-09,未知,5,古东瀑布确实有它独特之处，极力推荐！入门之后先爬瀑布，它分为几段爬的，落山时有一段可以坐飞索到对面值得一坐，到了另一边可以坐滑车下山也可自行走下山，坐滑车有点少贵，我选择走下山，走下山也很快，几分钟就到了，证明我选择正确！！！！！
2022-07-19,未知,5,【景色】无与伦比的美丽 【趣味】一般☺️☺️☺️☺️☺️☺️☺️☺️☺️☺️☺️☺️☺️☺️ 【性价比】超值的美丽风景如画
2016-01-13,未知,5,去了古东瀑布。带孩子夏季来这里玩水真是太适合了，换上草鞋爬瀑布，乐趣多多。物价不贵，当地人也很热情，放松身心的好去处！
2020-08-11,未知,4,一行出来大小一起10人，在景区玩得比较开心🥳体验很好，值得推荐，有趣好玩，
2017-03-16,未知,4,自驾就很方便，进去后换上草鞋逆流而上还是非常有意思的，天热点去是不错的选择。
2019-07-22,未知,5,夏天去真是再合适不过了，消暑圣地。水清澈见底，凉滋滋的又不会太冷，还有滑索和小火车可以坐。爬瀑布的话切记要门口的草鞋和头盔，否则不让上，雨衣倒不强迫你穿
2017-06-04,未知,5,还不错哦，这个爬瀑布挺好玩的，也不危险，确实可以。
2018-08-22,未知,5,可以爬的瀑布，因为带孩子的，银子岩看过了，就不想去冠岩，就自己从市区打车去古东瀑布，去程70回程拼车50。孩子未满1.4不要门票，只有成人60元，玩了整整一天，太爽了。
2017-05-07,未知,5,古东瀑布值得一去，惊险刺激又开心，从来没玩过能攀爬的瀑布，大开眼界！
2017-08-27,未知,5,非常非常好的野生公园，天然，那么的亲近大自然，非常的迷人。里面走一遭，身心都得以放松，真的值得一去的景点。
2017-08-02,未知,5,孩子很喜欢，环境不错，滑索有点坑，基本就连啊的时间都没有就到头了。
2017-07-31,未知,5,攀爬瀑布儿子特别喜欢 还有滑道 索道 他都能坐 算得上是他最刺激的一天了
2016-09-10,未知,5,为了孩子才去的，早上在桂林滴滴打车去的，花了85元，玩了差不多3小时，我们家孩子很喜欢 。回来就在路口坐三轮车到路口坐大巴回桂林 。建议有孩子的家庭去，不过有些有身高限制，太小的还是别去了
2016-08-10,未知,5,瀑布非常壮观，下了雨后更加好看。可惜不能爬了
2016-08-25,未知,5,大力推荐，跟团吧，冠岩古东一天游120左右，比自行前往古东省点，虽然冠岩有些无趣。
2019-06-06,未知,4,特别好的一次亲水体验，山也不算高，空气特别好。唯一的败笔就是景区门口卖水果的商贩，缺斤短两现象太严重，态度还特别恶略！ 另外景区门口有好多买雨衣和草鞋的小贩，可以购买那种5元两件的雨衣，但是草鞋不要买！草鞋不要买！草鞋不要买！重要的事情说三次！
2018-08-31,未知,4,这次在漓江古东景区感受了瀑布的另外一种近距离接触法—攀爬瀑布。确实有点刺激，只可惜瀑布水不大，总共有五瀑，进入第一瀑攀爬觉得真不错，瀑水飞溅，抓着锁链前行，大家“哇”的叫着其乐融融，之后的瀑布因水太小都没什么感觉。不过第一次穿着编织的草鞋，玩水、游走于山间，心情也很愉快！网上订票，取票地点有一段路，还算方便。爬瀑布还需另外购买装备，收费有15元和10元两种。建议还是选贵的，因它包含雨衣和手机防水套，毕竟还是有水会弄湿衣服的。10元的只有头盔和草鞋。景点有段路是要走的，还可以体验溜索、吊桥、小火车，累了不想自己走下山的话，可以乘小火车直接下山，小火车开得很平稳，车速挺快，没有落差。收费30元/人。古东景区别具特色的旅游项目，夏日亲子游玩真棒！
2018-08-24,未知,4,临时决定去的一个景点，离市区开车40分钟，整个景点规划的还不错，山青水美，下山还可以自费做丛林飞跃和小火车，挺刺激的。值得一说的是景点门口有一些商贩，水果品种齐全并且价格不贵。总体来说在国内景点里算是业界良心了。
2017-07-18,未知,5,爬瀑布，大姑娘上轿头一回，新鲜，刺激，过瘾，以后向朋友推荐。
2016-12-12,未知,3,唯一可以爬的瀑布哦！瀑布的风景不是太多，还称不上是“群”。离桂林30公里，开发较睌，设置还不太完善，商业味不算浓，瀑布落差不大，人可拉着绳索在瀑布中走，如果是夏天来感觉应该蛮好玩！
2018-07-08,未知,5,实际体验还是不错的，亲水感觉不错，不过雨衣基本没用，草鞋穿着不舒服，头盔也没什么用，刺激性再强一点就好，也许处于安全考虑。景点服务再注重细节问题就好了，感觉衔接上不流畅，有点别扭
2017-08-02,未知,5,非常好玩，小朋友最满意的景点了，特别是在夏天，又凉爽又好玩
2017-03-03,未知,5,大圩古镇，巷道两边竹编作坊、草鞋作坊、草医诊室、老理发店等一批古老的手工作坊，仍坚守着最后的古老。
2022-08-28,广西,5,漓江古东景区西傍漓江，北靠桂林，南望阳朔，东接海洋山脉，地利极佳，气候宜人。
2017-08-01,未知,5,很适合亲子游，森林、瀑布，吊桥、溜索、小火车，玩得很开心
2016-08-22,未知,5,带孩子去玩的，孩子特别喜欢，很快乐。
2018-08-09,未知,5,可以爬的瀑布是最大的特点，穿草鞋感觉也跟不错，值得一去
2017-09-03,未知,5,1. 包车比自驾方便。不用找路问路，司机到酒店来接，就在出口等到，一家人不慌不忙的玩个尽兴，不像跟团那样赶时间，完了又送回酒店。司机还可以告诉你有些在这个景点游玩的注意事项。
2017-01-26,未知,5,可以邀请朋友一起去吃好吃的看好看的风景，拍美美的照片，那里的风景真的很不错，推荐，值得一去。
2017-10-07,未知,5,距桂林市区大概一个小时车程，早上人不多，玩得很开心，第一个瀑布爬起来真是惊险又刺激，后面几个就容易多了！滑索和小火车也很值得体验～
2020-11-16,未知,5,还不错，尤其是那个攀爬瀑布，近距离和瀑布接触，感觉很不错～温馨提示，攀爬的时候注意安全！
2019-07-16,未知,5,夏季爬瀑布真的好爽！景区的石板路好有趣，还有吊桥。清凉一夏，值得一去
2017-07-24,未知,5,古东景色之美超出想象，瀑布攀爬，林中漫步，因为有美景相伴，丝毫不觉疲累，下山时，还有索道、小火车连接，游玩时间大概三个小时，门口有卖草鞋的，但记得一定不要买，因为里面要
2016-07-29,未知,5,古东瀑布很好，值得玩，从桂林坐车到大圩，然后在大圩古镇2元钱坐108路公交到景区，很方便
2018-01-26,未知,5,"虽然是淡季，景色也还是很好看,就是天气太冷啦，"
2018-05-17,未知,5,路程稍远，交通不太便利～ 个人出行要计算好时间～ 但是爬瀑布真的是别样感受～ 超级有意思！
2017-07-30,未知,5,各种项目，爬瀑布，滑溜索，坐滑道，都不错！
2016-06-30,未知,5,林区古木参天，红枫诱人。藤缠树，树缠藤，野趣横生。景色秀丽，鸟语花香，空气清新。是距桂林市区最近、面积最宽、最具特色的一处森林公园，也是登山探险、森林寻幽之佳境。
2024-07-14,北京,5,桂林古东瀑布景区景区设计优雅别致！服务人员热情好客！攀登瀑布的设计有趣又稍带风险，更增加了攀登瀑布的情趣！有竹筏可以乘坐，体验不同旅游感受。
2022-03-10,未知,5,好地方，景色好，环境好，空气好，树木也非常多，除了瀑布，坐竹筏等等，景色十分壮美
2019-08-16,未知,4,风景不错，水质很清澈，带着孩子没有徒步爬上瀑布上面，所以也不知道上面的景色如何，反正下面景一般，还有10块钱的竹筏不建议坐，因为很短也没什么看，还不如走过去舒服，1米2以下的孩子不需要买票，景区里面有5块钱一套的爬瀑布的全套装备，不需要到外面买。
2018-07-31,未知,4,到古东，一定要体验爬瀑布。停车场下来，景区门口推销买雨衣的不要理会。景区里爬瀑布装备有2个套餐，10块的帽子+草鞋，15块的帽子+草鞋+一次性雨衣。进了景区有个三姐湖什么的，坐船10块一个，其实没有多少路，旁边有浮桥可以走。瀑布结束，再往山上走，有一个吊桥，如果有恐高的，可以绕道，多走300米。下山有溜索，好像是10块一个，不过没多少路。溜索结束后，走一段路，有滑滑车下山。一车一个人30块，一车两个人50块。5辆车一组，第一辆是景区师傅开的，不用自己操作。有点小小的刺激。
2017-10-04,未知,4,景区门口处有人兜售草鞋，价格说是比景区便宜，但是景区里15元是包含了（帽子、草鞋、雨衣、手机防水袋）外面就只是一双草鞋；入园之后的瀑布攀登还是可以体验一下，毕竟是大众的所以难度不是特别大，主要就是来玩水；总体来说景区的体验感还不错
2017-09-22,未知,4,没抱团，自由行，从市中心过去不太方便，找的顺风车去的，来回给了80元路费。到了景区外面有卖草鞋的，不要买，景区内帽子草鞋雨衣一起买，15元，从停车场需要走1公里的路，绕着这种弯弯进去。到达景区门口后会看到存放包包，存鞋子的地方。因为第一次去，所以就在前面存包换鞋耽误了一些时间。下面说重点，瀑布真的很刺激，总共有六个瀑布，有链条抓，老人都可以爬，14岁以下的小朋友在第一个瀑布不可以爬，后面可以玩水，爬小瀑布。总体还是刺激，商业化气息不是特别严重，可以考虑自由行。
2017-08-08,未知,4,古东瀑布确实值得一玩，还挺不错！近距离的接触瀑布，攀岩直上，非常有趣！冠岩也还有自己的特色，洞中有水，有暗河，还有瀑布。
2017-08-07,未知,4,没有跟团，从桂林市区出发，来回都是滴滴打车。回来车不太好打，碰巧有位师傅送客人到旁边的大酒店，正好载我们回来。景点挺好玩的，溜索和滑车孩子挺喜欢的，周边和景区内消费不算贵，就是人多，天气太热。游玩时间三到四小时。
2017-06-29,未知,1,感受一般。 景区不大。 爬瀑布是特色。 可是孩子感觉可能好玩一点。 大人真没感觉。景色一般般。 最差体验是携程买票自己去。我倒了三趟车。网上说南站有旅游直通车。可是最南面到最东面的小村落 大家想想要多久。坐公交时 司机又说南站很远。 车次很长时间才有一辆。所以听从建议坐大圩的车。 大圩下转冠岩的车在古东景区路口下。下车后到景区还有2.5公里。只好坐路口对面饭店老板的破五菱。 一人5元。去个景点倒了三趟车。而且在大圩镇等冠岩的车等了差不多一个小时。 最坑爹是在车上司机说回桂林20元。出景区看见车不少 问问价格。 饭店老板就和我们吵起来。 结果其他司机不好意思拉我们。 饭店老板更得意。三个人要150回桂林。 最后我们赔礼道歉才降到100块。去景区的时候三个人倒三次车一共才36。 路上想打110。 后面还是算了吧。 出门在外不想找麻烦。 拉倒吧。感受相当差劲。相当相当差劲。 相当相当差劲。 古东路口对面饭店老板和他的破五菱。大家注意
2017-03-25,未知,5,古东景区，建议去桂林的朋友一定要去看看，非常有意思和可玩乐的景点，玩山还能玩水。
2016-05-07,未知,5,水多，树多，风景宜人，雨后空气清新很舒服
2018-07-25,未知,5,很好玩的地方，有机会还要来爬一爬瀑布。
2016-08-06,未知,5,不是自驾的话也许不太方便，不过到了景区经过一番有趣的体验之后，一切都是值得的。
2016-07-21,未知,5,可以爬的瀑布，真的是一大卖点！！这种有难度，但是很安全挑战自己的项目，很有趣！
2018-07-30,未知,5,很好玩，可以攀爬的瀑布。景区里挺凉快。下山的滑索推荐坐哦，不恐怖，而且丛林中飞速穿梭的感觉非常好，就是滑索时间太短。
2017-08-01,未知,5,景色秀丽，与水亲近，小朋友超喜欢！
2017-06-01,未知,4,古东全程走的水路上去的。瀑布都是爬的。很爽。就是要多带条裤子可以换了。。水特别清澈。环境很好的。。里面消费业不高。
2017-10-11,未知,5,很不错的亲子活动，一天之内爬了六趟，夏天避暑嬉水的好去处，滑道车不是很刺激，但是别有一番风味！门票在网上和实地买相差不大，只是分本市人和外地人，有点贵。
2016-07-28,未知,5,古东瀑布给人最深刻的记忆，就是可以爬瀑布，非常有特色，虽然穿的那种草鞋不是很舒服，但总的来说很有特色，非常有趣，还有索道，和滑道可以下山，很不错的活动。
2019-12-11,未知,5,很不错的小景点，尤其夏天去比较好，爬瀑布很有意思。就是衣服要多带一身了
2019-08-26,未知,5,泛舟游于遇龙河之上，安全第一。
2017-08-03,未知,4,人太多了。适合大点的小孩，我的比较小，不是很适合，没有爬瀑布。好可惜。
2016-08-23,未知,4,好玩！很有趣味性！就是底租帽子
2016-08-15,未知,5,这里景美人美，真是好的不得了哦
2016-08-03,未知,5,一次愉快的爬瀑布的经历，小朋友玩的很开心。滑车感觉跟坐小火车一个效果，没有任何刺激感觉，就是几辆挂车紧挨一起，第一辆由工作人员控制，后面车辆紧挨着！
2020-10-07,未知,5,适合亲子游，小朋友特别喜欢
2017-09-05,未知,4,感觉还行吧，瀑布规模不大，主要就是开发的瀑布攀越，这个有些趣味性，不过12岁以下的小朋友不建议玩。 其实类似的瀑布浙江很多的，这个瀑布没有很大的亮点，一般情况下来过之后就不会来第二次了。
2019-01-24,未知,4,这里有小溪瀑布，还可以爬瀑布。有山有寨，有高空吊桥，有滑车有吊索。总体来说还是很好玩的，不过爬山有点累。
2017-08-04,未知,5,夏季避暑的好去处，玩水爬瀑布，要带安全头盔和穿草鞋，挺有意思的。
2017-07-25,未知,5,值。最大亮点，连爬六道瀑布，有惊无险，避暑降温好去处。体验草鞋。
2016-10-24,未知,5,好玩好玩好玩好玩好玩好玩好玩好玩好玩好玩好玩好玩好玩好玩好玩好玩好玩好玩好玩好玩好玩好玩好玩好玩好玩好玩好玩好玩好玩好玩好玩好玩好玩好玩好玩好玩
2022-02-03,未知,5,好地方，景色很美，值得一去，有机会还会去玩
2017-08-20,未知,5,挺好玩的景点，唯一美中不足的是出于安全考虑，两处稍稍刺激一些的瀑布不让孩子爬，孩子表示很遗憾。不过滑索和小火车挺好玩，山顶的鲜榨橙汁很好喝……
2017-07-17,未知,5,漓江不管哪个景点都是值得流连忘返，需要细细品味，如一段旧时光。
2016-09-03,未知,5,刺激与挑战同在，攀爬瀑布是勇气与耐力的考验，孩子比较喜欢，由于年龄小，没有爬更有挑战的瀑布，有点遗憾。
2021-07-16,未知,4,爬瀑布玩水很好玩。但摄影师开着闪光灯怼脸拍照，还叫小朋友抬头看，真的很影响体验，而且不是一名摄影师，一路上都是摄影师。如果景区管理人员能看到，希望不要怼脸闪，长焦抓拍什么的都可以。
2019-08-29,未知,5,挺不错的一个爬瀑布的项目，就是去的时候要带一身衣服，真的会湿
2017-07-29,未知,5,还不错，适合家庭出游，瀑布可以近距离接触
2020-03-11,未知,5,适合年轻人攀爬的瀑布，有意思！确实不错
