date,ip 属地,评分,comments
2020-07-11,未知,5,柳州周边好玩不贵景色优美之地。 交通：柳州半小时高铁到鹿寨北，接公交（一小时一班貌似，等不到就打个摩托车）15分钟到中渡镇，接摩托20块就到啦。 途中经过响水瀑布（免费，可以玩水），石林，鹿院，奈何时间有限，下次一定玩遍 景区：门票40，疫情期间人烟稀少，里头小吃摊零散开放，豆花米粉也就5-7块，国内景点哪有？推荐逆时针游览，观景台-九龙洞（逢半点开放）-天生桥瀑布-蜘蛛洞 ，大概两小时搞定。人少拍照啥的也爽。喀斯特地貌一览无遗，何必跟别人凑热闹去桂林阳朔？
2021-04-15,未知,5,香桥还是很美的，建议游玩路线，检票后往右边路走，经过香桥观景台，观赏拍照，然后去岩洞，之后走香桥峡谷下来，一路观景，峡谷的水呈碧绿色，一路古藤怪树，走到香桥下是整个景区最美地方，夏天去玩不错，很凉爽！
2017-10-27,未知,5,20171005柳州鹿寨*中渡古镇&香桥岩国家地质公园游记：香潭，天生硚，响门石林，古榕渡口，九龙洞，武圣宫，古民居……第一张让我想起中学时翻铁门偷溜出校看录相的旧时光[偷笑]鹿寨人民很纯朴[强]
2017-08-30,未知,4,景区不大，2，3小时就可以走完。风景还可以，不愿意走路的话景区有环保车座，十五元一人，建议体力好就徒步吧，行走会看验更多。适合一家老少自驾游。溶洞不错，
2020-09-02,未知,5,周末买了东航的随心飞，可以飞到全国各地，本周的主题是柳州，柳州旁边的香桥岩溶国家地质公园，很惊艳。太喜欢这种自然景观，层峦叠嶂，高低起伏，形态各异的山峰组成了一副美的画卷。
2020-08-12,未知,4,名字有点绕口，景色很美，可惜位置不好，其实距离柳州市区也不过一个半小时车程，鹿寨县到这里才四十分钟。这也说明了广西发展更多是缺乏意识。香不知从何而来，桥可以理解，陆生桥。溶洞效应使得这里飘逸的如同隐士追求的世外桃源。
2018-03-10,未知,5,20171005柳州鹿寨香桥岩国家地质公园游记：香潭，天生硚，响门石林，古榕渡口，九龙洞，武圣宫，古民居……景色很美，天生硚让我想起了重庆武隆鹿寨人民很纯朴
2021-01-03,未知,5,香桥岩溶公园位于广西鹿寨。景区内主要地质地貌遗迹有香桥岩天生桥，香桥岩峡谷，响水石林，九龙洞，响水瀑布等。集石奇，洞幽，水秀于一体。具有很高的科学研究价值和旅游观赏价值，是大自然赐予人类宝贵的自然遗产，被岩溶地质学家称为“中国喀斯特地貌的缩影”和“天然的喀斯特地貌地质博物馆”。公园的地质遗迹十分丰富，在不到四十平方公里的区域内，集中展示了亚热带喀斯特不同发育阶段的典型地貌景观及代丧喀斯特发育过程且极具特色的多种多样喀斯特个体形态，在国内实属罕见。
2021-01-01,未知,4,非常值得去的地方，九龙洞非常漂亮，天生桥神奇壮观，整个行程大概要2.5小时，特别是参观九龙洞时还有免费讲解。行程可以从大门口花五元景交车到九龙洞，出来后下行去看天生桥全程不走回头路。
2022-02-04,未知,5,香桥岩溶国家地质公园是岩溶地貌国家地质公园国家AAAA级旅游景区。位于广西鹿寨县中渡镇大兆村，香桥以地质奇观著称，喀斯特地貌景观和生态景观为一体的景区。公园内植被丰富，公园中的香桥天生桥、香桥岩溶峡谷、响水低头瀑布，以及九龙洞中的脑纹状洞穴沉积等景观，是我国喀斯特地貌景观中的精品。
2020-03-28,未知,5,天地山水之间总想找个别有洞天的地方！这就是人们一直不停的在行走旅途中原因，中国那么大！时不时的总会惊喜到你，南方的夜色来的晚，去的时候刚好可以赶上最后一场迳入溶洞的时间，还是感受到了鹿寨美和神奇了！看光影效果下的溶岩放肆的开放你的想象！门票在携程上购买要优惠的，需提前的！ 【景色】 【趣味】 【性价比】
2015-11-01,未知,5,美美哒，可以摸摸哒，满满的全是爱值得拥有
2024-10-11,广东,5,很好玩儿，早点儿去，9点到，要不停不了车，走山路上去，然后走公路下来。
2020-12-14,未知,4,景色很美，管理也很好。夏季来最棒。坐火车到鹿寨北站后，有3元的公交到中洲镇，然后叫一部黑车或者摩托20-30元到景区。记得留下司机电话，返程接你回。景区可以逛2-3小时。
2020-05-23,未知,5,鹿寨香桥景区建设得很好，游客也不是很多，可以仔细观赏喀斯特地貌景点。这里还是西游记取景地，绝对值得去看看。地下河，溶洞，天然桥，天坑，在一个景区里都有。
2020-02-22,未知,5,鹿寨香桥景致很好，一个景区里面，溶洞，地下河，天然桥，天坑地缝等，都可以看到。这里还是86版经典西游记的取景地。景区人也不多，绝对值得去看看。
2019-02-17,未知,5,广西因为有十万大山这件天赐“绿衫”打扮，到处尽显花艳绿色的美丽，而在大自然“巧手”布局的一个个“镂空”之地，又以另外一种色彩，填补出大地的另外一种美。这个国家地质公园即是这样的存在。
2022-09-23,广西,5,柳州城中区可以包车去地质公园，单程一个半小时，推荐8:30或者9:00出发，带好干粮，公园先进溶洞，穿过后进入山内部，非常有特色，全程走不累，到九龙洞看完后坐车下山，五元一位，司机会在回程的观景台停，建议下去拍照，景色非常优美，可以从另一个角度看到刚才自己走过的那些景点。
2017-03-20,未知,5,距离鹿寨县城约三十公里。有“中国最美溶洞”之称。整个景区是地下溶洞群形成的一个峡谷，九龙洞是最大的一座，也是景观最美的，洞内有两个大水池。
2022-10-02,广西,5,因为想来地质公园所以特地来了鹿寨玩，有美丽的溶洞和风景，而且属于小众景点，所以来的人不多，可以静静的欣赏美丽的风景，小河里还有好多野生小鱼，游玩过程心情大好
2017-05-04,未知,5,典型的喀斯特地貌风景区，景区面积很大，奇石林立、岩洞幽邃、植被茂盛、瀑潭成串。响水瀑布、响水石林和天生桥都是游人最多的景点。
2019-11-18,未知,5,"中渡著名的旅游景点。景区内主要地质地貌遗迹有香桥岩天生桥、香桥岩峡谷、九龙洞、响水石林及响水瀑布等50余处，集石奇、洞幽、水秀于一-体,具有很高的科学研究价值和旅游观赏价值,是大自然赐予人类宝贵的自然遗产，被岩溶地质学家称为“中国喀斯特地貌的丨影”和“天然的喀斯特地貌地质博物馆”。 三"
2019-06-11,未知,3,门票价格50元/张（印象中国全旅游卡一卡通免门票）。 一般可以避开拥挤的人群，不用再去体验，人比景色多的时候。可以更好的欣赏景色，更好的放松心情。也更可以体验这些独特的与众不同的景观，给人一种别样的旅游经历。让旅游变得轻松，变得不拥挤，可以闲看繁花盛开，坐等日月起落。
2017-11-05,未知,5,购票之后提示要两个小时后才能使用，实际上并不需要等两个小时，在售票处很快就验证通过。景区有停车场，停车很方便，只收费五元。天生桥还是很让人觉得震撼的，香潭也挺不错，让人联想到盗墓笔记里面的场景。总体来说还是物超所值的一次游玩，强烈推荐。
2020-07-26,未知,5,性价比非常高，服务好景色美，停车方便智能马桶电动窗帘，设备很新，冰箱小吃饮料免费小孩很高兴，唯一吐槽的是早餐品种太少。值得推荐，体验很好，景色不错，有趣好玩，
2023-08-06,湖南,5,景色绝了，视觉享受满分，科普馆也不错，孩子看看挺好的！总之不亏，对了 物价超实惠，山上山下价格一致，味道很棒，九龙洞入口右侧大姐很热情，清补凉好吃😋，水果超甜。值得尝试，虽然天气很热但确实很棒。
2019-10-02,未知,4,青山蓝水，非常美了。景区不大，景点比较集中，两个小时够玩了，建议走路进景区，一路才能看到香潭等景色，也不会累。建议住在附近的鹿园酒店，早上第一批入园人少
2020-08-09,未知,5,鹿寨香桥岩溶国家地质公园景色不错，避暑胜地，溶洞景观，很美很漂亮，清凉，慢慢欣赏，感觉挺好的，令人心旷神怡，舒服极了，棒棒的。
2017-09-29,未知,5,众里寻她千百度，爱人已在心里处！！！！！！！！
2019-10-02,未知,5,鹿寨香桥岩溶国家地质公园在广西鹿寨中渡，附近有高铁站，交通也算是比较便利的，空气质量很好，秋天的天气秋高气爽，很不错哟……
2023-03-01,广东,5,香桥岩溶国家地质公园 柳州市鹿寨县内 路上的风景很美，但游客不多，沿路上的每个小景点都游览一下，终于到达目的地啦！ 门票40每位，孩子凭学生证半价（门票已含所有景点）； 游览全程，大概需要2小时左右； 园内上山的路非常易走，脚不会累，连我这条大懒虫都显得十分轻松； 刚好在山上遇到大雨，但雨后的景观更迷人； 【天生桥】著名的喀斯特地貌，山清水秀，美景尽现眼前； 【九龙洞】钟乳石柱，千姿百态，都有它们相传的故事，岩洞不大，十几分钟就逛完，现场有小姐姐细心解说，值回票价。
2020-01-30,未知,5,鹿寨香桥岩溶国家地质公园，鹿寨人气榜第一，一路上都是小山路，边上是人行步道，空气很好！这个时间正是沙糖桔采摘的时候，好多收购的大车！还是说景区吧！去的时候人少的！香潭很美，溶洞有专门讲解的，很大很美！景区也有公交的，但是走走也不累的！空气新鲜。
2019-05-17,未知,5,鹿寨香桥的景色不错，人不多，可以慢慢地欣赏广西特色风光。景区游客中心建设的很好，难得见到一些真有景区特色的纪念品。
2018-12-16,未知,4,门票价格比较便宜，行程大概一个半小时，全部在峡谷探秘，主要景点还是香湖，天生桥，蜘蛛洞，九龙洞，可惜九龙洞翻修中，其他的地质没有能看清
2019-06-01,未知,5,风景很赞，路线设计合理，拍拍玩玩居然三个小时。虽然下小雨，景区洗手间之间隔得比较远，好在人没那么多。每个洗手间都提示附近洗手间距离就更好了。正门第一家摊位的汤粉，阿嬷手艺不错噢，简单的美味。
2023-11-15,广东,5,，香桥岩溶地质公园 因为在国庆假日出行 观光车排队人多没坐上 来回 都是徒步 不过也是一次新体验 风景很美 可以从 “香桥岩”小路一直往下走 香潭的水清澈碧绿 可以在岸边玩水拍照 非常出片 这里是观光车看不到的 景色 但是需要爬大量阶梯 要有一定的体力“九龙洞”也是个必打卡点里面有大量钟乳石、地下泉水 体感温度 20°C 很凉快 “观景台”也可停留拍照
2023-03-09,广西,4,景区规模小，兜一圈一个半小时再坐观光车下山，精彩的就是天生桥和九龙洞两个景点，九龙洞还有专业讲解不另外收费，这要赞一个。对体能一般以下的人适合。 从柳州市过去路上实际行程要88公里，包车很贵，交通不方便，特地包车去一次不合算，本人很后悔，四百几十块在柳州能请三五好友小聚一下吃喝玩乐了，这就是它只能是小众景区的主要原因吧。
2019-02-02,未知,5,夏天去估计更好些，水真的很绿，溶洞还有没开发完的地方，洞内游玩时间短了些，但是洞真的很大，值得推荐
2018-03-12,未知,4,香桥的水质蓝绿蓝绿的，有点像九寨的水。我们没有开车上去，开车的话就看不到途径的水了。终点九龙洞里面是喀斯特地貌钟乳石，没有见过的值得一去。
2023-08-14,广西,5,生态较原始，一路植物上好多蜘蛛网，水质很清，九龙洞希望进一步开发，扩大游览范围。从九龙洞出来建议花5块乘坐电瓶车下山，经过观景台时一定一定要下车拍照，非常值得，不要偷懒哦
2020-06-27,未知,4,鹿寨香桥岩溶国家地质公园是到了鹿寨可以顺路去的一个景点，里面结合天生桥、溶洞、地下河为一体，附近还有响水瀑布和响水石林。里面的溶洞风景不错，对面的月亮山有空可以登上看看。
2019-11-06,未知,5,风景还是不错的，就是大路有点晒，我们是先坐车到九龙洞再游下来，相对没有那么累。就是不明白九龙洞为什么要半个小时才能进一批，不过有专门的讲解员确实不错。
2018-03-25,未知,5,标准的超4A 级景区，步道，卫生间完善，景区票价合理，内容精神丰富。赞！
2020-03-04,未知,5,对北方朋友，应该是个遗珠般的所在，绿水青山，溶洞惊奇，价位合理，半开发中。从桂林来一路美景，个人觉得以后能火，旁边的中度古镇吃饭可以，基本未开发
2024-07-01,北京,5,简直是大自然的杰作，令人陶醉。山峦叠嶂，峰峦如聚，形态各异，水波粼粼，湖泊碧绿如玉。仿佛置身于一幅美丽的画卷之中。山间草木葱茏，鸟语花香，生机勃勃。让人流连忘返。
2024-08-10,广西,4,景区不算很大，就是一条游览线路，可以选择坐观光车去到终点再走回来，也可以走到终点看完景点，再坐车回来。个人感觉景区最值得看的就是香桥，有些什么蜘蛛洞没开，后面的九龙洞，也不算大。这里要吐槽的有两样，第一是这个观光车，门票不算便宜，还额外收5块钱，完全可以含在门票里的，第二是额外收5块钱停车费，我们这一路游玩下来，就只有这个景点是收停车费的，其实游客都这么远开车过来游玩，大可不必要了吧。建议景点可以增加多一些游玩设施，例如可以游船的，或者亲子玩水的，体验感会更好。另外游览线路是沿着河水而走的，靠河边沿途的一些树木可以清理一些，让游客视野看到河水，走起来也会舒服些
2023-07-24,广东,5,公园里小卖部的老板们都很热情，还会主动告诉你怎么游玩更好更省力。在里面消费也不会溢价得很离谱。整体环境非常棒，九龙洞的环境和空气也太棒了，一进去就感觉只有十来度，室外三十多度，温差很大，如果带小朋友去游玩，还是要带多一件外套，以防感冒！
2023-01-17,湖南,5,不知道是不是天气降温的原因，我去的那天人很少，但是景区很大，景色也不错，悠闲的逛一个半小时到九龙洞，然后坐观光车下来。门票有优惠，很便宜，观光车单程10元也不贵，是个不错的景区！要是夏天有水的季节来玩，应该可玩性更高！
2022-11-18,广东,5,门票价格不贵，是一个比较小众的景区，人不多，我们两个人包场，香桥下河水碧绿，在观景台上看香桥最为惊艳。距柳州市区一个半小时车程，个人认为值得一游，途经鹿寨鹿鸣谷，可以进去喂梅花鹿，不用门票，午饭在鹿鸣谷酒店吃，黄炆黑山羊非常香非常好吃。
2021-01-27,未知,5,性价比高，去年我去过，旅行有时候也只是一种心情的释放，好比沉在水底的鱼儿，在雷雨到来之前感觉烦闷，迫切的想要到水面透一口气。远离一个城市，奔赴另外一个城市，无论这个城市给你好与坏的感觉，但有点不变的是，对于未知的风景，我们总抱着憧憬和好奇。
2024-07-07,广西,5,天生桥还是比较震撼和特色的，恰逢丰水期间水质可能不是很好但可能也更有气势些了。其它的洞穴感觉过得去，就是不是特别大的那种，不过也还是有小惊喜，走走还是值得的。
2019-11-19,未知,5,香桥岩溶国家地址公园很不错，溶洞，地下河，天生桥，喀斯特地貌的岩峰等，在一个景区里可以全部看到。景区基础设施齐全，人也不多。值得去游玩
2024-10-08,广西,5,北方来的，没见过什么大场面，就那个桥就很漂亮，还有个网红观景台，都非常漂亮，有个香潭荒废了，远处看起来挺不错有点可惜了，崖壁上还有栈道，也只能远处看看，如果把这些都维护好，这个景区真的很哇塞！
2021-10-14,未知,4,地质公园自然景观还不错，整理游览下来约2-3小时。由于非节假日去的，游客极少（不超过十位）。 缺点：交通极为不便，鹿寨北站下来只有黑车，来回要120元。
2020-08-27,未知,5,鹿寨香桥景区真心不错，离响水古镇不远，交通方便，景点设施好，里面天然桥，溶洞，地下河，天坑等喀斯特地貌景点齐全，值得去好好看看。
2021-06-14,未知,5,景点设施还算齐全，工作人员态度也很好，空气清新，景色不错，喜欢这种大自然的鬼斧神工的美景。总体来说还是不错，就是交通不太便利。
2024-11-25,广西,5,公园规模适中，有观光车搭乘，可以不行一段路，整体不费脚力，十分适合我这个走不得远路的人，景区内生态环境保护得很好，设施完善，非常干净，景色丰富
2021-01-27,未知,5,总体超赞，景色不错，去年我去过，旅行有时候也只是一种心情的释放，好比沉在水底的鱼儿，在雷雨到来之前感觉烦闷，迫切的想要到水面透一口气。远离一个城市，奔赴另外一个城市，无论这个城市给你好与坏的感觉，但有点不变的是，对于未知的风景，我们总抱着憧憬和好奇。
2021-01-25,未知,5,总体超赞，去年我去过，旅行有时候也只是一种心情的释放，好比沉在水底的鱼儿，在雷雨到来之前感觉烦闷，迫切的想要到水面透一口气。远离一个城市，奔赴另外一个城市，无论这个城市给你好与坏的感觉，但有点不变的是，对于未知的风景，我们总抱着憧憬和好奇。
2023-01-27,广西,3,景色不错，就是进去要开半小时以上的乡道，下雨天能见度极低，很危险，大家尤其各位司机，一定要小心了！那里道路差，保险和救援过去基本会被耽误。
2024-01-28,广西,5,可能是淡季，去的人不多，体验了一把私家园林的幸福。全程遇到不超过20人，但是每个岗位的工作人员都很认真负责。在鹿寨北火车站叫的网约车，留了师傅电话来接，不然基本打不到车回去。
2021-04-07,未知,5,国营管理，精致美丽，价格低廉，人少
2024-12-15,广西,5,广西柳州鹿寨香桥岩公园，地质奇观震撼。溶洞瑰丽神秘，天生桥似长虹卧波，森林葱郁，山水交融，尽显自然鬼斧神工，是供人们悠闲娱乐的圣地!
2018-05-14,未知,5,性价比高，没有商业化污染，原始森林空气清新，适合一家自驾出游。有十几公里在修路，走高速比较好
2018-05-06,未知,5,在公园门口换票很方便。公园里空气清新，香潭、香桥、香岩、各具特色，让人感叹大自然的鬼斧神工！
2019-06-03,未知,5,热带哈斯特地貌，天生桥，蜘蛛洞，景色很美！九龙洞夏天凉快，配套设施完善，环境比较干净，适合一家老小游玩的景点！
2024-10-04,广西,5,非常不错的地方，爱来自广阔的东边❤️ 价格还算不错，还免费送了一张2寸的照片。没有强制购买挺好的。风景也非常的秀丽。会推荐给其他人
2023-05-21,广西,4,不是太大的景区，比预想的要精彩些。 得益于天然景观，山水相互映衬之下，蛮有意境。 不过最里面的溶洞，好像叫黄龙洞吧，如果去过其他较为出门的溶洞，就不是太推荐了，聊胜于无吧。
2024-01-27,广东,5,值得一去，淡季景区游客不多，小卖部也没有开的，空气十分好。景区不算很大，两小时不用就等步行走完，门票在携程买30元比较划算。鹿寨北站包车过去150往返走完附近几个景点
2023-08-04,上海,5,性价比爆表，游览内容丰富，没有强制消费，避暑好地方，非常推荐，全程总共花费都没有一百块玩好的好地方，溶洞非常清凉，推荐走一走。
2023-11-18,广东,4,香桥岩溶国家地质公园的自然景观超美，山清水秀，知识面丰富，有景区交通车上下，游客不多，游玩起来非常舒适，带小朋友来亲子游，是一个非常不错的选择。
2023-08-25,广东,5,很好，就是距离高铁站比较远，回来可以搭顺丰车到中渡，然后做公交或者打车，整体风光很美，特别是九龙洞，里面风光很舒适，很舒服
2024-10-04,广西,4,想不到距离柳州一个半小时车程有这么漂亮的地方，今天是享受大自然的神奇，快乐的吸氧日！ 岩洞里面不要期望太高，广西很多这种溶洞，这个不算出彩的。 最佳机位在观景台，花了五元坐电瓶车到观景台，电瓶车大叔拍照技术超赞
2023-07-08,上海,4,挺原始的公园，设施不是非常完善，不过地质特征确实很明显，褶皱断层还有溶洞，都很典型。上山去最顶上的溶洞，要爬挺久的，大热天的话挺累的。溶洞内部很凉快，但是保护的不是很好，有游客随意站上钙化沉积的莲台，也没人管，可能这边溶洞太多了不在乎了吧…
2023-05-01,广西,5,地质公园里有停车场5元，反而外面私人停车场收10元。由于要先买票（换票）才能开车进，所以会在门口堵一会车。景区不提供电瓶车，全程步行。入园验票时会提醒，九龙洞会需要再验票，保存好票。目前九龙天窗段无开放，好奇会是什么样的？4月30日涨水，淹了不少观景台，水是黄色混浊的，人不少，关键是车要排队进
2021-01-27,未知,5,有趣好玩，去年我去过，旅行有时候也只是一种心情的释放，好比沉在水底的鱼儿，在雷雨到来之前感觉烦闷，迫切的想要到水面透一口气。远离一个城市，奔赴另外一个城市，无论这个城市给你好与坏的感觉，但有点不变的是，对于未知的风景，我们总抱着憧憬和好奇。
2021-01-27,未知,5,总体超赞，去年我去过，旅行有时候也只是一种心情的释放，好比沉在水底的鱼儿，在雷雨到来之前感觉烦闷，迫切的想要到水面透一口气。远离一个城市，奔赴另外一个城市，无论这个城市给你好与坏的感觉，但有点不变的是，对于未知的风景，我们总抱着憧憬和好奇。
2021-01-27,未知,5,景色不错，去年我去过，旅行有时候也只是一种心情的释放，好比沉在水底的鱼儿，在雷雨到来之前感觉烦闷，迫切的想要到水面透一口气。远离一个城市，奔赴另外一个城市，无论这个城市给你好与坏的感觉，但有点不变的是，对于未知的风景，我们总抱着憧憬和好奇。
2021-01-25,未知,5,景色不错，去年我去过，旅行有时候也只是一种心情的释放，好比沉在水底的鱼儿，在雷雨到来之前感觉烦闷，迫切的想要到水面透一口气。远离一个城市，奔赴另外一个城市，无论这个城市给你好与坏的感觉，但有点不变的是，对于未知的风景，我们总抱着憧憬和好奇。
2021-01-25,未知,5,总体超赞，去年我去过，旅行有时候也只是一种心情的释放，好比沉在水底的鱼儿，在雷雨到来之前感觉烦闷，迫切的想要到水面透一口气。远离一个城市，奔赴另外一个城市，无论这个城市给你好与坏的感觉，但有点不变的是，对于未知的风景，我们总抱着憧憬和好奇。
2021-01-25,未知,5,有趣好玩，去年我去过，旅行有时候也只是一种心情的释放，好比沉在水底的鱼儿，在雷雨到来之前感觉烦闷，迫切的想要到水面透一口气。远离一个城市，奔赴另外一个城市，无论这个城市给你好与坏的感觉，但有点不变的是，对于未知的风景，我们总抱着憧憬和好奇。
2021-01-25,未知,5,有趣好玩，去年我去过，旅行有时候也只是一种心情的释放，好比沉在水底的鱼儿，在雷雨到来之前感觉烦闷，迫切的想要到水面透一口气。远离一个城市，奔赴另外一个城市，无论这个城市给你好与坏的感觉，但有点不变的是，对于未知的风景，我们总抱着憧憬和好奇。
2023-07-16,广西,5,门口有5元一人的观光车票，价格合理，自己走路的话，差不多要半个多小时，来回10元解决了这两天因为爬山而腿酸的问题。 第一张图需要步行十分钟左右，观光车到不了。 图2图3会在下行的时候停留让游客拍照。
2018-02-27,未知,5,里面的景色真的很美很漂亮，空气也特别清新，值得到此一游
2023-07-30,广西,5,鹿寨地质公园挺不错的，值得一去，从桂林开车一个多小时，再从鹿寨到柳州需要一个多小时，从鹿寨到柳州途经中渡古镇，在中渡古镇可以吃粉。
