date,ip 属地,评分,comments
2018-03-07,未知,5,比较有特色的溶岩地貌，特别是潭、洞、桥一体。
2024-04-11,浙江,5,景点不大，但是别致的地质特征还是值得一游。
2021-04-15,未知,1,从柳州做动车到鹿寨下车，在网上也预订了门票，结果下了动车，在门口等公交，只有一趟，珊珊迟来，中午一点十分下的动车，两点了公交车才开，而且叫你中途再自己转车。打车的话，都统一叫价50元，还没有去到景区感觉就要被宰了，感觉实在服务太差，中途退门票回柳州了 【性价比】
2020-01-09,未知,5,门票很方便，风景也不错，九龙洞就开放了一点点，里面配套设施还不健全。门口在造房。
2023-01-31,广西,5,除了交通不太方便，景色不虚此行。景区人不多，溪水淙淙，潭水静谧幽深，一步一景。
2024-10-01,广西,4,山清水秀，景色迷人，就是开新能源车过去景点没有地方充电，有点落伍，希望能改进
2023-10-07,广西,4,小众景点还不错，从柳州去桂林的路上。
2023-11-26,吉林,5,景色很美，就是去的时候人少，路上会提示有蛇虫出没不能过多逗留，要注意安全。
2017-02-17,未知,4,第一次来看起来不错，有时间一起来U
2023-10-11,广东,5,没去过的朋友还是值得去体验一下的，就是上山下山的路不算太好走，路太窄了。
2023-10-04,广东,5,很美很出片 人也不太多 凉爽点去合适
2018-04-22,未知,5,全家游，非常开心～香桥这里没有过度商业化，保持了景区原来的风貌，很好～
2024-08-28,广西,5,山水相宜，奇石香桥，桥下凉风习习，河水清澈。交通便利。景区干净卫生。
2019-09-17,未知,5,重新规划以后园区路线优化了，让我们走起来不是很累了，但是最好有代步车
2024-02-11,广西,5,香桥岩太美啦！！！！！！
2019-08-21,未知,5,携程的票价比**贵，售票窗口不够专业，有待提高，验票业务不熟悉。
2018-01-02,未知,5,第一次去，环境不错，空气清新，山清水秀的地方
2023-08-07,广东,4,石奇丶洞幽丶水秀于一体
2018-03-11,未知,5,一个地质公园，有天生桥和九龙洞，水是像在九寨沟看到的颜色，很美
2017-12-09,未知,4,感觉挺不错的 环境挺好 就是九龙洞里面有点小尽快开发吧 等等再去看看
2021-08-10,未知,5,风景独特，值得一游。
2020-07-13,未知,4,香桥岩。长红水下不去。最漂亮的没赶上。枫叶小道全程看不到江边景色。可以规划修剪树木。徒步趣味很一般。
2024-10-05,广西,3,什么年代了？4 A景区还有裤子提起来上半身露外面的洗手间？景区人不多，还没水……
2024-02-15,广东,5,4点多去的，溶洞不给进啦，不过其他景色还是很美，值得走一趟
2022-05-06,未知,5,夏天非常适合去避暑
2018-05-07,未知,5,山青水秀，天生桥很壮观，值得一游，年纪大的爬山可能有点累。
2023-10-07,广西,4,还可以，人不太多
2018-09-19,未知,5,景区景色不错，对得起门票，值得一游。
2024-12-08,广东,4,不是顺路，不建议特意去，除了天生桥和500米的溶洞，基本没有啥，景区不是很大，2个小时能玩完，
2023-11-28,广西,5,很美，值得一游
2023-07-10,广东,4,门口那个卖票的大妈态度非常差，直接上手抢我手机验携程的券码，很无语。景色还是很美的，最好自驾去
2021-04-20,未知,3,到景区大门沿途的风景也很不错，适合骑单车去玩 。景区本身不是很大，一个小时就可以走完。有待改进，
2024-05-31,广西,5,特别好特别好
2017-10-30,未知,5,不错的，炒鸡喜欢那个天生桥，国庆后人少，还打了五折。
2024-06-14,广西,4,景色还不错，尤其香潭的激流，大气澎湃，值得一游。遇到雨天景区石板路很湿滑，要穿防滑鞋才行。
2024-03-24,广西,5,山青水绿之地，人很少，开放时间有点晚，可看点少！
2024-01-13,江苏,5,地质类公园，去的时候下小雨，空气湿润感觉非常不错
2022-08-12,广东,5,性价比很高，服务很好，今天很好玩，值得推荐。
2018-02-20,未知,5,好棒的景点，虽说路不是很好开，但是景点很值得
2018-02-19,未知,5,携程预订迅速而且价格优惠，景区很不错，票价值
2024-10-14,广东,5,你这里有一个老粉快糊了，你不打算翻个面吗？
2020-07-19,未知,5,床大，阳台大，景色一如既往的景色不错，好！
2018-04-22,未知,5,家庭游，很好玩～ 风景很好，没有过度商业化。
2024-07-19,吉林,5,零距离接触到了梅花鹿，超级可爱超级的赞！
2024-07-08,广东,5,安静小众的景点，很适合2小时商圈内的溜娃
2017-11-27,未知,5,非常漂亮，人间仙境，不虚此行，强烈推荐！
2024-04-17,广西,5,爬爬山不错，就是那个拍照环节有点鸡肋。
2020-01-13,未知,5,携程购买，有优惠，即买即用，蛮方便的。
2019-10-04,未知,5,景点不错，值得一游，携程订票方便、优惠
2017-11-10,未知,5,路途遥远，可以跟团去，自己去就是苦力活
2024-10-09,贵州,5,自然景观不错，附近古镇的柴火粉很好吃
2019-12-30,未知,5,值得一去的好地方
2018-08-13,未知,5,风景不错，门票搞活动时才30元，很好
2024-11-16,广西,4,风景还是没的，人少的时候来，呼吸新鲜空气不错，就是除了看景没啥可玩儿的东西
2020-11-25,未知,4,还可以，在携程网上购票就是方便。我出去旅游，定酒店，定门票都是在这里定购。
2019-02-12,未知,5,很不错的景点，价格也合理，值得再去
2018-07-12,未知,4,很清凉，亲近大自然，但是出园的路实在太远了，建议安排小型游览车，收费也行啊
2021-10-17,未知,5,景点还可以，天气太热，影响心情。
2020-08-09,未知,5,景色很不错，性价比较高体验很好，
2018-10-06,未知,5,性价比超高，20块很值，极力推荐
2017-07-02,未知,5,下雨不能游香桥岩大峡谷，非常遗憾
2020-10-23,未知,5,有趣好玩，景色不错，性价比高，
2018-10-05,未知,5,不错，环境很好，空气质量也很好
2019-10-15,未知,5,不出名却是很好的地方，值得去
2019-01-17,未知,3,带爸妈去玩的，景区还挺大，全程走路，其实宣传做起来的话这个景区还是会很吸引游客的。。去的时候显得萧条了些。。
2018-10-02,未知,5,可以咔咔可口可乐了看看啦啦啦
2024-04-17,广西,5,带娃出门挺舒服的，山不高。
2020-11-28,未知,5,值得去，人少景美总体超赞，
2020-10-07,未知,5,壮丽河山，与想象中一样美！
2019-10-10,未知,4,小众景点，游客不多，适合一家大细游玩，可开车直接进入，停车费5元。
2024-08-25,广东,5,还不错，环境挺好徒步慢走
2023-10-16,广西,4,鹿寨北下车，站外有去景点的专线公交，回程要等时间，所以建议叫滴滴
2023-06-24,广西,5,超级喜欢这里，很美很漂亮
2024-10-28,广西,5,风景不错，推荐朋友来玩
2020-10-07,未知,5,景色不错，负离子满满的
2024-12-17,广西,5,值得一游的地质公园！
2024-08-31,广西,5,风景独特，交通不便！
2024-08-19,广西,5,还可以，讲解听不清楚
2024-04-29,广西,5,风景不错，第二次来了
2024-04-17,广西,5,可以爬爬山，看看水。
2023-05-02,广东,5,大自然的神奇，点赞！
2022-02-08,未知,5,还不错，人少，包场了
2021-10-09,未知,5,老少皆宜，景致宜人！
2021-08-23,未知,5,挺好的，适合亲子出游
2021-02-07,未知,5,景色不错，性价比高，
2020-10-08,未知,5,人很少景很美的地方～
2020-09-25,未知,5,值得推荐，景色不错，
2020-09-25,未知,5,景色不错，值得推荐，
2020-08-13,未知,5,景色不错，值得推荐，
2024-07-16,广东,5,挺不错的，值得一去
2024-05-05,广西,5,青山绿水，非常不错
2022-08-05,河北,5,挺好玩的，山清水秀
2020-08-13,未知,5,很不错，值得一去。
2024-08-12,广东,5,很好玩，景色优美
2024-04-17,广西,5,挺好的一个打卡点
2020-07-17,未知,4,九龙洞里头很凉快
2020-01-19,未知,5,景点不错、给好评
2024-07-18,江西,5,改了也哦滴滴滴
2023-03-29,浙江,5,真不戳啊真不戳
2022-09-14,广西,5,很好！超级棒！
2022-07-08,未知,5,挺好的 值得欣赏
2020-11-22,未知,5,还挺好 值得一去
2019-12-16,未知,5,售票处不够专业
2024-09-05,广西,3,这个景点，如果不是自驾，就不要去了。景色真的一般，最主要是交通实在不方便，听任当地黑车司机宰
2024-04-08,广西,5,还是挺好玩的
2024-04-06,贵州,5,不错，都挺好
2023-12-06,广西,5,比现场买划算
2023-09-10,广东,5,景色还不错。
2023-08-16,广西,5,风景挺好看的
2021-04-07,未知,5,很赞很赞很赞
2021-02-06,未知,5,非常喜欢 谢谢
2018-02-11,未知,3,对广西人来说，不是很好玩，一般吧，门口取票也是波折，老是说查不到订单，最后打了客服电话才入园
2024-10-04,广西,5,值得去走走
2024-07-28,湖南,5,景色漂亮。
2024-02-13,广西,5,值得推荐哦
2023-11-22,海南,5,好地方好玩
2023-02-09,上海,5,环境好 漂亮
2021-03-19,未知,5,风景很好！
2020-10-10,未知,5,景色不错，
2020-07-31,未知,5,环境很好好
2020-04-16,未知,5,优惠方便。
2023-11-20,广东,4,爬的好累，当天下雨不太好看！下次晴天再去一次
2020-10-06,未知,3,景区一半景点不开放，景区没有摆渡车，不让开车进入，却看见别人车到处跑，不会再来了。
2020-08-16,未知,4,景色不错，管理太差。
2024-05-01,广西,4,还可以，没去可以去玩一下，相片下次补发
2020-10-06,未知,3,一半景区景点不开，景区没有摆渡车，不让开车进去，却看见别人车到处走，不会再来。
2019-07-24,未知,4,典型的溶洞景观，景区不大，收费算合理。
2019-09-15,未知,4,空气蛮好，就是后面进洞的景点没有做好
2022-12-06,江苏,4,景美人少的地方
2020-12-27,未知,4,景区太小了，就只有观景台值得一看。
2018-01-04,未知,4,山青水秀，值得一去，门票也不贵。
2024-04-15,广西,3,景色非常不错，值得一游！就是交通不够便利，从鹿寨高铁站需打车前往。
2020-12-17,未知,3,门口卖票那个，我不欠你钱，你也不面瘫，稍微带点表情，说话客气点
2019-12-14,未知,3,总体来说一般，但是水特别美！！！！！！！！！！！！！！！很蓝！
2024-10-05,广西,4,环境很好，其他一般般
2022-08-17,广西,4,还可以吧，没想象的好
2020-07-09,未知,4,值得推荐，景色不错，
2023-10-11,广东,4,景点不错，交通不便
2023-06-08,广西,4,景色不错，服务不行
2023-05-09,广东,4,风景不错，值得一来
2023-03-01,广东,4,爬山的强度能接受
2023-07-21,广东,4,总体感觉还可以
2020-03-23,未知,3,一般，管理不是太到位。不会再去了。
2021-04-17,未知,4,还行吧。。。
2023-06-24,北京,4,整体还可以
2023-02-16,广东,4,景点还可以
2022-02-07,未知,4,景色还不错
2022-02-07,未知,4,景色还不错
2021-09-24,未知,3,景点还可以，和桂林比还是差很多
2021-01-17,未知,4,走的有点累
2019-09-19,未知,3,风景，一般，交通适合自驾游，千万别抱着坐车去的想法
2022-01-29,未知,3,景色一般，感觉景区没有开发好，游玩一个小时吧
2022-02-08,未知,3,天气好的话还好！最后那岩洞就一般了吧
2023-08-10,广西,3,总体不好玩 那么远来这 有点踩雷
2023-01-26,广西,3,除非是看溶洞，实在是没说 啥
2023-06-14,广西,3,山多水少，缺乏灵气。
2024-10-10,广西,3,一般，景点缺少内容
2021-01-04,未知,3,灵魂配不上价格
2020-12-17,未知,2,门口售票员实在无礼，溶洞解说员很棒，风景一般般，现在去外地游客是免票的，如果超过20块钱就没必要去了。而且只能开车去，交通实在不便。
2024-08-04,广西,1,体验非常的差。毫无秩序可言，观光车不是排队等候的，是一窝蜂的谁凶谁抢到谁坐的。工作人员没有在票上写号反而质疑我的车票没付款，翻翻付款记录后居然要排在最后面的班次，整整等一个小时，走都走回去停车场了。九龙洞的进出口同一个楼梯，拥挤不堪，灯光不足，容易出意外。
2020-08-29,未知,2,没什么景色 溶洞也很小 现在哪里在装修 没什么好玩的 停车还要收费可玩性低，景色一般，性价比低，体验不佳，
2024-10-03,广西,2,没啥意思 没必要特地跑这一躺
2019-04-30,未知,1,差评，三月三有优惠没提醒游客，服务态度差！
2022-10-05,广西,2,没什么好玩的
2022-10-05,广西,2,没什么好玩的
2024-02-13,广西,1,非常后悔，不会再去
2023-07-06,广东,1,不值这个价
