date,ip 属地,评分,comments
2023-02-14,广西,4,到桂林只安排了一天的行程，上午去象山玩了一下，中午打车（52元)到了大圩古镇。很多铺面都关门，于是我来到了毛洲岛码头，看是否可以坐竹筏。因天气阴沉风较大，很多的竹筏排列在江面上，一位师傅说天气不好坐竹筏的游客少。我就问古镇里有吃饭的地方么？他说有啊，对面有很多农家乐，可以吃鸡。于是叫师傅带我去了古镇一江之隔的毛洲岛，坐船10元。到了48号农家乐，要了一只土鸡，包做150元（含蔬菜），一鸡两吃。主人还带我们摘了沃柑（很甜），地里摘油麦菜，又尝了杨桃、甘蔗（甜）。炒鸡味道更好，炖鸡可加蔬菜，我们两人吃得很撑，纯土鸡味道鲜美。吃完后又在岛上走了走，现摘草莓和沃柑，满满两袋，感觉很值。听师傅家他们家也可以住宿，100块一晚，旺季的时候家里六个房间都住满了。
2017-11-25,未知,5,大圩古镇是广西古代“四大圩镇”之一。大圩古镇始建于公元200年。古老的大圩老街顺着漓江绵延2公里长，不宽的街道上铺着青石板，石板路两边是保存完好的老房子。 大圩古镇在漓江东岸，父子岩东南，磨盘山北，距桂林23公里水程。史载，古镇始建于北宋初年，中兴于明清，鼎盛于民国时期，距今已有千年历史，远在600年前，大圩以其“大”，成为广西四大圩镇之最。 大圩古镇曾名长安市、芦田市，通称大圩。汉代已形成小居民点，北宋时已是商业繁华集镇，明为广西四大古镇之一。其商业初兴于宋，曾设税官；中兴于明，清光绪三十一年《临桂县志》称“水陆码头”，抗日时期有“小桂林”之称，赶圩人数高达1万余人，泊船多达二、三百艘，地方商业文化积淀深厚，特色鲜明。
2016-01-08,未知,4,大圩古镇在漓江东岸，父子岩东南，磨盘山北，距桂林23公里水程。史载，古镇始建于北宋初年，中兴于明清，鼎盛于民国时期，距今已有千年历史，远在600年前，大圩以其“大”，成为广西四大圩镇之最。 大圩古镇曾名长安市、芦田市，通称大圩。汉代已形成小居民点，北宋时已是商业繁华集镇，明为广西四大古镇之一。其商业初兴于宋，曾设税官；中兴于明，清光绪三十一年《临桂县志》称“水陆码头”，抗日时期有“小桂林”之称，赶圩人数高达1万余人，泊船多达二、三百艘，地方商业文化积淀深厚，特色鲜明。 最佳旅游时间编辑大圩古镇一年四季均适合游览，每年4-10月是最佳的旅游时间，大圩古镇地处广西桂林地区，属于亚热带季风气候，气候较为温和，夏长冬短，年降水量多，阳光充足，年平均温度为19度，光照充足，四季分眀，冬无严寒，夏无酷暑。当然，出行一定要留意天气变化，以免因此受到影响。
2015-11-16,未知,3,很古朴的小镇，很安详宁静，也很干净，紧靠江边，山清水秀……但真的要好好维护管理了，要不撑不了几年，电线乱拉、房屋建筑已经腐朽……喜欢原始古镇的可以走走看看，跟已经开发的商业古镇是两种概念，也正因为原始，所以几乎没有可看可玩的东西，只能体会这种底蕴……
2021-07-11,未知,5,大圩古镇曾名长安市、芦田市，通称大圩。汉代已形成小居民点，北宋时已是商业繁华集镇，明为广西四大古镇之一。其商业初兴于宋，曾设税官；中兴于明，有“小桂林”之称。
2019-03-30,未知,5,值得一去，适合自由行，细细品味古建筑和古镇的商业文化，镇里都是一些特产，价格合理！ 那里的村民热情、真诚。不用担心被宰！
2018-06-05,未知,4,大圩古镇景色不错，原汁原味的感觉，青的砖，青的石板路，青的瓦，木结构的设计，风格有独特魅力，没有过度开发，保留了原有的传统文化和传统习俗。
2016-01-30,未知,5,实在是太值得一看的景点了！难得没有商业化的古镇，一定要去住一天。里面很多建筑都是几百年历史，基本没有什么卖东西的，原汁原味的古镇，看看建筑和生活真是再好不过！
2016-05-28,未知,3,很小的镇，刚进去的地带基本上没人，一直往里走才开始看见一些外国人和一些小摊位，走一下就没什么可看的了，后来又坐船游了漓江，也还一般吧
2018-02-19,未知,3,逛了一圈、买了酱菜、味道不错、里面虽然小摊小贩很多、但是来这样的地方就是淘点小玩意感觉才好、东西都不贵、相对来讲村民还是很朴实。
2017-03-06,未知,5,古代桂林著名的“水陆码头”，镇子上并没有进行大规模的商业开发，至今保留着古香古色的明清风格建筑群，历史沧桑随处可见。值得一游。
2016-01-06,未知,3,这是一个比较破败的古镇，维护比较差，电线乱拉，如果发生火灾等情况很危险。好就好在古镇比较原始，没什么商业气息，相对比较宁静。而且这个古镇靠近江边，江两岸的景色很漂亮。
2023-01-03,广西,5,大圩古镇，古老的石桥和充满生活气息的街道，还有废弃了的铁轨，如今成了菜地。希望保持好这份古朴，不要商业化成为千篇一律的地方。
2019-12-24,未知,4,大圩古镇是广西古代“四大圩镇”之一，古老的大圩老街顺着漓江绵延2公里长。 史载，古镇始建于北宋初年，中兴于明清，鼎盛于民国时期，距今已有千年历史，远在600年前，大圩以其“大”，成为广西四大圩镇之最。
2019-08-27,未知,5,来这里看到的就是朴素，看到的就是人间烟火，看到的就是平凡，走在古镇老街上，心很平静很舒畅，古镇朴素的平凡也是很美的啊 ！
2018-05-01,未知,4,广西四大古镇之一，保存的古宅很多，毛洲岛只适合农家游，整体的格局很符合古镇的感觉，但是某些古宅还没有修缮完全，久远带绿苔的码头巷子很舒服
2016-01-26,未知,5,广西四大圩镇之一，古老的大圩老街顺着漓江绵延2公里，街道上铺满青石板，值得一提的是古镇的老房子保存完好！总有许多名人古迹民风淳朴。
2021-04-01,未知,4,桂林周边的古镇古村挺多的，大圩算的上很不错的一个，主要是桂林周边的游客和本地人比较多，外地游客对他了解不多，去的也少，还不错。
2021-05-04,未知,4,大圩古镇在桂林，村子里的建筑都很古老，保存很完美，虽然很就，依然能看出当年的繁华，精致。周围景色也很美，像世外桃源一样。
2021-02-10,未知,4,大圩古镇在桂林，离市区不是很远，是桂林四大古镇之一，本地人去的比较多，主要是赶圩，郊游。古镇整体保存还好，周围景色很美。
2017-03-26,未知,3,民风古朴，历史悠久，古玩很多，有一些稀奇古怪的小玩意，商品琳琅满目，如果是喜欢历史悠久的古风文化，是建议来这参观参观的。
2017-02-08,未知,5,一千多年的古镇，商业化气息很少，街上的小吃也便宜，可以坐竹筏，4人座，80元一船，就是古镇有点小了，玩不了太久，环境还不错，挺有感觉的。
2017-03-08,未知,4,大圩古镇街道不宽，石板路两边是保存完好的老房子，历史气息浓厚。来这里的游客真是不少，能够想像以前的繁华景象。曾经的水陆码头，小桂林。
2021-08-01,未知,4,去桂林旅游，还都喜欢去些古镇，大圩外地游客不是很多，主要是桂林周边的，去那里赶圩，郊游。古城保存不错，周围景色也很美。。
2016-01-27,未知,4,大圩古镇是广西古代“四大圩镇”之一。大圩古镇始建于公元200年。古老的大圩老街顺着漓江绵延2公里长，不宽的街道上铺着青石板，石板路两边是保存完好的老房子。 大圩古镇在漓江东岸，父子岩东南，磨盘山北，距桂林23公里水程。史载，古镇始建于北宋初年，中兴于明清，鼎盛于民国时期，距今已有千年历史，远在600年前，大圩以其“大”，成为广西四大圩镇之最。
2021-04-06,未知,5,广西山水就是吸引人，无论是自熟风光，还是古村古镇，都体现出一种自然大气出来，很有一种况味感，大圩古镇也是一样，从这工里能够看出许多古韵。
2021-01-01,未知,4,大圩古镇在桂林郊区，其实离市区不是很远，公交车半个多小时就到了，当地人更喜欢去这里赶圩，可能规划一般，但景色还可以，值得一游。
2018-05-04,未知,4,镇子很小，一会儿逛完了，没有什么吸引人的地方。不过骑车出古镇，沿路往阳朔方向骑还可以。
2019-11-26,未知,5,桂林的大圩古镇是个免费的景点，这里的景色优美，自由行可以更能体验到古镇的纯朴，可以选择在古镇上购买一些桂林的特产，价格公道。
2019-11-30,未知,5,平身体验一下古代人的幽静感受到了古香古色
2018-05-10,未知,5,山水一色，古镇悠悠。花草遍布，漫天芋香。
2017-05-14,未知,4,离市区不太远的一个古镇。沿着七星路--》桂磨路往前走，没多远就到了。停车收10块钱，不收门票。镇里有座拱桥，两边没有围栏的，这才是真实的古建筑。还有一条为游客准备的购物街，有很多旅游纪念品。可以讲价，很便宜就可以成交。当然如果你不在乎钱，另当别论。这里的酱菜很不错。
2017-03-27,未知,4,回程中游览了路过的位于漓江边的大圩古镇（免费），只是一般的广西农村民居，没啥特别。回桂林再坐车往漓江边的风景溶洞冠岩（收费没进），想沿漓江徒步去兴坪镇，但必须坐船过渡才能继续徒步，船家漫天开价，要100多元，故放弃最初的徒步计划，回桂林。
2016-09-15,未知,5,守望最后的古镇！小镇上没有充满情调的酒吧，更没有人山人海的游客，唯有古朴和安静，给人的是祥和的感觉。古镇一座座明清时期的建筑还有原来的模样，只是家家都在门上挂上红红的灯笼，摆上小摊出售一些纪念品。踏着石板路漫步在古镇老街，沿街现在还保留着许多竹编作坊、草难作坊、草医诊室、老理发店等一批古老店铺，仿佛在诉说着一个又一个古老的故事。
2016-06-14,未知,4,古镇一直都在保护修缮中，人流量不大，城府不够重视旅游车场的管理，本来来此处游览都是免费的，但是停车场却给私人承包收费去了，对与旅游团来说还真不愿意来这个点，望大圩乡镇府能解决这问题，以提高古镇的客流量！
2021-04-05,未知,5,广西是一片热土，广西的古镇，也祤这片热土衬托着格外有咪道，这个提法，从大圩古镇的概貌变化当中可以看得出来，不能，大圩古镇的风景很美。
2023-02-08,湖南,4,真的很一般。顺路看看也就罢了，专程来有点划不来。与其说商业化气息不够浓，不如说没有多少商业价值——不是没有商业，而是都关门了。
2023-02-05,北京,5,雨天去的人不多，很有意思的小镇，值得一去。
2021-01-06,未知,3,旅游去到广西，这一站来到了桂林灵川县的大圩古镇，大圩是广西古代“四大圩镇”之一，始建于公元200年，北宋初年，中兴于明清，鼎盛于民国时期，到现在为止已经有千年历史了，古老的大圩老街顺着漓江绵延两公里长，街道上铺着青石板，石板路两边是保存完好的老房子。 在古镇里面停车，如果说是住客栈的，应该是不用收费的，就算是收费也都是10元，而我们去的时候，也是黄金假期，所以收费加几倍了，说住店的也要收，过夜再收10元，一共收了30元，真奇怪，住酒店的肯定就要过夜吧？这样乱收费不好。
2020-08-23,未知,4,古镇很不错，古香古色的，景色很美的地方，但是景区管理挺一般的，现在游人也不多，周边景色很美，可以坐船游览，欣赏桂林山水。
2021-03-01,未知,4,大圩古镇，看着挺古老的了，在桂林郊区吧，其实离市区不是很远，有公交可以到达，去那里赶圩的人比较多，坐坐竹筏，逛逛街，还是挺不错的，房子挺古老的，保存也不错。
2017-06-03,未知,3,很無聊很小的小鎮，1小時不用就走完了。優點是沒啥遊客，但同時也沒啥好逛的，不必專門來逛。
2016-12-27,未知,5,到大圩，万寿桥是必去的地方。万寿桥诗建于明代，是一座石块砌起的石拱桥，桥面的石头已被磨得溜光发亮，间杂些许小草，古朴自然。远望似青龙卧江，近看桥影如月，气势非凡；与两岸古朴的民居相依，具小桥流水的典雅妩媚。
2017-06-03,未知,4,未完全开发 很值得看看，记得江边的鱼很正
2016-07-17,未知,4,景色远古，原汁原味，保留下来的门口牌坊较好！
2019-11-04,未知,5,大圩古镇一个古老而历史感很强的村镇，走在石板铺成的街道上，踏着石板路漫步在古镇老街，仿佛又回到了从前，街道两旁的老房子向你诉说着一个又一个传奇而古老的故事。
2020-09-02,未知,4,大圩古镇也很有名，在桂林郊区，是桂林四大古镇之一，但没有兴坪古镇去的外地游客多，本地人居多。有些桂林传统小吃，和用品，景色也很美。
2016-10-05,未知,5,古镇现在还保留着许多竹编作坊、草鞋作坊、老理发 店等一批古老的手工作坊。闲着无事的老人们或是在街边看些发黄的书，或是聚集在在一起喝喝茶打牌，平静的生活着，守望着最后的古镇。
2018-04-24,未知,4,古朴之美与自然之美的融合，但卫生环境不敢恭维，当地政府要加大整治力度哦!不然，太可惜了。
2016-12-02,未知,4,街道上铺着青石板，石板路两边是保存完好的老房子。有很多古老的建筑，有地方特色，踏着石板路漫步在古镇老街，尝尝小吃，逛逛小店，都是蛮不错的。
2015-10-20,未知,4,没啥特点，没有特色，就是石子路，石头围墙，人少
2023-08-30,辽宁,5,没有被商业化的质朴古镇，没有门票，免费参观体验的小镇一日游，这里是一个充满烟火气的地方，古镇内大部分都是原住民，房子都是原滋原味的，适合拍照。
2016-11-19,未知,5,一座有着千年历史的古镇，古镇始于北宋，兴于明清，鼎盛于民国，成为当年广西四大圩镇之首，不宽的街道上铺着石青板，石板路两边是保存完好的老房子。
2016-08-15,未知,4,"古老的大圩老街顺着漓江绵延2公里长，不宽的街道上铺着青石板，石板路两边是保存完好的老房子。大圩古镇在漓江东岸，父子岩东南，磨盘山北，距桂林23公里水程。史载，古镇始建于北宋初年，中兴于明清，鼎盛于民国时期，距今已有千年历史，远在600年前，大圩以其""大""，成为广西四大圩镇之最。 大圩古镇曾名长安市、芦田市，通称大圩。汉代已形成小居民点，北宋时已是商业繁华集镇，明为广西四大古镇之一。其商业初兴于宋，曾设税官;中兴于明，清光绪三十一年《临桂县志》称""水陆码头""，抗日时期有""小桂林""之称，赶圩人数高达1万余人，泊船多达二、三百艘，地方商业文化积淀深厚，特色鲜明。"
2023-11-08,广西,3,漓江边 离桂林市区不远 小而宁静 【景色】
2017-12-04,未知,5,漓江边的大圩古镇，几座古老的建筑，商号，见证了历史的商业经济，虽然里面有民居，但是商业气息不是很浓重。旅游参观的人不是很多，没什么乐趣。
2018-01-15,未知,5,大圩古镇，过着平静生活，守望着这片最后的古老，石板路旁为青砖、青瓦的两层明清建筑的老房子，历史沧桑随处可见。
2017-10-22,未知,5,大圩古镇，保留着许多竹编作坊、草鞋作坊、老理发店等古老手工作坊，老街顺着漓江绵延，不宽的街道上铺着青石板，两边保存完好的老房子。
2016-12-31,未知,5,古镇的建筑物依然保存着古老的风格，满街都是特色小吃，去到那不怕没吃的
2023-09-04,辽宁,5,这种古香古色的镇子确实不多见，尤其是保存的完好不说，更为难得的是这里竟然几乎没怎么被商业化，就是不知道还能维持多久，否则想找一块宁静的土地都很难了
2017-01-08,未知,5,大圩古镇建于公元200年，有着浓厚的历史文化积淀。镇中民居临江依山而建，在街两旁青砖、青瓦的二层老房子，一批古老的手工作坊，仍坚守着最后的古老。
2017-09-09,未知,5,大圩古镇，老街顺着漓江绵延，不宽的街道上铺着青石板，保存完好的老房子，建筑南高北低，临江依山而建，多为三进、四进式建筑，成为广西四大圩镇之一。
2017-11-20,未知,5,古老的大圩老街顺着漓江绵延，不宽的街道上铺着青石板，古街还保留着许多传统手工作坊，漫步在古镇内随处可见各种历史古物。
2017-02-19,未知,5,镇中民居临江依山而建，在街两旁青砖、青瓦的二层老房子里，竹编作坊、草鞋作坊、草医诊室、老理发店等一批古老的手工作坊，仍坚守着最后的古老。
2016-11-09,未知,5,古镇始建于公元前200年，曾是广西四大圩镇之首。古老的大圩老街顺着漓江绵延2公里，不宽的街道上铺着青石板，石板路两边保存完好的老房子。
2016-10-27,未知,5,始建于公元200年，真够老的。看看去吧，悠长的青石板路，陈旧的青砖青瓦或者木板房，沿着小街走，一路都是手工作坊和小铺小店，充满历史沧桑
2017-08-11,未知,5,大圩古镇在桂林漓江东岸，父子岩东南，磨盘山北，距桂林23公里水程。史载，古镇始建于北宋初年，中兴于明清，鼎盛于民国时期，距今已有千年
2017-01-11,未知,5,大圩古色古香，安宁静谧，是一个三面环水一面靠山的地方，村前漓江环绕，如玉带青罗；村后奇峰雄起，似龙腾虎跃，一个难得而自在的好去处
2021-12-20,未知,5,大圩古镇有菜馆味道还是很不错的，有很多干货还有鲜货，总体还是很新鲜的，有不一样的感觉，腊肉非常的好吃，味道十分的不错。
2017-02-24,未知,5,大圩古镇，老街是快磨平的青石板路，旧拖车，小木凳，都是寻常大家的摆放，不少古老的手工作坊依然保留着，满满历史沧桑观。
2019-05-14,未知,3,枉费我150元的车费，整个古镇到处都是卖咸菜，辣酱的…… 破旧不堪的镖局即是景点又是公共卫生间，不看镖局就要交卫生间费用看镖局，每位三元，不用交费用。卫生极差。 陈旧的博物馆十元门票，无人问津……
2017-03-25,未知,5,位于漓江边上的大圩古镇，也是桂林去旅游的一处看历史的景点，虽然不是人人去了都会逛，但是如果经过还是值得看看的。
2016-12-04,未知,5,大圩古镇还挺不错，气氛感觉特别好，尤其是建筑有种跟时光倒流一般……
2016-02-10,未知,4,去观赏银杏秋色的途中路过，顺道参观，感觉古镇的古老民居保存也不多了，只是沿河岸的一排还有点古朴的味道。
2022-10-24,安徽,5,大圩古镇这里风景十分的优美，这里有很多的美好小景点，十分的赞，很好很好的。心里十分的伤痛在这里治愈。
2016-03-10,未知,5,去的时候人很少，古镇不大，但是很有味道，特别喜欢镇下面的那条小河。在河边看落日，是一件极其浪漫的事
2017-01-26,未知,5,可以邀请朋友一起去吃好吃的看好看的风景，拍美美的照片，那里的风景真的很不错，推荐，值得一去。
2017-05-17,未知,5,古老的大圩老街顺着漓江绵延2公里长，不宽的街道上铺着青石板，石板路两边是保存完好的老房子。
2017-01-14,未知,5,穿梭于古镇的青石板街道，两旁也是青砖青瓦的老房子，零星分布着几家上铺，还有很多手工老作坊。
2018-02-26,未知,4,离桂林市区不远，还不用门票，里面的古建筑挺有味道的，和其他古镇一样都是买东西，里面的各种特色腌菜挺好吃的。
2016-06-28,未知,4,1800年悠久历史的古镇，依稀还能看出当时的一派繁华景象。建在漓江边上，风景挺好。
2019-08-15,未知,1,这次跟朋友几家人自驾车到大圩古镇旅游，本来被大圩古镇的朴实所带来好感的，但被一家私人博物馆里的人骗了，心里难受和不甘，这么好的地方被这些害群之马搞坏了，觉得可惜。 具体的过程我说说，希望以后不要再有人上当：当时我们见有一个私人博物馆对外开放，还在修建中就进去参观了，我们在参观的过程中有一位说是这博物馆的老板，给我们免费讲解博物馆的历史还有博物馆里从各个地方收回来的收藏品，件件都有历史和价值，最后带我们进到他们博物馆第三进房子里，跟我们说全部都是他最值钱的宝贝，可以带我们进去参观但不能照相，进去后关门还搞得神神秘秘。开始先介绍脸谱、墨砚等等，然后说他能把这间博物馆买下来是本来是做玉石生意，赚了钱为兴趣将博物馆买下来，再作修建开课题客栈和文物博物馆。然后就带我们去参观他的玉石成品，教我们怎样辨别玉石真伪，搞得很内行的样子，我们不怎么懂，就信以为真，后来还进来一个他的女员工，我们都挑了几块玉问价钱，都是在一千多块钱左右，就讲价，老板和员工就唱起双簧，我们出的价，老板装作考虑一下，行，当作交个朋友成交，员工说老板成交价格太低了，比成本价还低，表现得委屈和难做的样子，但老板已经答应了就没办法了成交算了，手法很高明，最后我们卖了6块玉4000多元成交。 回来找懂玉石鉴定人鉴定了，证实是假货，是合成品，不能佩戴，对人身体有危害，会致癌，价值5元都不到。说了这么多我们想给大家提个醒，千万不要再上当受骗了。最后附上我们买的玉石和这家博物馆的图片（可惜没有拍到那个老板的相片），千万不要再有人上当受骗了。
2017-07-04,未知,1,今天给差评的原因不是说因为古镇的风景不美，而是因为这个民风被一些所谓的一些行家给污染了造成了一些心情心情不好，因此在这里自身的经历为真，下面也有一位用户提到了一家叫广昌布行的人家，他首先会给你介绍周围的文物的历史和背景，然后慢慢就会带你进到一个小屋子里面介绍自己收藏的一些玉器之类的东西，然后会告诉你市场价和行家一起他这里的价格区间的区别，然后就会以很低的价钱卖给你，本来也是本着交朋友的一恶心情去买这块玉的，但是这个玉的真实性并不可靠，如果您是行家很深的游客可以一辩真伪，但你若是像我们这样对与玉器不懂行的人千万别买，另外在这里给一个温馨提示，她向你展示玉器的地方的光线是十分暗的，以自身经历为鉴警示大家不要上当受骗，价格是不贵的，但我相信人人都不喜欢假货，
2016-06-04,未知,5,我比较推崇这个古镇，几乎没有人为的破坏。
2019-02-11,未知,4,大圩古镇是广西四大古镇之首，感觉只是一般般，古建没有留存很多，几乎都被开放了，仅存一小部分，游览大圩古镇目前是免费的。
2017-11-16,未知,5,去过的所有的古镇最最有感觉的一个地方，很古老，很有气息
2017-09-15,未知,4,去古东瀑布路上顺路，十几分钟走完一条街，是真的旧房子，冰粉好吃。没有有的古镇那么商业和繁华。
2016-03-01,未知,3,一个小镇，挺古老，不大，1小时足矣。跟团赠送的形成，自己来不来都行。有一个卫生间，收费1元，说是4星级，没进去。
2021-03-05,未知,5,尚未被完全的商业开发，喜欢古意的可前往，建议搭配冠岩、古东瀑布游玩。
2022-02-10,未知,5,古镇老街不错，是一个免费的古镇，原汁原味，在漓江边上，很漂亮
2021-11-07,未知,5,很宁静的一个古镇，古老的小桥，古老的建筑
2020-12-17,未知,1,现在古镇在改造，到处都是新修的建筑，没有一点古镇的味道，古镇里面的工作人非常排外，大家岩注意，古镇景区里面有个停车场，是开放停车场，我们进去一个人都没有拦着，结果停好车，我们走出来，有个挂牌子的人找我们收停车费，就是见我们是外地车牌就坑人，看了一圈本地人的车基本来去自如，体验感简直不要太差劲，在一个什么庙前面，一堆公务车停在那里，说是有领导来检查，不就一个破县城的破领导吗？门前马路不让一轿车走，停下来看两眼就有人非常凶的直接破口骂你，简直了，不会再来了，难怪没什么游客，桂林再这样做旅游，真的是会越做越差的
2017-07-29,未知,5,广西四大古镇之一，有山有水，人景合一。
2022-06-29,未知,5,历史文化底蕴深厚的小镇，附近的古东瀑布是清凉一夏的好去处
