date,ip 属地,评分,comments
2023-08-20,山东,4,20230311下午： 1、“桂林观石堂鸡血玉博物馆”位于4A景区“芦笛岩”是国内著名的喀斯特溶洞，洞内仙宫秘境和洞外山水田园，让人能同时身临其境得感受到桂林山水的里里外外，被誉为“大自然艺术之宮”，景区历史悠久，自唐代起便有文人墨客探洞，留有自唐贞元八年（792年）以来的历代壁画70多幅。近代开发的时间较早，是老版《西游记》电视剧中的“东海龙宫”和17集里的“芭蕉洞”、“摩云洞”的取景地，曾接待过美国前总统尼克松、卡特等诸多外宾，又称“国宾洞”。芦笛岩因洞口古时生长有一种可制作笛子的芦荻草而得名。 ①地址：桂林市秀峰区芦笛路1号。 ②交通：公交直达，开车也很好停。 ③旺季：无，但夏季去可避暑。 ④用时：2小时。 ⑤注意事项：洞内无信号，但有免费WiFi可连。 2、桂林观石堂鸡血玉博物馆是与旅行社合作的跟团游购物点，我是散客不让我进，馆外的仿真鸡血玉装饰蛮有趣。
2020-10-06,未知,2,跟团去的，导游在门口就给你发个参观证这样的牌子戴上，进去后，就有购物店的女的来给你讲解鸡血石的故事，先给你讲故事，让你以为真的进了博物馆一样，先是听她讲解了故事，然后他就直接带我们进购物点了，导游就在出口等我们，让我们逛一个多小时，没几个人买，里面的柜姐趾高气昂的样子真讨厌，意思就是你必须要买
2018-09-29,未知,1,千万别去这种所谓的景点，就是购物点，卖的东西都挺贵。跟团去的，说是进去领个免费的鸡血玉，结果要在里面的商场里呆1.5小时，还不让出来。
2018-12-31,未知,2,作为本地人不推荐，去过一次，虽然对本地人免费，但是很不友好，估计是卖东西坑游客的。
2024-03-24,北京,1,垃圾一样的打着博物馆旗号的购物点，但凡跟团桂林游必须去扶贫，罚站几个小时，素质极其差的柜姐和讲解员，强行要求听完卖广告才允许上厕所。麻烦不要给桂林旅游局惹事，别抹黑桂林这城市。
2018-07-05,未知,1,强行罚站式购物。。。。。。。。。。
2019-10-05,未知,1,强制性的购物点，自由行的旅客不会去的点
